date,headline,source,summary
2025-05-30,RBC on Brookfield Renewable Partners Outlook,Yahoo,"RBC Capital Markets hosted Brookfield Renewable Partners Chief Financial Officer Patrick Taylor, and"
2025-05-31,The Smartest High-Yield Stocks to Buy With $100 Right Now,Yahoo,UPS is a turnaround with a 6.7% yield and a price thats just at the cusp of $100.  Brookfield Renewable Partners has a 6.5% yield and a long runway for growth.  Enterprise Products Partners offers a 6.8% yield and steady distribution growth.
2025-06-01,How To Build A High-Yielding Dividend Portfolio In June 2025,SeekingAlpha,"As June 2025 begins, markets remain pricey and risks are mounting, making investing tough. Learn how Iâm allocating capital and building a dividend portfolio now."
2025-06-02,"If I Could Buy Only 1 High-Yield Dividend Stock in June, This Would Be It",Yahoo,Brookfield Renewable currently pays a dividend yielding more than 5%.  Heres why it stands out as my top buy for dividend income this month.  Shares of Brookfield Renewable have been drifting lower and currently sit more than 15% below their 52-week high.
2025-06-04,Brookfield Renewable to Issue $250 Million of Green Subordinated Hybrid Notes,Yahoo,"Brookfield Renewable Corp. (NYSE: BEP, BEPC; TSX: BEP.UN, BEPC) overnight Tuesday said it will issue"
2025-06-04,A 300% Increase in AI Data Center Demand Will Propel Growth for These 3 High-Yield Stocks,Yahoo,"Artificial intelligence effectively lives in data centers.  Demand from data centers for electricity is projected to increase by 300% over the next decade or so.  NextEra Energy, Dominion Energy, and Brookfield Renewable are all set to benefit from this increase in power demand."
2025-06-04,These Stocks Are The High-Yield Dividend Investors Best Friend,SeekingAlpha,There are some high-yield stocks available today that check all of my boxes. Check out some of my top high-yield picks of the moment.
2025-06-04,Brookfield Corporation: A Slight Premium For A Generational Compounder,SeekingAlpha,"Brookfield Corp. is a complex, global powerhouse in alternative asset management. Read why I believe BN stock remains a high-quality compounder worth holding."
2025-06-04,Brookfield Renewable to Issue C$250 Million of Green Subordinated Hybrid Notes,Yahoo,"The prospectus supplement, the corresponding base shelf prospectus and any amendment thereto in connection with this offering will be accessible through SEDAR+ within two business days. NOT FOR DISTRIBUTION TO U.S. NEWSWIRE SERVICES OR FOR DISSEMINATION TO THE UNITED STATES BROOKFIELD, News, June 03, 2025 (GLOBE NEWSWIRE) -- Brookfield Renewable (NYSE: BEP, BEPC; TSX: BEP.UN, BEPC) (“Brookfield Renewable”) today announced that it has agreed to issue C$250 million aggregate principal amount of Fi"
2025-06-06,A Major Market Reversal Is Likely Coming,SeekingAlpha,A major market reversal may be on the horizon. Click here to learn strategic portfolio positioning to leverage macro tailwinds while hedging risks.
2025-06-09,Theres Absolutely Massive Demand Growth Ahead for This Well-Positioned High-Yield Stock,Yahoo,"The world is in the middle of an energy transition.  The big picture is that energy transitions take decades to play out.  In fact, even some of the oldest energy sources havent been eliminated, even though they have been usurped by newer energy sources."
2025-06-10,National Bank of Canada Switches Analyst Coverage of the Sustainable Infrastructure and Clean Technology Sector,Yahoo,National Bank of Canada over the weekend said analyst Baltej Sidhu is assuming coverage of its Susta
2025-06-10,Prediction: This High-Yield Dividend Stock Will Crush the S&P 500s Returns Over the Next Decade,Yahoo,"It has multiple drivers that could power more than 10% annual growth in its FFO per share through 2034.  A high dividend yield often signals that a companys growth days are in the rearview mirror.  In many cases, the high-yielding income stream makes up most, if not all, of the return the company delivers for investors."
2025-06-10,Brookfield Renewable (BEP) Soars 7.7%: Is Further Upside Left in the Stock?,Yahoo,Brookfield Renewable (BEP) saw its shares surge in the last session with trading volume being higher than average. The latest trend in earnings estimate revisions may not translate into further price increase in the near term.
2025-06-11,Forever Dividend Stocks: 5 Income Stocks I Plan to Never Sell,Yahoo,Brookfield Infrastructure and Brookfield Renewable plan to increase their dividends by 5% to 9% each year.  Realty Income has raised its dividend 130 times since coming public 30 years ago.  Enterprise Products Partners has increased its distribution for 26 straight years.
2025-06-11,Recession Alert: Very Good News For Dividend Stocks,SeekingAlpha,A recession could be likely to hit in H2 2025. But this could actually be very good news for dividend stocks. Read how I am positioning my portfolio to benefit from this.
2025-06-14,Important Warning For Infrastructure Stocks: 4 Major Looming Risks,SeekingAlpha,"Infrastructure investing offers steady cash flow and dividend growth, but faces macro risks. See why smart stock selection is key to managing that risk."
2025-06-16,"Boralex, Northland Power, Brookfield Renewable Partners to Benefit from Ontarios Energy for Generations Plan, National Bank Says",Yahoo,"National Bank of Canada has an Outperform rating on each of Boralex (Target C$42), Northland (Target"
2025-06-16,Warren Buffett Owns Chevron. You Should Buy These 3 High-Yield Energy Stocks Instead.,Yahoo,"Enbridge operates in two sectors that Buffett likes, generating reliable and growing cash flows from each.  Brookfield Renewable generates very stable cash flow backed by renewable energy.  Enterprise Products’ high yield is backed by growing cash flows, and that’s unlikely to change."
2025-06-17,Brookfield Renewable Corporation Announces Results of Annual Meeting of Shareholders,Yahoo,"BROOKFIELD, NEWS, June 16, 2025 (GLOBE NEWSWIRE) -- Brookfield Renewable Corporation (the “Corporation”) (TSX, NYSE: BEPC) today announced that all eight nominees proposed for election to the board of directors of the Corporation by holders of class A exchangeable subordinate voting shares (“Exchangeable Shares”) and holders of class B multiple voting shares (“Class B Shares”) were elected at the Corporation’s annual meeting of shareholders held on June 16, 2025 in a virtual meeting format and t"
2025-06-18,3 Artificial Intelligence Stocks You Can Buy and Hold for the Next Decade,Yahoo,Nvidia is viewed as a bellwether for artificial intelligence stocks.  The demand for electricity is something thats certain about AI that investors can confidently invest in for the long term.  Nvidia (NASDAQ: NVDA) reported yet another quarter of strong growth with its fiscal first quarter 2026 earnings.
2025-06-22,5-9% Yields To Build A Low-Stress Dividend Income Stream,SeekingAlpha,Build a low-stress retirement income with a diversified portfolio yielding 5-9%. Explore two strategies and top dividend growth picks for retirees.
2025-06-23,Brookfield Renewable: 8% Yielding Preferreds Become The Better Bet Again,SeekingAlpha,"We go over the recent earnings results for Brookfield Renewable, the macro risks, and tell you why we think the fixed income choices are better today. Read the full analysis here."
2025-06-24,NML: Solid Distribution Coverage And Stability In The Face Of Conflicts,SeekingAlpha,Invest in stability with Neuberger Berman Energy Infrastructure and Income Fund Incâoffering resilient energy infrastructure exposure. Click for my NML update.
2025-06-25,2 Tactical Moves For Retirement Income Right Now,SeekingAlpha,"In this article, I discuss two high-yielding tactical retirement income picks for prudent investors to consider. Read more on the retirement picks."
2025-06-25,My Dividend Stock Portfolio: New May Dividend Record - 100 Holdings With 15 Buys,SeekingAlpha,"Explore May 2025 market volatility, U.S.-China trade talks, and record dividend income growth."
2025-06-25,Could Buying Brookfield Renewable Corp. Today Set You Up for Life?,Yahoo,Brookfield Renewable Corp. has a lofty 4.7% dividend yield.  The company has the backing of Canadian investment company Brookfield Asset Management.  Brookfield Asset Management has material plans to grow its clean energy investments.
2025-06-26,The Market Is Ignoring Brookfield Renewables Hidden Value,SeekingAlpha,"Brookfield Renewable stands out in the clean energy sector with stable, growing cash flows from a diversified, global asset base. Click to read why BEPC is a Buy."
2025-06-30,Brookfield Renewable to Host Second Quarter 2025 Results Conference Call,Yahoo,"BROOKFIELD, News, June 30, 2025 (GLOBE NEWSWIRE) -- Brookfield Renewable (NYSE: BEP, BEPC; TSX: BEP.UN, BEPC) (“Brookfield Renewable”) will hold its Second Quarter 2025 Conference Call and Webcast on Friday, August 1, 2025 at 9:00 a.m. ET to discuss results and business initiatives. Results will be released on Friday, August 1, 2025 at approximately 7:00 a.m. ET and will be available on our website at https://bep.brookfield.com under “Press Releases”. Participants can join by conference call or"
2025-07-05,2 Undervalued High-Yield Sectors With Huge Tailwinds (Top Picks),SeekingAlpha,"Diversification builds stability in dividend portfolios, but sector overweights can enhance returns. See why these two high-yield sectors and top picks stand out."
2025-07-07,Forget Get Rich Quick: The Real Dividend Strategy That Built My Income Machine,SeekingAlpha,Many investors lose money chasing hype instead of setting realistic goals and building wealth steadily. Read why my dividend strategy drives 90% of my net worth.
2025-07-10,The Best 5%+ Yielding Dividend Growers To Buy And Hold Forever,SeekingAlpha,It is rare to find stocks paying 5%+ yields that are well-suited to being long-term buy-and-hold investments. Read about two stocks that are exceptions to this.
2025-07-11,What I Wish I Knew Before Becoming A Dividend Investor,SeekingAlpha,"I have done very well over the long run, but had to learn some lessons the hard way. Check out valuable investment lessons from my personal mistakes."
2025-07-12,Billionaire Investor Warns Markets Are Too Complacent On Tariffs: Our Approach,SeekingAlpha,Rising tariffs could impact markets and learn top investment strategies and picks to maximize returns. Click here for more on Market Outlook.
2025-07-12,7 Stocks Im Buying As Tariffs And Deportations Prowl Behind The Rally,SeekingAlpha,"Read here for key economic risks from tariffs and slowing population growth, renewables resilience, and top REIT picks for defensive growth."
2025-07-15,"Brookfield and Google Sign Hydro Framework Agreement to Deliver up to 3,000 MW of Homegrown Energy in the United States",Yahoo,"The World’s Largest Framework Agreement for the Purchase of Hydroelectricity Over $3 Billion of Contracts Signed Today for 670 MW Holtwood and Safe Harbor Facilities in Pennsylvania NEW YORK and PITTSBURGH, July 15, 2025 (GLOBE NEWSWIRE) -- Brookfield Asset Management (NYSE: BAM; TSX: BAM), together with Brookfield Renewable (NYSE: BEP, BEPC; TSX: BEP.UN, BEPC) (“Brookfield”) and Google today announced a first-of-its-kind Hydro Framework Agreement (“HFA”) to deliver up to 3,000 megawatts (MW) of"
2025-07-17,"Brookfield Renewable Partners: AI Data Center Growth, 80% Pay-Out Ratio, Strong Yield",SeekingAlpha,"Brookfield Renewable Partners offers inflation-hedged income, AI-driven growth, and a solid yield from global assets. Find out why BEP stock is a buy."
2025-07-17,Billionaire Says Infrastructure Investing Is Entering A Golden Age - Our Top Picks,SeekingAlpha,See why top billionaires are betting on infrastructure in this golden age and how you can invest to capitalize on this emerging macro trend. Click for the picks.
2025-07-18,BUI & DNP: Utility Funds Get Too Expensive,SeekingAlpha,"BUI has outperformed DNP over the last 6 months, which is unusual given its typical structure and strategy. Read about why it happened and which stocks we recommend for 7%-8% yields today."
2025-07-19,Brookfield Renewable to Increase Stake in a Strategic Portfolio of Hydro Assets,Yahoo,"Brookfield Renewable will invest up to $1 billion and increase its equity interest in Isagen to approximately 38%As part of this transaction, QIA, an existing co-investor in Isagen, will invest approximately $500 million and increase its equity interest in Isagen to approximately 15% BROOKFIELD, News, July 18, 2025 (GLOBE NEWSWIRE) -- Brookfield Renewable (NYSE: BEP, BEPC; TSX: BEP.UN, BEPC) (“Brookfield Renewable”) today has announced that it will invest up to $1 billion to increase its equity"
2025-07-21,BEP- A High Percentage Bet in the Renewables Sector,Yahoo,"The key motivation for 2025 utility M&A is a quest for scale. The best way to bet on it is to build positions in the strongest companies that are on track to grow with or without a deal — like Brookfield Renewable Partners LP (BEP), notes Roger Conrad, managing partner at Capitalist Times."
2025-07-24,A Major Market Rotation Is Likely Coming,SeekingAlpha,A major market disruption may be imminent despite AI-driven highs. Read about which stocks I recommend investing in instead.
2025-07-25,Top Wind Energy Stocks That Will Drive Long-Term Portfolio Growth,Yahoo,"Wind power surges as U.S. demand grows-stocks like DTE, BEP, ACA and D eye big gains amid tech-driven energy shifts."
2025-07-25,The #1 Mistake High-Yield Investors Keep Making (I Learned The Hard Way),SeekingAlpha,High-yield dividend stocks can be traps and learn a smarter investment approach to boost returns. Read here for more analysis.
2025-07-26,Keep Calm And Keep Buying These Dividends,SeekingAlpha,Discover why giving up on dividend investing could be a costly mistake & explore top dividend investments to buy now for steady income & long-term growth. Read more here.
2025-07-29,Brookfield Renewable Partners to Post Q2 Earnings: What to Expect?,Yahoo,BEPs second-quarter 2025 results are expected to continue to gain from a diversified portfolio and investments in renewable power.
2025-07-30,These 2 Utilities Stocks Could Beat Earnings: Why They Should Be on Your Radar,Yahoo,Finding stocks expected to beat quarterly earnings estimates becomes an easier task with our Zacks Earnings ESP.
2025-08-01,Buy These Renewable Energy & Battery Energy Stocks to Boost Your Portfolio,Yahoo,"NXT, BEP, and VWDRY are tapping into soaring demand for renewables and battery storage with global expansion moves."
2025-08-01,Brookfield Renewable (BEP) Reports Q2 Earnings: What Key Metrics Have to Say,Yahoo,"The headline numbers for Brookfield Renewable (BEP) give insight into how the company performed in the quarter ended June 2025, but it may be worthwhile to compare some of its key metrics to Wall Street estimates and the year-ago actuals."
2025-08-01,Brookfield Renewable Partners L.P. Limited Partnership Units (BEP) Q2 2025 Earnings Call Transcript,SeekingAlpha,"Brookfield Renewable Partners L.P. Limited Partnership Units (NYSE:BEP) Q2 2025 Earnings Conference Call August 1, 2025 9:00 AM ETCompany ParticipantsConnor..."
2025-08-01,Brookfield Renewable Partners Posts Wider-Than-Expected Q2 Loss,Yahoo,BEPs second-quarter 2025 earnings and revenues improve year over year. Funds From Operations rise 10%.
2025-08-01,"If I Could Only Buy 2 Dividend Stocks, It Would Be These",SeekingAlpha,Discover exceptional dividend stocks worth holding onto for the long-term. Learn why these picks stand out and how they can boost your portfolio.
2025-08-02,Brookfield Renewable Partners LP (BEP) Q2 2025 Earnings Call Highlights: Strong FFO Growth and ...,Yahoo,"Brookfield Renewable Partners LP (BEP) reports a 10% increase in FFO per unit and secures significant contracts, despite facing policy and market challenges."
2025-08-03,"Brookfield Renewable Partners: Hydro Play, Growth, And Attractive Dividend; It Is A Buy",SeekingAlpha,"Brookfield Renewable Partners continues to deliver strong results and growth despite macro headwinds, reinforcing long-term upside. Read why BEP stock is a strong buy."
2025-08-05,2 High-Yield Preferreds For Non-Cyclical Retirement Income,SeekingAlpha,Using Brookfield Renewable Partners and Global Medical REIT to preserve high yields could be a smart move. Click here for more on Dividend Quick Picks & Lists.
2025-08-05,Are Utilities Stocks Lagging  Algonquin Power & Utilities (AQN) This Year?,Yahoo,Here is how Algonquin Power & Utilities (AQN) and Brookfield Renewable Energy Partners (BEP) have performed compared to their sector so far this year.
2025-08-06,Brookfield Renewable Partners L.P Outperform Rating Confirmed and Target Raised at National Bank,Yahoo,National Bank of Canada on Monday maintained its outperform rating on the shares of Brookfield Renew
2025-08-07,Camecos Bet on Westinghouse Pays Off: Can It Keep Delivering?,Yahoo,"CCJs Q2 net earnings soar 792% on Westinghouse gains, fueling a strong outlook and 45.2% year-to-date stock surge."
2025-08-13,My Dividend Stock Portfolio: New July Dividend Record - 100 Holdings With 12 Buys,SeekingAlpha,"See here for more on Julys investment insights: record-breaking dividends, high-yield BDCs, and strategies for steady income growth."
2025-08-14,"Building A $50,000 Dividend Portfolio: Enhancing SCHDs Income With Augusts Top High-Yield Stocks",SeekingAlpha,"Build a $50k dividend portfolio with SCHD at the core, boosted by high-yield picks & growth stocks."
2025-08-19,Brookfield Renewable Partners: Buy The Dip On This Dividend Powerhouse,SeekingAlpha,BEPs price dip offers a 6.1% yield and growth potential.
2025-08-19,Will Hydropowers Dominance in Clean Energy Benefit GE Vernova?,Yahoo,"GE Vernova expands its hydropower footprint with major global projects, reinforcing its role in the clean energy transition."
2025-08-23,Goodbye Growth? Heres What Im Buying As Value Mounts A Comeback,SeekingAlpha,"Recent underperformance in growth tech stocks reflects doubts about AI, while value-oriented dividend stocks have shown resilience and defensiveness. See more here."
2025-08-26,Renewable stocks dip from Trump’s halt on wind project,Yahoo,Orsted said it had finished 80% of its Revolution Wind Project before receiving a stop work order from the Bureau of Ocean Energy Management
2025-08-28,"The World Awaits: AI Infrastructure, Energy Convergence Drives Investment",SeekingAlpha,AI infrastructure and energy are converging themes driving massive capex from hyperscalers and related beneficiaries. Read what investors need to know about these developments.
2025-08-28,Bond Investors Beware: The Next Crisis May Already Be Here,SeekingAlpha,Protect your income from bond market risks. Discover alternative investment strategies to avoid a potential bond crisis and rethink the 60-40 portfolio.
2025-08-29,A Historic Opportunity For Dividend Investors,SeekingAlpha,Imminent rate cuts could boost dividend stocks. Read here for an analysis of picks among the top income stocks.
2025-08-29,Brookfield Renewable: I Added Its Low-Carbon Dividend To My Renewables Portfolio,SeekingAlpha,"Brookfield Renewable boosts FFO per unit by 10%, adds 7,700 MW, and leverages global diversification and inflation-indexed revenues for sustainable growth."
2025-09-04,The Great Disconnect: AI Stocks Soar While The Economy Stalls,SeekingAlpha,"AI is driving stock market highs, but economic reality lags behind, raising questions about sustainability and risk. Find out why investors should watch closely."
2025-09-05,"The $100,000 Dividend Portfolio: 10-Year Blueprint For Financial Freedom",SeekingAlpha,Turn $100K into lifelong passive income in 10 years with a simple plan that redefines retirement. Learn why the fastest path to freedom might be in your hands.
2025-09-06,Two Retirement Bargains With Upside Potential,SeekingAlpha,"Discover smart retirement portfolio strategies focusing on downside protection, stable income, and inflation hedge, plus 2 prudent bargain investment picks."
2025-09-09,Brookfield Renewable (TSX:BEP.UN): A Fresh Look at Valuation During a Period of Mixed Momentum,Yahoo,"Brookfield Renewable Partners (TSX:BEP.UN) has been quietly drifting on the market’s radar. There has been no major headline or dramatic news, just subtle moves that have left some investors pausing to ask what comes next. In times like these, it is easy to overlook a company’s true prospects, yet these periods can also be when opportunities start to emerge. Whether you already hold shares or are eyeing the stock, recent price action has likely given you cause to wonder if the current value..."
2025-09-09,The 2 Income Engines I Would Trust To Fund Retirement,SeekingAlpha,I want to have investments that are not at risk of financial distress. Find out why midstream and AI infrastructure are my two favorites for retirement passive income.
2025-09-10,Brookfield: My Long-Term Anchor For My Portfolio,SeekingAlpha,"Brookfield is evolving into an investment-led insurer, using annuity and pension float as a permanent engine for growth. Read why BN stock is a Buy."
2025-09-12,2 Higher Dividend Yields With Growth,SeekingAlpha,"Income investors are still focused on looking for yield, even as risk-free Treasury Rates moved higher. Click here for more on Dividend Quick Picks & Lists."
2025-09-19,The Near-Perfect Portfolio Of 3-13% Yields For The Feds Rate Cuts,SeekingAlpha,"The Fed just cut ratesâhereâs a portfolio of 3â13% yielding investments poised to benefit, plus what to avoid now. Find out why in this timely breakdown."
2025-09-20,"Dividend Champion, Contender, And Challenger Highlights: Week Of September 21",SeekingAlpha,"This is our weekly summary of dividend activity for Dividend Champions, Contenders, and Challengers. Read the latest in the article series here."
2025-09-22,2 Of My Highest Conviction Stress-Free Big Dividends,SeekingAlpha,"Discover two blue-chip stocks with high yields and growth potential. Enjoy safe, AI-driven dividends at bargain prices."
2025-09-23,Why This Fed Rate Cut Is Terrible News For Some Dividend Stocks,SeekingAlpha,"Rate cuts may look bullish, but certain sectors could face painful losses. See which sectors may suffer despite rate cuts and where to find reliable dividends."
2025-09-24,Brookfield Renewable: Trumps Policy Gambit Vs. Brookfields Global Diversification,SeekingAlpha,"Discover why Brookfield Renewable Partners (BEP) offers stable returns, dividend growth, and lower risk than high-yield options."
2025-09-26,RBC Keeps Outperform on Brookfield Renewable and US$31 Target After Investor Day,Yahoo,Brookfield Renewable Partners (TSX: BEP.UN; NYSE: BEP) Friday had its outperform rating and target p
2025-09-26,Bond Kings Dire AI Warning: A Major Market Reversal Could Be Coming,SeekingAlpha,"AI sector faces major risk, warns the Bond King. Read about how to protect your portfolio and optimize risk-reward amid potential market upheaval."
2025-09-26,Brookfield Renewable Partners L.P. Limited Partnership Units (BEP.UN:CA) Analyst/Investor Day - Slideshow,SeekingAlpha,2025-09-25. The following slide deck was published by Brookfield Renewable Partners L.P.
2025-09-28,A Generational Opportunity To Buy Dividends At Fire-Sale Prices,SeekingAlpha,Discover top dividend stocks trading at discounts and set for a rebound.
2025-10-02,Why Brookfield Renewables Growth Is Set To Accelerate,SeekingAlpha,Discover how Brookfield Renewable leverages global energy trends and inflation-linked contracts to target 10%+ annual FFO growth. Click for BEP & BEPC updates.
2025-10-06,My Retirement Is Built On These Dividend Machines,SeekingAlpha,"To retire on dividends, investors need to ensure that their portfolio is filled with holdings that pass five key tests. Learn more about those tests in detail here."
2025-10-09,A Major Market Shift Could Be Coming,SeekingAlpha,The S&P 500 has been on a very strong run over the past several years. Click here for more information on Market Outlook.
2025-10-09,My Dividend Stock Portfolio: New September Dividend Record - 100 Holdings With 13 Buys,SeekingAlpha,"Discover Septembers top stock gains, AI-driven strategies, and high-yield BDC investments to boost passive income."
