date,headline,source,summary
2025-02-28,"Building A $1,000,000 Dividend Portfolio: A Strategy For Growth, Income And Risk Management",SeekingAlpha,A high net worth dividend portfolio should prioritize capital preservation. Read more about an investment approach that offers diversification and helps generate extra income.
2025-03-01,Brookfield Renewable Completes Annual Filings,Yahoo,"BROOKFIELD, News, Feb. 28, 2025 (GLOBE NEWSWIRE) -- Brookfield Renewable (NYSE: BEP, BEPC; TSX: BEP.UN, BEPC) announced today the filing of its 2024 annual reports, including audited financial statements for the year ended December 31, 2024, on Forms 20-F with the SEC on EDGAR as well as with Canadian securities regulatory authorities on SEDAR+. These documents are available at bep.brookfield.com (or for Brookfield Renewable Corporation, at bep.brookfield.com/bepc), on SEC’s website at www.sec.g"
2025-03-02,Billionaire Bill Ackman Has 43% of His Hedge Funds $14.8 Billion Portfolio Invested in Just 3 Stocks,Yahoo,You can invest like Ackman. Here are his best ideas right now.
2025-03-02,"The More They Drop, The More I Buy (Up To 11% Yields)",SeekingAlpha,"As a dividend investor, I am focused primarily on the income that my investments generate for me. Check out four high-yield dividend stocks to buy the dip."
2025-03-02,A $1 Million Portfolio To Live Off Dividends In Retirement,SeekingAlpha,Learn how to build a $1M dividend portfolio for lifelong passive income.
2025-03-05,"2 Clean Energy Dividend Stocks to Buy With $10,000 and Hold Forever",Yahoo,"Clean energy is still a relatively modest contributor to the global energy pie.  If you are looking for a dividend stock to hold forever in the energy sector, it should probably have a clean energy angle to it.  What does NextEra Energy do?"
2025-03-07,I Am Buying These 6% Yielding Blue-Chip Dividend Stocks,SeekingAlpha,Dividend stocks are undervalued today. Learn why high-yielding blue-chip dividend stocks offer more rewarding returns than tech stocks.
2025-03-10,3 Reasons Brookfield Renewable Is a Long-Term Buy for 2030 and Beyond,Yahoo,Brookfield Renewable (NYSE: BEPC)(NYSE: BEP) operates one of the worlds largest publicly traded renewable energy and decarbonization platforms.  The company has three notable catalysts that give it increasing visibility into delivering double-digit earnings growth well into the next decade.  The company expects that inflation-driven rate increases will grow its funds from operations (FFO) by 2% to 3% per share each year.
2025-03-11,Brookfield Renewable to Issue C$450 Million of Green Bonds,Yahoo,"BROOKFIELD, News, March 10, 2025 (GLOBE NEWSWIRE) -- Brookfield Renewable (NYSE: BEP, BEPC; TSX: BEP.UN, BEPC) (“Brookfield Renewable”) today announced that it has agreed to issue C$450 million aggregate principal amount of Series 19 Notes (the “Notes”), due October 12, 2035, which will bear interest at a rate of 4.542% per annum. Brookfield Renewable Partners ULC, a subsidiary of Brookfield Renewable, will be the issuer of the Notes, which will be fully and unconditionally guaranteed by Brookfi"
2025-03-11,Buy The Dip: Big Dividend Growth Stocks With Major Upside Catalysts,SeekingAlpha,It is very rare to be able to buy a stock that offers both a high dividend yield and high growth. Read more to see my stock picks.
2025-03-12,"Brookfield Renewable: The More It Drops, The More I Buy",SeekingAlpha,"Brookfield Renewable is a top buy with 10%+ growth, 6.5% yield, and resilience to political shifts. Explore more details here."
2025-03-14,2 Powerful Catalysts Are Emerging For Dividend Stocks: My Top Picks,SeekingAlpha,Discover why 2025 could be a goldmine for dividend investors.
2025-03-14,Brookfield Renewable Partners: Excellent High-Yield Investment,SeekingAlpha,"Brookfield Renewable Partners offers a 6.5% dividend yield, driven by AI demand and growth trends. Discover BEPâs strong growth, low valuation, and high yield."
2025-03-14,Dividend Stocks Vs. Rental Properties: Whats The Smarter Investment In 2025?,SeekingAlpha,"See why dividend stocks outperform rental properties in 2025. Learn how to build safer, hassle-free passive income with a diversified portfolio."
2025-03-16,5 Dividend Stocks Yielding Over 5% to Buy Right Now,Yahoo,"The silver lining amid this sell-off is that dividend yields move in the opposite direction as stock prices.  Here are five high-quality dividend stocks that currently yield more than 5%, which you can confidently buy right now for a lucrative income stream.  Brookfield Renewable (NYSE: BEPC)(NYSE: BEP) currently yields 5.2%."
2025-03-18,Why Im Choosing Dividend Stocks Over Tech For Maximum Wealth Growth,SeekingAlpha,Tech stocks have outperformed for years. Dividend stocks offer a secret weapon that can crush the market. Check out my simple dividend strategy and its returns.
2025-03-18,Brookfield Asset Management: Market Correction Offers Another Opportunity To Buy This Business,SeekingAlpha,"Brookfield Asset Managements strong fundamentals, attractive valuation, and long-term growth prospects make it a compelling investment opportunity. See more."
2025-03-19,Brookfield Renewable: Clean Energy Is Not Going Away,SeekingAlpha,Brookfield Renewable hiked its dividend by 5.1% and now offers a healthy 6.56% dividend yield to its unit holders. Learn more about BEP stock here.
2025-03-20,My Dividend Stock Portfolio: New February Dividend Record - 100 Holdings With 11 Buys,SeekingAlpha,"February investments fell below $1,000, mainly in BDCs like Owl Rock Capital and Ares Capital, boosting annual dividend income by $77."
2025-03-20,3 Brilliant High-Yield Energy Stocks to Buy Now and Hold for the Long Term,Yahoo,"Theres a new administration in Washington, D.C., and it has a short-term plan for the energy sector whose key goal is to quickly lower energy prices for consumers.  For energy stock dividend investors who want to buy now and hold for the long term, consider Chevron (NYSE: CVX), Enterprise Products Partners (NYSE: EPD), and Brookfield Renewable (NYSE: BEP)(NYSE: BEPC)."
2025-03-21,"How Id Invest $100,000 Right Now For Stagflation (Up To 10% Yields)",SeekingAlpha,Protect your portfolio with dividend stocks offering up to 10% yields. See why these picks outperform SCHD and VYM during market chaos and inflation.
2025-03-22,"Dividend Champion, Contender, And Challenger Highlights: Week Of March 23",SeekingAlpha,"Stay updated with weekly dividend activity for Champions, Contenders, and Challengers. Learn about changes, ex-dividend dates, and upcoming pay dates."
2025-03-23,Brookfield Renewable Partners And Clearway Energy: 2 Bargains In Risk-Off Renewable Energy Segment,SeekingAlpha,"Discover my two favorite durable-income producing renewable stocks, which, in my view, have fallen in a bargain territory. Read more here."
2025-03-24,Using Options Writing To Generate Cash Flow,SeekingAlpha,Were highlighting how we generate some option income with a recap of several trades plus some ideas going forward. Check out our recommendations.
2025-03-24,Innergex Acquisition: Ideas Of Where To Redeploy Capital,SeekingAlpha,Innergexs buyout highlights renewable energys value. Explore top picks like Northland & Terna.
2025-03-25,AI Needs Power: Invest in High-Yield Utility Stocks to Ride the Electricity Demand Wave,Yahoo,"During Brookfield Renewables (NYSE: BEP)(NYSE: BEPC) fourth-quarter 2024 earnings call, the companys CEO stated very clearly that, Following several decades of modest electricity demand growth, we are experiencing a dramatic shift in demand driven by the AI revolution.  Brookfields CEO went on to explain that he believes artificial intelligence (AI) is one of, if not the most, significant advancement in technology in our lifetime."
2025-03-27,"Strategically Building A $100,000 Dividend Portfolio For Attractive Income And Strong Risk-Adjusted Returns",SeekingAlpha,The Dividend Income Accelerator Portfolio focuses on financially healthy companies with strong balance sheets. Check out the recent additions to the portfolio.
2025-04-01,These Ultra-High-Yielding Dividend Stocks Are No Joke,Yahoo,"You see a high dividend yield on a stock and believe you can make a lot of passive income.  Realty Income (NYSE: O), Brookfield Renewable (NYSE: BEPC)(NYSE: BEP), and Verizon (NYSE: VZ) all currently pay dividends yielding more than 5%, putting them several times higher than the S&P 500s (SNPINDEX: ^GSPC) 1.3% yield.  Because of that, you can confidently buy these dividend stocks without the fear of eventually looking like a fool for falling for a trap."
2025-04-01,2 No-Brainer Dividend Stocks to Buy This April,Yahoo,"There are three types of dividend stocks: those that dont change their dividend payments, those that have cut or eliminated their payouts, and those that initiate and grow their dividends.  Given the returns data on dividend stocks by their policy, investing in dividend growth stocks is a no-brainer strategy."
2025-04-01,NextEra Energy: Buy Ahead Of Tariff Day,SeekingAlpha,"NextEra Energy stands out among utility companies with its energy infrastructure, modest valuation, and high-growth potential. Click to read why NEE is a Buy."
2025-04-02,Brookfield Renewable Announces Dividend Rates On Its Series 1 and Series 2 Preference Shares,Yahoo,"All amounts in Canadian dollars unless otherwise stated BROOKFIELD, News, April 01, 2025 (GLOBE NEWSWIRE) -- Brookfield Renewable Partners L.P. (NYSE: BEP; TSX: BEP.UN) (“Brookfield Renewable”) today announced that Brookfield Renewable Power Preferred Equity Inc. (“BRP Equity”) has determined the fixed dividend rate on its Class A Preference Shares, Series 1 (“Series 1 Shares”) (TSX:BRF.PR.A) for the five years commencing May 1, 2025 and ending April 30, 2030 and the floating dividend rate on it"
2025-04-03,How to Find Strong Utilities Stocks Slated for Positive Earnings Surprises,Yahoo,Finding stocks expected to beat quarterly earnings estimates becomes an easier task with our Zacks Earnings ESP.
2025-04-03,Brookfield Renewable to Host First Quarter 2025 Results Conference Call,Yahoo,"BROOKFIELD, News, April 02, 2025 (GLOBE NEWSWIRE) -- Brookfield Renewable (NYSE: BEP, BEPC; TSX: BEP.UN, BEPC) (“Brookfield Renewable”) will hold its First Quarter 2025 Conference Call and Webcast on Friday, May 2, 2025 at 9:00 a.m. ET to discuss results and business initiatives. Results will be released on Friday, May 2, 2025 at approximately 7:00 a.m. ET and will be available on our website at https://bep.brookfield.com under “Press Releases”. Participants can join by conference call or webcas"
2025-04-06,"The Market Is Crashing, But We Are Rejoicing",SeekingAlpha,The stock market is crashing right now. Read why I think the recent sell-off is a great thing for long-term oriented dividend investors.
2025-04-08,How to Boost Your Portfolio with Top Utilities Stocks Set to Beat Earnings,Yahoo,The Zacks Earnings ESP is a great way to find potential earnings surprises. Why investors should take advantage now.
2025-04-09,3 Top Dividend Stocks to Buy and Hold for the Next 20 Years,Yahoo,"Dividend stocks are great long-term investments.  Brookfield Renewable (NYSE: BEPC)(NYSE: BEP), Realty Income (NYSE: O), and Medtronic (NYSE: MDT) have multi-decade histories of increasing their dividends."
2025-04-09,Is Brookfield Renewable Corporation (BEPC) the Best Clean Energy Stock to Buy According to Billionaires?,Yahoo,"We recently published a list of the 10 Best Clean Energy Stocks to Buy According to Billionaires. In this article, we are going to take a look at where Brookfield Renewable Corporation (NYSE:BEPC) stands against other top clean energy stocks according to billionaires. The current overall bearish trend has also dealt a massive blow to […]"
2025-04-11,"Brookfield Renewable (BEP): Strong Industry, Solid Earnings Estimate Revisions",Yahoo,"Brookfield Renewable (BEP) has seen solid earnings estimate revision activity over the past month, and belongs to a strong industry as well."
2025-04-16,Ray Dalio Warns Of Something Worse Than A Recession - Our Approach,SeekingAlpha,Protect your portfolio from economic turmoil! Discover assets and strategies were using to safeguard dividends. Click for our exclusive dividend stock picks.
2025-04-16,3 Dividend Stocks Yielding Over 4% to Buy in April,Yahoo,"Many growth-focused companies dont pay dividends at all, which is why the yield on the S&P 500 (SNPINDEX: ^GSPC) has fallen to just 1.4%.  Stocks with reliable dividends and high yields can be excellent ways to collect passive income no matter what the broader market is doing.  Heres why these three fool.com contributors think Chevron (NYSE: CVX), Brookfield Renewable Partners (NYSE: BEP) (NYSE: BEPC), and MSC Industrial Direct (NYSE: MSM) are three high-yield dividend stocks to buy now."
2025-04-16,Here Are My Top 3 High-Yield Stocks to Buy Now,Yahoo,"Toronto-Dominion Bank (NYSE: TD) has a 5% dividend yield.  Realty Incomes (NYSE: O) yield is 5.7%.  There was a large fine, the company is upgrading its internal controls, and TD Bank, as it is more commonly known, is operating under an asset cap in the U.S. The asset cap is the big problem because it basically means TD Bank cant expand its U.S. business until regulators are convinced the money laundering issue is in the past."
2025-04-18,Brookfield Renewable Corporation (BEPC): Among the Best Utility Stocks to Buy According to Analysts,Yahoo,"We recently published a list of 13 Best Utility Stocks to Buy According to Analysts. In this article, we are going to take a look at where Brookfield Renewable Corporation (NYSE:BEPC) stands against other best utility stocks to buy according to analysts. Utility stocks represent companies primarily engaged in providing electricity, natural gas, and water […]"
2025-04-21,Billionaire Bill Ackman Has 44% of His Hedge Funds $13 Billion Portfolio Invested in 3 Outstanding Stocks,Yahoo,Ackman aims to emulate some of the qualities that made Warren Buffett so successful.
2025-04-21,2 Durable Dividends At Bargain Prices,SeekingAlpha,"We have now more interesting, high-quality opportunities to consider. Check out two high-yielding and strong quality picks."
2025-04-22,How to Boost Your Portfolio with Top Utilities Stocks Set to Beat Earnings,Yahoo,Why investors should use the Zacks Earnings ESP tool to help find stocks that are poised to top quarterly earnings estimates.
2025-04-23,3 No-Brainer Energy Stocks to Buy Right Now,Yahoo,"Demand drivers such as artificial inteligence (AI) data centers, the onshoring of manufacturing, and the electrification of everything will power a 55% surge in electricity demand by 2040, according to some estimates.  Given the continued concerns surrounding climate change, this power will need to come from cleaner sources, including renewables, natural gas, and nuclear.  This forecast makes energy companies focused on supporting growing electricity demand look like no-brainer investments right now."
2025-04-24,3 Dangerous Truths I Learned The Hard Way As A Preferred Stock Investor,SeekingAlpha,"For investors looking to maximize income, preferred equity is often one of the best places to look. Read why preferred dividends arenât as safe as they seem."
2025-04-25,Pershing Square Holdings Full Year 2024 Letter To Shareholders,SeekingAlpha,"In 2024, Pershing Square Holdings generated a solid NAV performance of 10.2%, and a 8.3% total shareholder return. Click here to read the full letter."
2025-04-25,"GEV, SU, or BEP: Discover the Green Energy Stock Primed for the U.S.-China Trade War",Yahoo,"In a gas-powered world gradually transitioning to electric vehicles, many investors forget that green energy stocks have more potential than once thought. Three powerhouses currently stand out in the world of green energy investments: GE Vernova (GEV), Suncor Energy (SU), and Brookfield Renewable Partners (BEP). These companies are shaping the future of green power while neatly dodging the chaos of Trump’s tariff storm and the unravelling U.S.-China trade war. Each stock in this comparison has a"
2025-04-26,3 Megatrends Are Creating A Once-In-A-Generation Boom For Infrastructure Stocks,SeekingAlpha,"Markets are volatile, but infrastructure shines under todayâs macro conditions. See which stocks picked offer lasting dividend growth and real wealth."
2025-04-27,"The More It Underperforms, The More I Buy",SeekingAlpha,Recent sector surges hide undervalued stocks with major upside potential. Check out why these market laggards are great buys today.
2025-04-28,Wall Street Analysts Think Brookfield Renewable (BEP) Could Surge 32.08%: Read This Before Placing a Bet,Yahoo,"The consensus price target hints at a 32.1% upside potential for Brookfield Renewable (BEP). While empirical research shows that this sought-after metric is hardly effective, an upward trend in earnings estimate revisions could mean that the stock will witness an upside in the near term."
2025-04-28,Brookfield Renewable: Check Out That 6.9% Yield,SeekingAlpha,Brookfield Renewable Partners earnings and cash flows have been growing steadily over time. Read why I consider BEP stock as a buy.
2025-04-29,Top Wind Energy Stocks to Add to Your Portfolio for Solid Returns,Yahoo,"Leading wind energy stocks like EXC, BEP, AES and PCG present compelling opportunities, given their strong foothold in the market and focus on expansion."
2025-04-29,Brookfield Renewable Partners to Post Q1 Earnings: What to Expect?,Yahoo,BEPs first-quarter 2025 results are expected to continue to benefit from a diversified portfolio and investments in renewable power.
2025-04-29,3 High-Yield Energy Stocks to Buy to Create Years of Passive Income,Yahoo,"The energy sector can be a great place for investors to collect a lucrative passive income stream.  Many energy companies generate lots of excess cash flow, giving them the money to pay hefty dividends.  Several companies in the sector also have long dividend growth streaks."
2025-05-02,Brookfield Renewable: Q1 Earnings Snapshot,Yahoo,"HAMILTON, Bermuda (AP) — Brookfield Renewable Energy Partners LP (BEP) on Friday reported a loss of $108 million in its first quarter. The Hamilton, Bermuda-based company said it had a loss of 35 cents per share. The results fell short of Wall Street expectations."
2025-05-02,A Major Market Disruption Is Likely Coming,SeekingAlpha,A major market shakeup could be imminent. Techâs AI-fueled rally may be running on fumesâhereâs where the real profits are shifting. Read the full article here.
2025-05-02,Brookfield Renewable Announces Strong First Quarter Results,Yahoo,"All amounts in U.S. dollars unless otherwise indicated BROOKFIELD, News, May 02, 2025 (GLOBE NEWSWIRE) -- Brookfield Renewable Partners L.P. (TSX: BEP.UN; NYSE: BEP) (“Brookfield Renewable Partners”, BEP) today reported financial results for the three months ended March 31, 2025. “We had a strong start to the year, delivering record results from our large, highly contracted, global operating fleet, which is now approaching 45,000 megawatts diversified across the lowest cost energy technologies"
2025-05-02,Brookfield Renewable (BEP) Q1 Earnings: Taking a Look at Key Metrics Versus Estimates,Yahoo,"Although the revenue and EPS for Brookfield Renewable (BEP) give a sense of how its business performed in the quarter ended March 2025, it might be worth considering how some key metrics compare with Wall Street estimates and the year-ago numbers."
2025-05-02,Brookfield Renewable Partners L.P. Limited Partnership Units (BEP) Q1 2025 Earnings Call Transcript,SeekingAlpha,"Brookfield Renewable Partners L.P. Limited Partnership Units (NYSE:BEP) Q1 2025 Earnings Conference Call May 2, 2025 9:00 AM ETCompany ParticipantsConnor..."
2025-05-03,Brookfield Renewable Corp (BEPC) Q1 2025 Earnings Call Highlights: Strong Financial Performance ...,Yahoo,"Brookfield Renewable Corp (BEPC) reports a 15% increase in FFO per unit, driven by strategic acquisitions and robust renewable energy capacity expansion."
2025-05-03,Brookfield Renewable Partners LP (BEP) Q1 2025 Earnings Call Highlights: Strong FFO Growth and ...,Yahoo,Brookfield Renewable Partners LP (BEP) reports a robust 15% increase in FFO per unit and outlines ambitious growth plans amid market challenges.
2025-05-05,Brookfield Renewable Partners Q1 Earnings & Revenues Lag Estimates,Yahoo,BEPs first-quarter 2025 earnings and revenues decrease year over year. Funds From Operations rise 15%.
2025-05-05,This More Than 5%-Yielding Dividend Stock Looks Like a Cant-Miss Buy for Income and Upside Potential,Yahoo,"The company is in an exceptional position to capitalize on the growing demand for renewable energy.  The leading global renewable energy company is capitalizing on the surging demand for clean power, which should continue for decades.  Few companies in the sector can match Brookfields scale, expertise, and balance sheet strength."
2025-05-06,Brookfield Renewable Partners price target lowered to $30 from $31 at CIBC,Yahoo,"CIBC lowered the firm’s price target on Brookfield Renewable Partners (BEP) to $30 from $31 on updated debt values/assumptions, while keeping an Outperformer rating on the shares. The firm does not believe Brookfield Renewable Partners’ share price performance and current valuation reflects its ability to deliver consistent results and deliver on its growth objectives. CIBC thinks Brookfield Renewable Partners is one of the best-positioned firms to navigate tariffs/U.S. policy changes in terms o"
2025-05-07,Growth And Yield? Get Them Both With Brookfield Renewable Corporation,SeekingAlpha,"Brookfield Renewable Partners offers 6%+ yield, renewable energy growth, fair valuation, and strong assetsâideal for dividend investors. Click here to read more."
2025-05-07,Renewable Energy & Battery Storage Stocks to Add to Your Portfolio Now,Yahoo,"As industries are increasingly adopting renewable energy, demand for energy storage solutions is surging. You may consider buying DTE, BEP, BE & STEM."
2025-05-08,Dividend Stocks That Beat The Market - With Less Risk,SeekingAlpha,Higher returns typically come with higher risk. Read here for 2 high-yield dividend stocks offering potential higher returns with lower risk.
2025-05-13,This Top High-Yield Dividend Stock Has a Brilliant Strategy to Capitalize on This Growing Value Disconnect,Yahoo,Brookfield Renewable is always looking for opportunities to grow value for its shareholders.  Its seeing a widening disconnect between public and private market values for renewable energy assets.  Brookfield is capitalizing on this opportunity through its smart capital recycling strategy.
2025-05-15,Brookfield’s TerraForm Power Accelerates U.S. Development with Acquisition of Sun Tribe Development,Yahoo,"NEW YORK, May 15, 2025 (GLOBE NEWSWIRE) -- TerraForm Power, an affiliate of Brookfield Asset Management and a leading developer, builder and operator of renewable power, today closed on its acquisition of Sun Tribe Development, a mid-sized utility-scale solar and storage developer based in Virginia. With the transaction, TerraForm Power is initiating a new growth strategy, more than doubling its development pipeline to over 6,000 MW of solar and battery energy storage and strengthening its capab"
2025-05-16,Buy The Dip: 2 Blue-Chip High Yields Getting Way Too Cheap,SeekingAlpha,2 top high-yield dividend growth stocks are on sale after recent pullbacks. See why they are strong buys now and take advantage of the opportunity.
2025-05-19,Selling Options Delivers Cash Flow: Locking In Premiums For May,SeekingAlpha,"All our recent options trades expired worthless, locking in premiums and freeing up capital for new opportunities. Check out our latest options trading here."
2025-05-21,300% More Clean Energy Equals a Big Growth Opportunity for This High Yield Stock,Yahoo,"The worlds gradual transition from carbon-based energy sources to cleaner alternatives is ongoing.  Between 2020 and 2050, clean energy power generation in the U.S. is projected to grow by 300%.  Yielding as much as 6.2%, this diversified clean energy company is a long-term growth opportunity for income investors."
2025-05-24,4 Dividend Stocks Im Buying As The Big Beautiful Bill Takes Its Toll,SeekingAlpha,"The recent market selloff in dividend stocks, especially REITs and utilities, presents attractive buying opportunities. Read about stocks with dividend growth and long-term potential."
2025-05-26,4 Dividend Stocks to Double Up On Right Now,Yahoo,"These magnificent dividend stocks, yielding up to 6.7%, are top buys now to earn years of passive income."
2025-05-27,3 Safe Ultra-High-Yield Dividend Stocks to Buy and Hold for a Lifetime of Passive Income,Yahoo,Brookfield Renewable has grown its high-yielding payout at a 6% compound annual rate since 2001.  MPLX has grown its big-time distribution at a more than 10% annual rate over the past three years.  NNN REIT has one of the longest dividend growth streaks in its sector.
2025-05-27,My 2 Favorite Big Beautiful Bargains Offering High Yields,SeekingAlpha,The market is not always efficient. This creates opportunities to buy diamonds at regular stone prices. Discover 2 dividend bargains in an inefficient market.
2025-05-27,"How To Build A $100,000 Dividend Portfolio That Could Yield 10.75% In 15 Years",SeekingAlpha,The Dividend Income Accelerator Portfolio targets income growth and diversification across sectors and countries. Learn why it offers strong returns and low risk.
2025-05-28,3 Top High-Yield Dividend Stocks to Buy and Hold Through at Least the End of the Decade,Yahoo,Brookfield Renewable has highly visible and secured growth through 2029.  ConocoPhillips expects to deliver sector-leading free-cash-flow growth through the end of the decade.  Enbridge has expansion projects lined up to come online through 2029.
