date,headline,source,summary
2024-12-18,Billionaire Bill Ackman Has 45% of His Hedge Funds $13.4 Billion Portfolio Invested in Just 3 Stocks,Yahoo,The billionaire activist investor has made some big moves in his portfolio recently.
2024-12-18,Brookfield Renewable Partners Price Target Lowered to US$32 from US$33 at National Bank of Canada,Yahoo,Brookfield Renewable Partners (BEP-UN.TO) has had its price target cut to US$32 from US$33 but kept
2024-12-19,Brookfield Renewable: Preferreds Deliver As Stock Tanks,SeekingAlpha,"Brookfield Renewable Partners Q3-2024 FFO per unit was $0.42, showcasing robust growth despite below-average generation. Learn more about BEP stock here."
2024-12-19,A Rare Buying Opportunity,SeekingAlpha,There are also some exciting developments that could be a powerful tailwind for growth in the coming years. Click here to read what investors need to know.
2024-12-20,"NMAI: Very Attractive Yield, If It Is Sustainable",SeekingAlpha,"Is NMAI a good investment? High yield, flexible strategy, but concerns over distribution sustainability and current valuation. Click here for more on NMAI."
2024-12-21,Brookfield Renewable Announces Closing Date of Reorganization,Yahoo,"BROOKFIELD, NEWS, Dec. 20, 2024 (GLOBE NEWSWIRE) -- Brookfield Renewable Partners L.P. (“BEP”) (NYSE: BEP; TSX: BEP.UN) and Brookfield Renewable Corporation (“BEPC”) (TSX, NYSE: BEPC) today announced that they have now received all required shareholder, court and regulatory approvals for the previously-announced proposed reorganization of BEPC (the “Arrangement”). Accordingly, the Arrangement will become effective prior to markets open on December 24, 2024. As a result of the Arrangement, in exc"
2024-12-22,3 Top High-Yield Stocks to Buy Before 2024 Is Over,Yahoo,"The dividend yield on the average stock has fallen over the past year due to the surge in the stock market.  For example, the S&P 500s dividend yield has declined from 1.6% a year ago to around 1.2% these days, which is near its lowest level in over 20 years.  Enterprise Products Partners (NYSE: EPD), Clearway Energy (NYSE: CWEN)(NYSE: CWEN.A), and Brookfield Renewable (NYSE: BEP)(NYSE: BEPC) stand out to a few Fool.com contributors as great stocks to buy as we head into the new year."
2024-12-22,Worried About Higher For Longer? Sleep Well With This 7%-Yielding Portfolio,SeekingAlpha,Discover why high-yield investors have nothing to fear from higher inflation and interest rates with our 7%-yielding portfolio recommendation.
2024-12-22,"If You Like Warren Buffetts Berkshire Hathaway, Youll Love This Wealth-Creating Stock",Yahoo,"Warren Buffett is a masterful investor.  Over the last 30 years, his company, Berkshire Hathaway (NYSE: BRK.A)(NYSE: BRK.B), has delivered an average annualized return of 13%, beating the S&P 500s 11% average annualized total return.  As good as the Buffett-led Berkshire Hathaway is at growing shareholder value, Brookfield Corporation (NYSE: BN) has been even better."
2024-12-23,Volatile Week To Finish Up The Last Monthly Options Expiration Of 2024,SeekingAlpha,Explore the volatility of the financial market during the last monthly options expiration of 2024 and the impact on options trades. Click for our income strategy.
2024-12-24,Brookfield Renewable Partners: A Growth Play On Renewable Energy,SeekingAlpha,Brookfield Renewable Partners is a green energy company with a diversified international portfolio. Click here to find out why I rate BEP stock a buy.
2024-12-24,"Down 9%, 11%, and 14% in 1 Month, These 3 Dividend Stocks Are Screaming Buys in December",Yahoo,"Lee Samaha (Diamondback Energy): Its been a challenging year for investors in Diamondback, with the stock underperforming the S&P 500, but its been a good year for Diamondback operationally.  The price of oil is about $70 a barrel, similar to what it started the year at, and it spent most of the year above that price.  In addition, Diamondback completed a transformational $26 billion transaction with Endeavor resulting in a merger."
2024-12-26,"How To Build A Strategically Balanced $50,000 Dividend Portfolio To Be Well-Positioned For 2025",SeekingAlpha,"Learn how to build a $50,000 dividend portfolio to position yourself well for 2025 with a focus on dividend income, growth, and diversification."
2024-12-26,Brookfield Renewable: A Millionaire Maker in the Making?,Yahoo,"Brookfield Renewable (NYSE: BEP)(NYSE: BEPC) is a fairly complex entity, but it has positioned itself to benefit from a trend that is likely to last for decades.  With a lofty yield and an increasingly diversified business, this clean energy leader has a very real chance of helping investors build million-dollar portfolios.  What does Brookfield Renewable do?"
2024-12-28,3 Great Dividend Stocks to Buy Right Now for $33 or Less,Yahoo,"Several high-quality dividend stocks cost less than $33 a share.  Three great ones under that price point are Brookfield Renewable (NYSE: BEPC)(NYSE: BEP), Invitation Homes (NYSE: INVH), and Kinder Morgan (NYSE: KMI)."
2024-12-28,2 High Yield Bargains That Are Worth Including In A Retirement Portfolio,SeekingAlpha,Discover two income investing picks with durable income streams and potential for upside gains to help you meet your financial objectives.
2024-12-28,8 Stocks Im Buying As I Hone My Buying Strategy For 2025,SeekingAlpha,"Strategizing to balance growth and income in my portfolio by prioritizing dividend growth with quality stocks like SCHD, ADC, AMT, and NEE."
2024-12-28,"Dividend Champion, Contender, And Challenger Highlights: Week Of December 29",SeekingAlpha,"Stay up to date on dividend activity with a weekly summary for Dividend Champions, Contenders, and Challengers, including changes and upcoming dates."
2024-12-29,"MEGI: The Market Expects A Cut, The Numbers Reinforce That Conclusion",SeekingAlpha,"The NYLI CBRE Global Infrastructure Megatrends Term offers a high yield, but it has still disappointed investors. Read why MEGI is a Hold."
2024-12-31,Brookfield: Why The Corporation Looks Better Positioned Than The Manager,SeekingAlpha,Expected growth in Private Funds and BWS Capital should be in favor of Brookfield Corporation. Learn more about BN and BAM stocks and why BN is a Buy.
2024-12-31,3 Top Financial Resolutions Im Making for 2025,Yahoo,"My long-term goal is to become financially independent by eventually generating enough passive income to cover my routine living expenses.  Given that lofty aim, my financial goals for the upcoming year align with that desire to become more financially free.  Here are my top three financial goals, which I hope will inspire you to set some of your own."
2025-01-03,Buy The Dip 2: Dividend Stocks Getting Way Too Cheap,SeekingAlpha,Discover why the dip in dividend stocks is being considered a Christmas gift by investors and find out about two top picks to buy today. Click for our choices.
2025-01-03,Forget 2025 -- Brookfield Renewable Is Already Laying the Groundwork for Growth in 2030,Yahoo,"Brookfield Renewable (NYSE: BEP)(NYSE: BEPC) is an energy company focused on clean energy.  What does Brookfield Renewable do?  Brookfield Renewable is actually a little complex, involving three different stock tickers."
2025-01-04,2 Top Dividend Stocks to Buy in January,Yahoo,"Dividend stocks can be powerful investments.  The highest returns came from companies that grew their dividends.  While lots of companies increase their dividends, Brookfield Renewable (NYSE: BEPC)(NYSE: BEP) and Chevron (NYSE: CVX) stand out for their terrific dividend growth track records."
2025-01-04,Brookfield Renewable Partners: Im Kicking Off 2025 With This Wonderful Bargain,SeekingAlpha,"Discover why income-focused investors are turning to Brookfield Renewable Partners for its attractive dividend yield, growth prospects, and discounted..."
2025-01-04,5 High-Yield Infrastructure Stocks Looking Cheap On The Dip,SeekingAlpha,Discover five attractive investment opportunities in the rapidly growing infrastructure sector for strong returns in the coming years.
2025-01-04,Brookfield Renewable to Host Fourth Quarter 2024 Results Conference Call,Yahoo,"BROOKFIELD, News, Jan. 03, 2025 (GLOBE NEWSWIRE) -- Brookfield Renewable (NYSE: BEP, BEPC; TSX: BEP.UN, BEPC) (“Brookfield Renewable”) will hold its Fourth Quarter 2024 Conference Call and Webcast on Friday, January 31, 2025 at 8:30 a.m. ET to discuss results and business initiatives. Results will be released on Friday, January 31, 2025 at approximately 7:00 a.m. ET and will be available on our website at https://bep.brookfield.com under “Press Releases”. Participants can join by conference call"
2025-01-05,5 Top Stocks to Buy in January,Yahoo,"Naturally, investors are likely wondering how much longer the bull market rally can go.  Heres why these five Fool.com contributors have high conviction in Alphabet (NASDAQ: GOOG)(NASDAQ: GOOGL), Micron Technology (NASDAQ: MU), Brookfield Renewable (NYSE: BEP)(NYSE: BEPC), PepsiCo (NASDAQ: PEP), and United Parcel Service (NYSE: UPS) as top stocks to buy this month."
2025-01-05,Why A Major Market Reversal Is Likely Coming In 2025,SeekingAlpha,Discover why a major market reversal may be on the horizon in 2025 and how one financial writer is adjusting their investments accordingly.
2025-01-06,My Top Energy Stock to Buy in 2025,Yahoo,"Brookfield Renewable (NYSE: BEPC)(NYSE: BEP) is a global leader in producing renewable energy.  In addition, it has investments in nuclear energy services through its stake in Westinghouse Electric and a growing sustainable solutions business, which includes investments in carbon capture and storage.  Add in everything else it has to offer, and Brookfield Renewable is my top energy stock pick for the New Year."
2025-01-06,"A High-Yield, High-Growth Portfolio For Financial Independence And Early Retirement",SeekingAlpha,"Financial Independence, Retire Early movement has become popular with many. Check out a diversified portfolio of high-yield, high-growth stocks to achieve that."
2025-01-07,Brookfield Renewable: Diversified Clean Energy Leader,SeekingAlpha,"Brookfield Renewable has a diversified portfolio, strategic investments in emerging technologies, and partnerships. Read why I maintain Buy rating for BEPC stock."
2025-01-10,"Strategically Building A $10,000 Dividend Portfolio: Realty Income As Its Core Position",SeekingAlpha,"Learn how holding Realty Income as the largest position in your $10,000 dividend portfolio can reduce risk and maximize income and growth. Read more here."
2025-01-12,An Important Warning For These 6-20% Dividend Yields,SeekingAlpha,"Recently, one of the most dynamic high-yield, high-growth segments of the market has been dealt severe headwinds. I share how I am navigating these choppy waters."
2025-01-14,ClearBridge Canadian Equity Strategy Q4 2024 Commentary,SeekingAlpha,"During the fourth quarter, the ClearBridge Canadian Equity Strategy underperformed its S&P/TSX benchmark. Read more here."
2025-01-15,Jerome Powell Is Doing Dividend Investors A Huge Favor,SeekingAlpha,Discover the recent gift for dividend investors from the Fed and top picks to maximize your investment opportunities. Click for our picks and strategy.
2025-01-18,NextEra Energy Partners: A New Major Problem Has Just Emerged,SeekingAlpha,Learn why NEP may cut its distribution and the bigger problem its facing.
2025-01-19,A Big Dividend Snowball Portfolio For Early Retirement,SeekingAlpha,Discover how to build a big dividend snowball for retirement savings by avoiding certain stocks and investing in the right ones.
2025-01-19,Buy The Dip: High Dividend Growth Stocks Getting Way Too Cheap,SeekingAlpha,High-yield dividend growth stocks have pulled back recently. This has created some highly compelling opportunities. Read more to see my 2 picks.
2025-01-20,Brookfield Renewable: Bonds Offer 7.3% Yield For 63 Cents On The Dollar,SeekingAlpha,"Learn about the recent selloff of Brookfield Renewables 4.625% notes, offering a high yield and strong growth potential in the renewable energy sector."
2025-01-20,"Brookfield Renewable Partners: Chase The Yield, And The Growth",SeekingAlpha,Brookfield Renewable Partners benefits from AI-driven electricity demand and renewables growth. Learn why BEP stock is undervalued and has a solid entry point.
2025-01-20,Brookfield Infrastructure Partners: Buy The Dip,SeekingAlpha,Brookfield Infrastructure is a diversified infrastructure investor with strong FFO growth. Read why BIP stock has growth opportunity firmly in its sights.
2025-01-22,If I Could Only Retire With 5 Investments Today,SeekingAlpha,"When it comes to investing for and in retirement, sometimes simplicity is best. Check out how I would approach retirement with just five investments today."
2025-01-24,The Trump Trade: Top High-Yield Stocks For The New Administration,SeekingAlpha,Explore high-yield investing opportunities under the Trump administration for potential growth and attractive yields in the next four years. Read what investors need to know.
2025-01-25,10 Stocks Im Buying As A New Government Takes Power,SeekingAlpha,"This week, I share 10 dividend stock picks. Plus commentary on: Trumps limits to ramping oil production; Neither global warming nor renewable energy are going away; DOGE is fated to fail."
2025-01-28,Prospect Capital: 8.9% On Bonds With Heavy Insider Buys,SeekingAlpha,"S&P downgraded PSECs credit rating to junk due to portfolio turbulence and liquidity pressures, impacting its ability to raise equity funding. Yet insider buying has been extremely strong."
2025-01-28,Thanks Trump For The Gifts: 2 High-Quality Bargain Dividends,SeekingAlpha,"Since Trumps 2024 victory, sectors like AI, conventional energy, and financials have thrived. Read more to see two quality dividend picks."
2025-01-30,Northland Power: Preferreds Outperform But Commons 7% Monthly Yield Looks Interesting,SeekingAlpha,Northland Power Inc. A preferred shares beat common by 40%. See why NPI remains a solid choice and how weâre approaching it for optimal returns.
2025-01-30,"How To Strategically Allocate $25,000: Positioning Your Dividend Portfolio For 2025",SeekingAlpha,Maximize your dividend portfolio potential with strategic allocations for 2025.
2025-01-31,Brookfield Renewable Partners L.P. Limited Partnership Units (BEP) Q4 2024 Earnings Call Transcript,SeekingAlpha,"Brookfield Renewable Partners L.P. Limited Partnership Units (NYSE:BEP) Q4 2024 Earnings Conference Call January 31, 2025 8:30 AM ETCompany..."
2025-01-31,Brookfield Renewable Partners L.P. Limited Partnership Units 2024 Q4 - Results - Earnings Call Presentation,SeekingAlpha,The following slide deck was published by Brookfield Renewable Partners L.P.
2025-01-31,2 Top Dividend Stocks For 2025,SeekingAlpha,"Discover the top dividend paying stocks for 2025, with a focus on yield, growth, value, and safety."
2025-02-01,"Dividend Champion, Contender, And Challenger Highlights: Week Of February 2",SeekingAlpha,"Stay informed on dividend activity with a weekly summary for Dividend Champions, Contenders, and Challengers, including changes and ex-dividend dates."
2025-02-01,Brookfield Renewable Corp (BEPC) Q4 2024 Earnings Call Highlights: Record Growth and Strategic ...,Yahoo,"Brookfield Renewable Corp (BEPC) reports a 21% increase in quarterly FFO and unveils a landmark agreement with Microsoft, despite market challenges."
2025-02-01,8 Stocks & 1 ETF Im Buying As The Trade Wars Begin,SeekingAlpha,"The stock markets current valuations are elevated, driven by AI optimism, and theres a potential rotation from tech to other sectors to come in 2025. I share what stocks Im buying now."
2025-02-01,Two 7% Yields With Near-Term Catalysts,SeekingAlpha,Finding both yield and growth is tough. Find out two picks with ~7% yields and strong catalysts for future price appreciation.
2025-02-01,Brookfield Renewable Partners LP (BEP) Q4 2024 Earnings Call Highlights: Record Growth and ...,Yahoo,"Brookfield Renewable Partners LP (BEP) reports a 21% increase in Q4 FFO, significant capital deployment, and a landmark agreement with Microsoft, despite market challenges."
2025-02-02,This Top High-Yielding Dividend Stock Continues to Generate High-Powered Growth,Yahoo,"Brookfield Renewable (NYSE: BEPC) (NYSE: BEP) continues to prove its more than just an income stock.  The renewable energy giant delivered record results last year, growing its funds from operations (FFO) by 10% per share.  The top renewable energy dividend stock expects to continue generating high-powered growth in 2025 and beyond."
2025-02-02,"Brookfield Renewable Partners: Misunderstood, Discounted And My Favorite Pick",SeekingAlpha,"Brookfield Renewable Partners is one of the largest battery developers in the world. Read why BEP stock has become my favorite pick outside REIT, BDC, and MLP space."
2025-02-04,This Top Energy Stock Is Leading the Charge in Capturing This Historic Growth Opportunity,Yahoo,Brookfield Renewable (NYSE: BEPC)(NYSE: BEP) has become a force in the clean energy sector.  The opportunity to supply clean power to corporations has never been greater.  Few companies are in as strong a position to capitalize on this trend as Brookfield Renewable.
2025-02-05,Retirement Income: Great 7-11% Yields You Can Count On,SeekingAlpha,Discover two high quality stocks with high yields and discounted prices that could potentially provide market-beating returns for investors. Click here to read.
2025-02-05,6-12% Blue-Chip Yields: The Simple Path To Retiring With Dividends,SeekingAlpha,Retiring with dividends does not have to be difficult. Check out a model portfolio of high-yielding blue-chip stocks.
2025-02-06,‘You’ll be free too’: Kevin O’Leary says you’ll be a ‘multimillionaire’ if you can do 1 crucial thing,Yahoo,OLeary says the money came second to this one thing that drove his passion forward.
2025-02-06,1 Renewable Energy Stock to Buy in 2025 and Hold for Decades,Yahoo,Want to invest in the future of energy? This renewable energy stock is poised for long-lasting growth.
2025-02-06,1 Thing You Need to Know About Brookfield Renewable Stock Before You Buy,Yahoo,Brookfield Renewable (NYSE: BEP)(NYSE: BEPC) is a unique clean energy investment.  Heres why Brookfield Renewable is an interesting way to play the clean energy transition and why you have to go in with your eyes open if you decide to buy it.  What does Brookfield Renewable do?
2025-02-06,Brookfield Renewable Partners: Looking Like A Solid Value With A Strong Yield,SeekingAlpha,Discover why investing in Brookfield Renewable Partners (BEP) over BEPC is a smart move for higher yield and distribution growth opportunities. Read the full report here.
2025-02-07,"Brookfield Renewable Partners Q4 Earnings Top Estimates, Stock Up 3.5%",Yahoo,"BEPs fourth-quarter earnings decrease year over year, while revenues increase."
2025-02-07,Brookfield Corporation: Trump Administrations Priorities Match Bullish Sentiment,SeekingAlpha,"Brookfield Corporation trades reasonably cheaply compared to distributable earnings, is growing, and faces a permissive M&A environment. See why BN stock is a Buy."
2025-02-10,3 Top Dividend Stocks You Shouldnt Hesitate to Buy This February,Yahoo,"Dividend stocks can be terrific investments.  The best ones provide investors with passive income and upside potential.  Over the last 50 years, dividend stocks have outperformed non-payers by more than 2-to-1, according to data from Hartford Funds and Ned Davis Research."
2025-02-10,ClearBridge Global Value Improvers Strategy Q4 2024 Commentary,SeekingAlpha,The ClearBridge Global Value Improvers Strategy outperformed its MSCI World Value benchmark during Q4 2024. Click here to read the full commentary.
2025-02-11,Buy The Dip: High-Conviction High-Yields Getting Way Too Cheap,SeekingAlpha,"Due to concerns over rising long-term interest rates, there are currently several high-quality, high-yield businesses. Click to read more about high-yield stocks."
2025-02-11,7 Stocks And 1 ETF Im Buying As AI Spending Keeps Ramping Up,SeekingAlpha,AI capex is ramping up among major hyperscalers as they significantly increase their investments. Read what this means for investors looking at these stocks.
2025-02-13,A Rare Buying Opportunity Before A Big Market Reversal Takes Place,SeekingAlpha,Read more on three key opportunities to capitalize on a potential market reversal as AI-driven highs shift.
2025-02-14,These Big Dividends Are Printing Cash - Im Going All In,SeekingAlpha,"High-yield stocks face risks, but two sectors are thriving. Learn why my top picks in these sectors are poised for success in the current market."
2025-02-14,Brookfield Renewable Partners price target raised to $29 from $28 at Scotiabank,Yahoo,"Scotiabank analyst Robert Hope raised the firm’s price target on Brookfield Renewable Partners (BEP) to $29 from $28 and keeps an Outperform rating on the shares. The firm is introducing its 2027 estimates for its Canadian energy infrastructure coverage and providing perspectives on its outlook for the space, the analyst tells investors. Tailwinds from power and natural gas demand are driving increased opportunities to put capital to work and there is an upward bias to its estimates longer-term"
2025-02-15,This Top-Performing Stock Continues to Deliver Market-Crushing Returns,Yahoo,"Brookfield Corporation (NYSE: BN) is coming off another excellent year.  The leading global investment firm delivered record financial results.  Its businesses are growing briskly, and it trades at a wide discount compared to its intrinsic value."
2025-02-15,Want Decades of Passive Income? 2 Energy Stocks to Buy Right Now.,Yahoo,"The energy sector can be a great source of durable passive income if you know where to look.  While commodity price volatility can affect the cash flows of many energy companies, others have business models designed to mute the impact of that volatility on their earnings, so they can generate steadier cash flow to help support their growing dividends.  Enbridge (NYSE: ENB) and Brookfield Renewable (NYSE: BEPC)(NYSE: BEP) have been dividend stalwarts in the energy sector over the decades."
2025-02-16,3 Dividend Stocks to Double Up On Right Now,Yahoo,These incredible dividend growth stocks could multiply your money over time.
2025-02-17,Parnassus Mid Cap Fund Q4 And 2024 Annual Investment Commentary,SeekingAlpha,"The Parnassus Mid Cap Fund returned -4.09% (net) for Q4 2024, underperforming the Russell Midcap Indexâs 0.62% return. Click here to read the full commentary."
2025-02-18,The Market Is About To Flip: 3 AI-Driven Dividend Stocks Set To Soar,SeekingAlpha,"Discover three underrated, high-dividend stocks positioned to capitalize on AI demand and market shifts. Explore more details here."
2025-02-19,Brookfield Renewable Partners: Punished Unit Price But My Favorite 2025 Renewable Pick,SeekingAlpha,"Brookfield Renewable Partners (BEP) offers a 6.66% yield, strong growth potential, and global diversification. Discover why its a top investment for 2025."
2025-02-21,Dont Wait For A DOGE Dividend: Bet On Musks Team With These Stocks,SeekingAlpha,Discover how Elon Musks DOGE initiative could impact dividend stocks. Click here to read what investors need to know.
2025-02-22,"Dividend Champion, Contender, And Challenger Highlights: Week Of February 23",SeekingAlpha,"Stay updated with weekly dividend changes for Dividend Champions, Contenders & Challengers. Explore ex-dividend dates, pay dates and more."
2025-02-22,Brookfield Renewable Partners L.P. (BEP): Among the Worst Performing Utilities Stocks to Buy According to Analysts,Yahoo,"We recently compiled a list of the 10 Worst Performing Utilities Stocks to Buy According to Analysts. In this article, we are going to take a look at where Brookfield Renewable Partners L.P. (NYSE:BEP) stands against the other bad performing utilities stocks. As 2025 kicks off, the global energy sector continues to face a volatile and […]"
2025-02-23,Snowball Your Passive Income: 2 High-Yield Dividend Stocks With Significant Growth,SeekingAlpha,Investing in dividend growth stocks is a great way to achieve financial independence. Read more to see my 2 high-yield dividend stock picks.
2025-02-25,This 5%-Yielding Dividend Stock Continues to Add to Its Powerful Growth Profile,Yahoo,"The leading global renewable energy producer also has powerful growth potential.  The company and its partners recently agreed to buy National Grids (NYSE: NGG) onshore renewable energy business.  National Grid has agreed to sell its National Grid Renewables U.S. business to Brookfield Asset Management and its institutional partners, which include its renewable energy subsidiary, Brookfield Renewable."
2025-02-25,National Grid to divest US renewables business to Brookfield,Yahoo,The deal values National Grid Renewables at an enterprise value of $1.73bn.
2025-02-25,3 Dividend Stocks With Yields Over 5% to Buy Now and Boost Your Passive Income Stream,Yahoo,"The benefits of investing in dividend stocks can feel modest when the major market indexes are notching all-time highs.  With the S&P 500 (SNPINDEX: ^GSPC) yielding just 1.2%, investors will have to look beyond index funds if they want to generate meaningful levels amount of dividend income.  If thats your goal, United Parcel Service (NYSE: UPS), Brookfield Renewable (NYSE: BEPC) (NYSE: BEP), and Conagra Brands (NYSE: CAG) stand out as dividend stocks to buy now."
2025-02-26,Dividend Income For Early Retirement: Well-Covered 7-11% Yields With Strong Growth,SeekingAlpha,Inflation-proof your retirement with dividend stocks that pay you to wait and grow your wealth over time. Check out 3 stocks that offer enticing dividends.
