date,headline,source,summary
2025-06-27,"Tesla exec. & Musk confidant reportedly ousted, US stocks rise",Yahoo,"John Hyland outlines some of the top stories on the trading day on this rendition of Yahoo Finances Market Minute. Micron (MU) shares fall despite reporting earnings results that beat estimates. Tesla (TSLA) executive Omead Afshar has left the company, according to Bloomberg, with Forbes reporting Afshar was fired. Novo Nordisk (NVO) announces a weight loss drug partnership with Weight Watchers, just after the pharma giant cut ties with Hims & Hers (HIMS). Stay up to date on the latest market action, minute-by-minute, with Yahoo Finances Market Minute"
2025-06-27,Why Is Hims & Hers Health (HIMS) Stock Soaring Today,Yahoo,"Shares of telehealth company Hims & Hers Health (NYSE:HIMS) jumped 12.1% in the afternoon session after the companys CEO stated that it will continue to offer cheaper, compounded versions of GLP-1 weight-loss drugs. This statement comes on the heels of Novo Nordisks recent termination of its partnership with Hims & Hers, where it was to supply its branded weight-loss drug, Wegovy. Novo Nordisk ended the collaboration citing concerns over Hims & Hers promotion and sale of compounded drugs."
2025-06-27,Novo Nordisk says WeightWatchers will sell Wegovy,Yahoo,"STORY: Novo Nordisk is to collaborate with WeightWatchers to sell its blockbuster weight-loss drug Wegovy.Under the deal to start on July 1st, cash-paying patients can access a months supply of Wegovy through the Danish drugmakers Novocare pharmacy for $299.Novo recently announced the end of its collaboration with Hims and Hers Health.It cited the telehealth platforms sales of Wegovy copies and marketing tactics.WeightWatchers, which has exited  bankruptcy, says it no longer offers compounded versions of semaglutide.Thats the active ingredient in Wegovy.Novo said it is maintaining deals with WeightWatchers rivals Ro and LifeMD.WeightWatchers, intending to shed over $1 billion in debt, filed for Chapter 11 bankruptcy relief in May as part of a restructuring plan.In court documents, the company said its weight management program faced competition from sales of drugs like Wegovy.Demand for cheaper compounded versions of popular weight-loss drugs have risen over the past two years.After its deal with Novo fell apart, Hims CEO in a statement this week accused the drugmaker of attempting to steer patients toward the branded version of Wegovy."
2025-06-27,Weekly Recap: 12 Health Press Releases You Need to See,Yahoo,"With thousands of press releases published each week, it can be difficult to keep up with everything on PR Newswire. To help healthcare journalists and consumers stay on top of the weeks most newsworthy and popular releases, heres a recap of some major stories from the week that shouldnt be missed."
2025-06-27,AbbVie Adds More Than $24B in 6 Months: How to Play ABBV Stock,Yahoo,"ABBV adds $24B in market cap as Skyrizi and Rinvoq drive growth post-Humira, with more upside from a strong pipeline."
2025-06-27,Amgen Looks to Take Share of Booming Obesity Space: Will It Succeed?,Yahoo,"Amgen aims to challenge obesity drug leaders with MariTide, a potential monthly treatment now in late-stage trials."
2025-06-27,Is It Too Late to Buy NVIDIA?,Yahoo,"At the forefront of the AI frenzy has been beloved NVIDIA, which has seen unprecedented growth over recent years. But if youve missed the run, is it too late to get in now?"
2025-06-27,Hims & Hers Stock Tumbles as Novo Nordisk Ends Its Wegovy Sales Deal. Can the Telehealth Giant Recover?,Yahoo,"The stocks market-beating momentum has come crashing to a halt, following shocking allegations from one of the worlds largest pharmaceutical companies."
2025-06-28,Citi Expresses Optimism for Eli Lilly and Company (LLY),Yahoo,"Eli Lilly and Company (NYSE:LLY) is one of the 13 Best Long Term Growth Stocks to Invest in Right Now. On June 25, Citi reported that “compelling” data shows that Eli Lilly and Company (NYSE:LLY) and Novo Nordisk (NVO) have turned obesity into a treatable disease from a lifestyle-based condition. The firm models more than $40 […]"
2025-06-29,Calamos Long/Short Equity & Dynamic Income Trust Q1 2025 Commentary,SeekingAlpha,"For the quarter ending March 31, 2025, Calamos Long/Short Equity & Dynamic Income Trustâs total return was 1.69% on NAV and 6.82% on market price. Read more here."
2025-06-29,This Dirt Cheap Healthcare Stock Could Be a Hidden Artificial Intelligence (AI) Opportunity (Hint: Its Not Eli Lilly),Yahoo,Artificial intelligence (AI) has the potential to transform several different areas of the healthcare industry.
2025-06-29,Merck: Dont Let Todays Bargain Opportunity Pass You By,SeekingAlpha,"Merck remains a top Big Pharma name with strong leadership, rising sales, and high margins, despite regulatory fears and pressures. Learn why MRK stock is a buy."
2025-06-30,Will CVS Healths Formulary Move Boost Its Weight Management Program? (Revised),Yahoo,"CVS adds Wegovy to its top formularies and bolsters its Weight Management program, aiming to expand access while cutting costs."
2025-06-30,Hardman Johnston Global Equity Sold Novo Nordisk (NVO) due to Weak Script Trends,Yahoo,"Hardman Johnston Global Advisors, an investment management company, released its “Hardman Johnston Global Equity Strategy” first quarter 2025 investor letter. A copy of the letter can be downloaded here. The strategy returned 0.43%, net of fees, in the quarter compared to -1.32% for the MSCI AC World Net Index. The Portfolio experienced a solid quarter […]"
2025-07-01,Can Protagonist Take On Eli Lillys Next-Generation Obesity Treatment?,Yahoo,Protagonist Therapeutics is taking aim directly at Eli Lillys obesity treatment with a newly announced drug that uses the same mechanism.
2025-07-01,How Novo Nordisk misread the US market for its weight loss sensation,Yahoo,"COPENHAGEN (Reuters) -Novo Nordisks top executives ignored internal warnings that the company was not sufficiently prepared for the launch of its weight-loss drug Wegovy, leaving the Danish drugmaker in a more vulnerable position when rival Eli Lilly entered the market, six former employees involved in the discussions told Reuters.  Novo has enjoyed a tremendous windfall of $46 billion (292 billion Danish crowns) in net profit since mid-2021, when Wegovy became the first highly effective obesity treatment approved in the United States.  In response, Novo is reorganizing its leadership team following the surprise ouster of Chief Executive Lars Fruergaard Jorgensen."
2025-07-01,Market Chatter: Novo Nordisk Executives Ignored Warnings Against Wegovy Launch,Yahoo,Novo Nordisk (NVO)s top executives did not heed internal warnings that the company was not fully pr
2025-07-01,NYLI WMC International Research Equity Fund Q1 2025 Commentary,SeekingAlpha,The NYLI WMC International Research Equity Fund outperformed the index for the period. Global ex-U.S. equities rose in the first quarter. Read more here.
2025-07-01,Dividend Yield Theory Says Merck Is A Buy,SeekingAlpha,"Merck & Co., Inc.s 4.09% dividend yield and robust pipeline signal strong growth potential. Click here to read an analysis of MRK stock now."
2025-07-01,Hims & Hers Can Still Thrive Without GLP-1s,SeekingAlpha,"Hims & Hers thrives with telehealth growth, strong subscriber base, and expanding products, despite challenges like competition and regulatory scrutiny. Learn more on HIMS stock here."
2025-07-01,Top Midday Stories: Powell Blames Tariffs for Rate Pause; Tesla Shares Fall on Trump-Musk Feud,Yahoo,"The S&P 500 and the Nasdaq Composite fell in late morning trading, while the Dow Jones Industrial Av"
2025-07-01,Sector Update: Health Care Stocks Lean Lower Premarket Tuesday,Yahoo,Health care stocks were leaning lower premarket Tuesday with the iShares Biotechnology ETF (IBB) and
2025-07-02,Novo Nordisk (NVO) Ascends While Market Falls: Some Facts to Note,Yahoo,"Novo Nordisk (NVO) reached $69.82 at the closing of the latest trading day, reflecting a +1.16% change compared to its last close."
2025-07-02,"WeightWatchers and Novo Nordisk Expand Collaboration to Improve Medication Access Through Trusted, Holistic Model of Care",Yahoo,"WeightWatchers Clinic Members Can Access FDA-Approved Wegovy® for $299 in July, a $200 Savings Offer to Improve Access as WeightWatchers’ Trusted, Science-Backed Approach Continues to Lead the Industry Collaboration Builds a Seamless NovoCare® Pharmacy Integration, Shared Vision to Enhance Outcomes Through WW’s GLP-1 Companion Support, and a Commitment to Publishing Real-World Evidence WeightWatchers Sets the Standard in Evidence-Based Weight Health, Prescribing Only FDA-Approved Medications NEW"
2025-07-02,This GLP-1 Stocks Bad News Could Be a Big Win for Eli Lilly and Novo Nordisk,Yahoo,"Amgen recently released the full data from a trial involving its GLP-1 drug, MariTide.  More than one-quarter of the participants on the highest dosage of the drug had to stop taking it due to adverse side effects.  There are a lot of healthcare companies that are investing in GLP-1 weight loss drugs."
2025-07-02,"Semaglutide Market Forecast Report 2025-2033 | Growth Accelerates Amid Rising Awareness, Regulatory Approvals, and Strong Pipeline Advancements",Yahoo,"The Semaglutide market is projected to expand from US$ 27.15 billion in 2024 to US$ 61.7 billion by 2033, with a CAGR of 9.55% from 2025. Driven by rising obesity and type 2 diabetes incidences, the market for semaglutide, a GLP-1 receptor agonist, is growing due to its efficacy in glycemic control and weight management. Brand names like Ozempic, Rybelsus, and Wegovy underscore its role in improving health outcomes. Increased awareness, approvals, and advanced delivery systems play pivotal roles"
2025-07-02,Is Hims & Hers Stock in Trouble?,Yahoo,"Hims & Hers Health and Novo Nordisk announced a partnership a few months ago, and it has already come to an end.  Novo Nordisk is concerned about the telehealth companys practices, particularly relating to compounded drugs.  Hims & Hers Health (NYSE: HIMS) is a telehealth company that offers personalized solutions for its customers."
2025-07-02,How to Find Strong Medical Stocks Slated for Positive Earnings Surprises,Yahoo,Why investors should use the Zacks Earnings ESP tool to help find stocks that are poised to top quarterly earnings estimates.
2025-07-02,2 Growth Stocks to Buy Hand Over Fist in July,Yahoo,These companies are poised to produce fireworks for your portfolio over the coming years.
2025-07-03,Pfizer Trades Above 50-Day Average for a Month: Time to Buy?,Yahoo,"PFE trades above its 50-day average for over a month, signaling bullish momentum despite COVID revenue declines and patent risks."
2025-07-04,Are You Looking for a High-Growth Dividend Stock?,Yahoo,"Dividends are one of the best benefits to being a shareholder, but finding a great dividend stock is no easy task. Does Novo Nordisk (NVO) have what it takes? Lets find out."
2025-07-04,Will Novo Nordisks Rare Disease Bets Reduce GLP-1 Reliance?,Yahoo,NVO is expanding into rare blood disorders like hemophilia to ease reliance on GLP-1 drugs Ozempic and Wegovy.
2025-07-04,Can CVS Sustain Pharmacy & Consumer Wellness Gains Through Year-End?,Yahoo,"Strong pharmacy drug mix, flu season and store optimization power CVS Healths PCW gains. Will the momentum continue?"
2025-07-04,Take The Labor Market Data With A Pinch Of Salt,SeekingAlpha,"Junes labor market exceeded expectations, but Fed projections and trade tariffs loom. Check out why I think healthcare stocks could make some of the best buys."
2025-07-04,Hims & Hers Health’s Q1 Earnings Call: Our Top 5 Analyst Questions,Yahoo,"Hims & Hers Health delivered a first quarter that surpassed Wall Street’s expectations, driven by strong adoption of its personalized healthcare solutions and momentum in weight loss offerings. Management highlighted that expanding the range of treatments, such as the addition of liraglutide and branded Wegovy through a new partnership with Novo Nordisk, was key to attracting new subscribers. CEO Andrew Dudum emphasized, “Our vision involves expanding from hundreds of personalized treatments tod"
2025-07-04,Lilly and Novo Are the Kings of Weight-Loss Drugs. The Companies Coming for Their Crowns.,Yahoo,"Both well-established and small, clinical-stage pharma companies are investing heavily to be able to someday compete with Lilly and Novo."
2025-07-05,PRTA Dives 53.5% YTD: Will the Restructuring Effort Boost Prospects?,Yahoo,"Prothena slashes 63% of its workforce and axes birtamimab after trial failure, reshaping its pipeline and financial outlook. Shares plunge 53.5% YTD."
2025-07-06,Novo Nordisks Sell-Off Has Gone Too Far,SeekingAlpha,"Discover why Novo Nordisks current sell-off offers a strong buy opportunity. Backed by solid fundamentals, growth prospects, and valuation discounts."
2025-07-06,2 Stocks to Buy on the Dip and Hold for 10 Years,Yahoo,"DexCom has significant room to grow in its core market, despite disappointing results last year.  One of Warren Buffetts famous pieces of investing advice is to be greedy when others are fearful.  Two great examples today in the healthcare sector are Novo Nordisk (NYSE: NVO) and DexCom (NASDAQ: DXCM)."
2025-07-07,GLP-1 roadblocks: Discontinuation rates soar as insurers clamp down,Yahoo,"As more drugmakers aim for the lucrative weight loss market, patient challenges linger."
2025-07-07,Novo and Lilly compete in India as obesity drugs demand hikes,Yahoo,"STORY: :: Eli LillyDemand for weight-loss drugs in India has shot up.And rivals Novo Nordisk and Eli Lilly are battling for market share.That’s according to research firm Pharmarack.It said sales of Lillys Mounjaro, which launched in March, doubled from May to June.Overall, its almost hit close to 88,000 units sold - over $3 million.:: Novo NordiskMeanwhile, Pharmarack said Novo sold almost 1,800 units of Wegovy since its late-June launch.Medical journal the Lancet has said the incidence of obesity and diabetes is rising in India.And the country ranks among the worst three globally for high obesity rates.Pharmarack said the Indian obesity market has grown fivefold since 2021 and is valued at $73 million.And affordability and willingness to try new drugs for obesity have propelled the growth of the market.While Wegovy’s only just launched, the active ingredient in it - semaglutide - has a two-thirds share in the Indian market, according to Pharmarack.And Novo has sold oral versions of semaglutide for diabetes in India since 2022.However, semaglutide will lose patent protection in India next year.Enabling generic drugmakers to produce cheaper versions of Wegovy as India becomes a key battleground for drugmakers in the global obesity market."
2025-07-08,"Revived WeightWatchers Rallies, In Strongest Position In Years",Yahoo,Analyst initiates coverage of WeightWatchers with a buy rating after bankruptcy reemergence. IPO hot streak continues.
2025-07-08,Anti-Obesity Drugs Market Research and Forecast Report 2025 | Market to Surpass $120 Billion by 2034 - Increased Strategic Merger and Initiatives to Meet Rising Demand,Yahoo,"The anti-obesity drugs market, valued at USD 3.20 billion in 2024, is propelled by rising obesity prevalence worldwide, aiming for USD 120.32 billion by 2034 at 43.72% CAGR. Key drivers include FDA-approved drugs like Liraglutide, strategic mergers, regulatory support, and rising awareness. Top players include Novo Nordisk and Eli Lilly. Anti-Obesity Drugs Market Anti-Obesity Drugs Market Dublin, July 08, 2025 (GLOBE NEWSWIRE) -- The Anti-Obesity Drugs Market Report and Forecast 2025-2034 repo"
2025-07-08,Fundsmith Equity Fund 2025 Semi-Annual Letter To Shareholders,SeekingAlpha,"Fundsmith Equity Fund fell 1.9% in the first six months of the year, two percentage points less than what is perhaps the most obvious comparator â the MSCI World Index (Â£ net)."
2025-07-08,"European shares rise on energy, healthcare boost; tariff uncertainty lingers",Yahoo,"(Reuters) -European shares ended higher on Tuesday, boosted by healthcare and energy shares while investors assessed the latest phase of U.S. President Donald Trumps tariff rollouts, which included a new deadline for trade deals.  The pan-European STOXX 600 index ended 0.4% higher, hitting its highest level in three weeks.  Heavyweight energy shares advanced 1.1% on higher crude oil prices, and healthcare gained 0.8% with Danish drugmaker Novo Nordisk, one of the biggest weights on the STOXX 600, up 2%."
2025-07-08,"WeightWatchers names new medical chief, plans to offer menopause therapy and support",Yahoo,"NEW YORK (Reuters) -WeightWatchers on Tuesday named Dr. Kim Boyd as chief medical officer and said it was planning a new program to help women manage the transition into menopause and beyond, as part of its growth strategy in emerging from bankruptcy.  Boyd, a Stanford University graduate who has worked with several consumer health startups, said in an interview WeightWatchers is building upon its decades-long work providing weight management tools to also address the specific needs of people using obesity treatments.  WeightWatchers CEO Tara Comonte said such support for members using weight-loss drugs should appeal to health insurers and employers who pay for health benefits as they seek more sustainable management of the costly medications."
2025-07-09,Ideal Portfolio For A 60+ Year Old,SeekingAlpha,Individual stock picking might not be the most efficient strategy for part-time investors. Check out the ideal investment mix for 60+ year old investors.
2025-07-09,"Alcohol Use Disorder Market Report 2025-2035 Featuring Clearmind Medicine, Purdue Pharma, Psyence Biomedical, Eli Lilly and Co, Tempero Bio,, Nxera Pharma, Novo Nordisk, Adial, Alkermes, Lundbeck",Yahoo,"The global alcohol use disorder market is experiencing significant growth, driven by increasing demand for innovative and personalized treatments, and the integration of digital health technologies. Advancements in pharmacotherapies and personalized medicine are offering more effective solutions, while telemedicine and online support expand treatment accessibility. Despite challenges like high costs and stigma, especially in developing regions, the market shows potential for further growth. Key"
2025-07-09,TD Cowen Keeps Buy on Novo Nordisk (NVO),Yahoo,"Novo Nordisk A/S (NYSE:NVO) is one of the 11 Best Foreign Stocks to Buy According to Hedge Funds. On June 18, TD Cowen maintained its “Buy” rating on Novo Nordisk A/S (NYSE:NVO) with a price target of $105. This decision came after meetings with the company’s senior leaders in Copenhagen, Denmark. The research firm pointed […]"
2025-07-09,Is Novo Nordisk Increasing Dosage to Defend Wegovys Edge in Obesity?,Yahoo,"NVO submits higher-dose Wegovy to EMA, aiming for greater weight loss and stronger defense against rivals in the obesity market."
2025-07-10,"Lilly Down More Than 15% in a Year: Time to Buy, Sell or Hold?",Yahoo,"LLY has slid 15.7% over the past year, but surging demand for Mounjaro and Zepbound could revive the stocks momentum."
2025-07-10,"The Zacks Analyst Blog Highlights SAP SE, Novo Nordisk, Thermo Fisher Scientific and FONAR",Yahoo,"SAP, NVO, TMO and FONR navigate growth and headwinds as analysts spotlight cloud momentum, obesity drugs, and innovation plays."
2025-07-10,3 To Watch Of 23 Safer July Dividends From 46 Fortune Worlds Most Admired Companies,SeekingAlpha,"I analyze the 50 Fortune Worlds Most Admired Companies, focusing on dividend-paying stocks and their yield-based investment potential. View the full analysis here."
2025-07-10,3 Reasons I Bought Novo Nordisk Stock Instead of Eli Lilly,Yahoo,"Novo Nordisks beaten-down valuation became too attractive to pass up, so I bought the stock earlier this year.  Eli Lillys GLP-1 drugs may have more potential, but Novo Nordisk is still likely to be a dominant player in the weight loss and diabetes markets.  Eli Lilly (NYSE: LLY) and Novo Nordisk (NYSE: NVO) are two phenomenal growth stocks that investors probably cant go wrong with when investing in for the long term."
2025-07-10,U.S. telehealth upstart plans to sell generic Ozempic in Canada as patent due to lapse,Yahoo,Hims & Hers Health says generic version should sell at significant discount
2025-07-11,Eli Lilly Has Seized the Lead in Anti-Obesity Drugs. Next Up: a Pill.,Yahoo,"The drugmaker has become a clear winner with its weight-loss drugs. Now, with a pill under development, the company should see earnings gains through the end of the decade."
2025-07-11,ClearBridge International Growth ADR Strategy Q2 2025 Commentary,SeekingAlpha,"During the second quarter, the ClearBridge International Growth ADR Strategy performed mostly in line with its MSCI EAFE Index benchmark. Read more here."
2025-07-11,Eli Lilly Comes Out As ADA Winner,SeekingAlpha,Eli Lilly reported impressive data at the recent American Diabetes Association (ADA) conference. Its robust pipeline will solidify its market dominance for the next 5-7 years. Read more.
2025-07-11,June in Review: 14 Top Health Press Releases,Yahoo,"With thousands of press releases published each month, it can be difficult to keep up with everything on PR Newswire. To help healthcare journalists and consumers stay on top of the months most popular releases and newsworthy trends, heres a recap of some of the past months most read- and engaged-with stories."
2025-07-11,WeightWatchers Has Exited Bankruptcy. How Should You Play WW Stock Here?,Yahoo,"WeightWatchers is out of bankruptcy with a bold health pivot, but its stock surge faces a reality check."
2025-07-11,"Terns Pharmaceuticals: A Risky Buy Ahead Of Q4 Obesity, Oncology Catalysts",SeekingAlpha,Terns late-stage assets target CML & obesity with key data in Q4 2025. Explore their potential in massive markets. Click here to find out why TERN is a Buy.
2025-07-11,Can Mounjaro and Zepbound Drive Another Strong Quarter for Eli Lilly?,Yahoo,"LLY rides high on surging demand for Mounjaro and Zepbound, now nearly half its revenues ahead of Q2 earnings."
2025-07-11,Smart Money Going in Senior Health: Key Stocks in Elderly Care,Yahoo,"RHHBY, NVO, EW and SYK are ramping up senior care innovation as aging populations reshape global healthcare demand."
2025-07-12,Bull of the Day: Hims & Hers Health (HIMS),Yahoo,Hims & Hers Health stock continues to be a market leader even amid controversy
2025-07-13,Why Novartis Is Still A Buy After 15% Surge,SeekingAlpha,"Novartis shares climb on strong Cosentyx sales, franchise growth, and a new malaria drug approval despite political risks. Find out why NVS stock is a buy."
2025-07-13,NVIDIA (NVDA) Announces Collaboration with Novo Nordisk,Yahoo,NVIDIA Corporation (NASDAQ:NVDA) is one of the 10 Best Semiconductor Stocks to Buy According to Reddit. NVIDIA Corporation (NASDAQ:NVDA) announced a collaboration with Novo Nordisk to ramp up the drug discovery efforts via innovative AI use cases. The work supports Novo Nordisk’s agreement with DCAI to utilise the Gefion sovereign AI supercomputer. The companies are focusing on creating customized […]
2025-07-13,"Hims & Hers Health, Inc. (HIMS) Isn’t Regarded As A Great Actor By Doctors, Says Jim Cramer",Yahoo,"We recently published 14 Stocks Jim Cramer Discussed As He Talked About Record Bitcoin Price. Hims & Hers Health, Inc. (NYSE:HIMS) is one of the stocks Jim Cramer recently discussed. Hims & Hers Health, Inc. (NYSE:HIMS) is a well-known digital health platform that allows users to order medicines after securing prescriptions. Despite multiple headwinds in […]"
2025-07-13,"Novo Nordisk A/S (NVO): “Canada’s A Backdoor,” Says Jim Cramer",Yahoo,We recently published 14 Stocks Jim Cramer Discussed As He Talked About Record Bitcoin Price. Novo Nordisk A/S (NYSE:NVO) is one of the stocks Jim Cramer recently discussed. Novo Nordisk A/S (NYSE:NVO) is a Danish pharmaceutical company that was one of the earliest movers in the weight loss drug market. The shares have lost 21% […]
2025-07-14,WW International: Menopause Healths Comeback,SeekingAlpha,"WW International relists on Nasdaq, pivoting to menopause care with GLP-1 drugs and coaching. Click here to read an analysis of WW stock now."
2025-07-14,Temasek eyes more Indian family-run businesses after Haldirams deal,Yahoo,"MUMBAI (Reuters) -Singapores state investor Temasek is looking to invest more in Indian family-run businesses, a top executive said on Monday, months after it invested $1 billion in a popular domestic snacks company.  Family businesses in India, with their multigenerational legacies, strong domestic brands and loyal customers, have become attractive for global investors in recent years.  In March, Temasek bought a 10% stake in Haldirams at a valuation of around $10 billion, with sources describing it as a prized asset that will help investors expand its focus on Indias consumer sector."
2025-07-14,"Europe Glucagon-like Peptide-1 (GLP-1) Agonists Research Report 2025 | Market to Reach $14.34 Billion by 2034, Driven by Innovative R&D, Strategic Collaborations, and Drug Formulation Advancements",Yahoo,"The Europe GLP-1 agonists market, valued at USD 7.09 billion in 2024, is set to grow at a 17.30% CAGR, reaching USD 14.34 billion by 2034. Driven by rising diabetes and obesity rates, innovative drug formulations, and supportive healthcare policies, the market is expanding. Key players include Eli Lilly, Sanofi, and Novo Nordisk. Challenges involve high costs and regulatory complexities. Opportunities lie in obesity treatment expansion and advanced drug delivery systems. European Glucagon-like P"
2025-07-15,Amgen: Great Starting Yield For This Wealth Compounder,SeekingAlpha,"Amgen combines patent protection, a robust pipeline, and strong execution for defensive investment."
