date,headline,source,summary
2024-12-10,BNY Mellon Concentrated International ETF Q3 2024 Commentary,SeekingAlpha,The BNY Mellon Concentrated International ETF underperformed the MSCI EAFE Index for the third quarter of 2024. Read more here.
2024-12-10,VXUS: 51 Countries Against 1,SeekingAlpha,Now is a great time to consider increasing allocation to international stocks via Vanguard Total International Stock Index Fund ETF Shares. Click for more on VXUS.
2024-12-11,Allspring International Equity Fund Q3 2024 Commentary,SeekingAlpha,The Allspring International Equity Fund underperformed the benchmark MSCI EAFE Index (Net) for the third quarter of 2024. Click here to read the full commentary.
2024-12-11,Allspring Premier Large Company Growth Fund Q3 2024 Commentary,SeekingAlpha,The Allspring Premier Large Company Growth Fund outperformed the Russell 1000 Growth Index during the third quarter of 2024. Click here to read the full commentary.
2024-12-11,GLP-1 compounding is still in limbo. Will the FDA leave it for the next administration?,Yahoo,The agency has yet to make a decision about keeping tirzepatide on or off of its shortage list — letting compound pharmacies continue their lucrative operations for now.
2024-12-11,Novo Nordisk: Just The Right Price (Rating Upgrade),SeekingAlpha,"Market multiples for Novo Nordisk are also attractive now, especially with a forward P/E for 2025 at 28.3x. Learn more about NVO stock here."
2024-12-12,Here’s Why Novo Nordisk A/S (NVO) Fell in Q3,Yahoo,"PGIM Jennison Health Sciences Fund recently released its third quarter 2024 investor letter. A copy of the letter can be downloaded here. Given concerns regarding the decreasing pace of U.S. employment and the associated concerns that U.S. interest rates may have been maintained at levels higher than necessary to moderate the pace of inflation, U.S. […]"
2024-12-12,Telehealth Firm Ro Partners With Eli Lilly to Boost Access to Obesity Drug Zepbound,Yahoo,"Telehealth firm Ro has partnered with Eli Lilly And Co (NYSE:LLY) to enhance patient access to Zepbound (tirzepatide) single-dose vials for obesity treatment. Through LillyDirect, Ro will provide patients with streamlined access to this FDA-approved medication at a self-pay price, making it more affordable for clinically eligible individuals. The collaboration integrates diagnosis, prescription, and home delivery into one platform. Also Read: Eli Lilly Investments In Production Reach $23 Billion"
2024-12-12,Novo Nordisk A/S: European regulatory authority adopts positive opinion for an update of the Ozempic® label to reflect risk reduction of kidney disease-related events,Yahoo,"Bagsværd, Denmark, 12 December 2024 – Novo Nordisk today announced that the European Medicines Agency’s (EMA) Committee for Medicinal Products for Human Use (CHMP) has adopted a positive opinion for an update of the Ozempic® (once-weekly subcutaneous semaglutide) label to reflect data from the FLOW kidney outcomes trial. The FLOW trial assessed the risk reduction from Ozempic® therapy in chronic kidney disease-related events, including persistent ≥50% decline in estimated glomerular filtration r"
2024-12-12,Pioneer Fund Q3 2024 Performance Analysis And Market Commentary,SeekingAlpha,"Pioneer Fundâs Class Y Shares returned 3.79% in the quarter, underperforming the 5.89% return of the Fundâs benchmark, the SPX. Read more here."
2024-12-12,Harbor International Compounders ETF Q3 2024 Commentary,SeekingAlpha,"During the quarter, the Harbor International Compounders ETF returned 4.10%, underperforming its primary benchmark."
2024-12-12,Harbor Diversified International All Cap Fund Q3 2024 Commentary,SeekingAlpha,"The Harbor Diversified International All-Cap Fund performed broadly in line with its benchmark, the MSCI All Country World Ex. US (ND) Index, during the quarter."
2024-12-13,American Century Focused International Growth Fund Q3 2024 Commentary,SeekingAlpha,Equity markets faced periods of volatility but remained strong to finish the quarter higher as central banks cut interest rates. Click here to read the full fund letter.
2024-12-13,American Century Focused Global Growth Fund Q3 2024 Commentary,SeekingAlpha,"Stocks rebounded from a brief early August downturn fed by fears the Fed wouldnât act quickly
enough to stave off a recession. Click here to read the full commentary."
2024-12-13,American Century Growth Fund Q3 2024 Commentary,SeekingAlpha,The broad U.S. stock market posted solid gains that saw a reversal of first-half  trends. Click here to read the full commentary.
2024-12-13,3 Growth Stocks That Can Be No-Brainer Buys in 2025,Yahoo,"Amazon (NASDAQ: AMZN), Carnival Corp (NYSE: CCL), and Novo Nordisk (NYSE: NVO) are among the best stocks you can buy heading into 2025.  Heading into the new year, there are a couple of things I really like about Amazons stock.  Although it is up around 50% in 2024, its valuation is fairly low -- by Amazon standards, anyway."
2024-12-14,"Novo Nordisk A/S: The acquisition of Catalent by Novo Holdings, and the related acquisition by Novo Nordisk of three manufacturing sites from Novo Holdings, is cleared to close",Yahoo,"Bagsværd, Denmark, 14 December 2024 — As of today, all regulatory closing conditions relating to the review of Novo Holdings A/S’s pending acquisition of Catalent, Inc. (Catalent), including expiry of the timing agreement in the US, have been fulfilled. Catalent is a global contract development and manufacturing organisation headquartered in New Jersey (US). The parties are now free to close the transaction, as well as Novo Nordisk’s subsequent acquisition of three Catalent manufacturing sites f"
2024-12-14,Novo Nordisk (NVO) Stock Moves -1.53%: What You Should Know,Yahoo,"Novo Nordisk (NVO) closed at $106.95 in the latest trading session, marking a -1.53% move from the prior day."
2024-12-14,Novo Nordisks Ozempic reportedly linked to vision loss in new study,Yahoo,"Novo Nordisks (NVO) GLP weight-loss drug Ozempic has reportedly been linked to a rare form of vision loss, known as non-arteritic anterior ischemic optic neuropathy (NAION). The study, which has yet to be peer-reviewed, was published on medRxiv and supports findings reported in a Harvard University study from this past July. Market Domination hosts Julie Hyman and Josh Lipton expand upon these findings and Novo Nordisks year-to-date stock performance. To watch more expert insights and analysis on the latest market action, check out more Market Domination here. This post was written by Luke Carberry Mogan."
2024-12-15,"Nvidia, GM, Walmart, Palantir, Tesla, Meta, and others battle this Yahoo Finance awards season",Yahoo,Which companies really delivered the goods for investors in 2024?
2024-12-15,Did Eli Lilly Just Say Checkmate to Novo Nordisk?,Yahoo,"Eli Lilly (NYSE: LLY) and Novo Nordisk (NYSE: NVO) have competed for decades.  In recent years, these two healthcare leaders have also been butting heads in the GLP-1 weight loss space.  Eli Lillys Zepbound and Novo Nordisks Wegovy are the two most prominent brands in this area, which is projected to grow by leaps and bounds in the coming years."
2024-12-16,Altimmune 2025: Redefining Obesity And MASH Treatment,SeekingAlpha,Altimmune is redefining success in both obesity and MASH to position Pemvidutide in blue ocean categories. Read why I rate ALT stock a Buy now.
2024-12-16,Novo Nordisk invests $1.2 billion in new rare disease drugs plant in Denmark,Yahoo,"STOCKHOLM/LONDON (Reuters) -Danish drugmaker Novo Nordisk will invest 8.5 billion crowns ($1.20 billion) in a new facility in Odense, Denmark, for the production of rare disease drugs, it said on Monday.  The site will manufacture various types of rare disease drugs, including those for the treatment of haemophilia, Novo Nordisk said in a statement on Monday.  Novo Nordisk, which has become Europes most valuable listed company on the back of its hugely popular weight-loss injection Wegovy, bought the 200-acre site in July, saying it may build a new plant there, without indicating for what type of drugs."
2024-12-16,Wall Street Breakfast Podcast: Wedbush Boosts Tesla Price Targets,SeekingAlpha,"Full speed ahead: Tesla lands higher price targets from Wedbush. Lawmakers call on Apple, Google to prepare for potential TikTok ban. Novo Nordisk to park $1.2B in new plant in Denmark."
2024-12-16,American Century International Growth Fund Q3 2024 Commentary,SeekingAlpha,Equity markets faced periods of volatility but remained strong to finish the quarter higher. Click here to read the full commentary.
2024-12-16,American Century Sustainable Equity Fund Q3 2024 Commentary,SeekingAlpha,The broad U.S. stock market posted solid gains that saw a reversal of trends from the first half of the year. Click here to read the full commentary.
2024-12-16,Are You a Growth Investor? This 1 Stock Could Be the Perfect Pick,Yahoo,"Whether youre a value, growth, or momentum investor, finding strong stocks becomes easier with the Zacks Style Scores, a top feature of the Zacks Premium research service."
2024-12-16,The Weight-Loss Drug Market Is Heading for a Reckoning This Week. What to Expect.,Yahoo,The FDA is slated to reveal whether Eli Lilly’s supply of its obesity drug Zepbound can meet U.S. demand.
2024-12-17,Top Midday Stories: Honeywell Mulls Separation of Aerospace Business; Starbucks Expands Parental Leave for US Store Workers,Yahoo,All three major US stock indexes were trading in positive territory around midday on Monday with the
2024-12-17,Novo’s New Deal May End Wegovy Shortages. It Could Reshape the Pharma Industry Along the Way.,Yahoo,Catalent says it worked on more than half of the new drugs approved by the FDA over the past 10 years.
2024-12-17,Novo Nordisk’s Hiring Binge Leaves Danish Firms Starved of Labor,Yahoo,"(Bloomberg) -- Business was good for Brian Larsen’s car service shop in Kalundborg, a coastal town west of Copenhagen, but he had to shut it down. With Novo Nordisk A/S in the midst of a rapid hiring spree at its manufacturing hub, just half a mile away, finding staff to keep his small business running became virtually impossible. Most Read from BloombergHong Kongs Expat Party Hub Reshaped by Chinese InfluxHow California Sees the World, and ItselfLondon’s Tube Fares Are Set to Rise by 4.6% Next"
2024-12-17,Harbor International Fund Q3 2024 Commentary,SeekingAlpha,"The Harbor International Fund (Institutional ) outperformed its benchmark, the MSCI EAFE (ND) Index, during the quarter. Click here to read the full commentary."
2024-12-17,Hartford International Growth Fund Q3 2024 Commentary,SeekingAlpha,The Hartford International Growth Fund (I share) underperformed the MSCI ACWI ex USA Growth Index during the quarter. Read more here.
2024-12-17,SCHY Vs. IGRO: Comparing Two Top Low P/E International Dividend Growth ETFs,SeekingAlpha,"International stocks remain significantly undervalued, presenting a potential investment opportunity for retail investors. Click for more."
2024-12-18,"Elon Musk, RFK Jr., Dr. Oz, and the coming clash over Ozempic",Yahoo,Biden officials recently proposed allowing Medicare to start covering GLP-1 medications to treat obesity. Its unclear whether Trumps administration will see it through.
2024-12-18,"The acquisition of Catalent by Novo Holdings, and the related acquisition by Novo Nordisk of three manufacturing sites from Novo Holdings, is completed",Yahoo,"Bagsværd, Denmark, 18 December 2024 — Today, Novo Nordisk completed its acquisition of three manufacturing sites from Novo Holdings A/S. The completion follows the finalisation of Novo Holdings’ acquisition of Catalent, Inc. (Catalent), a global contract development and manufacturing organisation headquartered in New Jersey (US). The agreement to acquire the three manufacturing sites was announced on 5 February 2024. For further information, please see the company announcement here. “We are very"
2024-12-18,Ozempic Dethroned? A Head-to-Head Study Confirms This Company Has the Best Weight Loss Drug,Yahoo,"When you think of a top weight loss drug, chances are that Ozempic is the name that first comes to mind.  Although it is approved for diabetes (Wegovy is the equivalent version, which is approved for weight loss), many people have been using it for years to lose weight, and it has been highly effective in doing that.  The success of Ozempic and Wegovy has helped the company behind the products, Novo Nordisk (NYSE: NVO), become one of the most valuable healthcare stocks in the world."
2024-12-18,Alger International Opportunities Fund Q3 2024 Commentary,SeekingAlpha,Class A shares of the Alger International Opportunities Fund recorded a 5.62% net return for the third quarter of 2024. Click here to read the full commentary.
2024-12-19,The Gabelli Global Growth Fund Q3 2024 Commentary,SeekingAlpha,"The Gabelli Global Growth Fund returned +2.7% during the third quarter, compared with a +5.5% return for the S&P 500. Click here to read the full commentary."
2024-12-19,This Is Huge News for Eli Lilly Investors,Yahoo,Eli Lilly just gave investors several reasons to cheer.
2024-12-19,"Merck Enters Obesity Space, Buys Rights to Hansohs Oral GLP-1 Drug",Yahoo,"Merck gets exclusive global rights to develop, manufacture and commercialize GLP-1 receptor agonist, HS-10535, from Hansoh Pharma."
2024-12-19,Viking Therapeutics: Competition Fears Are Exaggerated,SeekingAlpha,"Viking Therapeutics shows promise with weight loss drug VK2735 and potential in NASH treatment, making it a potential takeover target. Read more on VKTX here."
2024-12-19,Novo Nordisk A/S (NVO) Fell as its Weight Loss Drug Faced Supply Constraints,Yahoo,"Hardman Johnston Global Advisors, an investment management company, released its “Hardman Johnston Global Equity” third quarter 2024, investor letter. A copy of the letter can be downloaded here. The portfolio slightly underperformed its benchmark index in the third quarter following a robust first half of the year. Performance was impacted by volatility, especially towards the […]"
2024-12-19,Got $250? 2 Healthcare Stocks to Buy and Hold Forever,Yahoo,"One of the great things about the stock market is that one doesnt have to be a genius or a multimillionaire to take advantage of its wealth-building power.  Lets consider two companies in the healthcare sector that look like excellent long-term bets: Bristol Myers Squibb (NYSE: BMY) and Novo Nordisk (NYSE: NVO).  If you have $250 to spare now, putting that money to work by investing in these healthcare leaders would be a great move."
2024-12-20,IBD 50s Hims & Hers Tumbles After FDA Pulls Lillys Weight-Loss Drug From Shortage List,Yahoo,Hims stock skidded Thursday after the FDA determined Eli Lillys tirzepatide — which sells as a weight-loss drug — is no longer in shortage.
2024-12-20,Novo Is Ready to Ramp Up GLP-1 Manufacturing Following $11B Factory Deal,Yahoo,"Henrik Wulff, the man in charge of product supply at  Novo Nordisk  just spent $11 billion to try to fill an ocean.  Novo has handed Wulff one of the most complex jobs in all of pharmaceuticals.  Novo and its competitor  Eli Lilly  have gone to greater and greater lengths to speed their GLP-1 output, as they battle each other and the increasingly aggressive telehealth industry, which is selling large quantities of legal GLP-1 knockoffs."
2024-12-20,"In weight loss battle, Novo and Lilly face growing offensive from licensed copies",Yahoo,"As Novo Nordisk and Eli Lilly expand sales of their popular diabetes and weight-loss drugs, cheaper copies of their patented remedies are winning approval from some regulators overseas, posing a threat to the pharma giants prices and market share.  Since Novos blockbuster Ozempic diabetes treatment was approved in the United States in 2017, regulators have greenlighted 22 medicines containing its main ingredient in Bangladesh, Laos, Russia and Paraguay as well as seven copies of Lillys rival drugs in Bangladesh, according to a Reuters review."
2024-12-20,Impax Global Social Leaders Fund Q3 2024 Commentary,SeekingAlpha,The Impax Global Social Leaders Fund outperformed its benchmark in Q3 2024. Click here to read the full commentary.
2024-12-20,Novo Nordisk shares plunge after CagriSema obesity drug trial disappoints,Yahoo,"Novo Nordisk said on Friday its experimental next-generation obesity drug CagriSema helped patients cut their weight by 22.7% in a late-stage trial, below the 25% it had expected, wiping as much as $125 billion off its market value.  The lower-than-expected weight loss from the drug candidate deals a blow to the Danish companys ambitions for a successor to its popular Wegovy that is more powerful than Eli Lillys rival Zepbound, also known as Mounjaro.  Investors and analysts had eagerly awaited this data as a test of Novos case that it has a strong pipeline of drugs to follow Wegovy in the fiercely competitive anti-obesity market."
2024-12-20,Novo Nordisk: Why The Market Sell-Off On CagriSema Data May Be Justified,SeekingAlpha,"Novo Nordisks CagriSema Phase 3 data showed 22.7% weight loss, missing the companys own 25% target, causing a 20% drop in stock price. Learn more on NVO stock here."
2024-12-20,"FDA finalizes decision to end Lillys GLP-1 shortage, analysts predict Novo will be next",Yahoo,The FDA decided the shortage for Eli Lillys GLP-1 tirzepatide has finally come to an end.
2024-12-20,Novo Nordisk Stock: A Rare Buying Opportunity,SeekingAlpha,"Financial writer sees Novo Nordisks stock drop as a buying opportunity after disappointing trial results, citing strong revenue growth and product..."
2024-12-20,5 Things to Know Before the Stock Market Opens,Yahoo,"News of the day for Dec. 20, 2024"
2024-12-20,"Eli Lilly: Improved Competitive Position In Obesity Market, But Strong Execution Is A Must Now",SeekingAlpha,The updates from clinical trials of Eli Lillys competitors in the obesity market were largely underwhelming this year. See why I remain bullish on LLY stock.
2024-12-20,A next-gen Ozempic falls short in a drug trial — and Novo Nordisk stock plunges 20%,Yahoo,"Novo Nordisk (NVO) released mixed clinical-trial results for its potential Ozempic successor on Friday, leaving Wall Street disappointed."
2024-12-20,"LLY Stock Up as FDA Removes Mounjaro, Zepbound From Shortage List",Yahoo,Eli Lilly stock gains as the FDA removes tirzepatide drugs from the drug shortage list following a thorough reevaluation.
2024-12-20,"Novo Nordisk Dives On CagriSegma Obesity Drug Trial. Eli Lilly, Viking Jump.",Yahoo,Novo Nordisk stock crashed Friday after the Danish giant reported its experimental obesity drug CagriSegma missed goals. Eli Lilly and Viking Therapeutics jumped
2024-12-20,"November PCE, govt. shutdown looms, Novo Nordisk: 3 Things",Yahoo,"US stock futures (ES=F, NQ=F, YM=F) are slipping Friday morning after the Personal Consumption Expenditures (PCE) price index rose by 2.8% in November, just 0.1% below economists estimates A government shutdown looms after House Speaker Mike Johnsons (R-La.) bipartisan spending bill was rebuffed by President-elect Donald Trump and Elon Musk, who Trump tapped to co-lead the proposed Department of Government Efficiency (DOGE). Novo Nordisk (NVO) shares dive by over 20% in Fridays pre-market trading after its experimental weight-loss shot CagriSema helped patients lose less weight than anticipated in its clinical trial. To watch more expert insights and analysis on the latest market action, check out more Morning Brief here. This post was written by Luke Carberry Mogan."
2024-12-20,Novo Nordisk Falls Most on Record After New Weight Drug Disappoints,Yahoo,(Bloomberg) -- Novo Nordisk A/S’s shares fell by the most on record after a failed attempt to leapfrog rival Eli Lilly & Co. in the red-hot market for obesity drugs. Most Read from BloombergNew York City’s Historic Preservation Movement Is Having a Midlife CrisisNYPD Car Chases Are Becoming More Frequent — and More DangerousDakar’s Air Quality Plummets as Saharan Dust Descends on SenegalRescuing a Little-Known Modernist Landmark in BuffaloNovo’s experimental obesity shot CagriSema helped patient
2024-12-20,Novo Nordisk Sinks on Disappointing Trial Results for Next Gen Weight Loss Drug,Yahoo,"Novo Nordisks U.S.-listed shares sank over 19% in premarket trading Friday after releasing trial results for its next generation of weight loss drug, meant to add to its current lineup of Ozempic and Wegovy."
2024-12-20,Novo Nordisk A/S - share repurchase programme,Yahoo,"Bagsværd, Denmark, 20 December 2024 – On 11 November 2024, Novo Nordisk initiated a share repurchase programme in accordance with Article 5 of Regulation No 596/2014 of the European Parliament and Council of 16 April 2014 (MAR) and the Commission Delegated Regulation (EU) 2016/1052 of 8 March 2016 (the Safe Harbour Rules). This programme is part of the overall share repurchase programme of up to DKK 20 billion to be executed during a 12-month period beginning 6 February 2024. Under the program"
2024-12-21,Top Midday Stories: Novo Nordisk Shares Drop After Obesity Treatment Falls Short of Expectations; CFPB Sues 3 Big Banks Over Alleged Zelle Fraud,Yahoo,All three major US stock indexes were up around midday on Friday after the release of better-than-ex
2024-12-21,European Equities Close Lower in Friday Trading; Novo Nordisk Shares Fall After Obesity Treatment Falls Short of Expectations,Yahoo,"The European stock markets closed lower in Friday trading as The Stoxx Europe dropped 0.78%, Germany"
2024-12-21,European Stocks Suffer Worst Week Since September as Novo Sinks,Yahoo,"(Bloomberg) -- European stocks posted the biggest weekly decline in over three months, as Danish drugmaker Novo Nordisk A/S sank 21% after a study showed underwhelming results from its obesity drug trial.Most Read from BloombergThe Architects Who Built MiamiNew York City’s Historic Preservation Movement Is Having a Midlife CrisisReviving a Little-Known Modernist Landmark in BuffaloNew York’s Congestion Pricing Plan Still Faces Legal HurdlesNYPD Car Chases Are Becoming More Frequent — and More Da"
2024-12-21,"Top Stock Movers Now: Carnival, US Steel, Occidental Petroleum, and More",Yahoo,Major U.S. indexes gained at midday Friday after the Federal Reserve’s favored measure of inflation came in below estimates.
2024-12-21,Novo Nordisks Ozempic Wins Approval in Europe for Chronic Kidney Disease,Yahoo,Ozempic shows 20% decrease in overall mortality risk in Chronic Kidney Disease associated with Diabetes.
2024-12-21,Stocks suffer as Trump calls for US shutdown to ‘begin now’,Yahoo,"Donald Trump triggered a turbulent end to the week as stocks plunged after he called for a US government shutdown to “begin now” under Biden, rather than under his administration."
2024-12-21,3 Fantastic Stocks That Could Enjoy a Santa Claus Rally,Yahoo,"Santa Claus will soon be on his way delivering presents to kids around the world.  Three Motley Fool contributors think theyve identified fantastic stocks that could be in a good position to benefit from a Santa Claus rally.  Heres why they chose AbbVie (NYSE: ABBV), Novo Nordisk (NYSE: NVO), and Vertex Pharmaceuticals (NASDAQ: VRTX)."
2024-12-21,"Stock Market Today: Dow Jones, Other Indexes Rebound But Trim Gains; Nvidia Climbs After Bullish Report (Live Coverage)",Yahoo,"The Dow Jones Industrial Average and other major stock indexes closed higher but off session highs Friday after a soft inflation report provided a bullish backdrop, while efforts continued to avert a partial government shutdown.  The Dow industrials added nearly 500 points, or 1.2%.  The S&P 500 climbed 1.1% and the Nasdaq composite gained 1% but had been up as much as 2%."
2024-12-21,Lazard International Equity Select Portfolio Q3 2024 Commentary,SeekingAlpha,"During Q3 2024, the Lazard International Equity Select Portfolio rose 7.3% (net), lagging the MSCI All Country World ex-US Index. Click here to read the full commentary."
2024-12-21,Is Now a Good Time to Buy the Dip in Eli Lilly Stock?,Yahoo,"Since Eli Lilly reported third-quarter earnings on Oct. 30, its shares have had a prolonged sell-off."
2024-12-22,Is Merck the Next Big Weight-Loss Stock?,Yahoo,"Merck (NYSE: MRK) is hungrily looking to take a bite out of the weight-loss drugs market.  Merck on Dec. 16 said it had just inked a license agreement with a Chinese biopharma company called Hansoh Pharma that could presage its merits as a weight-loss stock in the coming years.  Per the terms of that deal, Merck will get the exclusive worldwide rights to develop and then sell HS-10535, a preclinical-stage candidate that could potentially be useful for treating a few high-profile cardiometabolic disorders, including obesity and perhaps type 2 diabetes."
2024-12-22,Prothena Surges After Parkinsons Drug Misses Primary Endpoint,SeekingAlpha,"Prothenas stock soared 34% despite setbacks, with promising partnerships and potential in Parkinsons and Alzheimers diseases. Explore more here."
2024-12-23,Lazard International Strategic Equity Portfolio Q3 2024 Commentary,SeekingAlpha,"During Q3 2024, the Lazard International Strategic Equity Portfolio rose 5.5% (net), lagging the MSCI EAFE Index. Click here to read the full commentary."
2024-12-23,Top trending global stocks of 2024,Yahoo,Here are the stocks that have reflected the key market trends of 2024 and have been closely watched by investors.
2024-12-23,"Trending tickers: Palantir, Spotify, Novo Nordisk, Honda and Direct Line",Yahoo,The latest investor updates on stocks that are trending on Monday
