date,headline,source,summary
2025-03-14,Abbott (ABT) Stock Moves -0.3%: What You Should Know,Yahoo,"Abbott (ABT) reachead $129.89 at the closing of the latest trading day, reflecting a -0.3% change compared to its last close."
2025-03-15,Baby Formula Makers Abbott and Reckitt See Stocks Slide as Judge Allows Retrial,Yahoo,Infant formula makers Abbott and Reckitt saw their stocks decline Friday after a judge ruled plaintiffs could pursue a new trial against the companies.
2025-03-15,Top Midday Decliners,Yahoo,Li Auto (LI) shares retreated 3% Friday after the Chinese electric vehicle manufacturer reported a 1
2025-03-15,Abbott Says CEO Robert B. Fords 2024 Compensation Was $22.6 Million,Finnhub,Abbott Laboratories: * ABBOTT SAYS CEO ROBERT B. FORDS 2024 COMPENSATION WAS$22.6MILLION- SEC FILINGFurther company coverage: ...
2025-03-18,Is It Worth Investing in Abbott (ABT) Based on Wall Streets Bullish Views?,Yahoo,"Based on the average brokerage recommendation (ABR), Abbott (ABT) should be added to ones portfolio. Wall Street analysts overly optimistic recommendations cast doubt on the effectiveness of this highly sought-after metric. So, is the stock worth buying?"
2025-03-20,Abbott (ABT) Gains But Lags Market: What You Should Know,Yahoo,"In the most recent trading session, Abbott (ABT) closed at $127.42, indicating a +0.89% shift from the previous trading day."
2025-03-21,Returns At Abbott Laboratories (NYSE:ABT) Are On The Way Up,Yahoo,"Finding a business that has the potential to grow substantially is not easy, but it is possible if we look at a few key..."
2025-03-21,2025 Dividend Kings: Strong Run Continues,SeekingAlpha,"Discover the top-performing Dividend Kings of 2025, outperforming the S&P 500 by 4.57%. Click here to explore more promising picks."
2025-03-24,Jim Cramer On Abbott Laboratories (ABT): “Abbott Labs Stock Is Back on My Radar”,Yahoo,"We recently published a list of Jim Cramer Discusses These 10 Stocks & Says US Faces Unfairly High Tariffs Abroad. In this article, we are going to take a look at where Abbott Laboratories (NYSE:ABT) stands against other stocks that Jim Cramer discusses. In a recent appearance on CNBC’s Squawk on the Street, Jim Cramer […]"
2025-03-26,2 Dividend Stocks Defying the Market Dip to Buy for a Lifetime of Passive Income,Yahoo,"AbbVies shares  dropped off a cliff  in November after it announced a clinical setback for emraclidine, an investigational schizophrenia treatment it got in an $8.7 billion acquisition.  Investors were worried the company spent nearly $9 billion for nothing, which is understandable."
2025-03-27,Abbott Laboratories (ABT): Among Dividend Zombies to Invest in,Yahoo,"We recently published a list of 15 Dividend Zombies to Invest in. In this article, we are going to take a look at where Abbott Laboratories (NYSE:ABT) stands against other dividend zombies to invest in. The broader market has posted consecutive annual gains of 25%, largely fueled by growth stocks and companies capitalizing on the […]"
2025-03-28,Equity Markets On Track to Close Lower Following Trumps Auto Tariffs,Yahoo,"US benchmark equity indexes are on track to close lower on Thursday, as markets weigh the impact of"
2025-03-28,Why Abbott Laboratories Stock Leaped by Almost 4% on Thursday,Yahoo,"Abbott Laboratories (NYSE: ABT) stock was in fine health on the second-to-last trading day of the week, thanks to news from Europe.  The CE mark is an affirmation by a products manufacturer that it conforms with a range of standards covering aspects such as health and safety.  In its press release touting the development, Abbott wrote that roughly 8 million people in Europe over the age of 65 are coping with atrial fibrillation, and that figure is anticipated to double within three decades."
2025-03-31,GE HealthCares Latest Product Launch to Boost Cardiology Care,Yahoo,GEHCs latest commercial launch of Flyrcado and the grant of pass-through status by CMS aim to serve a wider patient pool across the United States.
2025-04-01,ABT Stock to Gain From Early CE Mark Approval of Volt PFA System,Yahoo,Abbott achieves early CE Mark approval for the Volt PFA system.
2025-04-03,Court Denies Abbotts Summary Judgment Motion In Patent Infringement Case: A Lesson In Joinder Rules,Finnhub,"In a recent decision from the United States District Court for the District of Massachusetts, the district court denied Abbott Laboratories motion for summary judgment in a patent infringement case..."
2025-04-04,The Dow Needs a Refresh. These Stocks Could Make It Sing.,MarketWatch,The Dow Needs a Refresh. These Stocks Could Make It Sing.
2025-04-05,Will Weakness in Abbott Laboratories (NYSE:ABT) Stock Prove Temporary Given Strong Fundamentals?,Yahoo,"It is hard to get excited after looking at Abbott Laboratories (NYSE:ABT) recent performance, when its stock has..."
2025-04-09,ICUI Stock Gains Following Latest FDA Approvals for Precision IV Pumps,Yahoo,"ICU Medical aims to enable healthcare systems to customize infusion setups, optimizing device footprint without compromising performance or safety."
2025-04-09,Abbott (ABT) Earnings Expected to Grow: Should You Buy?,Yahoo,Abbott (ABT) possesses the right combination of the two key ingredients for a likely earnings beat in its upcoming report. Get prepared with the key expectations.
2025-04-10,"Abbotts Q1 Earnings Coming Up, Medical Devices Arm in Focus",Yahoo,"ABTs Structural Heart, Rhythm Management and Neuromodulation businesses are likely to have driven its first-quarter 2025 performance."
2025-04-15,"The Zacks Analyst Blog Abbott, Taiwan Semiconductor, American Express, ManpowerGroup and D.R. Horton",Yahoo,"Abbott, Taiwan Semiconductor, American Express, ManpowerGroup and D.R. Horton are included in this Analyst Blog."
2025-04-15,5 Top Stock Charts for This Week,Yahoo,"Tracey Ryniec talks about a new strategy for Q1 earnings season, including impacts of the tariffs, on ABT, TSM, AXP, MAN, and DHI."
2025-04-16,Abbott Laboratories (ABT) Q1 2025 Earnings Call Transcript,SeekingAlpha,"Abbott Laboratories (NYSE:ABT) Q1 2025 Earnings Conference Call April 16, 2025 9:00 AM ETCompany ParticipantsMike Comilla - VP, IRRobert Ford - Chairman and..."
2025-04-16,"Top Midday Stories: Nvidia, AMD Flag Looming Charges Tied to China Export Licenses; ASML Shares Fall on Sales Miss, Downbeat Guidance",Yahoo,"All three major US stock indexes were in the red at midday Wednesday, with the Nasdaq Composite down"
2025-04-16,"Abbott Labs 1Q Profit Jumps on Gains in Nutrition, Medical Devices",Finnhub,By Dean Seal Abbott Labs recorded higher earnings and revenue in the first quarter as strong demand for its nutritional products and medical devices offset weakness in other segments. The...
2025-04-17,Health Care Stays Ahead of Market Amid Defensive Bias - Health Care Roundup,MarketWatch,Health Care Stays Ahead of Market Amid Defensive Bias - Health Care Roundup
2025-04-17,Health Care Roundup: Market Talk,DowJones,Health Care Roundup: Market Talk
2025-04-20,Jim Cramer Applauds Abbott Laboratories (ABT): “A Tour de Force Quarter – Robert Ford Is Keeping the Miles White Legacy Alive”,Yahoo,"We recently published a list of Jim Cramer Defended American Superiority and Discussed These 13 Stocks. In this article, we are going to take a look at where Abbott Laboratories (NYSE:ABT) stands against other stocks that Jim Cramer discussed. In his latest appearance on CNBC’s Squawk on the Street, Jim Cramer highlighted the often-overlooked role of […]"
2025-04-21,Earnings To Watch: Intuitive Surgical (ISRG) Reports Q1 Results Tomorrow,Yahoo,Medical technology company Intuitive Surgical (NASDAQ:ISRG) will be reporting results tomorrow after market close. Here’s what investors should know.
2025-04-24,EPD Growth in Emerging Market Supports Abbott Stock Amid Macro Woes,Yahoo,"Abbotts Diabetes Care business continues to benefit from the growing sales of its flagship, sensor-based continuous glucose monitoring system, FreeStyle Libre."
2025-04-27,"New Clinical Study Data Showcase Long-Term, Sustained Benefits of Abbotts Volt™ PFA System for Patients with AFib",Yahoo,Abbott (NYSE: ABT) has announced new data from its Volt CE Mark Study that show strong safety and efficacy out to 12 months for patients receiving pulsed field ablation (PFA) therapy with the Volt™ PFA System for the treatment of atrial fibrillation (AFib). The data also highlights the excellent safety profile of the Volt PFA System alongside the systems ability to achieve results with fewer therapy applications (just 4.7 applications per vein on average) than on-market competitive PFA systems.
2025-04-28,Abbott Laboratories (NYSE:ABT) Is Doing The Right Things To Multiply Its Share Price,Yahoo,"There are a few key trends to look for if we want to identify the next multi-bagger. Amongst other things, well want..."
2025-04-29,"Abbott Integrates Libres Data with Epics Electronic Health Record System, Providing Healthcare Professionals Seamless Glucose Monitoring Information",Yahoo,"Abbott (NYSE: ABT), the global leader in continuous glucose monitoring (CGM) biowearable technology1, today announced that it has entered a first-of-its-kind agreement to integrate data from its world-leading1 Libre CGM systems directly into Epics electronic health record systems in the U.S. The collaboration aims to improve workflow efficiency for providers through Epics Aura software, which brings health systems together with diagnostics labs and medical device manufacturers."
2025-05-01,Abbott Laboratories (ABT): Jim Cramer Calls It a ‘Tour de Force’ — Why He’s Still Amazed at This Stock,Yahoo,"We recently published a list of How Did Jim Cramer’s 12 Bold Predictions Play Out?. In this article, we are going to take a look at where Abbott Laboratories (NYSE:ABT) stands against other stocks that Jim Cramer recently discussed. During the most recent episode of Mad Money, Jim Cramer revisited the recent turbulence in artificial […]"
2025-05-01,MotoAmerica Becomes First Sports Organization to Use Abbotts Rapid Blood Test for Concussion Evaluation On-site at Races,Yahoo,"Abbott (NYSE: ABT), the global healthcare company, and MotoAmerica, the premier motorcycle road racing series in North America, announced today that MotoAmerica is the first professional sports organization worldwide to use Abbotts groundbreaking blood test to help assess suspected concussions for riders in the on-site medical facilities at all races."
2025-05-03,Comstock Resources to List Shares on NYSE Texas,MarketWatch,Comstock Resources to List Shares on NYSE Texas
2025-05-06,Reflecting On Medical Devices & Supplies - Diversified Stocks’ Q1 Earnings: Stryker (NYSE:SYK),Yahoo,"Wrapping up Q1 earnings, we look at the numbers and key takeaways for the medical devices & supplies - diversified stocks, including Stryker (NYSE:SYK) and its peers."
2025-05-06,Fidelity Value Discovery Fund Q1 2025 Commentary,SeekingAlpha,"For Q1 2025, Fidelity Value Discovery Fund gained 2.16%, outpacing the 1.64% advance of the benchmark Russell 3000Â® Value Index. Click here to read the full commentary."
2025-05-07,2024 Total Dividend Income And Portfolio Update,SeekingAlpha,2024 also saw some changes to some of my holdings as the author shuttled several dividend income payers for higher return crypto plays. Click to read.
2025-05-07,Jim Cramer Predicts Big Earnings for Abbott Laboratories (ABT): Libre Leads the Way!,Yahoo,"We recently published a list of Jim Cramer Talked About These 7 Stocks Recently. In this article, we are going to take a look at where Abbott Laboratories (NYSE:ABT) stands against other stocks that Jim Cramer discussed recently. On Monday, Jim Cramer, host of Mad Money, shared valuable insights from his years of experience as […]"
2025-05-08,Reflecting On Medical Devices & Supplies - Diversified Stocks’ Q1 Earnings: Abbott Laboratories (NYSE:ABT),Yahoo,"As the Q1 earnings season comes to a close, it’s time to take stock of this quarter’s best and worst performers in the medical devices & supplies - diversified industry, including Abbott Laboratories (NYSE:ABT) and its peers."
2025-05-17,3 Magnificent Stocks That Are Passive Income Machines,Yahoo,Abbott Laboratories is a dividend stock you can buy and (almost) forget about.  AbbVie has proved its resilience by becoming stronger after losing patent exclusivity for its blockbuster drug Humira.  Johnson & Johnson is a seasoned dividend payer for all seasons.
2025-05-19,Abbott Laboratories (ABT)’s Libre Linked to Fewer Heart Hospitalizations in Diabetes,Yahoo,"Abbott Laboratories (NYSE:ABT) recently shared findings from its REFLECT real-world studies, revealing that the use of its FreeStyle Libre® continuous glucose monitoring (CGM) system is linked to a notable decrease in hospitalizations for heart-related complications among people with diabetes. For the first time, the data demonstrate that CGM technology can reduce the severity of cardiovascular […]"
2025-05-20,Unpacking Q1 Earnings: Baxter (NYSE:BAX) In The Context Of Other Medical Devices & Supplies - Diversified Stocks,Yahoo,"As the Q1 earnings season comes to a close, it’s time to take stock of this quarter’s best and worst performers in the medical devices & supplies - diversified industry, including Baxter (NYSE:BAX) and its peers."
2025-05-23,2 Dividend Stocks to Buy With $500 and Hold Forever,Yahoo,Zoetis is a leading animal health company with a deep lineup and significant long-term tailwinds.  Abbott Labs has a diversified portfolio of medical devices and several attractive growth avenues.  The fact that the stock market will sometimes go through erratic periods is not a good reason not to invest.
2025-05-23,Sequel Med Tech to Integrate Twiist Automated Insulin Delivery System with Abbotts Future Dual Glucose-Ketone Sensor,Finnhub,"Sequel Med Tech, LLC announced a commercial development agreement for future integration of Sequels twiist Automated Insulin Delivery System powered by Tidepool, with Abbotts glucose-ketone sensor,..."
2025-05-24,Abbott (ABT) Stock Moves -0.15%: What You Should Know,Yahoo,"In the closing of the recent trading day, Abbott (ABT) stood at $131.30, denoting a -0.15% change from the preceding trading day."
2025-05-25,"If You Invested $10K In Abbott Laboratories Stock 10 Years Ago, How Much Would You Have Now?",Yahoo,"Abbott Laboratories (NYSE:ABT) discovers, develops, manufactures, and sells healthcare products worldwide. If You Bought Abbott Laboratories Stock 10 Years Ago The companys stock traded at approximately $49.14 per share 10 years ago. If you had ..."
2025-05-27,"Abbott Receives FDA Approval for Tendyne™, First-of-Its-Kind Device to Replace the Mitral Valve Without Open-Heart Surgery",Yahoo,"Abbott (NYSE: ABT) today announced the U.S. Food and Drug Administration (FDA) has approved the companys Tendyne™ transcatheter mitral valve replacement (TMVR) system to treat people with mitral valve disease. This life-changing therapy is available for patients whose mitral valves are not functioning properly due to severe mitral annular calcification (MAC), a buildup of calcium within the ring-like structure (known as an annulus) that supports the mitral valve."
