date,headline,source,summary
2025-08-02,"3 Growth Stocks to Invest $1,000 in Right Now",Yahoo,These 3 growth-oriented companies are all great choices for investors.
2025-08-03,Microsoft: Dont Get Too Excited About Future Returns,SeekingAlpha,Discover why MSFTs upside might be limited despite strong earnings. Learn how peaked margins and valuation could impact future returns.
2025-08-03,Amazon: Panic Selloff Could Be Short Lived (Rating Upgrade),SeekingAlpha,"Amazons latest earnings obliterated my previous concerns, mainly related to the impact of tariffs on its retail business."
2025-08-04,Cash Windfall From Trump’s Tax Law Is Starting to Show Up at Big Companies,Yahoo,"The magnitude of the cash savings from this summer’s federal tax legislation is starting to take shape at America’s biggest companies.  AT&T  recently said it expected $1.5 billion to $2 billion in cash tax savings this year, due to provisions in the tax-and-spending law dubbed the One Big Beautiful Bill Act.  The high end of the range is equivalent to an 11% boost to analyst estimates of 2025 free cash flow before the law was enacted."
2025-08-04,"DOVE LAUNCHES WOMENS WELLNESS RANGE, TURNING TMI INTO SUPERIOR CARE, AVAILABLE EXCLUSIVELY ON AMAZON",Yahoo,"Dove proudly unveils its first-ever Womens Wellness Range, an innovative lineup of life-stage tailored personal care products developed in close collaboration with gynecologists, menopause experts and dermatologists. Available exclusively in the Amazon U.S. store, the collection is just a search away for the millions of women already turning to Amazon for health and wellness essentials."
2025-08-05,Weave Names Abhi Sharma as Chief Technology Officer,Yahoo,"LEHI, Utah, August 04, 2025--Weave (NYSE: WEAV), a leading all-in-one customer experience and payments software platform for small and medium-sized healthcare businesses, today announced the appointment of Abhi Sharma as the company’s Chief Technology Officer (CTO)."
2025-08-05,Oracle Stock Get Price Target Hike. Microsoft And Meta Driving Positive AI Infrastructure Sentiment,Yahoo,Oracle stock got a price target hike from an analyst who cited momentum for AI infrastructure spending and AI stocks.
2025-08-05,Jim Cramer on Amazon: “It’s Just Going to Be Another Buy”,Yahoo,"Amazon.com, Inc. (NASDAQ:AMZN) is one of the stocks that Jim Cramer spoke about. Cramer believes the stock’s sell-off creates a buying opportunity. He said: “After the close, we drifted from lunacy back to reality. Amazon reported what I thought was a good quarter… Much better than expected sales at every division, even if the web […]"
2025-08-06,New York Times forecasts subscription revenue above estimates on bundling strength,Yahoo,"The New York Times forecast third-quarter subscription revenue growth above Wall Street expectations on Wednesday, as it bet on adding more customers through its bundled strategy. Shares of the publisher rose more than 4% in premarket trading. The NYT has been packaging its core news offerings with lifestyle-focused products such as Wirecutter, sports website The Athletic, and games, including Wordle, to enhance subscriber engagement and diversify revenue streams."
2025-08-06,Don’t Panic on Nasdaq Dips: Leverage Seasonal Trends for Smarter Trades,Yahoo,"Are you misreading the Nasdaq’s August dip? Seasonal data shows a consistent rally into mid-September, despite early weakness. Rethink your approach with correlated S&P 500 moves and technical support zones."
2025-08-07,Donville Kent Asset Management July 2025 Commentary,SeekingAlpha,"The Capital Ideas Fund was up +2.05% in July, -1.55% YTD and up +33.57% over the last 12 months."
2025-08-08,"Ecommerce Platform Market Analysis and Global Forecast Report 2025-2030 | Omnichannel Retailing to Drive Demand, Internet Penetration and Smartphones Fuel Adoption",Yahoo,"The global eCommerce platform market is set to accelerate from USD 9.07 billion in 2025 to USD 16.50 billion by 2030, growing at a 12.7% CAGR. Growth is driven by increasing internet and smartphone penetration, and consumer preference for digital shopping. Technologies like AI, cloud computing, and big data are boosting platform capabilities. Despite cybersecurity concerns, the market expands with rising omnichannel retailing and cross-border trade. Notably, the payments & billing subsegment and"
2025-08-10,"Work-Life Balance Is Out, Hardcore Culture Is In: How Experts Suggest You Adjust To The New Era Of Work",Yahoo,"For many, the era of work-life balance is coming to a close. “The spillover from home life to work life is not of concern to bosses these days,” Yale management professor Jeffrey Sonnenfeld told Business Insider recently. It’s not the time to talk about what makes your creature comforts so different from everybody else’s, that somehow the company has to accommodate your needs.” Within the last year, major companies like Amazon (NASDAQ:AMZN) and JPMorgan Chase (NYSE:JPM) enacted return-to-office"
2025-08-11,AMZN: Amazon Pours Millions Into Quantum Computing With Bold IonQ Bet,Yahoo,Amazons $36.7M IonQ Deal Fuels Quantum Stock Momentum
2025-08-11,2 Soaring Growth Stocks to Buy and Hold Forever,Yahoo,These no-brainer buys are worth a second look.
2025-08-12,Warren Buffett Warns Investing At ‘Too-High Purchase Price’ Even for ‘an Excellent Company’ Can Undo a Decade of Smart Investing,Yahoo,Warren Buffett cautions investors that overpaying for even a great company can eliminate the value created by future success.
2025-08-12,Should You Buy FLY Stock after the Firefly Aerospace IPO?,Yahoo,Shares of Firefly Aerospace made a spectacular public debut.
2025-08-12,The Rich Get Richer,SeekingAlpha,"While the S&P 500 was up about 2.4%, the 492 stocks in the index with market caps of less than a trillion dollars were up an average of just 0.71%. Click to read."
2025-08-12,Broadcom Q3 Preview: Anticipating Strong Networking Business Growth,SeekingAlpha,"Broadcom Inc.s AI-driven growth, cutting-edge products, and strong revenue projections make it a Strong Buy. Click here to find out why AVGO is a Strong Buy."
2025-08-15,"Amazon, IBD Stock Of The Day, Delivers Early Entry As Grocery Move Hits Rivals",Yahoo,"Amazon is the IBD Stock of the Day for Thursday.  Amazons stock is continuing to rebound from key support on news, flashing an aggressive entry for the tech titan on a day when hot inflation data is weighing on major stock indexes.  The gains for Amazon stock come as Wall Street analysts are offering mostly positive takes on the companys grocery expansion plans."
2025-08-15,1 Stock Under $50 with Solid Fundamentals and 2 We Ignore,Yahoo,"Stocks in the $10-50 range offer a sweet spot between affordability and stability as they’re typically more established than penny stocks. But their headline prices don’t guarantee quality, and investors should exercise caution as some have shaky business models."
2025-08-15,Stock Market Today: Dow Down; AI Stock Coherent Delivers 3 Sell Signals; Coach Owner Tapestry Gets Support At Key Level (Live),Yahoo,Stock Market Today: The Dow Jones index dropped mildly on a hot PPI inflation report as the Nasdaq trimmed losses. Coherent stock plunged after its earnings report included a disappointing forecast.
2025-08-15,"These Were the 5 Biggest Companies in 2019, and Here Are the 5 Biggest Companies Now",Yahoo,"Tech stocks have dominated in recent years, with one stock rocketing 4,000% since 2019."
2025-08-16,This Jabil Peer Reports Monday As AI Fever Boosts Top-10 Industry,Yahoo,"Many of the groups companies are reaping rewards from heavy spending in data centers, including group leader Jabil.  Fabrinet — which specializes in advanced electronics for tech companies — comes into its quarterly report with a tailwind from strong spending in cloud computing.  Analysts consensus earnings estimate for Fabrinet is $2.43 a share, a 9.5% increase year over year."
2025-08-19,UiPath Stock Falls 11% in 3 Months: Should You Buy the Dip or Wait?,Yahoo,"UiPath stock slides 11% in three months, but strong automation demand, key tech partnerships and solid finances keep it in focus."
2025-08-19,An Apple robot will need a lot of AI help,Yahoo,Apples robot efforts will need some AI help.
2025-08-19,Interactive Brokers and General Mills have been highlighted as Zacks Bull and Bear of the Day,Yahoo,"Interactive Brokers shines with surging volumes and a Strong Buy rating, while General Mills struggles under weak sales and profit declines."
2025-08-19,Budweiser maker invests $15 million in St. Louis brewery,Yahoo,The brewers latest announcement is part of its larger $300 million investment in U.S. manufacturing in 2025
2025-08-20,Case Study Uncovers Major Gap in Sliding Screen Doors,Yahoo,"When industry veteran Steve Tristan, founder of BestCustomScreens.com, set out to answer a simple but persistent homeowners question—Where can I buy an 8-foot fully assembled sliding screen door?—he uncovered a revealing gap in the U.S. home improvement market."
2025-08-20,Thai Data Center Capacity May Triple on Surging Demand for AI,Yahoo,"The nation’s capacity is expected to rise to about 1 gigawatts in 2027 from 350 megawatts in 2024, said Supparat Singhara Na Ayutthaya, vice chairman of the Thai Data Center Association.  A data center requires an investment of about $10 million for each megawatt, he said.  “Thailand has drawn tremendous interest for new data center investments with its steady power generation and water supply,” Supparat said in an interview this week."
2025-08-20,"Stock Market Today: Dow Ends Nearly Flat As Nasdaq Gets Hammered; Palantir, Nvidia Are Big Losers (Live Coverage)",Yahoo,"The Dow Jones index closed slightly in positive territory. Nvidia, Palantir both sank Tuesday. A manufacturing services name sold off."
2025-08-21,What went wrong at Target,Yahoo,A timeline of the highs and lows for Target under the tenure of outgoing CEO Brian Cornell.
2025-08-21,West Loop Strategy Signs Strategic Collaboration Agreement with AWS to Accelerate Adoption of Generative A.I. and Modernize Business Intelligence,Yahoo,"CHICAGO, August 21, 2025--West Loop Strategy, an Advanced Tier AWS Partner and recognized leader in cloud analytics consulting, has signed a Strategic Collaboration Agreement (SCA) with Amazon Web Services (AWS). This partnership aims to accelerate adoption of Generative A.I., Amazon Q and Amazon QuickSight, while helping organizations modernize legacy business intelligence (B.I.) platforms and unlock scalable insights across AWS services."
2025-08-21,"Top Research Reports for Amazon.com, Salesforce & Abbott",Yahoo,"Amazon posts strong Q2 gains across AWS, Prime and ads, but weak Q3 income guidance and AI costs drag shares lower."
2025-08-22,Amazon is selling a $100 food dish warming mat for $28 that heats up quickly,Yahoo,"Its perfect for potlucks, family dinners, or just eating by the TV."
2025-08-22,Sector Update: Tech Stocks Mixed Late Afternoon,Yahoo,"Tech stocks were mixed late Thursday afternoon, with the Technology Select Sector SPDR Fund (XLK) de"
2025-08-22,"Bullish Analysts, Options Traders Expect New Highs for Nvidia Stock After Earnings",Yahoo,"NVDA scored a couple of price-target hikes today, with Wedbush and UBS both looking for a move above $200."
2025-08-22,TestSquared Launches AffiliateTor: A Free Directory for Affiliate Programs,Yahoo,"Test Squared today announced the launch of AffiliateTor, a free affiliate program directory that simplifies how affiliates discover and connect with opportunities. The platform also gives brands a cost-effective way to gain visibility and attract partners in the fast-moving world of affiliate marketing."
2025-08-24,3 Stocks That Could Create Lasting Generational Wealth,Yahoo,"There are stocks often called forever holdings, and then there are actual forever holdings."
2025-08-24,Is Buying AST SpaceMobile Stock a Once-In-a-Generation Opportunity?,Yahoo,The satellite internet company is planning to disrupt this fast-growing market.
2025-08-24,What AI Bubble? Alphabets Business Is Booming,SeekingAlpha,"Alphabet shows strong fundamentals, accelerating growth in Search and Cloud, and attractive valuation despite AI bubble fears. Find out why GOOG stock is a buy."
2025-08-24,"Prediction: This Quantum Computing Stock Will Still Be Worth More Than Berkshire Hathaway, Palantir, and Tesla Combined in 2030",Yahoo,Quantum computing could become the next frontier of the artificial intelligence revolution.
2025-08-25,Major Hyperscaler Expands AI Processor Production Capacity with Additional Aehr Test Package-Level Test and Burn-in Systems,Yahoo,"FREMONT, CA / ACCESS Newswire / August 25, 2025 /Aehr Test Systems (NASDAQ:AEHR), a worldwide supplier of semiconductor test and burn-in equipment, today announced it has received additional follow-on orders for six Sonoma ultra-high-power packaged ..."
2025-08-26,The AI Revolution Is Devouring Everything,SeekingAlpha,"The AI revolution is reshaping industries, the economy, and society. Heres how the world may change in the coming years and what investors should consider."
2025-08-27,Exiger Wins AI Company of the Year in STEVIE® Awards for Technology Excellence,Yahoo,"Exiger, the market-leading supply chain AI company and largest provider of supply chain technology to the U.S. Federal Government, has been named a winner of the Silver® Award for Artificial Intelligence Company of the Year in the second annual Stevie Awards for Technology Excellence. Exiger was recognized alongside fellow enterprise software and advanced technology leaders, including Amazon / Amazon Web Services, Google, IBM, Meta, Microsoft, Nvidia, Oracle, Salesforce, and ServiceNow."
2025-08-28,Why Fabrinet (FN) Just Got a Major Upgrade From JPMorgan,Yahoo,"Fabrinet (NYSE:FN) is one of the AI Stocks Analysts Say You Shouldn’t Ignore. On August 25, JPMorgan analyst Samik Chatterjee upgraded the stock from Neutral to Overweight with a price target of $345.00 (from $318.00). The firm has upgraded the stock citing robust “longer-term drivers for optical companies with leverage to multi-faceted investment.” Analysts are also optimistic […]"
2025-08-28,Volkswagen extends Amazon cloud partnership to save costs with AI,Yahoo,"BERLIN (Reuters) -Volkswagen has extended its factory cloud partnership with Amazon Web Services by another five years, the German carmaker said on Thursday, as it rolls out the use of artificial intelligence to improve production and reduce costs.  The company partnered with the cloud computing services unit of Amazon.com to create a digital production platform, or DPP, which Volkswagen says is already used in 43 locations in Europe, North America and South America.  Globally, Volkswagen has over 114 production sites."
2025-08-28,Should You Buy NVIDIA After Solid Q2 2026 Results Without China Sales?,Yahoo,"NVDA posts strong fiscal Q2 results with soaring AI-driven growth, but China sales halt weighs on its Data Center momentum."
2025-08-28,Invesco Equity And Income Fund Q2 2025 Commentary,SeekingAlpha,"Stock selection information technology, communication services and consumer staples contributed to relative performance. Read more here."
2025-08-28,"Chipolo, an AirTag rival, debuts rechargeable trackers with a six-month battery life",Yahoo,Chipolo debuts a lineup of rechargeable trackers to compete with AirTag and others.
