date,headline,source,summary
2025-06-13,"Visa, Mastercard stocks fall after stablecoin report",Yahoo,"Investing.com -- Visa (NYSE:V) stock fell 5.4%, Mastercard (NYSE:MA) dropped 4.6%, and American Express (NYSE:AXP) declined 2% after a Wall Street Journal report revealed major retailers are exploring stablecoin options to bypass traditional card payment fees. Other payment processors also suffered, with Capital One (NYSE:COF) down 3%, PayPal (NASDAQ:PYPL) falling 2.6%, and Block dropping 2.4%."
2025-06-14,Walmart and Amazon Explore Stablecoins. Visa Stock Falls but Analysts Don’t See Immediate Threat.,Yahoo,"Shares of  Visa  and  Mastercard  were sliding Friday after The Wall Street Journal reported that  Walmart  and  Amazon.com  among other merchants, have been considering issuing their own stablecoins to customers, a move that could siphon revenue from traditional payments providers.  Merchants’ decisions on whether to unveil stablecoins—cryptocurrencies pegged to stable currencies like the U.S. dollar—rest on the passage of the Genius Act, a bill moving through Congress that would regulate the coins and require issuers to maintain reserves of dollars or other liquid assets, the Journal said."
2025-06-16,My 5 Favorite Stocks to Buy Right Now,Yahoo,"Amazon is using artificial intelligence to improve efficiency and drive earnings growth.  Meta Platforms and Pinterest are using AI to enhance user engagement and improve ad targeting.  An e-commerce and cloud computing leader, Amazon (NASDAQ: AMZN) has been incorporating artificial intelligence (AI) across its businesses to drive efficiency, expand margins, and fuel growth."
2025-06-17,Crypto hails Senate vote on stablecoin bill as a major victory,Yahoo,"The Senate is preparing for a final vote Tuesday on a bill that would establish the first federal framework for dollar-backed cryptocurrencies known as stablecoins, a major victory for an industry that has pushed for more favorable oversight in Washington, D.C."
2025-06-17,Sector Update: Tech Stocks Gain Late Afternoon,Yahoo,Tech stocks rose late Monday afternoon with the Technology Select Sector SPDR Fund (XLK) gaining 1.6
2025-06-17,History Says the Stock Market Is About to Soar: 2 Brilliant AI Stocks to Buy Now,Yahoo,"Investors became very bearish when the Trump administration announced tariffs, but extreme pessimism has historically been a contrarian signal.  Amazon is leaning into artificial intelligence (AI) across its retail and cloud segments, and its multibillion-dollar AI business is growing at a triple-digit pace.  CoreWeave has been recognized by independent analysts as the best GPU cloud on the market, and the company reported 420% revenue growth in the first quarter."
2025-06-17,Could Buying UPS Today Set You Up for Life?,Yahoo,"UPS strategy of shifting revenue to higher-margin deliveries and optimizing its network can add significant value for investors.  The stock has enormous potential to deliver great returns for investors, but investors need to be aware of the near-term risk.  Can buying UPS stock set you up for life?"
2025-06-17,Time CEO on embracing AI: Its better to have a seat at the table,Yahoo,Time CEO Jessica Sibley makes the case for media publishers to embrace AI.
2025-06-17,"Tesla price hikes, Roku–Amazon, Hinge Health analyst coverage",Yahoo,"Wealth host Brad Smith tracks today’s top moving stocks and biggest market stories in this Market Minute. Tesla (TSLA) announced price increases on its Model S and Model X by $5,000. The company also teased robotaxi rollout plans for this weekend. Roku (ROKU) is gaining on news that the company will partner with Amazon (AMZN) Ads, giving marketers exclusive access to 80 million US TV households. Hinge Health (HNGE) pops after analysts initiated coverage with a bullish outlook. Stay up to date on the latest market action, minute-by-minute, with Yahoo Finances Market Minute."
2025-06-17,Oracle Earnings Impress: Are Cloud Stocks a Buy?,Yahoo,"Impressively, Oracles remaining performance obligations were up a strong 41% year-over-year, a reflection of the red-hot demand the company has been witnessing. Are other cloud players seeing momentum?"
2025-06-18,"Zacks Investment Ideas feature highlights: Oracle, Microsoft and Amazon",Yahoo,Oracle rallies on strong cloud results as Microsoft and Amazon ride sustained demand across AI and infrastructure.
2025-06-19,AWS Enhances Security Offerings,SeekingAlpha,Amazonâs AWS division clearly demonstrated at their recent re:Inforce event that security-based capabilities are the rock upon which future technology developments can be made
2025-06-19,Netflix vs. Amazon: Which Streaming Giant Has Better Upside Potential?,Yahoo,"NFLX offers superior upside vs AMZN through a focused streaming model, doubling ad revenue potential and strong operating leverage."
2025-06-19,Agents Are the Hot Thing in AI. These Stocks Could Win.,Yahoo,"Agentic AI is expected to change the internet for good, and BofA Securities has identified a few companies it believes are set to reap the benefits.  Generative AI has taken the world by storm as chatbots grow in popularity, bringing more specific and conversational answers to questions.  Tech experts foresee yet more change, saying agentic AI could be the next big thing."
2025-06-19,Adobe vs. Apple: Which AI-Driven Tech Stock is a Better Buy Now?,Yahoo,"Both Adobe and Apple are infusing AI into their core offerings. However, which stock, AAPL or ADBE, is a better buy?"
2025-06-20,UK grocery watchdog probes Amazon over alleged supplier payment delays,Finnhub,"Britains grocery regulatoron Friday launched an investigation into Amazon,probing whether the U.S. retail giant breached rules on timelysupplier payments over a three-year period. ..."
2025-06-21,SoftBank Wants To Build A $1 Trillion Chip Hub In The U.S. Heres What It Means,SeekingAlpha,"SoftBankâs bold AI and chip ambitions, including the $1T Arizona AI Park, bring opportunity but major funding risks and volatility. Learn why SFTBY stock is a hold."
2025-06-23,United Launch Alliance and Amazon Launch the Future of Global Connectivity,Yahoo,"A United Launch Alliance (ULA) Atlas V rocket carrying the Kuiper 2 mission for Amazons Project Kuiper lifted off on June 23 at 6:54 a.m. EDT from Space Launch Complex-41 at Cape Canaveral Space Force Station. This mission marks the next step in Amazons initiative to provide fast, reliable internet to customers around the world, including those in unserved and underserved communities."
2025-06-24,Jeff Bezos famously neglected to sign a prenup in his first marriage. He’s not making the same mistake twice,Yahoo,"The Amazon founder, who is worth nearly $224 billion, is set to wed fiancée Lauren Sanchez this week."
2025-06-24,"Amazon Will Be Largest U.S. Retailer This Year, Beating Walmart, Says J.P. Morgan",Yahoo,Internet analyst Doug Anmuth reiterated an Overweight rating and $240 price target for the e-commerce stock.
2025-06-25,Why Meta’s $14.3 Billion Deal to Buy Scale AI Is Great News for Reddit Stock,Yahoo,The massive $14.3 billion deal between Meta and Scale AI has sparked optimism for Reddit’s future.
2025-06-25,Bezos and Sanchez arrive in Venice as protesters say their wedding highlights wealth inequality,Finnhub,"VENICE, Italy — Amazon founder Jeff Bezos and Lauren Sanchez arrived in Venice, Italy, on Wednesday ahead of their star-studded weekend wedding, which has galvanized an assortment of protesters. ..."
2025-06-26,AMAZON COM INC : Gets a Buy rating from JP Morgan,Finnhub,"In a research note published by Doug Anmuth, JP Morgan advises its customers to buy the stock. The target price remains unchanged at USD 240."
2025-06-26,Wyze Appoints Former Amazon Executive Melissa Kirmayer Eamer as President and Chief Operating Officer,Yahoo,"SEATTLE, June 25, 2025--Wyze, a company creating products that make homes smart and safe, today announced the appointment of Melissa Kirmayer Eamer as President and Chief Operating Officer. In this role, she will bring experience from consumer-centric brands, including Glossier and Amazon, to guide Wyze through its next phase of strategic growth."
2025-06-26,They Said I Do on Dans 90th Birthday: Heartfelt Debut Novel Chronicles Seven Years of Secret Bucket-List Adventures--with a Cat Narrator,Yahoo,"In her debut novel Love Beyond the Bucket List, Dawn Mari McMillion shares a heartwarming and humorous tale of newlyweds in their nineties who trade rocking chairs for road trips—checking off a bucket list with help (and sass) from their feline narrator, Mahi. Based on true events, this 232-page story blends family drama, laugh-out-loud moments, and poignant reflections on aging, friendship, and second chances at love."
2025-06-28,Everything We Know About Jeff Bezos and Lauren Sánchez’s Wedding,DowJones,Everything We Know About Jeff Bezos and Lauren Sánchez’s Wedding
2025-06-28,"If I Could Only Buy 1 Artificial Intelligence (AI) Stock, It Would Be This Monster Magnificent Seven Member Approved by Billionaires Warren Buffett and Bill Ackman",Yahoo,Billionaire investors Bill Ackman and Warren Buffett both feature a particular Magnificent Seven member in their portfolios.
2025-06-28,Where Will Amazon Be in 1 Year?,Yahoo,"Amazon aims to take on Walmart and dollar stores in rural areas.  Project Kuiper officially gets off the ground in 2025.  While Amazon (NASDAQ: AMZN) stock has shown strength of late, it has actually been one of the laggards among the Magnificent Seven stocks since the end of the pandemic."
2025-06-29,I Paid Off $30K in Credit Card Debt With a Side Gig at Amazon — and You Can Too,Yahoo,"GOBankingRates reached out to an Amazon picker, who will remain anonymous, who used their Amazon side gig to pay off about $30,000 in credit card debt."
2025-06-29,Would Investing $10K in the Magnificent 7 Stocks in 2023 Have Made You Rich?,Yahoo,"In a nutshell, if you had the foresight to invest in the Magnificent 7 stocks at the beginning of 2023, you would have done well. How well? Read on to find out."
2025-06-29,Walmart’s digital momentum signals long-term profit growth: Morgan Stanley,Yahoo,"Investing.com -- Walmart’s transformation into a digital retail powerhouse has reshaped its earnings trajectory, according to a detailed e-commerce “Block” analysis from Morgan Stanley."
2025-06-29,Should You Buy Roku Stock After Its Partnership With Amazon?,Yahoo,"Rokus recent partnership with Amazon makes the streaming specialist more attractive.  Although it still faces some headwinds, Rokus long-term prospects remain bright.  On June 16, Roku (NASDAQ: ROKU) announced a partnership with Amazon (NASDAQ: AMZN) that will allow advertisers access to the streaming specialists ecosystem through Amazons advertising platform."
2025-06-30,My 5 Favorite Stocks to Buy Right Now,Yahoo,"Amazon is using AI to drive efficiency and growth.  The coffee chain Dutch Bros has a huge expansion opportunity ahead.  Amazon (NASDAQ: AMZN) remains the dominant player in e-commerce, where its been leveraging artificial intelligence (AI) to improve varied tasks ranging from logistics to ad targeting."
2025-06-30,Medela Delivers Big Prime Day Savings on New Pump In Style® Pro Breast Pump,Yahoo,"From July 8 to July 11, moms can save 20% on Medela’s newest hospital-grade pump Pump In Style® Pro Pump In Style® Pro brings Medela’s hospital-grade performance to a mother’s home in a compact, easy-to-use design McHenry, Illinois, June 30, 2025 (GLOBE NEWSWIRE) -- Medela, the brand trusted by millions of moms worldwide and the #1 brand in hospitals1, is offering an exclusive offer on its newest hospital-grade innovation, Pump In Style® Pro, for Amazon’s Prime Day sales event. Moms will receive"
2025-06-30,"Stock Market News for Jun 30, 2025",Yahoo,U.S. stock markets closed sharply higher at record-high level on Friday.
2025-07-01,Declare Freedom from Discomfort This July -- Bestqools Non-invasion Red Light Therapy,Yahoo,"As the fireworks illuminate the night sky this 4th of July, Bestqool invites customers to celebrate independence not only as citizens but also within their own well-being journeys — with powerful tools that enhance vitality, performance, and recovery. This July, the pioneering red light therapy company is set to deliver massive sales to ensure clinically proven wellness is available to all."
2025-07-01,"Wall Street Eyes $250 for Oracle, But Could ORCL Stock Climb Even Higher?",Yahoo,"Oracle shares have already seen a strong rise, and Wall Street’s highest price target of $250 points to even more potential gains."
2025-07-01,These 5 Stocks Will Replace Your Job,Yahoo,"Back in 1999, when I enlisted in the Marine Corps, my base pay started at less than $1,000 a month. Even after four years and a promotion to corporal, I was making just over $1,300 living paycheck to paycheck. In total, my entire enlistment earned me less than $55,000. Fast forward to today, and I […]"
2025-07-02,NSC Warns 437 People May Die in July 4 Weekend Traffic Crashes,Yahoo,"The National Safety Council estimates 437 people may die in preventable traffic crashes during the 2025 Independence Day holiday period, from 6 p.m. Central Time on Thursday, July 3, to 11:59 p.m. on Sunday, July 6."
2025-07-02,"Citi sees upside for Trade Desk into Q2 results, adds on a catalyst watch",Yahoo,"Investing.com -- Citi placed Trade Desk (NASDAQ:TTD) on a 90-day positive catalyst watch, citing signs of stronger ad spending and robust connected TV (CTV) trends ahead of the company’s second-quarter earnings report."
2025-07-02,Jeff Bezos sold Amazon shares worth about $737 million in June,Yahoo,"Amazon founder and executive chair Jeff Bezos sold shares worth almost $737 million in the e-commerce giant in June, according to a regulatory filing on Tuesday. Bezos, who founded Amazon in 1994, sold 3.3 million shares for $736.7 million, after adopting a 10b5-1 trading plan in March, showed the filing, made after the market closed. After the sale, Bezos will own about 905 million Amazon shares."
2025-07-02,Google’s quiet AI win spells trouble for Amazon,Yahoo,A big endorsement just tipped the hardware balance.
2025-07-03,MiLi Gears Up for Amazon Prime Day with Exclusive Deals on the MiTag Duo & LiTag Duo for Travel Gadgets Up To 30% Off,Yahoo,"Shenzhen, China, July 02, 2025 (GLOBE NEWSWIRE) -- Fast Prime shipping now available to customers in the USA, Canada, Japan, UK, France, Germany, Italy, Spain, Poland, Sweden, Turkey, Austria, Ireland, Belgium and the Netherlands. With Amazon having confirmed that its 11th annual Prime Day will return this July 8-11th, spanning all major European and North American marketplaces, MiLi is rolling out its biggest summer celebration yet. The travel tech innovator will headline the two day event with"
2025-07-03,"Magnificent Seven Makeover: Which Stocks Have Earned a Spot, and Which Havent?",Yahoo,"Palantirs revenue growth is accelerating, and its long-term opportunities appear to be huge.  Broadcom reports strong growth in its networking portfolio, and it has an even bigger opportunity in custom AI chips.  The so-called Magnificent Seven stocks -- Alphabet, Apple (NASDAQ: AAPL), Amazon, Meta Platforms, Microsoft, Nvidia, and Tesla (NASDAQ: TSLA) -- provided much of the driving force behind the markets strong growth over the past several years."
2025-07-05,How did the hyperscale clouds do in Q1 2025?,Yahoo,"Investing.com -- In a note to clients on Monday, Bernstein analysts said the hyperscale cloud market remains on a strong, long-term growth path, with generative AI now taking center stage as the primary revenue driver."
2025-07-05,"Amazon: Shein And Temu Downfall, Robotics, And AI Inflection",SeekingAlpha,"Amazonâs valuation overlooks major growth drivers like AI, AWS, and robotics, with margin gains and FCF upside ahead. Check out why AMZN stock is a strong buy."
2025-07-08,Amazon extends Prime Day discounts to 4 days as retailers weigh tariffs and price increases,Finnhub,NEW YORK — Amazon is extending its annual Prime Day sales and offering new membership perks to Gen Z shoppers amid tariff-related price worries and possibly some consumer boredom with an event...
2025-07-09,A Slow Start to Amazons Prime Day,Yahoo,Amazons Prime Day kicks off to a slower than expected start as early spending drops 14% compared to 2024. Bloombergs Spencer Soper joins Caroline Hyde on Bloomberg Tech to discuss the tariff impact on retailers and shoppers.
2025-07-09,Mark Zuckerberg’s AI Spending Spree Tab Keeps Climbing as Projected Expenditures Could Reach $72 Billion,Yahoo,"Meta has invested billions of dollars in its AI ambitions, offering some top researchers compensation packages reportedly reaching $100 million, fueling an intense global competition for AI talent."
2025-07-09,CoreWeave-Core Scientific deal pushes AI merger tally over $65 billion as M&A market thaws,Yahoo,"As the market enters the second half of the year, AI is primed to remain the darling of dealmaking for 2025."
2025-07-10,TD Cowen Remains Bullish on Amazon (AMZN) With $250 Target on AI and Retail Tailwinds,Yahoo,"Amazon.com, Inc. (NASDAQ:AMZN) is one of the 10 AI Stocks Investors Are Watching This Week. On July 8, Analyst John Blackledge from TD Cowen reiterated a “Buy” rating on the stock and increased the price target to $250.00 from $240.00. Blackledge is optimistic about Amazon’s performance in the upcoming quarters, anticipating its second-quarter results to surpass market […]"
2025-07-10,TTD Declines 23% in a Year: Continue to Hold or Sell the Stock?,Yahoo,TTD stock plunges 23% in a year amid fierce competition and macro headwinds. Should you still hold?
2025-07-10,"These Tennessee companies are among the best in the world, according to Forbes. See where they rank",Yahoo,Forbes ranked these Tennessee-based companies as some of the best nationwide and internationally. See which made the list and where they rank.
2025-07-10,Roku Stock Rises After Upgrade. This Big Shift Is Helping the Streamer.,Yahoo,"Partnerships with Amazon and The Trade Desk should help boost ad sales, KeyBanc analyst Justin Patterson said."
2025-07-10,Only 35% of Americans Feel on Track For Retirement. Here Are 2 Stocks to Buy Now and Hold For Decades.,Yahoo,"Only about one-third of all Americans believe their retirement plan is on track, which is down from 40% in 2021.  Amazon and Meta Platforms could serve as building blocks for investors willing to adopt a buy-and-hold strategy.  Do you feel on track for retirement?"
2025-07-10,Astronomer and AWS Announce Strategic Collaboration Agreement,Yahoo,"Astronomer, the company behind Astro, the leading unified DataOps platform powered by Apache Airflow®, today announced a strategic collaboration agreement (SCA) with Amazon Web Services (AWS). This SCA will help customers accelerate their data movement to AWS with Astro and modernize their data infrastructures for greater agility and cost efficiency."
2025-07-11,"The Zacks Analyst Blog Highlights Tesla, Alphabet and Amazon",Yahoo,"TSLA eyes San Francisco for its next robotaxi push, but regulatory hurdles and valuation risks may stall its ride."
2025-07-14,Amprius Selected for Amazon Devices Climate Tech Accelerator,Yahoo,"FREMONT, Calif., July 14, 2025--Amprius Technologies, Inc. (Amprius or the Company) (NYSE: AMPX), a leader in next-generation lithium-ion batteries with its Silicon Anode Platform, today announced its selection for the 2025 cohort of the Amazon Devices Climate Tech Accelerator. The program supports companies developing technologies that could help reduce the carbon footprint of Amazon’s devices and operations as part of its broader commitment to reach net-zero carbon by 2040 through The Clim"
2025-07-14,Bitcoin soars to new all-time high as US lawmakers focus on pro-crypto legislation,Yahoo,"Bitcoin continued its rapid climb and hit another all-time high Monday as U.S. lawmakers begin a week focused on passing pro-crypto legislation.  The world’s oldest and most popular cryptocurrency is currently the fifth most valuable asset class in the world at $2.4 trillion, giving it a higher market cap than Amazon.  The enthusiasm for bitcoin comes as the U.S. House is set to take up several pieces of cryptocurrency-related legislation in what’s been dubbed “crypto week” in Congress."
2025-07-15,"Prime Day event drove over $24B in US e-commerce sales, GenAI traffic was up 3,300%",Yahoo,"Amazons Prime Day, which leads to an overall boost to U.S. e-commerce thanks to competitive sales, saw a significant increase in retail traffic driven by generative AI products, including chatbots and browsers."
2025-07-16,Is Taboola Poised to Weather Challenges Posed by Walled Gardens?,Yahoo,"TBLA strengthens its open-web ad platform with AI, Yahoo partnership, and ROI-focused tools to challenge walled gardens."
2025-07-16,PAG Companies Book Sales Offers Price Match & Free Shipping on Amazon,Yahoo,"Mr. Anthony Wright of PAG COMPANIES, LLC, is pleased to announce an expansion of its book sales operations through becoming an approved prime seller with Amazon. The Company website is www.pagcompanies.com"
2025-07-17,Amazon.com defeats lawsuit by Prime Video subscribers over commercials,Finnhub,A federal judge on Wednesday dismissed a proposed class action over Amazon.coms decision to begin showing commercials on its Primeunless subscribers paid a $2.99 monthly opt-out...
2025-07-17,Amazon Makes Its First Public Sale | On This Day,Finnhub,"Amazon made its first public sale 30 years ago July 16, 1995 and Romaine Bostick explains that first sale and how the company expanded into one of the worlds biggest companies...."
2025-07-18,"The Three Skills You Need To Master In The Age Of AI, According To Tech Execs",Yahoo,"AI agent adoption is projected to grow by 327% by 2027, a new report from Salesforce (NYSE:CRM) finds. This is expected to increase a companys productivity by 30%, but will drastically impact the way those companies are organized and run. With the implementation of these AI agents, an estimated 61% of a companys workforce will remain in their current roles. However, their day-to-day responsibilities will almost certainly be impacted, human resource executives said. Around 75% of the HR executi"
2025-07-18,"Global Quantum Computing Market Report 2025: Revenue, Trends, and Key Players",Yahoo,"Discover the latest insights in the global quantum computing market. Analyzing trends, market revenue, and projections from 2024 to 2030, it covers industry dynamics, ESG developments, and profiles of leading companies like IBM, Google, and Amazon. Optimize your strategy with detailed data tables, market size forecasts, and patent analyses, while exploring emerging technologies and regional insights across North America, Europe, and Asia-Pacific. Unlock the future potential of quantum computing"
2025-07-19,"Cantor Fitzgerald Stays Bullish on Amazon (AMZN), Lifts Target to $260 on Retail and AWS Growth",Yahoo,"Amazon.com, Inc. (NASDAQ:AMZN) is one of the AI Stocks Investors Are Watching Closely. On July 16, Cantor Fitzgerald analyst Deepak Mathivanan raised the price target on the stock to $260.00 (from $240.00) while maintaining an “Overweight” rating. The firm increased its FY26E EBIT estimates by 9% and reiterated its Overweight / Top pick rating. Earnings Preview: […]"
2025-07-19,Netflix Earnings Show That YouTube Is the Streamer to Fear,Yahoo,"The streaming company has survived an onslaught of well-heeled competition from Disney, Amazon, Apple, and more."
2025-07-19,Tariffs Are Confusing. What to Focus On Next.,Yahoo,"A lot could happen on the trade front in the next few weeks, from pressuring Russia on Ukraine to arguing the legality of the administration’s tariff policy, to a China-U.S. summit. Here are a few developments to watch."
2025-07-21,Weve Been Served: Paul Tudor Jones Warns AI Could Be a Cookbook For Humanity In A Chilling Twilight Zone Warning,Yahoo,"This is obviously the most disruptive technology in the history of mankind, billionaire investor Paul Tudor Jones said last month. Weve been served, Jones warned during an appearance on Bloomberg Open Interest, casting artificial intelligence as a force that demands urgent scrutiny. His remarks sparked debate over looming job losses, classroom breakthroughs, and whether Congress can craft guardrails before machines outrun lawmakers. The Twilight Zone Cookbook Warning Jones invoked the 196"
2025-07-22,The ‘hallucinations’ that haunt AI: why chatbots struggle to tell the truth,Yahoo,The world’s leading artificial intelligence groups are stepping up efforts to reduce the number of “hallucinations” in large language models...
2025-07-22,"The Best Warren Buffett Stocks to Buy With $1,000 Right Now",Yahoo,"Amazon Web Services will drive Amazons growth for the foreseeable future.  Coca-Cola has one of the most reliable dividends in the stock market, with 63 consecutive years of annual increases.  To say that Warren Buffett has made a name for himself in the investing world would be a huge understatement."
2025-07-22,Billionaires Are Buying 3 Brilliant Stocks Shaping the Future of Technology,Yahoo,The technology sector outperformed the broader S&P 500 by more than 400 percentage points during the last decade.  Amazons innovations in robotics and autonomous driving could reduce logistics costs and create new revenue streams for the company.  Joby Aviation and Archer Aviation are developing electric vertical take-off and landing aircraft (flying taxis) to revolutionize urban mobility.
2025-07-22,"Model Portfolio For Capital Appreciation, July 2025",SeekingAlpha,"Build a high-performing portfolio with over 20 expert-recommended stocks. Focused on capital growth, beat the S&P 500 using institutional-grade picks. See more."
