date,headline,source,summary
2025-07-22,"1 Unstoppable Stock to Buy Before It Soars More Than 1,100% Over the Next 10 Years, According to 1 World-Renowned Analyst",Yahoo,"A long history of innovation, gale-force secular tailwinds, and its dominant position could drive the industry leader to new heights."
2025-07-23,Why Amazon Wants an AI Bracelet That Records Everything You Say,Yahoo,"After a decade of  Amazon  saying Alexa isn’t listening to your every word, the company is buying a bracelet that can.  Bee Chief Executive  Maria de Lourdes Zollo  said the company, which imagines “a world where AI is truly personal,” is joining Amazon in a LinkedIn post.  An Amazon spokeswoman said that while a deal is signed, the agreement isn’t yet closed."
2025-07-23,Etsy faces user boycott over ‘Alligator Alcatraz’ branded products,Yahoo,Etsy users are boycotting the site over its Alligator Alcatraz merchandise.
2025-07-23,Buy with Prime Powers Revlon’s Limited-Edition Flavortown Lip Balm Launch with Guy Fieri,Yahoo,"SEATTLE, July 23, 2025--Amazon (NASDAQ: AMZN) today announced that Revlon’s limited-edition Flavortown shade of its Super Lustrous Glass Shine Lip Balm—created in collaboration with Guy Fieri—is exclusively available through Buy with Prime, a direct-to-customer (DTC) offering, now through July 29. Timed to celebrate National Lipstick Day and National Chicken Wing Day, the fiery new shade inspired by the iconic heat and color of Guy’s new Flavortown O.G. Buffalo Wing Sauce comes with a customiz"
2025-07-23,Tesla Is Still Selling Glossy Future - GM Just Shipped 111% More EVs,Yahoo,"Even with shares down 12% this year, Tesla Inc. (NASDAQ:TSLA) still carries an out-of-this-world price-to-earnings ratio of 189x. Thats not just lofty—its meme-level. Teslas Valuation Is Still From Another Planet For context, Microsoft Corp (NASDAQ:MSFT) and Amazon.com Inc (NASDAQ:AMZN) sit around 39x and 37x (per Benzinga Pro data), while Toyota Motor Corp (NYSE:TM) and General Motors Co (NYSE:GM) trade at just 7 times earnings. Somehow, Tesla is still priced like it’s leading a future that"
2025-07-23,Amazon analysts reboot stock price targets ahead of Q2 report; a focus on space tech,Yahoo,This is what could happen next to Amazon shares.
2025-07-24,"Amazon.com, Inc. (AMZN) Is “An Overall Piece,” Says Jim Cramer",Yahoo,"We recently published 12 Stocks Jim Cramer Talked About. Amazon.com, Inc. (NASDAQ:AMZN) is one of the stocks Jim Cramer recently discussed. Amazon.com, Inc. (NASDAQ:AMZN) is one of the most important retailers and cloud computing companies in America. While Cramer has focused on its Alexa platform earlier, more recently, he has started discussing the firm’s Prime […]"
2025-07-24,Alphabet updates AI spending forecast after earnings surprise,Yahoo,Alphabets capex is being adjusted following the second quarters earnings.
2025-07-24,White House Unveils Push to Speed AI Development,Yahoo,President Donald Trump’s first major speech on artificial intelligence comes amid a technology arms race among Silicon Valley giants.
2025-07-25,Cadence Set to Report Q2 Earnings: Whats in the Offing?,Yahoo,"Strong AI momentum and design demand may lift CDNS second-quarter results, with EPS and revenues both set to rise year over year."
2025-07-25,Tesla Vs. Alphabets Waymo: Which Robotaxi Company Is The Better Bet?,SeekingAlpha,"Discover how the autonomous vehicle market could reshape mobility. Explore Tesla, Inc.s bold vision vs. Alphabet Inc. progress. Click for more on TSLA and GOOGL."
2025-07-25,4 Artificial Intelligence (AI) Stocks That Could Help Make You a Fortune,Yahoo,"The artificial intelligence (AI) build-out is far from over.  Data centers owned by Digital Realty are continuing to pop up, filled with components from Nvidia and Taiwan Semiconductor.  Amazon rents some of its data centers from Digital Realty."
2025-07-29,Top 10 Income Funds From Eaton Vance,SeekingAlpha,"Discover Eaton Vances top closed-end funds offering reliable income, strong returns, and expert management."
2025-07-29,Uber Or Unter? Where Could The Company Be In 20 Years?,SeekingAlpha,Explore Ubers future with 3 scenarios for 2045. Potential for gains or disruption makes it a buy for growth investors.
2025-07-30,"UPS posts tepid results amid tariff, restructuring challenges",Yahoo,"UPS’s stock price slid Tuesday after it reported lower parcel volumes and difficulty cutting costs as it works to right-size its delivery network. The post UPS posts tepid results amid tariff, restructuring challenges appeared first on FreightWaves."
2025-07-31,Big Tech to work with Trump administration to build digital health ecosystem,Yahoo,"The efforts will focus on two areas: creating a framework for patients and providers to easily share information, and creating more personal tools so patients can access resources needed to stay informed about their health."
2025-07-31,"QMOM Is Struggling, Consider Other Options",SeekingAlpha,QMOM ETFs structure limits upside from top performers. See here to know why SPMO and MTUM ETFs outperform QMOM in momentum investing.
2025-07-31,"Alphabets Recent Numbers Were Strong, but This Metric Could be a Red Flag",Yahoo,Alphabets growth may not be as solid as it looks.
2025-07-31,"Big Tech earnings, Fed stays on hold, tariff deadline: 3 Things",Yahoo,"Here are three stories Wall Street is watching for Thursday, July 31. Meta (META) and Microsoft (MSFT) posted quarterly results that topped analysts expectations, sending futures higher. Apple (AAPL) and Amazon (AMZN) will post their reports after the market close. The Federal Reserve left rates unchanged at its July meeting. Chair Jerome Powells more hawkish tone has some investors questioning whether or not the Fed will cut in September. Traders are also looking for tariff headlines with President Trumps August 1 deadline quickly approaching. To watch more expert insights and analysis on the latest market action, check out more Morning Brief."
2025-07-31,CMS partners with tech giants to enhance digital health framework in US,Yahoo,"The technology firms involved in the initiative include Amazon, Apple, Google, and OpenAI."
2025-08-01,"Amazon posts strong Q2 growth, provides mixed guidance",Yahoo,"Amazon’s second quarter earnings beat Wall Street expectations, but the company provided mixed guidance for the third-quarter. The post Amazon posts strong Q2 growth, provides mixed guidance appeared first on FreightWaves."
2025-08-01,Big Techs AI investments set to spike to $364 billion in 2025 as bubble fears ease,Yahoo,"Amazon, Alphabet, Microsoft, and Meta reported they were set to spend a cumulative $364 billion in their respective 2025 fiscal years, up from their prior estimates of around $325 billion."
2025-08-01,Amazon Crushes Q2: Buy The Dip Or Regret It Later,SeekingAlpha,"Amazon Q2 25 results shine with double-digit growth in all segments. AWS, e-commerce, and ads thriveâdont miss this Strong Buy opportunity."
2025-08-01,"These Stocks Are Moving the Most Today: Apple, Amazon, Figma, MicroStrategy, Coinbase, Reddit, Moderna, Fluor, and More",Yahoo,"Apple’s iPhone sales jump more than 13% in the tech giant’s fiscal third quarter, while Amazon stock falls on a weaker-than-expected forecast for third-quarter operating income."
2025-08-02,What Moved Markets This Week,SeekingAlpha,"Wall Street faced its worst week since May amid weak jobs data, trade tensions, and a hawkish Federal Reserve."
2025-08-02,Investing.com’s stocks of the week,Yahoo,"Investing.com -- Market sentiment soured in the latter part of the week, coming under significant pressure on Friday as investors digested the latest news, including signs of a weakening economy following the latest U.S. jobs numbers and President Trump’s updated tariffs."
