date,headline,source,summary
2025-06-04,These Are JPMorgans Top Picks for the Internet Sector,Yahoo,"JPMorgan analysts raised their price targets on a number of internet stocks, signaling to clients that concerns over the Trump administration’s tariff policies have at least partially subsided."
2025-06-04,Warren Buffett Loves This 1 Artificial Intelligence (AI) Stock,Yahoo,"Warren Buffett owns nearly $2 billion of a well-known AI stock.  Amazon actually gets most of its profits from its cloud business.  Most investors dont realize this well-known company is an AI giant, making the stock a solid long-term bet for those looking to follow one of Buffetts biggest positions right now."
2025-06-05,Wild Dark Shore by Charlotte McConaghy Claims Top Spot on Amazons Best Books of 2025 So Far List,Yahoo,"SEATTLE, June 05, 2025--Amazon.com (NASDAQ: AMZN) today revealed the Amazon Books Editors’ Best Books of the Year So Far list, with Charlotte McConaghy’s taut, psychological novel Wild Dark Shore earning the coveted No. 1 position. The Amazon Books Editors describe the novel as leaving you breathless, wide-eyed, and in awe of the extraordinary power of fiction. Rounding out the top five selections are King of Ashes by S.A. Cosby, No More Tears: The Dark Secrets of Johnson & Johnson by Gardiner"
2025-06-05,"Amazons delivery, logistics get an AI boost",Yahoo,"SUNNYVALE, Calif. (Reuters) -Amazon wants customers to know that artificial intelligence is not just for writing college essays.  In a series of announcements Wednesday, Amazon demonstrated how stockroom robots, delivery people and its sprawling warehouses will all benefit from a hefty dose of artificial intelligence, speeding packages to customer doorsteps.  Using so-called agentic AI, these robots will be able to unload trailers and then retrieve parts for repairs, according to Amazon."
2025-06-06,"Amazon cuts more jobs, this time in books division",Yahoo,"SAN FRANCISCO (Reuters) -Amazon has cut jobs in its books division, including at its Goodreads review site and Kindle units, the company said on Thursday.  The Seattle-based retailer said that fewer than 100 workers were impacted and the move was meant to improve efficiency and streamline operations.  As part of our ongoing work to make our teams and programs operate more efficiently, and to better align with our business roadmap, we’ve made the difficult decision to eliminate a small number of roles within the Books organization, an Amazon spokesperson said in a statement."
2025-06-06,3 Growth Stocks That Aren’t the Magnificent 7,MarketWatch,3 Growth Stocks That Aren’t the Magnificent 7
2025-06-06,"Ciena Delivers Growth, But Not Value",SeekingAlpha,"Ciena rides major growth trends like cloud, AI & 5G but faces margin pressures and valuation concerns. Click here to read an analysis of CIEN stock now."
2025-06-09,"Amazon to spend $20 billion on data centers in Pennsylvania, including one at a nuclear power plant",Finnhub,"HARRISBURG, Pa. — Amazon said Monday that it will spend $20 billion on two data center complexes in Pennsylvania, including one it is building alongside a nuclear power plant that has drawn federal..."
2025-06-09,The Best ETF to Invest in the AI Boom Without Betting on Just One Stock,Yahoo,"The new IVES ETF gives you expert guidance for AI investing.  The AI revolution is here.  Over the next decade, many experts believe that the artificial intelligence market will grow from a few hundred billion dollars in value to nearly $5 trillion."
2025-06-10,Cyberattack Disclosure Continues to Rattle United Natural Foods Stock,Yahoo,United Natural Foods gave a cautious outlook as it continues to weigh the impact of a cyberattack.
2025-06-10,Target Digital Sales Up 4.7% in Q1: Is Circle 360 the Real Driver?,Yahoo,"TGTs digital sales rise 4.7% in Q1, driven by Circle 360. Can this membership program outpace Walmart+ and Amazon Prime?"
2025-06-11,Talen to sell Amazon 1.9 GW from Susquehanna nuclear plant,Yahoo,"The “front of the meter” arrangement doesn’t require Federal Energy Regulatory Commission approval, according to Talen Energy."
2025-06-12,Can Shopifys Expanding Merchant Base Sustain Its Growth Momentum?,Yahoo,"SHOP expands its merchant base with tools like Shop Pay and new partnerships, but faces mounting pressure from AMZN and BABA."
2025-06-12,5 Reasons Amazon Is Still the Alpha in Tech Stocks,Yahoo,"Despite implementing job cuts, Amazon.com, Inc. (NASDAQ:AMZN) continues to outshine other tech stocks. The Seattle-based company’s high-growth segments—from AWS cloud services and digital advertising to ambitious ventures like Project Kuipers ..."
2025-06-12,New Findings from NSC Grant Recipients Help Tackle Americas Most Common Workplace Injury,Yahoo,"The National Safety Council released findings from 2023-2024 MSD Solutions Lab Research to Solutions (R2S) and MSD Solutions Pilot Grant programs. Results showed practical applications and measurable progress toward reducing musculoskeletal disorders (MSDs), the most common workplace injury."
2025-06-12,Netflix co-CEO sees Warner split as part of broader ‘shakeout’,Yahoo,"(Bloomberg) -- Warner Bros. Discovery Inc.’s decision to split into two independent companies is a sign of a broader “shakeout” across a media industry that has become increasingly dominated by streaming and on-demand services, Netflix Inc. co-Chief Executive Officer Greg Peters said.Most Read from BloombergShuttered NY College Has Alumni Fighting Over Its FutureTrump’s Military Parade Has Washington Bracing for Tanks and WeaponryNYC Renters Brace for Price Hikes After Broker-Fee BanNY Long Isla"
2025-06-12,3 No-Brainer Artificial Intelligence (AI) Stocks That Can Be Suitable Options for Any Investor,Yahoo,"Nvidia (NASDAQ: NVDA), Microsoft (NASDAQ: MSFT), and Amazon (NASDAQ: AMZN) are big names in tech, and they can also benefit significantly from AI.  Chipmaker Nvidia is simply unstoppable.  If that happens, its growth will take a hit, and investors may opt for other growth stocks instead."
2025-06-13,"Amazon reorganizes healthcare business, CNBC reports",Finnhub,"Amazons healthcare business will be divided into six new units as part of a restructuring effort after the company lost a handful of top health executives in recent months, CNBC reported on Friday,..."
2025-06-13,Silent Giant TSMC Returns to the Peak of its Powers as the AI Boom Continues,Yahoo,"AI and U.S. growth stocks have rebounded to record highs after their slump in February and March, rewarding those who bought the dip, especially in the IT and AI sectors. At the heart of this resurgence is Taiwan Semiconductor Manufacturing (TSM), better known as simply “TSMC”, the silent powerhouse behind the AI boom. The stock is within grasp of yet another historic high around the $225 mark. TSMC produces the chips that drive everything from Nvidia’s GPUs to Apple’s iPhones, and it’s now expe"
2025-06-13,Walmart and Amazon Are Exploring Issuing Their Own Stablecoins,Yahoo,"Walmart  Amazon.com and other multinational giants have recently explored whether to issue their own stablecoins in the U.S., according to people familiar with the matter.  Expedia Group  and other large companies such as airlines have also discussed potential efforts to issue stablecoins, some of the people said.  A move to launch a payments system by Walmart or  Amazon  that bypasses the traditional payments system would send shivers through the nation’s banks."
