date,headline,source,summary
2025-09-26,"Dows 270-point rally highlighted by gains for shares of Boeing, IBM",MarketWatch,"Dows 270-point rally highlighted by gains for shares of Boeing, IBM"
2025-09-26,Microsoft: No Signs Of Slowing Data Center Expansion,SeekingAlpha,Microsoft stock will benefit from AI and cloud investments that drive long-term growth. Click here to read more about MSFT and its potential upside.
2025-09-26,US Equity Indexes Continue Losing Streak as Yields Rise,Yahoo,US benchmark stock indexes traded lower after midday trading on Thursday after a two-day losing stre
2025-09-27,Amazon loses VP helping lead development of artificial general intelligence,Yahoo,"SAN FRANCISCO (Reuters) -An Amazon vice president helping to oversee one of the companys highest profile projects, artificial general intelligence, is stepping down on Friday, the online retailer confirmed after a Reuters inquiry.  Karthik Ramakrishnan, a 13-year veteran of Amazon, is stepping down, according to internal communications reviewed by Reuters.  It could not be learned if he had another job lined up and Ramakrishnan did not respond to a request for comment."
2025-09-29,"Up 100% in 6 Months, Is Oracle Stock Still Attractive?",Yahoo,Oracle is seeing significant AI-driven demand with its multi-cloud database strategy paying off handsomely.
2025-09-30,Why Instacart (CART) Shares Are Plunging Today,Yahoo,"Shares of online grocery delivery platform Instacart (NASDAQ:CART) fell 8.7% in the afternoon session after reports revealed that rival DoorDash Inc. and supermarket giant Kroger Co. are expanding their partnership for grocery delivery starting next month, intensifying competition."
2025-09-30,Will Amazon Stock Keep Rebounding This Year?,Yahoo,"As the worst performer of the Mag 7 this year, investors may be wondering if Amazon stock is being overlooked at the moment."
2025-09-30,"Amazon Ends 16-Year Prime Sharing Program, Moves to Household-Only Model",Yahoo,Change restricts shared delivery benefits to one household starting Oct. 1
2025-09-30,Zoox chooses Washington DC as its next autonomous vehicle testbed,Yahoo,The Amazon-owned company will start by mapping public streets of the nations capital before testing begins later this year.
2025-09-30,The AI Rally Is on Pause. Try These 11 Non-Tech Stocks.,Yahoo,"Highflying artificial intelligence stocks look increasingly risky, so investors should allocate some money to names that aren’t likely to plunge if the AI trade falters."
2025-09-30,Sector Update: Consumer Stocks Mixed Late Afternoon,Yahoo,"Consumer stocks were mixed late Monday afternoon, with the Consumer Staples Select Sector SPDR Fund"
2025-09-30,"CoreWeave initiated, Instacart downgraded: Wall Streets top analyst calls",Yahoo,"CoreWeave initiated, Instacart downgraded: Wall Streets top analyst calls"
2025-10-01,All The Focus Is On A.I.,SeekingAlpha,The significance of the A.I. definition is the fact these tasks require a large amount of computer memory and electrical power to process the data quickly and efficiently. Read more here.
2025-10-01,CoreWeave Is Winning Over Wall Street Amid Flurry of New Deals,Yahoo,"Nearly half of the analysts covering CoreWeave now have buy-equivalent ratings after at least three raised their recommendations in September.  It’s a stark shift from mid-July, when less than 20% of the 29 analysts tracked by Bloomberg recommended buying the stock.  The improving sentiment follows recent agreements with companies including OpenAI that quelled fears CoreWeave was too beholden to Microsoft Corp., which accounted for more than 70% of its revenue at the end of June."
2025-10-01,Amazon launches a grocery brand with most products under $5,Yahoo,The Amazon Fresh grocery items will be available online and at Amazon Fresh stores.
2025-10-01,Is eBay Set to Reignite Growth by Expanding Into Social Commerce?,Yahoo,"EBAY taps into social commerce with its Tise acquisition, aiming to boost C2C engagement and reignite growth."
2025-10-01,This ETF Has Beaten Every Stock in the Magnificent Seven This Year. Is It Too Late to Buy?,Yahoo,This semiconductor ETF has been an overlooked champ.
2025-10-01,"Amazon.com, Inc. (AMZN) Agrees to Pay $2.5 Billion in Fines and Reimbursements to Resolve Claims Made by the Federal Trade Commission",Yahoo,"Amazon.com, Inc. (NASDAQ:AMZN) is one of the 11 Most Profitable Blue Chip Stocks to Buy Right Now. Amazon.com, Inc. (NASDAQ:AMZN) agreed to pay $2.5 billion in fines and reimbursements on September 25, 2025, to resolve claims made by the Federal Trade Commission that it had fraudulently signed up millions of customers for Prime memberships. About 35 million […]"
2025-10-01,3 Cheap Tech Stocks to Buy Right Now,Yahoo,The valuations of these stocks make them very appealing.
2025-10-02,"2 Monster Growth Stocks (1 Backed by Nvidia) to Buy Before They Soar 150% and 430%, According to a Wall Street Expert",Yahoo,Hedge fund manager Philippe Laffont expects Arm and MercadoLibre to generate monster returns in the next five years.
2025-10-02,"Xylem (XYL), Amazon Partner To Support Water Sustainability In Mexico",Yahoo,"Xylem Inc. (NYSE:XYL) is one of the best smart city stocks. On September 11, Xylem and Amazon announced a collaboration for advanced water management technology in Mexico City and Monterrey to conserve over 1.3 billion liters of water per year. The project will deploy Xylem Vue, a software solution that applies data analytics to spot […]"
2025-10-02,Wall Street Breakfast Podcast: Half A Trillion And Counting,SeekingAlpha,"OpenAI dethrones SpaceX as worlds most valuable startup. White House halts ~$26B in funding for infrastructure, climate projects. Amazon introduces a new private label."
2025-10-02,How Investors Are Reacting To ACV Auctions (ACVA) Amazon Alliance and Analyst Optimism on Data Expansion,Yahoo,"A recent analyst note rated ACV Auctions as a Buy, highlighting the company’s expanding data services unit and increasing market share in its core auto auction marketplace, following news of an alliance with Amazon Autos. This development emphasizes the potential for ACV Auctions to unlock additional revenue streams through data-driven partnerships as industry consolidation continues. Well explore how the Amazon collaboration and analyst optimism could reshape ACV Auctions investment..."
2025-10-02,"Amazon, Palo Alto Networks — and 36 more hot stock picks from Deutsche Bank",MarketWatch,"Amazon, Palo Alto Networks — and 36 more hot stock picks from Deutsche Bank"
2025-10-02,Detroit Mayor Duggan says tariffs are squeezing Michigans auto industry,Yahoo,Detroit Mayor Mike Duggan says Canadian trade disputes weigh on automakers while Michigan must modernize to attract AI investments
2025-10-03,Jeff Bezos Is the Latest Tech Executive to Talk About an AI ‘Bubble.’ Why He’s Still Optimistic.,MarketWatch,Jeff Bezos Is the Latest Tech Executive to Talk About an AI ‘Bubble.’ Why He’s Still Optimistic.
2025-10-03,Amazon’s ‘crown jewel’ is this business that doesn’t get nearly enough attention,MarketWatch,Amazon’s ‘crown jewel’ is this business that doesn’t get nearly enough attention
2025-10-03,A Look at Amazon (AMZN) Valuation as It Expands Grocery Offering With New Private Label Launch,Yahoo,"Amazon.com (AMZN) just rolled out a new private label, Amazon Grocery, bringing together its Amazon Fresh and Happy Belly brands under one umbrella for grocery essentials. With over 1,000 items in the lineup, Amazon is focusing on affordable pricing, sustainable packaging, and easier-to-read nutrition labels as it aims to attract more shoppers and increase its share of the grocery market. See our latest analysis for Amazon.com. Amazon’s new grocery push comes hot on the heels of a flurry of..."
2025-10-03,AI Cloud Concerns Hover Over Amazon Stock. But Analyst Says Dont Forget This Crown Jewel.,Yahoo,Amazon stock has been dinged by cloud concerns but its advertising business should not be overlooked as a growth driver.
2025-10-03,From Apps to Nutrition: Health & Fitness Stocks to Buy Now,Yahoo,"UNFI, AMWL, STKL, and PTON stand out as health and fitness plays, tapping into booming demand for wellness, nutrition and digital care."
2025-10-03,Mercado Libres Double Trouble Amazon & China Threat,SeekingAlpha,MercadoLibre also continues to face intensifying competition from Amazon Brazil and Chinese platforms Temu and Shein. Read the latest analysis on the stock here.
2025-10-03,BC-Most Active Stocks,Yahoo,"Elong Power Holding Ltd. 25,377,948 0.4193"
2025-10-04,The Radical Changes That Are Making Your Smart Home Less Dumb,Yahoo,Amazon’s Alexa+ and Google’s Gemini for Home provide natural conversations while Ring cameras will soon find lost dogs.
2025-10-04,3 Must Own Artificial Intelligence (AI) Stocks to Buy Before 2025 Is Over,Yahoo,AI investing will continue to be a prevalent theme in 2026.
2025-10-04,Heres How Im Positioning For The Biggest Market Disruption Of My Lifetime,SeekingAlpha,"Investing strategies should focus on index funds, cyclical value stocks, and AI beneficiaries, including infrastructure and energy sectors. See more here."
2025-10-04,AI: The Bubble Driving The Economy And The Markets,SeekingAlpha,The stock market continues to rally despite clear signs of a weakening jobs market. Click here for more information on Market Outlook.
2025-10-04,My 3 Favorite Stocks to Buy Right Now,Yahoo,Act now while you can still step in at bargain prices.
2025-10-05,"Goldman Sachs, Morgan Stanley To Lead Amazon-Backed Beta Technologies $300M GE Deal And IPO As Military-Trained Electric Aircraft Firm Expands",Yahoo,"Beta Technologies, an electric aircraft manufacturer backed by Amazon (NASDAQ:AMZN), on Monday filed for an initial public offering in the U.S. at a moment when Wall Street’s appetite for growth stories has rarely been stronger. The filing arrives during what analysts describe as one of the most favorable periods for public listings in years, according to Reuters. Easing trade tensions, robust stock markets, and pent-up investor demand have combined to create a window where technology, aerospace"
2025-10-05,Startups Are Eating Big Food’s Lunch,Yahoo,"As American shoppers buy less packaged foods, Big Food has leaned on a familiar excuse: It’s the economy, stupid.  True, inflation has forced some families to trade down to cheaper store brands, and stagnant wages have squeezed household budgets."
2025-10-06,Nvidia Stock Drops. It Isn’t the Only Chip Maker With a Big OpenAI Deal.,Yahoo,"AMD announced a partnership with OpenAI on Monday, which could challenge Nvidias AI chip dominance."
2025-10-06,Timing The Bubble Top: The AI Mania Broadens In Late-Stage Push,SeekingAlpha,"The S&P 500 valuation is approaching the 2000 dot-com bubble level, and even Jeff Bezos joins the bubble warnings. Learn more about the market here."
2025-10-07,Wall Street analyst sees Bitcoin hitting new highs despite U.S. shutdown,Yahoo,Standard Chartered analyst Geoffrey Kendrick predicts that Bitcoin will continue to rise during the shutdown.
2025-10-07,Amazon and Alphabet Could Be Quiet Winners of the U.K.s Stargate Artificial Intelligence (AI) Deal,Yahoo,The tech titans stand to gain amid Great Britains push to be a global AI leader.
2025-10-07,IBM Set To Break Out On AI Partnership With Anthropic,Yahoo,"IBM stock jumped early Tuesday after the Dow tech giant announced a partnership with the artificial intelligence startup Anthropic, along with several other product updates to boost the use of generative AI by businesses.  Anthropics Claude large language models will be infused into IBMs software portfolio, starting with IBMs integrated development environment offering for software development.  IBM also worked with Anthropic to develop a guide that helps enterprises build and operate AI agents, according to a blog post from IBM."
2025-10-07,Heres How Much a $1000 Investment in Tesla Made 10 Years Ago Would Be Worth Today,Yahoo,"Investing in certain stocks can pay off in the long run, especially if you hold on for a decade or more."
2025-10-07,Is MercadoLibre Becoming a Riskier Growth Story?,Yahoo,MercadoLibre has long been seen as the Amazon of Latin America -- but its increasingly clear that its story is more complex.
2025-10-08,One Big Change Is Coming To Your Amazon Prime Membership,Yahoo,"One of Amazon Primes longest-standing perks is going away this fall, and it could force a lot of people to pay more for online shopping."
2025-10-08,Billionaire Philippe Laffont Sells Amazon Stock and Buys an Nvidia-Backed AI Stock Up 230% This Year,Yahoo,"Hedge fund manager Philippe Laffont added to his position in CoreWeave, an artificial intelligence stock that works closely with Nvidia."
2025-10-08,"Applied Optoelectronics, Inc. (AAOI): A Bull Case Theory",Yahoo,"We came across a bullish thesis on Applied Optoelectronics, Inc. on Value Degen’s Substack’s Substack by Unemployed Value Degen. In this article, we will summarize the bulls’ thesis on AAOI. Applied Optoelectronics, Inc.’s share was trading at $26.34 as of September 25th. AAOI’s forward P/E was 84.03 according to Yahoo Finance. Applied Optoelectronics (AAOI) stands out as […]"
2025-10-08,"Billionaires Buy 1 Brilliant Stock That Competes With Amazon and Google -- It Could Soar 150%, According to a Wall Street Analyst",Yahoo,Most Wall Street analysts view The Trade Desk stock as undervalued despite competition from the likes of Amazon and Google.
