date,headline,source,summary
2025-09-06,"AppLovin, Robinhood To Join S&P 500. The Stocks Are Jumping.",Yahoo,"AppLovin and Robinhood will join the S&P 500 index before the open on Sept. 22, S&P Global said. APP stock and HOOD jumped in late trading."
2025-09-06,"Robinhood, AppLovin Additions Lead S&P 500 Index Changes",Yahoo,Three companies will be joining the S&P 500 later this month.
2025-09-08,"Robinhood, AppLovin, and Emcor Stocks Trade Higher on News of S&P 500 Inclusion",Yahoo,"Robinhood Markets, AppLovin, and Emcor Group shares gained on word they will be added to the S&P 500 prior to the start of trading Sept. 22."
2025-09-08,"Trending tickers: Robinhood, Tesla, Alibaba, BP and Marks & Spencer",Yahoo,The latest investor updates on stocks that are trending on Monday.
2025-09-09,"Robinhood (HOOD) Stock Trades Up, Here Is Why",Yahoo,Shares of financial services company Robinhood (NASDAQ:HOOD) jumped 13.9% in the morning session after S&P Dow Jones Indices announced the company will be added to the benchmark S&P 500 index.
2025-09-09,Enphase Energy (ENPH) Stock Drops Despite Market Gains: Important Facts to Note,Yahoo,"In the latest trading session, Enphase Energy (ENPH) closed at $38.81, marking a -2.12% move from the previous day."
2025-09-09,Why Is AppLovin (APP) Stock Rocketing Higher Today,Yahoo,Shares of mobile app technology company AppLovin (NASDAQ:APP) jumped 11.3% in the morning session after S&P Dow Jones Indices announced on Friday that the company will be added to the benchmark S&P 500 index.
2025-09-09,Enphase Energy Unveils New IQ Bidirectional EV Charger Architecture for Home Backup and Grid Services,Yahoo,"FREMONT, Calif., Sept. 09, 2025 (GLOBE NEWSWIRE) -- Enphase Energy, Inc. (NASDAQ: ENPH), a global energy technology company and the worlds leading supplier of microinverter-based solar and battery systems, today unveiled its new IQ® Bidirectional EV Charger architecture for vehicle-to-home (V2H) and vehicle-to-grid (V2G) capability. The charger connects to the direct current (DC) port of the electric vehicle (EV) and lets homeowners charge their EV, power their home seamlessly during outages, a"
2025-09-09,Why SolarEdge (SEDG) Shares Are Plunging Today,Yahoo,"Shares of solar power systems company SolarEdge (NASDAQ:SEDG) fell 5.8% in the morning session after key competitor Enphase Energy (ENPH) announced the U.S. launch of a new, technologically advanced microinverter for the commercial solar market."
2025-09-09,Top Midday Stories: PNC Acquires FirstBank for $4.10 Billion; EchoStar Sells Spectrum Licenses to SpaceX for $17 Billion,Yahoo,"All three major US stock indexes were up in late-morning trading Monday, as investors looked ahead t"
2025-09-18,"Enphase Energy Boosts Solargraf with New TPO Partner Integrations, Faster Proposals, Availability in Japan, and NREL Validation",Yahoo,"FREMONT, Calif., Sept. 18, 2025 (GLOBE NEWSWIRE) -- Enphase Energy, Inc. (NASDAQ: ENPH), a global energy technology company and the worlds leading supplier of microinverter-based solar and battery systems, today announced enhancements to its Solargraf® platform with new third-party ownership (TPO) financing integrations, faster proposals, and availability in Japan. Solargraf is an all-in-one digital proposal, design, and permitting tool that enables solar installers to create, manage, and close"
2025-09-19,3 Reasons to Sell ENPH and 1 Stock to Buy Instead,Yahoo,Shareholders of Enphase would probably like to forget the past six months even happened. The stock dropped 38.5% and now trades at $38.31. This was partly driven by its softer quarterly results and might have investors contemplating their next move.
2025-09-24,"Enphase (ENPH) Stock Trades Down, Here Is Why",Yahoo,"Shares of home energy technology company Enphase (NASDAQ:ENPH) fell 2.9% in the afternoon session after an analyst at GLJ Research maintained a Sell rating on the stock, even while raising the price target. The analyst, Gordon Johnson, held firm on his negative outlook for the solar technology company. Although the price target was lifted to $23.49 from a previous $19.80, the reiterated Sell rating signaled continued skepticism about the stocks future performance. This analyst action appear"
2025-09-29,Is Enphase Energys (ENPH) Global Software Bet Redefining Its Edge in a Crowded Market?,Yahoo,"In September 2025, Enphase Energy was added to both the S&P 1000 and Russell Small Cap Comp Growth Index, following enhancements to its Solargraf platform, including new financing integrations and international expansion. Independent validation from the National Renewable Energy Laboratory and Solargrafs launch in Japan underscore Enphases push for global market relevance and digital innovation. Well explore how Enphases Solargraf platform enhancements shape the companys investment..."
2025-10-01,1 Profitable Stock with Exciting Potential and 2 We Find Risky,Yahoo,"Even if a company is profitable, it doesn’t always mean it’s a great investment. Some struggle to maintain growth, face looming threats, or fail to reinvest wisely, limiting their future potential."
2025-10-01,Enphase Energy (ENPH) Stock Drops Despite Market Gains: Important Facts to Note,Yahoo,"The latest trading day saw Enphase Energy (ENPH) settling at $35.39, representing a -1.91% change from its previous close."
2025-10-02,Enphase Energy Announces Collaboration with Essent in the Netherlands,Yahoo,"FREMONT, Calif., Oct. 02, 2025 (GLOBE NEWSWIRE) -- Enphase Energy, Inc. (NASDAQ: ENPH), a global energy technology company and the worlds leading supplier of microinverter-based solar and battery systems, today announced a collaboration with Essent, one of the largest residential energy providers in the Netherlands. The collaboration enables eligible Enphase customers with solar to expand their systems with IQ® Batteries and participate in Essent’s Smart Steering program, designed to help house"
2025-10-02,"Jefferies Raises Its Price Target for Enphase Energy Inc. (ENPH) to $41.00, Maintains Hold Rating",Yahoo,"Enphase Energy Inc. (NASDAQ:ENPH) is one of the 10 Most Promising Green Stocks According to Wall Street Analysts, supported by hedge fund interest and analyst-rated potential. On September 29, 2025, Jefferies raised its price target for Enphase Energy Inc. (NASDAQ:ENPH) from $36 to $41, keeping its Hold rating due to the company’s strengthening forecast for […]"
2025-10-03,Is Enphase Ready for a Turnaround After Q1 Earnings and Recent Stock Rebound?,Yahoo,"If you own or are eyeing shares in Enphase Energy, you probably know what it feels like to ride a roller coaster. The stock has tracked a path that has left investors alternately hopeful and cautious, with the past year showing a -64.4% slide, and the five-year picture still deeply in the red at -65.4%. Yet, more recently, there have been small signs of life, with a 3.4% gain over the past week and a modest 1.8% climb in the last month. It is enough to make any investor ask: is now the right..."
2025-10-06,"Enphase Energy Launches IQ Battery 5P with FlexPhase in India, Enabling Single-Phase and Three-Phase Backup for Homes and Small Businesses",Yahoo,"FREMONT, Calif., Oct. 06, 2025 (GLOBE NEWSWIRE) -- Enphase Energy, Inc. (NASDAQ: ENPH), a global energy technology company and the worlds leading supplier of microinverter-based solar and battery systems, today announced the launch of the IQ® Battery 5P™ with FlexPhase for customers in India. The system provides reliable backup power and supports both single-phase and three-phase applications, serving India’s growing residential and small commercial solar markets. Three-phase service is widely"
2025-10-07,Enphase: Risk Growing As Tesla May Control The U.S. Solar Market By 2030,SeekingAlpha,"Enphase faces challenges from rising rates, policy shifts, and Teslaâs dominance in solar tech. Click here to read an analysis of ENPH stock now."
2025-10-07,Enphase: More Pain In 2026 - Structural Risks Remain,SeekingAlpha,"ENPH faces significant headwinds from U.S. policy changes, including the accelerated phasing out of key renewable tax credits starting in 2026. Read why ENPH is a Hold."
2025-10-07,Enphase Energy Announces Conference Call to Review Third Quarter 2025 Financial Results,Yahoo,"Tuesday, Oct. 28, 2025 at 4:30 p.m. Eastern TimeFREMONT, Calif., Oct. 07, 2025 (GLOBE NEWSWIRE) -- Enphase Energy, Inc. (NASDAQ: ENPH), a global energy technology company and the worlds leading supplier of microinverter-based solar and battery systems, announced today that it will host a conference call and webcast on Tuesday, Oct. 28, 2025 at 4:30 p.m. Eastern Time to discuss its third quarter 2025 financial results for the period ended Sept. 30, 2025. The live webcast can be accessed on the E"
2025-10-10,Enphase Expands Smart Energy Management to Water Heaters in Europe,Yahoo,"Enphase Energy extends its IQ® Energy Management platform to include electric water heaters in Belgium, the Netherlands, and Switzerland."
2025-10-10,Why the Market Dipped But Enphase Energy (ENPH) Gained Today,Yahoo,"The latest trading day saw Enphase Energy (ENPH) settling at $36.71, representing a +1.89% change from its previous close."
2025-10-11,"Stanley Black & Decker, Enphase, and EVgo Shares Are Falling, What You Need To Know",Yahoo,A number of stocks fell in the afternoon session after the U.S. threatened to impose massive increases to tariffs on China in response to new export controls from Beijing.
