date,headline,source,summary
2025-07-10,"Enphase Energy Expands IQ EV Charger 2 in Europe with New Markets, Certifications, and Smart Meter Integration",Yahoo,"FREMONT, Calif., July 10, 2025 (GLOBE NEWSWIRE) -- Enphase Energy, Inc. (NASDAQ: ENPH), a global energy technology company and the worlds leading supplier of microinverter-based solar and battery systems, today announced that production shipments of its newest electric vehicle (EV) charger, the IQ® EV Charger 2, have expanded across Europe to now include Greece, Romania, Ireland, and Poland. The IQ EV Charger 2 is a smart charger designed to work seamlessly with Enphase solar and battery system"
2025-07-16,Enphase Energy Ups Presence in Europe With IQ EV Charger 2 Expansion,Yahoo,"ENPH expands IQ EV Charger 2 shipments across Europe, boosting its smart-charging footprint in Greece, Romania, Ireland and Poland."
2025-07-21,GEV or ENPH: Which Stock Leads the Green Energy Future?,Yahoo,"GE Vernova shines on momentum and contracts, while Enphase offers value and capital efficiency in the clean energy race."
2025-07-23,Are You a Momentum Investor? This 1 Stock Could Be the Perfect Pick,Yahoo,The Zacks Style Scores offers investors a way to easily find top-rated stocks based on their investing style. Heres why you should take advantage.
2025-07-23,Enphase Stock Plummets. Why an Earnings Beat Couldn’t Dispel the Solar Gloom.,Yahoo,"The company guided for revenue of between $330 million and $370 million in the current quarter, below expectations."
2025-07-24,S&P 500 Gains and Losses Today: Lamb Weston Stock Soars as Volumes Grow; Enphase Energy Falters,Yahoo,"The S&P 500 added 0.8% on Wednesday, July 23, 2025, after the U.S. announced a trade agreement with Japan and more companies posted quarterly results."
2025-07-24,Top Midday Decliners,Yahoo,Fiserv (FI) said Wednesday it signed an agreement with Toronto-Dominion Bank (TD) to acquire a porti
2025-07-25,Did You Already Make This Years Top 6 Stock Mistakes?,Yahoo,"The S&P 500s total return is almost 9% this year — pretty impressive. But there have been plenty of ways to make some big mistakes, too."
2025-08-04,Enphase Energy Stock Outlook: Is Wall Street Bullish or Bearish?,Yahoo,"Enphase Energy has underperformed the broader market over the past year, and Wall Street analysts remain hesitant about its long-term growth outlook amid ongoing market and regulatory headwinds."
2025-08-05,Residential Solar Industry Looks to Cut Costs as End to Tax Credits Looms,Yahoo,"With President Trump’s tax law putting an early end to solar tax credits, the residential solar industry is now looking to lower prices, particularly by cutting sky-high sales and marketing costs, according to companies and analysts."
2025-08-05,Enphase Energy Announces New Safe Harbor Agreement,Yahoo,"FREMONT, Calif., Aug. 05, 2025 (GLOBE NEWSWIRE) -- Enphase Energy, Inc. (NASDAQ: ENPH), a global energy technology company and the worlds leading supplier of microinverter-based solar and battery systems, today announced a new safe harbor agreement with a solar and battery financing company that offers third-party ownership (TPO) agreements to homeowners, including leases and power purchase agreements (PPAs). The safe harbor agreement covers Enphase’s U.S.-manufactured IQ8HC™ Microinverters (wi"
2025-08-06,Japan Gets a Trade Deal; Earnings Season Ramps Up,Yahoo,"The U.S. and Japan announced a big trade deal that lowers tariffs to just 15% on imports, and the team discusses earnings from General Motors, Intuitive Surgical, and Enphase Energy."
2025-08-11,"This Strategy Turned $1,000 Into $90 Million… Here Are 3 Stocks It Now Recommends",Yahoo,"Tom Yeung here with your Sunday Digest. Over the past several months, I’ve introduced several quantitative systems designed to help you compete with even the most advanced Wall Street algorithms. Some of these tools rely on seasonal effects… InvestorPlace - Stock Market News, Stock Advice & Trading Tips Others rely on price action… But all of them require fundamental research to confirm their results. There are simply too many real-world variables for algorithms to process alone, which is why hu"
2025-08-15,"Lennar, D.R. Horton, LGI Homes, Enphase, and EVgo Shares Plummet, What You Need To Know",Yahoo,"A number of stocks fell in the pre-market session after an unexpectedly sharp rise in wholesale inflation fueled concerns about rising costs and their impact on corporate profits. The primary catalyst was the July 2025 Producer Price Index (PPI), a measure of inflation at the wholesale level, which jumped 0.9% against forecasts of a 0.2% rise. This represents the most significant monthly increase in over three years, pointing to mounting cost pressures for manufacturers, with tariffs cited as a"
2025-08-16,Solar stocks surge after Treasury tightens clean energy tax credit rules,Yahoo,Investing.com -- Solar and renewable energy stocks rallied sharply Friday after the U.S. Treasury Department and IRS released new guidance on clean energy project construction requirements for tax credit qualification.
2025-08-20,$50 Million Safe Harbor Deal Bolsters Enphase’s Solar Growth Plans,Yahoo,"Enphase Energy Inc. (NASDAQ:ENPH) has signed a new safe harbor agreement with a solar and battery financing company, expected to generate about $50 million in revenue"
2025-08-20,Clean Energy ETFs Hit a 52-Week High: Heres Why,Yahoo,Clean energy ETFs like ICLN and CTEX surged to 52-week highs after U.S. tax credit guidance eased investor fears and fueled a solar stock rally.
2025-08-20,Micro-inverter Industry Set to Achieve $14.5 Billion Market Value by 2029,Yahoo,"Delray Beach, FL, Aug. 20, 2025 (GLOBE NEWSWIRE) -- According to the new market research report Micro-inverter Market by Offering, Communication Technology (Wired, Wireless), Type (Single Phase, Three Phase), Power Rating (Below 250 W, Between 250 & 500 W, Above 500 W), Connection Type, Sales Channel, Application - Global Forecast to 2029 The global Micro Inverter Industry Size is expected to be valued at USD 4.9 billion in 2024 and is projected to reach USD 14.5 billion by 2029; it is expecte"
2025-08-22,Why Enphase (ENPH) Stock Is Falling Today,Yahoo,"Shares of home energy technology company Enphase (NASDAQ:ENPH) fell 4.2% in the afternoon session after President Donald Trump announced his administration would not approve new solar or wind power projects, causing a sell-off in the renewable energy sector. The move came after President Donald Trump posted on his social media platform, Truth Social, that “We will not approve wind or farmer destroying Solar,” adding, “The days of stupidity are over in the USA!!!” This statement escalated his cam"
2025-08-22,"Enphase Energy: Bear Case Weakens, Why Im Upgrading To Hold",SeekingAlpha,"With valuation no longer excessive and weak growth, forward metrics suggest the market will keep Enphase in the penalty box until growth improves. Learn more on ENPH stock here."
2025-08-23,S&P 500 Gains and Losses Today: Index Surges as Expectations of a Rate Cut Climb,Yahoo,"The S&P 500 rose 1.5% on Friday, Aug. 22, 2025, as Federal Reserve Chair Jerome Powell said the central bank could begin trimming interest rates as soon as next month."
2025-08-23,US Equity Indexes Jump as Powells Jackson Hole Speech Sends September Rate-Cut Bets Sharply Higher,Yahoo,US equity indexes soared as bets favoring monetary policy easing in September rose after a potential
2025-08-26,ENPH or SEDG: Which Stock Shines Brighter in the Solar Energy Market?,Yahoo,"Enphase Energy and SolarEdge showcase growth, new products and challenges as investors weigh opportunities in the solar energy market."
2025-09-02,"Enphase Energy Introduces Next-Generation Battery System For Smarter, Simpler Home Power",Yahoo,"Enphase Energy Inc. (NASDAQ:ENPH) is among the 11 Best Green Stocks to Buy According to Hedge Funds. Enphase Energy Inc. (NASDAQ:ENPH) has launched its fourth-generation Enphase® Energy System, which includes the IQ® Battery 10C, IQ® Meter Collar, and IQ® Combiner 6C. Shipments of the system are now in progress and promise greater energy density, simpler […]"
2025-09-06,"AppLovin, Robinhood To Join S&P 500. The Stocks Are Jumping.",Yahoo,"AppLovin and Robinhood will join the S&P 500 index before the open on Sept. 22, S&P Global said. APP stock and HOOD jumped in late trading."
2025-09-06,"Robinhood, AppLovin Additions Lead S&P 500 Index Changes",Yahoo,Three companies will be joining the S&P 500 later this month.
2025-09-08,"Robinhood, AppLovin, and Emcor Stocks Trade Higher on News of S&P 500 Inclusion",Yahoo,"Robinhood Markets, AppLovin, and Emcor Group shares gained on word they will be added to the S&P 500 prior to the start of trading Sept. 22."
2025-09-08,"Trending tickers: Robinhood, Tesla, Alibaba, BP and Marks & Spencer",Yahoo,The latest investor updates on stocks that are trending on Monday.
2025-09-09,"Robinhood (HOOD) Stock Trades Up, Here Is Why",Yahoo,Shares of financial services company Robinhood (NASDAQ:HOOD) jumped 13.9% in the morning session after S&P Dow Jones Indices announced the company will be added to the benchmark S&P 500 index.
2025-09-09,Enphase Energy (ENPH) Stock Drops Despite Market Gains: Important Facts to Note,Yahoo,"In the latest trading session, Enphase Energy (ENPH) closed at $38.81, marking a -2.12% move from the previous day."
2025-09-09,Why Is AppLovin (APP) Stock Rocketing Higher Today,Yahoo,Shares of mobile app technology company AppLovin (NASDAQ:APP) jumped 11.3% in the morning session after S&P Dow Jones Indices announced on Friday that the company will be added to the benchmark S&P 500 index.
2025-09-09,Enphase Energy Unveils New IQ Bidirectional EV Charger Architecture for Home Backup and Grid Services,Yahoo,"FREMONT, Calif., Sept. 09, 2025 (GLOBE NEWSWIRE) -- Enphase Energy, Inc. (NASDAQ: ENPH), a global energy technology company and the worlds leading supplier of microinverter-based solar and battery systems, today unveiled its new IQ® Bidirectional EV Charger architecture for vehicle-to-home (V2H) and vehicle-to-grid (V2G) capability. The charger connects to the direct current (DC) port of the electric vehicle (EV) and lets homeowners charge their EV, power their home seamlessly during outages, a"
2025-09-09,Why SolarEdge (SEDG) Shares Are Plunging Today,Yahoo,"Shares of solar power systems company SolarEdge (NASDAQ:SEDG) fell 5.8% in the morning session after key competitor Enphase Energy (ENPH) announced the U.S. launch of a new, technologically advanced microinverter for the commercial solar market."
2025-09-09,Top Midday Stories: PNC Acquires FirstBank for $4.10 Billion; EchoStar Sells Spectrum Licenses to SpaceX for $17 Billion,Yahoo,"All three major US stock indexes were up in late-morning trading Monday, as investors looked ahead t"
2025-09-18,"Enphase Energy Boosts Solargraf with New TPO Partner Integrations, Faster Proposals, Availability in Japan, and NREL Validation",Yahoo,"FREMONT, Calif., Sept. 18, 2025 (GLOBE NEWSWIRE) -- Enphase Energy, Inc. (NASDAQ: ENPH), a global energy technology company and the worlds leading supplier of microinverter-based solar and battery systems, today announced enhancements to its Solargraf® platform with new third-party ownership (TPO) financing integrations, faster proposals, and availability in Japan. Solargraf is an all-in-one digital proposal, design, and permitting tool that enables solar installers to create, manage, and close"
2025-09-19,3 Reasons to Sell ENPH and 1 Stock to Buy Instead,Yahoo,Shareholders of Enphase would probably like to forget the past six months even happened. The stock dropped 38.5% and now trades at $38.31. This was partly driven by its softer quarterly results and might have investors contemplating their next move.
2025-09-24,"Enphase (ENPH) Stock Trades Down, Here Is Why",Yahoo,"Shares of home energy technology company Enphase (NASDAQ:ENPH) fell 2.9% in the afternoon session after an analyst at GLJ Research maintained a Sell rating on the stock, even while raising the price target. The analyst, Gordon Johnson, held firm on his negative outlook for the solar technology company. Although the price target was lifted to $23.49 from a previous $19.80, the reiterated Sell rating signaled continued skepticism about the stocks future performance. This analyst action appear"
2025-09-29,Is Enphase Energys (ENPH) Global Software Bet Redefining Its Edge in a Crowded Market?,Yahoo,"In September 2025, Enphase Energy was added to both the S&P 1000 and Russell Small Cap Comp Growth Index, following enhancements to its Solargraf platform, including new financing integrations and international expansion. Independent validation from the National Renewable Energy Laboratory and Solargrafs launch in Japan underscore Enphases push for global market relevance and digital innovation. Well explore how Enphases Solargraf platform enhancements shape the companys investment..."
2025-10-01,1 Profitable Stock with Exciting Potential and 2 We Find Risky,Yahoo,"Even if a company is profitable, it doesn’t always mean it’s a great investment. Some struggle to maintain growth, face looming threats, or fail to reinvest wisely, limiting their future potential."
2025-10-01,Enphase Energy (ENPH) Stock Drops Despite Market Gains: Important Facts to Note,Yahoo,"The latest trading day saw Enphase Energy (ENPH) settling at $35.39, representing a -1.91% change from its previous close."
2025-10-02,Enphase Energy Announces Collaboration with Essent in the Netherlands,Yahoo,"FREMONT, Calif., Oct. 02, 2025 (GLOBE NEWSWIRE) -- Enphase Energy, Inc. (NASDAQ: ENPH), a global energy technology company and the worlds leading supplier of microinverter-based solar and battery systems, today announced a collaboration with Essent, one of the largest residential energy providers in the Netherlands. The collaboration enables eligible Enphase customers with solar to expand their systems with IQ® Batteries and participate in Essent’s Smart Steering program, designed to help house"
2025-10-02,"Jefferies Raises Its Price Target for Enphase Energy Inc. (ENPH) to $41.00, Maintains Hold Rating",Yahoo,"Enphase Energy Inc. (NASDAQ:ENPH) is one of the 10 Most Promising Green Stocks According to Wall Street Analysts, supported by hedge fund interest and analyst-rated potential. On September 29, 2025, Jefferies raised its price target for Enphase Energy Inc. (NASDAQ:ENPH) from $36 to $41, keeping its Hold rating due to the company’s strengthening forecast for […]"
2025-10-03,Is Enphase Ready for a Turnaround After Q1 Earnings and Recent Stock Rebound?,Yahoo,"If you own or are eyeing shares in Enphase Energy, you probably know what it feels like to ride a roller coaster. The stock has tracked a path that has left investors alternately hopeful and cautious, with the past year showing a -64.4% slide, and the five-year picture still deeply in the red at -65.4%. Yet, more recently, there have been small signs of life, with a 3.4% gain over the past week and a modest 1.8% climb in the last month. It is enough to make any investor ask: is now the right..."
2025-10-06,"Enphase Energy Launches IQ Battery 5P with FlexPhase in India, Enabling Single-Phase and Three-Phase Backup for Homes and Small Businesses",Yahoo,"FREMONT, Calif., Oct. 06, 2025 (GLOBE NEWSWIRE) -- Enphase Energy, Inc. (NASDAQ: ENPH), a global energy technology company and the worlds leading supplier of microinverter-based solar and battery systems, today announced the launch of the IQ® Battery 5P™ with FlexPhase for customers in India. The system provides reliable backup power and supports both single-phase and three-phase applications, serving India’s growing residential and small commercial solar markets. Three-phase service is widely"
2025-10-07,Enphase: Risk Growing As Tesla May Control The U.S. Solar Market By 2030,SeekingAlpha,"Enphase faces challenges from rising rates, policy shifts, and Teslaâs dominance in solar tech. Click here to read an analysis of ENPH stock now."
2025-10-07,Enphase: More Pain In 2026 - Structural Risks Remain,SeekingAlpha,"ENPH faces significant headwinds from U.S. policy changes, including the accelerated phasing out of key renewable tax credits starting in 2026. Read why ENPH is a Hold."
2025-10-07,Enphase Energy Announces Conference Call to Review Third Quarter 2025 Financial Results,Yahoo,"Tuesday, Oct. 28, 2025 at 4:30 p.m. Eastern TimeFREMONT, Calif., Oct. 07, 2025 (GLOBE NEWSWIRE) -- Enphase Energy, Inc. (NASDAQ: ENPH), a global energy technology company and the worlds leading supplier of microinverter-based solar and battery systems, announced today that it will host a conference call and webcast on Tuesday, Oct. 28, 2025 at 4:30 p.m. Eastern Time to discuss its third quarter 2025 financial results for the period ended Sept. 30, 2025. The live webcast can be accessed on the E"
2025-10-10,Enphase Expands Smart Energy Management to Water Heaters in Europe,Yahoo,"Enphase Energy extends its IQ® Energy Management platform to include electric water heaters in Belgium, the Netherlands, and Switzerland."
2025-10-10,Why the Market Dipped But Enphase Energy (ENPH) Gained Today,Yahoo,"The latest trading day saw Enphase Energy (ENPH) settling at $36.71, representing a +1.89% change from its previous close."
2025-10-11,"Stanley Black & Decker, Enphase, and EVgo Shares Are Falling, What You Need To Know",Yahoo,A number of stocks fell in the afternoon session after the U.S. threatened to impose massive increases to tariffs on China in response to new export controls from Beijing.
