date,headline,source,summary
2024-10-18,VTI: Navigate Rate Cuts And Election Uncertainty With Broad Market Exposure,SeekingAlpha,"Read more on the historical trends in equity markets and bonds during election months, post-Fed rate cuts, and cutting cycles without a recession."
2024-10-18,"Zacks Investment Ideas feature highlights: include FTAI Aviation, Vistra Energy, Nvidia, Vertiv and Meta Platforms",Yahoo,"FTAI Aviation, Vistra Energy, Nvidia, Vertiv and Meta Platforms are part of the Zacks Investment Ideas article."
2024-10-18,"Jim Cramer on Meta Platforms, Inc. (META): ‘How Can You Have A Bull Birthday Party Without Inviting Meta?’",Yahoo,"We recently compiled a list of the Jim Cramer’s Best Performers List: 12 Stocks Cramer is Talking About. In this article, we are going to take a look at where Meta Platforms, Inc. (NASDAQ:META) stands against the other best performers on Jim Cramer’s list. On a recent episode of Mad Money, Jim Cramer took a moment […]"
2024-10-19,Meta releases AI model that can check other AI models work,Yahoo,"Facebook owner Meta said on Friday it was releasing a batch of new AI models from its research division, including a Self-Taught Evaluator that may offer a path toward less human involvement in the AI development process.  The release follows Metas introduction of the tool in an August paper, which detailed how it relies upon the same chain of thought technique used by OpenAIs recently released o1 models to get it to make reliable judgments about models responses.  Metas researchers used entirely AI-generated data to train the evaluator model, eliminating human input at that stage as well."
2024-10-19,What’re Zucks’ Bucks Good For?,Yahoo,In this edition of Weekend: the tech underdogs trying to elect Kamala and outfox elon; best new business and tech podcasts; and dismal Zuck bucks.
2024-10-19,Nvidia to be the first company to hit $4T market cap: Lumida CEO,Yahoo,"As the AI race heats up, Ram Ahluwalia, Lumida Wealth Management CEO, joins Catalysts to discuss how the competition may weigh on Nvidia (NVDA). I think were still in the early innings for Nvidia. Nvidia clearly is capturing the bulk of the value capture in the sector and industry, Ahluwalia tells Yahoo Finance. He expects Nvidia stock to hit $150 by the end of 2024, especially as hyperscalers intend to spend between $50-$100 billion on GPU compute. Ahluwalia believes theres no question about Nvidia being the first company to reach a $4 trillion valuation. He argues, We made a call earlier this year that Nvidia would be the most valuable company in the world. It achieved that milestone yesterday, and the demand for GPU chips is strong. And youre seeing enterprises start to get some ROI (return on investment) on it from the early adopters — Metas (META) seen ROI on their CapEx (capital expenditures) spend. So, we think Nvidias got plenty of room to grow from here. Of the Magnificent Seven players, he sees Nvidia as the AI winner alongside Alphabets Google (GOOG, GOOGL) and Meta. To watch more expert insights and analysis on the latest market action, check out more Catalysts here. This post was written by Melanie Riehl"
2024-10-19,"Meet the Unstoppable Stock That Could Join Apple, Nvidia, Microsoft, Alphabet, Amazon, Meta, and Taiwan Semiconductor Manufacturing in the $1 Trillion Club by 2035",Yahoo,Consistently strong growth and incremental opportunities could push this tech titan to new heights.
2024-10-20,Reddit Q3 Preview: Licensing The Next Growth Catalyst After Ads,SeekingAlpha,Reddits Q2 FY24 Daily Active Uniques reached an all-time high of 91.2M. Learn more about RDDT stock and what makes it a Buy.
2024-10-20,"The Best Stocks to Invest $1,000 in Right Now",Yahoo,These stocks fit most budgets and have tremendous long-term upside from current prices.
2024-10-21,2 ETFs That Billionaire Ken Griffin Is Buying Hand Over Fist,Yahoo,The billionaire hedge fund manager cant seem to get enough of these ETFs.
2024-10-21,Italy moves to ensure Big Tech share in costs of telecom networks rollout,Finnhub,"Italy is moving to introduce measures aimed at ensuring that Big Tech firms share the cost of developing telecoms infrastructure in the country, Industry Minister Adolfo Urso said on Monday. ..."
2024-10-21,FEPI: An Efficient Way To Utilize A Covered Call Fund,SeekingAlpha,"FEPIs strategy involves owning underlying tech assets and implementing out-of-the-money options, which allows for some capital appreciation. Read more here."
2024-10-21,Baron Opportunity Fund Q3 2024 Shareholder Letter,SeekingAlpha,"During Q3 2024, Baron Opportunity Fund rose 4.04% (Inst) outperforming the Russell 3000 Growth Index . Click here to read the full fund letter."
2024-10-21,Generative AIs Chartreuse Adoption Moment,SeekingAlpha,Generative AI is driving significant investment and is thought to become a pervasive technology. Read more to see my thoughts.
2024-10-22,The case for a Magnificent 7 resurgence: Morning Brief,Yahoo,"While a broadening of the stock market rally has led the S&P 500 toward record highs, further earnings dominance could favor the Magnificent Seven tech stocks into the end of the year."
2024-10-22,Meta Platforms : Testing New Ways to Combat Scams and Help Restore Access to Compromised Accounts,Finnhub,"Meta Testing New Ways to Combat Scams and Help Restore Access to Compromised Accounts October 21, 2024October 21, 2024 Takeaways ..."
2024-10-22,"Meta Platforms Likely to Deliver Q3 Beat, BofA Says",Yahoo,"Meta Platforms Likely to Deliver Q3 Beat, BofA Says"
2024-10-22,"Got $1,000 to Invest? This Magnificent Seven Stock Is a Great Option Heading Into 2025",Yahoo,The wide range of products and services Microsoft offers means its business faces fewer risks than other big tech companies.
2024-10-22,Facebook owner Meta restarts facial recognition tech in celeb-bait crackdown,Yahoo,"Three years after Meta shut down facial recognition software on Facebook amid a groundswell of privacy and regulator pushback, the social media giant said on Tuesday it is testing the service again as part of a crackdown on celeb bait scams.  Meta said it will enroll about 50,000 public figures in a trial which involves automatically comparing their Facebook profile photos with images used in suspected scam advertisements.  If the images match and Meta believes the ads are scams, it will block them."
2024-10-23,"Facebook should keep up satirical Harris-Walz nipple-pinching post, oversight board says",Finnhub,Meta Platforms Oversight Board on Wednesday told the company to keep up a Facebook post superimposing the faces of U.S. Democratic presidential candidate Kamala Harris and her running mate Tim Walz...
2024-10-23,Meta Tests Facial Recognition to Combat Scams and Help Restore Account Access,Yahoo,"After verification, Meta claims to encrypt and delete all facial data to protect users privacy"
2024-10-24,3 Fantastic Tech Stocks to Buy Before 2024 Is Over,Yahoo,"CrowdStrike, Meta Platforms, and dLocal look like winning investments for 2025."
2024-10-24,Rewey Asset Management Q3 2024 Investment Letter,SeekingAlpha,"Our RAM Smid Composites 9.83% rise in 3Q24 and 18.53% year-to-date, outperformed our benchmark, the Russell 2500 Value index, which gained 9.63% in 3Q24 and up 11.27% YTD."
2024-10-24,Reflecting On Social Networking Stocks’ Q2 Earnings: Meta (NASDAQ:META),Yahoo,Let’s dig into the relative performance of Meta (NASDAQ:META) and its peers as we unravel the now-completed Q2 social networking earnings season.
2024-10-24,LinkedIn Fined More Than $300 Million in Ireland Over Personal Data Processing,Yahoo,"Ireland’s data-protection watchdog fined LinkedIn 310 million euros ($334.3 million), saying the Microsoft-owned career platform’s personal-data processing breached strict European Union data-privacy and security legislation.  The Irish Data Protection Commission in 2018 launched a probe into LinkedIn’s processing of users’ personal data for behavioral analysis and targeted advertising after its French equivalent flagged a complaint it received from a non-profit organization.  Irish officials raised concerns on the lawfulness, fairness and transparency of the practice, saying Thursday that LinkedIn was in breach of the EU’s General Data Protection Regulation."
2024-10-25,"Market Chatter: Meta, Reuters Enter AI Deal for News",Yahoo,"Market Chatter: Meta, Reuters Enter AI Deal for News"
2024-10-25,Meta Platforms (META) Q3 Earnings on the Horizon: Analysts Insights on Key Performance Measures,Yahoo,"Beyond analysts top -and-bottom-line estimates for Meta Platforms (META), evaluate projections for some of its key metrics to gain a better insight into how the business might have performed for the quarter ended September 2024."
2024-10-25,"Five Stocks, 3 Days, $12 Trillion In Market Cap. Buckle Up For Huge Earnings.",Yahoo,"Apple, Microsoft, Google, Amazon and Meta Platforms all report next week. The S&P 500 giants have a combined market cap of $12 trillion, but the impact is even greater."
2024-10-26,"Between Mag 7 earnings and jobs data, next week is the Super Bowl for investors",Yahoo,"Horizon Investments head of portfolio strategy Zachary Hill joins Julie Hyman and Josh Schafer on Market Domination to break down what investors need to know with Big Tech earnings and fresh economic data on deck in the final week before the US presidential election. “The next two weeks are like the Super Bowl for investors, just one after another, after another,” Hill tells Yahoo Finance. Next week, five of the “Magnificent Seven” names — Alphabet (GOOG, GOOGL), Microsoft (MSFT), Amazon (AMZN), Meta Platforms (META), Apple (AAPL) — are reporting quarterly earnings. “Thats obviously a huge deal, not just for the Nasdaq (^IXIC) and related indexes, but also for the S&P 500 (^GSPC),” the strategist says, noting that the results could feed the “debate back and forth between, are we going to get a more cyclical kind of rebound because the economy is stronger or more of that kind of defensive growth trade that weve seen really over the last 18 months.” On top of continued third quarter earnings results, the market will also get new data that could provide insight into the state of the US economy and the Federal Reserve’s next move at the November meeting. The Bureau of Labor Statistics will release the Job Openings and Labor Turnover Survey (JOLTS) on Tuesday with fresh non-farm payroll data on Friday, November 1. Investors will also get the first cut of the US Gross Domestic Product (GDP) for the third quarter of 2024 on Wednesday. Amid uncertainties, Hill says he does expect markets to go higher. “Theres a lot of reasons to worry,” like rates staying higher for longer and the election, among other factors, but “really when we cut through a lot of that noise, we focus on the primarily on the health of the underlying economy, because thats going to drive earnings and ultimately thats going to dictate the path for risk assets. We still see that, broadly speaking, as being something thats thats very supportive.” To watch more expert insights and analysis on the latest market action, check out more Market Domination here. This post was written by Naomi Buchanan."
2024-10-26,"Meta Platforms, Apple, Amazon Headline Pivotal Week Of High-Profile Earnings Reports",Yahoo,"Besides Meta Platforms, other top performers are on the earnings calendar, including DoorDash, SharkNinja, Royal Caribbean and PayPal."
2024-10-26,"3 Must-See Earnings Reports Next Week (GOOGL, META, AAPL)",Yahoo,"Apple, Alphabet and Meta Platforms report earnings next week and the results will have broad implications for the market"
2024-10-30,"Jim Cramer on Meta Platforms, Inc. (META): ‘The Whole Ad Market Seems To Be Going Their Way’",Yahoo,"We recently compiled a list of the Jim Cramer’s Latest Game Plan: 20 Stocks to Watch. In this article, we are going to take a look at where Meta Platforms, Inc. (NASDAQ:META) stands against the other stocks featured in Jim Cramer’s latest game plan. Jim Cramer, the host of Mad Money, recently advised investors to maintain […]"
2024-10-30,"Stock Market Today: Stocks higher on Google boost; Meta, Microsoft on deck",Yahoo,"The first of a five megacap tech earnings delivered for Wall Street, with Alphabet shares driving early gains ahead of updates from Meta and Microsoft."
2024-10-30,"Tech Earnings Have Begun With Google, AMD and More. Here Are 3 Early Takeaways.",MarketWatch,"Tech Earnings Have Begun With Google, AMD and More. Here Are 3 Early Takeaways."
2024-10-30,Google Gets No Respect From Wall Street: Still The Best Buy In Tech,SeekingAlpha,Google trades for a lower P/E than the market but has superior and long-lasting earnings growth. Learn why GOOG stock is a Buy.
2024-10-30,Googles Strong Q3 Earnings: What It Means For Your Portfolio Strategy,SeekingAlpha,"Google has shown strong Q3 2024 earnings results, announcing EPS of $2.12, up 37% vs. the same quarter of the previous year. Find out why GOOG stock is a Strong Buy."
2024-10-30,"Microsoft, Meta to Feel AI Scrutiny as Investors Wait for Payoff",Yahoo,(Bloomberg) -- Ever-growing scrutiny from investors over when the billions spent on artificial intelligence will flow through to sales and profit is set to dominate when Microsoft Corp. and Meta Platforms Inc. report earnings later Wednesday. Most Read from BloombergNY Transit Agency Takes Next Step on Brooklyn-Queens Rail LinkThere Will Soon Be No Meatpackers Left in NYC’s Historic Meatpacking DistrictA South Korean City Plays Matchmaker to Tackle a Fertility CrisisInside NYC’s Playbook for Get
2024-10-31,"Nvidia Stock Falls. Why Meta, Microsoft Earnings Are Giving Investors a Halloween Fright.",Yahoo,Investors are fretting about how long the AI boom can last after the Big Tech companies forecast that their capital spending will carry on rising.
2024-10-31,"Google Pops On Great Results, The Prospect Of Cloud Growth",SeekingAlpha,Ongoing improvements in Alphabet Inc.s cloud services have led to a surge in revenue and earnings. Click here to read my GOOG Q3 earnings update.
2024-10-31,"Meta Earnings Beat Expectations, But Stock Slips As Facebook Parent Ramps AI Spending",Yahoo,Meta stock was trading lower late Wednesday after the Facebook parent reported Q3 earnings ahead of views.
2024-10-31,Meta Platforms Inc. stock underperforms Thursday when compared to competitors,MarketWatch,Meta Platforms Inc. stock underperforms Thursday when compared to competitors
2024-10-31,Meta Platforms : Reports Third Quarter 2024 Results Form 8 K,Finnhub,"Meta Reports Third Quarter 2024 Results MENLO PARK, Calif. - October 30, 2024 - Meta Platforms, Inc. today reported financial results for the quarter ended September..."
2024-10-31,"Meta Platforms, Inc. (META) Q3 2024 Earnings Call Transcript",SeekingAlpha,"Meta Platforms, Inc. (NASDAQ:META) Q3 2024 Earnings Call Transcript October 30, 2024 5:00 PM ETCompany ParticipantsKenneth Dorell - Director of IRMark..."
2024-10-31,Meta and Microsoft: AI’s Spending Champs Won’t Be Tapping the Brakes,DowJones,Meta and Microsoft: AI’s Spending Champs Won’t Be Tapping the Brakes
2024-10-31,Meta Platforms (META) Q3 Earnings: Taking a Look at Key Metrics Versus Estimates,Yahoo,"While the top- and bottom-line numbers for Meta Platforms (META) give a sense of how the business performed in the quarter ended September 2024, it could be worth looking at how some of its key metrics compare to Wall Street estimates and year-ago values."
2024-10-31,"Big Tech: Microsoft, Meta beat forecasts, but Samsung stumbles",Finnhub,"STORY: AI is in focus as the worlds top tech names report earnings. Wednesday saw Microsoft and Meta both beat forecasts, but also give investors cause for concern. The..."
2024-10-31,"Drone video shows cars, debris piled up in flooded Spanish town",Finnhub,"STORY: :: Drone video shows cars and debris piled up on a damaged railway track after floods in eastern Spain :: October 31, 2024 :: Chiva, Spain :: Marouan..."
2024-10-31,How Fraudsters Are Using TikTok to Spread Online Scams,Yahoo,"Viral life hacks are morphing into large-scale fraud like the TikTok ‘infinite money’ scam. Plus, Facebook users are watching more videos, thanks to AI."
2024-10-31,How To Earn $500 A Month From Meta Stock Ahead Of Quarterly Earnings (NASDAQ:META),Yahoo,"Meta Platforms, Inc. (NASDAQ:META) will release its third-quarter earnings results after the closing bell on Wednesday. Wall Street expects Meta to report quarterly earnings at $5.25 per share on revenue of $40.29 billion, according to data from ..."
2024-11-01,Nvidia stock sinks on fears of AI spending slowdown,Yahoo,Nvidia stock fell nearly 5% Thursday amid a widespread decline among chipmakers.
2024-11-01,"Nasdaq, S&P 500 sell off ahead of Amazon, Apple earnings",Yahoo,"The tech-heavy Nasdaq Composite (^IXIC) closed Thursday over 2.7% lower, the S&P 500 (^GSPC) not too far behind with a session loss of 1.86%. Tech sector worries seem to have been revived coming off Meta Platforms (META) and Microsofts (MSFT) latest earnings print and ahead of Amazon (AMZN) and Apples (AAPL) results due out after the close. Yahoo Finance markets and data editor Jared Blikre joins Alexandra Canal and Josh Schafer on Market Domination Overtime to examine bond market trends (^TYX, ^TNX, ^FVX) and losses from Magnificent Seven tech leaders. To watch more expert insights and analysis on the latest market action, check out more Market Domination Overtime here. This post was written by Luke Carberry Mogan."
2024-11-01,Exclusive-Chinese researchers develop AI model for military use on back of Metas Llama,Finnhub,"Top Chinese research institutions linked to the Peoples Liberation Army have used Metas publicly available Llama model to develop an AI tool for potential military applications, according to..."
2024-11-01,"The Zacks Analyst Blog Meta, Apple, Alphabet and Amazon",Yahoo,"Meta, Apple, Alphabet and Amazon are included in this Analyst Blog."
2024-11-01,Trump Media Stock Drops. How DJT’s Wild Week Looks as the Election Nears.,MarketWatch,Trump Media Stock Drops. How DJT’s Wild Week Looks as the Election Nears.
2024-11-01,Tech Stocks: Staying Ahead Of The Curve,SeekingAlpha,What happens when growth numbers for tech names start coming down? Joe Albano and Victor Dergunov dissect recent news and how the Presidential election will affect the sector.
2024-11-04,Can Meta Really Avoid Political Content?,Yahoo,Metas anti-politics stance may not be sustainable long-term.
2024-11-04,2 Trillion-Dollar Artificial Intelligence (AI) Stocks to Buy and Hold Forever,Yahoo,Large companies can still deliver excellent results.
2024-11-04,Meta’s Developing a New AI System to Detect Teens Lying About Their Age,Yahoo,The system will use advanced measures to determine user age.
2024-11-04,Is Meta Platforms (META) a Buy as Wall Street Analysts Look Optimistic?,Yahoo,"According to the average brokerage recommendation (ABR), one should invest in Meta Platforms (META). It is debatable whether this highly sought-after metric is effective because Wall Street analysts recommendations tend to be overly optimistic. Would it be worth investing in the stock?"
2024-11-04,IUSG: Growth ETF Underperforming Its Peers,SeekingAlpha,Learn about the iShares Core S&P U.S. Growth ETF (IUSG) with a concentrated tech portfolio and performance compared to popular growth funds.
2024-11-04,Meta Platforms : Open Source AI Can Help America Lead in AI and Strengthen Global Security,Finnhub,"Meta Open Source AI Can Help America Lead in AI and Strengthen Global Security November 4, 2024November 4, 2024 By Nick Clegg, President of Global..."
2024-11-05,Better Social Media Stock: Trump Media vs. Rumble,Yahoo,Which of these niche social media companies has a brighter future?
2024-11-05,Commentary: Trump has billions riding on whether he wins,Yahoo,"Trump is the ultimate election whale, with as much as $5.7 billion riding on whether he wins or not."
2024-11-05,How election misinformation thrived online during the 2024 presidential race—and will likely continue in the days to come,Yahoo,"The volume and methods for disinformation campaigns have grown since 2020, with a rise in bot accounts and deepfakes on social media."
2024-11-05,Amazons a company investors can put money to work in: Analyst,Yahoo,"Big tech companies, including Amazon (AMZN), Meta Platforms (META), and Alphabet (GOOG, GOOGL), posted solid third earnings this season. Despite the strong showings, capital expenditures (CapEx) on artificial intelligence (AI) are spooking some investors. Bernstein internet equity research analyst Mark Shmulik tells Yahoo Finance that Amazon feels like kind of the name that you can put money to work in and get excited about. Alphabet also reported a positive third quarter, but Shmulik notes ongoing legal issues — especially in the antitrust arena — for Google that could hold the company back: Theres just a whole bunch of noise around the name thats really hard to break through. In terms of Meta, Shmulik also thinks the socail media giant is positioned well, but that when it comes to AI spending, were still waiting to see just how big that spending is going to be and over what duration we could expect the return. Shmulik goes on to explain his Underpeform rating on Reddit (RDDT). Watch the video above to hear Shmuliks take on big tech and other internet stocks. To watch more expert insights and analysis on the latest market action, check out more Market Domination here. This post was written by Daniel A. Nelson"
2024-11-06,Big Tech stocks rally as Magnificent Seven adds more than $440 billion in market value,MarketWatch,Big Tech stocks rally as Magnificent Seven adds more than $440 billion in market value
2024-11-08,"Find The Next Palantir, Nvidia And Hot IPO With This Customizable Tool",Yahoo,Use the IBD Stock Screener to quickly filter through thousands of companies to find stocks that meet your criteria.
2024-11-09,Pinterest Sinks As Revenue Growth Underwhelms. Can Amazon And Google Help?,Yahoo,Pinterest stock sank after its sales guidance underwhelmed. Analysts remain bullish on Amazon and Google partnerships.
2024-11-10,This Magnificent Artificial Intelligence (AI) Stock Could Hit a $2 Trillion Valuation in the Next 3 Years,Yahoo,The growing adoption of AI in the digital ad market should help this social media giant deliver robust earnings growth and stock upside over the next three years.
2024-11-11,"If You Only Own the Vanguard S&P 500 ETF, Youre Missing Out on This Incredible Artificial Intelligence (AI) Semiconductor Stock",Yahoo,Its not too late to add this foundational AI leader to your portfolio.
2024-11-12,Trump 1.0 was as tough on M&A as Biden. Trump 2.0 may not be different.,Yahoo,The business world is expecting M&A to loosen up under President Donald Trump. It could be in for a surprise — if history is any guide.
2024-11-13,"Jim Cramer on Meta Platforms, Inc. (META): ‘You Should Think More About The Fundamentals Now, Which Are Fabulous’",Yahoo,"We recently compiled a list of the Jim Cramer Talked About These 16 Stocks. In this article, we are going to take a look at where Meta Platforms, Inc. (NASDAQ:META) stands against the other stocks Jim Cramer was talking about. Jim Cramer, host of Mad Money, shared his thoughts on the market’s reaction to the election […]"
2024-11-13,Pairing AI with our brains: Precision Neurosciences big bet,Yahoo,"Imagine being able to control a computer cursor with your mind. While it may sound like science fiction to many, major companies, like Meta (META) and Apple (AAPL) are investing in these technologies, and a handful of companies are working to make it a reality, including Precision Neuroscience. Co-founded by CEO Michael Mager and neurosurgeon and engineer Ben Rapoport, Precision Neuroscience began in 2021 with three former employees of Elon Musk’s Neuralink. Precision Neuroscience is developing its version of an implanted brain-computer interface (BCI) technology meant to help individuals with neurological disorders, such as ALS, to better function and communicate. Mager says Precision Neurosciences technology is high-bandwidth, sits on the surface of the brain without doing any damage, and is reversible.  In an interview with Yahoo Finance Senior Reporter Yasmin Khorram from the Yahoo Invest conference, Mager discusses the companys road ahead and potential market, what to expect from the upcoming Trump presidency, and a possible IPO. “We view brain computer interfaces as a generationally important life sciences innovation,” says Mager. “This is gonna have applicability today in paralysis, tomorrow in a number of different areas.” To see every interview from Yahoo Finance Invest, click here. This post was written by Luke Brooks."
2024-11-13,Top 10 Quant Stocks Of 2024: Up Over 120%,SeekingAlpha,"AI innovation, interest rate shifts, and political changes reshaped the investment landscape in 2024. Discover how our top stocks outperformed the market."
2024-11-14,APUE: This Sophisticated ETF Still Has To Prove Itself,SeekingAlpha,"ActivePassive U.S. Equity ETF, launched in 2023, blends active and passive management in a broad stock market universe. Click here to read my analysis of APUE."
2024-11-14,My Single Biggest Regret As An Investor,SeekingAlpha,Cyclical and stalwart dividend stocks are best for those pursuing outsized total returns through a capital recycling strategy. Read an analysis here.
2024-11-15,"Trump’s trade war could hit Britain, warns Bank of England ratesetter",Yahoo,A Bank of England rate-setter has warned that Donald Trump’s trade war could hit growth and push up consumer prices in the UK.
2024-11-15,Vertiv Stock Is Up 150%. Next Week Could Bring More Gains.,MarketWatch,Vertiv Stock Is Up 150%. Next Week Could Bring More Gains.
