date,headline,source,summary
2025-07-08,Snowflake Stock Rides on Cortex AI Adoption: Can the Growth Continue?,Yahoo,"SNOWs Cortex is now a key growth engine, powering a 26% product revenue gain amid broader AI application demand."
2025-07-10,Meta Poached Apple’s Pang With Pay Package Over $200 Million,Yahoo,(Bloomberg) -- Meta Platforms Inc. has made unusually high compensation offers to new members of its “superintelligence” team — including a more than $200 million package for a former Apple Inc. distinguished engineer.Most Read from BloombergSinger Akon’s Failed Futuristic City in Senegal Ends Up a $1 Billion ResortAre Tourists Ruining Europe? How Locals Are Pushing BackCan Americans Just Stop Building New Highways?Denver City Hall Takes a Page From NASAPhiladelphia Trash Piles Up as Garbage Wor
2025-07-10,Blok is using AI personas to simulate real-world app usage,Yahoo,"AI-powered coding tools like Cursor, Replit, Claude Code, and Lovable are helping developers write many lines of code every day to ship products faster. However, app makers still have to rely on either shipping full beta versions of their apps or using simulation software to gauge how upcoming features will work. Blok, a company that […]"
2025-07-10,Linda Yaccarino Ducks Out of X’s New Grok Era,Yahoo,"Just over two years after taking the job, X (formerly Twitter) CEO Linda Yaccarino on Wednesday announced she’d be stepping down from her role."
2025-07-10,EUs top court adviser sides with Italy in Meta Platforms dispute,Finnhub,EU member states have theright to impose their own measures to strengthen the position ofpublishers in their dealings with large online platforms as longas these do not undermine freedom of...
2025-07-10,The world’s 10 richest people: The wealthiest have $100 billion or more,Yahoo,Here are the world’s 10 richest people and some of their key investments.
2025-07-10,Nvidias $4 trillion milestone caps rise of stock market behemoth,Yahoo,"NEW YORK (Reuters) -The stunning rise of Nvidia Corp to become the first publicly traded company valued at $4 trillion underscores the massive importance to the stock market of the AI chipmaker and the technology sector.  Reaching the lofty milestone caps a massive run for Nvidias stock price, which has soared some 1,350% since October 2022.  The companys market value hit $4 trillion in morning trading on Wednesday, about 13 months after it had first reached the $3 trillion milestone."
2025-07-11,"Piper highlights Meta as best large-cap pick, lifts forecasts on AI strength",Yahoo,"Investing.com -- Piper Sandler analysts reiterated Meta (NASDAQ:META) as their top large-cap internet pick, citing improving digital ad trends and rising investor sentiment heading into second-quarter results."
2025-07-11,"xAI Launches Grok 4 Model, Which Has Achieved New Industry Benchmarks",Yahoo,xAIs latest model could be a big step up in AI development.
2025-07-13,Magnificent 7 check-in: Why these 3 names might not belong,Yahoo,"Spear Invest founder and chief investment officer Ivana Delevska joins BD8 Capital Partners CEO and chief investment officer Barbara Doran and Market Catalysts host Julie Hyman to check in on the Magnificent Seven, noting the growing dissimilarities between stock names. To watch more expert insights and analysis on the latest market action, check out more Market Catalysts here."
2025-07-14,"Meta investors, Zuckerberg to square off at $8 billion trial over alleged privacy violations",Yahoo,"WILMINGTON, Delaware (Reuters) -Mark Zuckerberg is expected to appear as a star witness in an unusual $8 billion trial that kicks off this week at which the Meta CEO is accused of operating Facebook as an illegal enterprise that allowed users data to be harvested without their consent.  Shareholders of Meta Platforms, the parent company of Facebook, Instagram and WhatsApp, sued Zuckerberg and other current and former company leaders, saying they continually violated a 2012 agreement between Facebook and the Federal Trade Commission to protect users data.  The case dates back to 2018, after it emerged that data from millions of Facebook users was accessed by Cambridge Analytica, a now-defunct political consulting firm that worked for Donald Trumps successful campaign for U.S. president in 2016."
2025-07-15,Jim Cramer Worries Meta’s Ray-Bans “May Hurt Duolingo’s Business”,Yahoo,"Duolingo, Inc. (NASDAQ:DUOL) is one of the stocks Jim Cramer shared his thoughts on. Referring to Cramer’s regard for subscription-based businesses, a caller asked about the company, and he replied: “You know, Duolingo had like a little bit of a hiccup, and people kind of freaked out. I agree with you. I think Duolingo is […]"
2025-07-15,"Meta’s AI Push Grows with PlayAI Deal, Instagram Engagement Hits New High",Yahoo,"Meta Platforms, Inc. (NASDAQ:META) is a Must-Watch AI Stock on Wall Street. On July 11, Citizens JMP analyst Andrew Boone reiterated a Market Outperform rating on the stock with a $750.00 price target. The firm is optimistic about Meta following information that Instagram’s global time spent growth accelerated in June, growing 11.9% year-over-year. This implies a […]"
2025-07-15,Trump’s China U-Turn Is a Win for Nvidia. Why Markets Must Be Wary.,MarketWatch,Trump’s China U-Turn Is a Win for Nvidia. Why Markets Must Be Wary.
2025-07-16,"Compelling Buys, Stellar Tech Moves With The Financial Prophet",SeekingAlpha,"Victor Dergunov, The Financial Prophet, on very interestingÂ market dynamics and stellar tech moves."
2025-07-18,Landlines less popular than Facebook for making phone calls,Yahoo,"Landlines have fallen behind both Facebook and WhatsApp as methods of making calls, as Britons increasingly shun traditional phones in favour of smartphone equivalents."
2025-07-18,Alphabet: This Threat Could Actually Be A Blessing,SeekingAlpha,"Alphabet Inc. is a Strong Buy, as Chromes dominance and Search & Cloud growth outweigh AI browser concerns and antitrust risks. Click for my GOOGL update."
2025-07-21,Tesla at a Crossroads: What to Watch in Q2 Earnings,Yahoo,"Tesla is at a crossroads as the company looks to diversify away from its legacy business into new businesses, such as the robotaxi business. Investors will gain valuable new insights when the company reports earnings on Wednesday evening."
2025-07-21,Why Nextdoor is having a founder-led re-founding moment,Yahoo,"Opening Bid Unfiltered is available on Apple Podcasts, Spotify, YouTube, or wherever you get your podcasts. Digital turnarounds take time, and are not guaranteed in a world where Google (GOOGL, GOOG) is dropping AI summaries on the web, Metas (META) Mark Zuckerberg is spending hundreds of millions of dollars to attract top AI talent, and OpenAI (OPAI.PVT) is upending how the very internet works. Still, many digital founders hope for the best when trying to bring a meandering platform back to life. Yahoo Finance Executive Editor Brian Sozzi discusses the Opening Bid Unfiltered podcast with Nextdoor (KIND) co-founder and CEO Nirav Tolia. Tolia co-founded Nextdoor in 2008 and led the company until 2018, when he reportedly left over a board disagreement regarding an acquisition. He returned to the company as CEO in May 2024, finding a social media platform struggling to grow, a weak product, and a sliding market cap. Tolia has since aimed to refocus the organization on the user experience, with initial signs of success in increasing weekly average users. But he concedes the turnaround has a long way to go, and investors are unsure what a complete turnaround will look like. Nextdoor’s market cap has dwindled from $4.3 billion during its SPAC IPO in 2021 to $636 million. Tolia dives deep into his turnaround strategy for Nextdoor, the decision to return as CEO, and what’s next for the digital platform. Listen on your favorite podcast platform or watch on our website for full episodes of Opening Bid Unfiltered. Langston Sessoms produces Yahoo Finances Opening Bid Unfiltered."
2025-07-21,"Trade Latest: Europe Braces for Higher Tariffs, China Magnet Exports Jump",Yahoo,"U.S. officials told European Union negotiators last week that further concessions are likely to be demanded to get a deal over the line, The Wall Street Journal reported Monday."
2025-07-21,"Exclusive-Meta, X and LinkedIn appeal unprecedented VAT claim by Italy",Yahoo,"MILAN (Reuters) -U.S. tech giants Meta, X and LinkedIn have lodged an appeal against an unprecedented VAT claim by Italy that could influence tax policy across the 27-nation European Union, four sources with direct knowledge of the matter said on Monday.  This is the first time that Italy has failed to reach a settlement agreement after bringing tax cases against tech companies, resulting in a fully-fledged judicial tax trial being launched.  Italian tax authorities argue that free user registrations with X, LinkedIn and Meta platforms should be seen as taxable transactions as they imply the exchange of a membership account in return for a users personal data."
2025-07-22,Enbridge to Proceed With US$900 Million Clear Fork Solar Facility in Texas,Yahoo,"Enbridge (ENB.TO) on Tuesday said it has reached a final investment decision on Clear Fork, a 600 MW"
2025-07-23,Amazon Buys a Wearables Company. Why It’s Joining Apple and Meta in the AI Hardware Race.,MarketWatch,Amazon Buys a Wearables Company. Why It’s Joining Apple and Meta in the AI Hardware Race.
2025-07-24,Here’s What Drives Meta Platforms’ (META) Growth,Yahoo,"Sands Capital, an investment management company, released its “Sands Capital Technology Innovators Fund” Q2 2025 investor letter. A copy of the letter can be downloaded here. Technology Innovators focus on pioneering businesses worldwide that serve as key drivers or beneficiaries of significant long-term changes driven by technology. The fund returned 26.0% (net) in the second […]"
2025-07-24,"Threads is Developing More DM Options, Including GIF Sharing and Group Chats",Yahoo,Threads is looking to quckly build out its DM option.
2025-07-24,4 Technology Stocks Poised to Beat Earnings Estimates in Q2,Yahoo,"Here, we have picked four technology stocks, META, LRCX, FLEX and STX, which are likely to pull off earnings surprises in second-quarter 2025."
2025-07-24,Warden Capital Q2 2025 Letter,SeekingAlpha,"Warden reflects on 2024 wins, AI mania, and CRE outlook, offering sharp insights for investors navigating uncertainty. Read on for key takeaways and trends."
2025-07-24,Will CoStars Earnings & Revenue Beat in Q2 Drive the Stock Price?,Yahoo,"CSGPs second-quarter 2025 results reflect solid top-line growth, led by robust performance in key segments."
2025-07-25,Cadence Set to Report Q2 Earnings: Whats in the Offing?,Yahoo,"Strong AI momentum and design demand may lift CDNS second-quarter results, with EPS and revenues both set to rise year over year."
2025-07-27,Data Science Course FAANG Interview Prep 2025 - Data Scientist Jobs at Google Amazon Meta Apple Netflix Updated,Yahoo,"Santa Clara, July 26, 2025 (GLOBE NEWSWIRE) -- In 2025, AI-driven data analytics is transforming industries by enabling real-time decision-making, predictive modeling, and automation. Companies like Google and SAS are leading this revolution with platforms like BigQuery and SAS Viya, which integrate AI to process complex data and support advanced analyses in real-time. This shift underscores the growing demand for professionals skilled in AI and data science, particularly in roles that require n"
2025-07-29,Should You Buy Meta Platforms Stock Before July 30? Wall Street Has a Clear Answer for Investors.,Yahoo,Most Wall Street analysts see upside in Meta Platforms stock ahead of the companys second-quarter earnings report.
2025-07-30,Wall Street Is Bullish on Meta Stock Ahead of Q2 Earnings. Should You Buy Shares Before July 30?,Yahoo,"With expanding user engagement, strengthening ad tools, and new revenue opportunities in AI, Meta is entering the second quarter in a strong position."
2025-07-30,"Dow Jones Futures: Market Rally Falls As Fed, Microsoft, Meta Loom; 7 Early Movers",Yahoo,The market rally reversed lower from highs heading into the Fed decision as well as earnings from Microsoft and Meta.
2025-07-31,"Metas hefty AI CapEx spend is already paying off, analyst says",Yahoo,"Its been a busy week for Big Tech. Not only did Microsoft (MSFT) and Meta (META) both beat big on earnings this quarter, but Microsoft officially reached a $4 trillion market cap. Additionally, Apple (AAPL) and Amazon (AMZN) are getting ready to report quarterly results on Thursday after the markets close. Jefferies senior analyst Brent Thill and Yahoo Finance Technology Editor Dan Howley join Market Catalysts with Julie Hyman to discuss Metas artificial intelligence (AI) capital expenditure (CapEx) spending and whether the numbers are showing a return on investment (ROI) yet. To watch more expert insights and analysis on the latest market action, check out more Market Catalysts."
2025-07-31,Zuckerberg says people without AI glasses will be at a disadvantage in the future,Yahoo,Mark Zuckerberg really believes AI glasses will be the ideal way to blend the physical and digital worlds together.
2025-07-31,"MICROSOFT AND META JOIN THE GLOBAL SIGNAL EXCHANGE AND THE COLLECTIVE GLOBAL FIGHTBACK AGAINST ONLINE SCAMS, FRAUD AND ABUSE",Yahoo,"The Global Signal Exchange (GSE), the worlds first global, multistakeholder and cross-sector clearing house for threat signals, today announces that Microsoft and Meta are joining as partners and data providers. Microsoft and Meta join more than 30 global leaders collaborating through GSE to tackle online scams, fraud and abuse with unprecedented pace, software capabilities and scale."
2025-08-01,Reddit Stock Rockets After Posting 78% Revenue Growth,DowJones,Reddit Stock Rockets After Posting 78% Revenue Growth
2025-08-01,Brokers Suggest Investing in Meta Platforms (META): Read This Before Placing a Bet,Yahoo,"The average brokerage recommendation (ABR) for Meta Platforms (META) is equivalent to a Buy. The overly optimistic recommendations of Wall Street analysts make the effectiveness of this highly sought-after metric questionable. So, is it worth buying the stock?"
2025-08-01,"Palantir, AMD, Shopify Headline Another Busy Week of Tech Earnings",Yahoo,"Expectations are high for Palantir stock, which continues to hold near all-time highs ahead of its Q2 earnings report."
2025-08-02,6 Stocks Im Buying As AI And Tariffs Battle For Market Dominance,SeekingAlpha,Are we in an AI bubble? And will it be AI or tariffs that determine the trajectory of the market going forward? Read about my investments during these uncertain times.
2025-08-02,Investing.com’s stocks of the week,Yahoo,"Investing.com -- Market sentiment soured in the latter part of the week, coming under significant pressure on Friday as investors digested the latest news, including signs of a weakening economy following the latest U.S. jobs numbers and President Trump’s updated tariffs."
2025-08-02,"3 Growth Stocks to Invest $1,000 in Right Now",Yahoo,These 3 growth-oriented companies are all great choices for investors.
2025-08-02,What Moved Markets This Week,SeekingAlpha,"Wall Street faced its worst week since May amid weak jobs data, trade tensions, and a hawkish Federal Reserve."
2025-08-04,"Innodata Trades 29% Below 52-Week High: Buy, Sell, or Hold the Stock? (Revised)",Yahoo,"INOD rides Gen AI momentum with major Big Tech deals and a 40% revenue growth forecast, but high valuation raises caution."
2025-08-04,"Analysts Warn That CoreWeave Stock Is ‘High Risk,’ But They Still Want You to Buy CRWV Now",Yahoo,CoreWeave stock has been on an absolute tear since its IPO in early 2025. Is CRWV stock still a good buy right now?
2025-08-05,Apple: Ignore The Short-Term Noise,SeekingAlpha,"Despite not splurging on AI infrastructure spending, Apples disciplined approach is a strategic strength, not a weakness, preserving robust cash flow. Read the latest stock analysis here."
2025-08-05,Meta Outlines Performance Improvements Based on its Evolving AI Systems,Yahoo,"Meta’s seeing increases in time spent, and better ad response, based on AI."
2025-08-05,Vertex Announces Results from Phase 2 Study of VX-993 for the Treatment of Acute Pain,Yahoo,"BOSTON, August 04, 2025--Vertex Pharmaceuticals Incorporated (Nasdaq: VRTX) today announced topline results from its recently completed Phase 2, randomized, double-blind, placebo-controlled dose-ranging study evaluating the safety and efficacy of its investigational selective NaV1.8 pain signal inhibitor, VX-993, in treating acute pain after bunionectomy surgery. Treatment with VX-993 did not result in a statistically significant improvement on the primary endpoint of the time-weighted Sum of th"
2025-08-06,"Big Tech defies earnings expectations, with Nvidia results still ahead, says Barclays",MarketWatch,"Big Tech defies earnings expectations, with Nvidia results still ahead, says Barclays"
2025-08-06,Why a Company You’ve Never Heard of Is One of the Best Nasdaq-100 Stocks of the Year,Yahoo,"Going under the radar, shares of this vet tech company have been winners this year."
