date,headline,source,summary
2025-09-11,"META EXECUTIVE DANE GLASGOW TO JOIN PARAMOUNT AS CHIEF PRODUCT OFFICER, DRIVING TECH INNOVATION AND PRODUCT STRATEGY",Yahoo,"Paramount, a Skydance Corporation today announced that Dane Glasgow, a seasoned technology leader with extensive experience in consumer product development and management, digital platforms, and advanced technologies, will join the company as Chief Product Officer. Glasgow has built and scaled multiple successful businesses across social, search, entertainment, commerce, communications, geospatial software, and finance – connecting hundreds of millions of people to some of the most widely used c"
2025-09-12,"Jack Dorsey’s Bitchat Surges in Nepal, Indonesia Amid Protest Crackdowns",Yahoo,Government crackdowns on social media amid social unrest have turned the new decentralized messaging app into a protest tool.
2025-09-12,Granite Declares Quarterly Dividend,Yahoo,"WATSONVILLE, Calif., September 11, 2025--Granite (NYSE:GVA) today announced that its Board of Directors has declared a quarterly cash dividend of $0.13 per common share. The dividend is payable on October 15, 2025, to all shareholders of record at the close of business on September 30, 2025."
2025-09-12,Meta Announces New Reels and Threads Ad Options,Yahoo,Metas also added more control options within its AI ad targeting process.
2025-09-15,"Longroad Energy Achieves Financial Close of 1000 Mile Solar, a 400 MWdc Project",Yahoo,"Longroad Energy, a U.S. based renewable energy developer, owner and operator, announced today the financial close and recent commencement of construction of 1000 Mile Solar, its 400 MWdc (300 MWac) solar project in Yoakum County, Texas. In late 2024 Longroad finalized a long-term offtake agreement with Meta in the form of an Environmental Attributes Purchase Agreement, which includes a financial settlement arrangement for the entire energy output of 1000 Mile. The project is expected to achieve"
2025-09-15,"Fed Decison, Meta Conference and Other Key Things to Watch this Week",Yahoo,"Markets face their most pivotal week in months as the Federal Reserves September 17-18 meeting arrives Wednesday afternoon, with Chair Jerome Powells 2:30pm press conference potentially reshaping the investment landscape."
2025-09-16,Apple Vs. Alphabet: Valuation And Growth Make Alphabet The Superior Choice,SeekingAlpha,"Compare Alphabet Inc. vs Apple Inc.: Click for why GOOGLs strong growth, lower valuation, and financial health offer better investment potential than AAPL stock."
2025-09-16,Meta Stock Rises. This Is Its New AI Product.,Yahoo,Meta Platforms  was gaining on Tuesday ahead of its annual conference.  A new pair of smart glasses is set to take center stage.  The stock has fallen back from its record close of $790 in mid-August but is still riding high on the social media company’s artificial-intelligence ambitions.
2025-09-16,Netflix Joins Google On Two Elite Lists. Now The Trial Begins.,Yahoo,"As Netflix stock looks launch a breakout, the streamer joins Alphabet, Amazon and Meta on two noteworthy lists."
2025-09-17,Should You Buy STUB Stock After the StubHub IPO?,Yahoo,The secondary ticket offering company will see its shares listed tomorrow.
2025-09-17,"The Smartest Artificial Intelligence (AI) Stocks to Buy With $1,000",Yahoo,"Investors can start buying shares in several leading artificial intelligence (AI) stocks with a modest sum of just $1,000."
2025-09-17,"Stock Market Today: Nasdaq, S&P 500 Retreat After Highs; This Energy Name Gets A Jolt (Live Coverage)",Yahoo,The Dow Jones index sinks Tuesday on surprise retail sales. An energy stock is on pace for nine straight weeks of gains.
2025-09-18,Circus SE Delivers First CA-1 AI Robot to Meta,Yahoo,"MUNICH, September 18, 2025--Circus SE (XETRA: CA1), a global technology leader in AI robotics for autonomous nutrition systems, today announces the first-ever deployment of its next-generation autonomous CA-1 robot, beginning with Meta (NASDAQ: META) in Germany as its first enterprise deployment. The deployment will begin with full integration at the Munich Meta offices and will be accompanied by a joint launch event."
2025-09-19,"Stock Market Rallies To New Highs On Fed Rate Cut, Nvidia News; Tesla Jumps: Weekly Review",DowJones,"Stock Market Rallies To New Highs On Fed Rate Cut, Nvidia News; Tesla Jumps: Weekly Review"
2025-09-20,Sustainable Concrete Buyers Alliance Launches to Accelerate Adoption of Low-Carbon Building and Infrastructure Materials,Yahoo,"In a landmark step for the cement and concrete sector, RMI (founded as Rocky Mountain Institute) and the Center for Green Market Activation (GMA) today launched the Sustainable Concrete Buyers Alliance (SCoBA), bringing together founding members, including Amazon, Prologis, and Meta, alongside other leading organizations to accelerate adoption of low-carbon cement and concrete for 21st century buildings and infrastructure. SCoBA is the first buyers group formed to collectively procure environmen"
2025-09-20,It’s not just Sam Altman warning about an AI bubble. Now Mark Zuckerberg says a ‘collapse’ is ‘definitely a possibility’,Yahoo,"“Based on past infrastructure build-outs and how they led to bubbles,” the Meta CEO said on the Access podcast, it’s quite possible “that something like that would happen here.”"
2025-09-22,"Meta Platforms: Risks Mount, Heres Why Im Selling 60%",SeekingAlpha,"Meta Platforms is up 46% since April with strong Q2 growth, but rising valuation and lower efficiency urge caution. Find out why META stock is a buy."
2025-09-23,Dealers Double Vehicle Sales Using the AutoMiner CDP with Meta Ads,Yahoo,"A new study shows CDP-based targeting improves ad spend performance and delivers lasting sales impactATLANTA, Sept. 23, 2025 (GLOBE NEWSWIRE) -- PureCars, the leader in automotive retail advertising, recently released a study showing that dealerships using both its customer data platform (CDP), the AutoMiner, and digital advertising platform more than doubled vehicle sales. To measure the impact of first-party data and real-time audience targeting, PureCars used Robyn, an open-source marketing m"
2025-09-23,Steve Madden Deploys Fivetran to Unify Cross-Channel Marketing and Analytics Data,Yahoo,"OAKLAND, Calif., September 23, 2025--Fivetran, the global leader in data movement, today announced that Steve Madden, the leading designer and marketer of fashion-forward accessories, and apparel is using Fivetran to centralize their advertising, web traffic, and social engagement data from its global digital footprint. The move enables Steve Madden to streamline reporting, improve campaign performance, and gain faster insights across all channels."
2025-09-24,"Coinbase, Sony and Samsung Back $14.6M Round for Stablecoin Startup Bastion",Yahoo,"The firm white-label stablecoin systems, enabling companies to issue digital dollars without coding or their own regulatory licenses."
2025-09-26,"Meta launches ‘Vibes,’ a short-form video feed of AI slop",Yahoo,"Think TikTok or Instagram Reels, but every single video you come across is essentially just AI slop."
2025-09-26,"Meta in talks with Google about AI models for ad business, Alphabet stock gains",Yahoo,Investing.com -- Alphabet (NASDAQ:GOOGL) stock rose 1.5% in afterhours trading Thursday following a report that Meta Platforms (NASDAQ:META) is considering using Google’s artificial intelligence models to enhance its advertising business.
2025-09-28,CoreWeaves AI Climb Still Hides Untapped Firepower,SeekingAlpha,CoreWeave leverages Nvidia-backed GPU cloud capacity and multi-year take-or-pay contracts with top AI clients. Read why CRWV stock is a Buy.
2025-09-29,Analyst Says Alphabet (GOOG) Can Surge to Over $300 – Here’s Why,Yahoo,"We recently published Analysts Are Talking About These 10 Stocks as AI Investments Continue to Grow. Alphabet Inc (NASDAQ:GOOG) is one of the stocks analysts were recently talking about. Mark Mahaney, Evercore ISI head of internet research, said in a recent program on CNBC that Alphabet Inc (NASDAQ:GOOG) is positioned well to gain following the […]"
2025-09-29,1 Life-Changing Stock That I Plan to Never Sell,Yahoo,Investing in this stock has changed my life in more ways than one.
2025-09-30,Google to Pay $24.5 Million to End Trump Suit Over Jan. 6 Ban,Yahoo,"The settlement disclosed Monday ends Trump’s long-running legal challenge to the suspension.  The filing says $22 million will go toward construction of a new ballroom in the White House, a project near and dear to Trump.  Google declined to comment."
2025-09-30,Lets Talk About SCHD And Its Miserable 5-Year Track Record,SeekingAlpha,Discover why SCHDs performance lagged after years of outpacing peers and if its strong dividend strategy can fuel future gains.
2025-09-30,Sector Update: Tech Stocks Mixed Late Afternoon,Yahoo,"Tech stocks were mixed late Monday afternoon, with the Technology Select Sector SPDR Fund (XLK) risi"
2025-09-30,"Anthropic launches Claude Sonnet 4.5, its best AI model for coding",Yahoo,"Anthropic says its new AI model is robust enough to build production-ready applications, rather than just prototypes."
2025-09-30,"Dont Fear AI Bubble, There Will Be Winners - Tech Contrarians",SeekingAlpha,Tech ContrariansÂ on pretty fishy levels and not giving China enough credit.
2025-09-30,California Governor Newsom signs landmark AI safety bill SB 53,Yahoo,"SB 53 requires large AI labs – including OpenAI, Anthropic, Meta, and Google DeepMind – to be transparent about safety protocols. It also ensures whistleblower protections for employees at those companies."
2025-09-30,CoreWeave Inks $14.2 Billion Deal With Meta for AI Cloud Infrastructure -- Update,MarketWatch,CoreWeave Inks $14.2 Billion Deal With Meta for AI Cloud Infrastructure -- Update
2025-10-01,Meta Will Target Ads Based On AI Chatbot Conversations,Yahoo,The tech giant said it will soon target advertisements and other content based on chatbot conversations.
2025-10-01,Metas Implied EPS Growth Expectations: Realistic Or Bubble?,SeekingAlpha,"Explore Meta Platforms, Inc.s 10-year EPS growth forecast, valuation risks, and moat strength. Click to see if META stock offers the right investment balance."
2025-10-01,GEN Boosts Cyber Safety With Norton Deepfake Protection on Intel PCs,Yahoo,"Gen Digital adds Norton deepfake protection on Intel, Qualcomm, and AMD AI PCs, expanding security reach across platforms."
2025-10-01,"Top Stocks today: Nvidia, Robinhood and Pfizer lead the market",Yahoo,Here are the stocks that made the biggest moves today
2025-10-01,"Tech, Media & Telecom Roundup: Market Talk",Yahoo,"Find insight on TSMC, Tele2 and more in the latest Market Talks covering Technology, Media and Telecom."
2025-10-01,"Stocks to Watch Wednesday: Nike, Lithium Americas, Arm, Occidental",Yahoo,↗️ Lithium Americas (LAC): The U.S. government said Tuesday it would take a 5% stake in both the Canadian company and its Nevada mining project. Shares jumped by roughly one-third in premarket trading.
2025-10-01,Why Nvidia-Backed CoreWeaves Stock Is Soaring Today,Yahoo,CoreWeaves stock surged Tuesday after the cloud computing company backed by Nvidia made this announcement.
2025-10-01,Elevated P/E Ratios: Get Used To It (And Embrace It),SeekingAlpha,Elevated S&P 500 P/E ratios signal a shift to cash-rich tech stocks. Click here for more information on Market Outlook.
2025-10-02,Apple shelves Vision Pro revamp in pursuit of AI glasses to rival Meta - Bloomberg,Yahoo,"Investing.com -- Apple Inc (NASDAQ:AAPL) is shelving development of a lower-cost Vision Pro headset to prioritize a more urgent initiative: building smart glasses that could rival offerings from Meta Platforms Inc (NASDAQ:META). The company is reallocating internal resources in a bid to gain ground in a growing segment of AI-powered wearables that many in the tech industry view as the successor to the smartphone, according to Bloomberg, citing sources familiar with the matter."
2025-10-02,Meta Earns Buy Rating as Strong Earnings Align with Ad-Free Subscription Rollout,Yahoo,"Meta Platforms, Inc. (NASDAQ:META) is one of the 12 Set-It-and-Forget-It Stocks to Buy Now. The company earns a consensus Buy rating amid a strong second quarter and the decision to soon roll out new ad-free versions of Facebook and Instagram. Meta Platforms, Inc. (NASDAQ:META) reported a 22% year-over-year increase in its Q2 2025 revenue, reaching […]"
2025-10-02,CoreWeave: Something Is Very Wrong,SeekingAlpha,"CoreWeave, Inc. secured a $14.2B compute deal with Meta, boosting its stock 15% and diversifying revenue. Click here to read why CRWV stock is a Buy."
2025-10-02,Meta to Announce Third Quarter 2025 Results,Yahoo,"Meta Platforms, Inc. (NASDAQ: META) announced today that the companys third quarter 2025 financial results will be released after market close on Wednesday, October 29, 2025."
2025-10-03,"The Trade Desk: What It Actually Does, And Why Its Disadvantaged",SeekingAlpha,"The Trade Desk, Inc. faces intensifying competition and market share losses, with shares down over 63% from their peak. Read why TTD stock is a Hold."
2025-10-03,3 Sizzling-Hot AI Stocks That Have Skyrocketed Over 120% This Year,Yahoo,Wall Street thinks one of these AI stocks could soar much higher.
2025-10-03,"OpenAI now worth $500 billion, possibly making it the worlds most valuable startup",Yahoo,"OpenAI could now be the worlds most valuable startup, ahead of Elon Musks SpaceX and TikToks parent company ByteDance, after a secondary stock sale designed to retain employees at the ChatGPT maker.  The investors buying the shares included Thrive Capital, Dragoneer Investment Group and T. Rowe Price, along with Japanese tech giant SoftBank and the United Arab Emirates MGX, the source said Thursday.  The valuation reflects high expectations for the future of AI technology and continues OpenAI’s remarkable trajectory from its start as a nonprofit research lab in 2015."
2025-10-03,"Tech-heavy Nasdaq turns lower as Palantir, Big Tech stocks drop",MarketWatch,"Tech-heavy Nasdaq turns lower as Palantir, Big Tech stocks drop"
2025-10-03,BC-Most Active Stocks,Yahoo,"Elong Power Holding Ltd. 25,377,948 0.4193"
2025-10-04,The Hidden Opportunities in AI,Yahoo,"Beyond the big names, where are there opportunities in AI and discounts in the market overall?"
