date,headline,source,summary
2025-04-09,"Got $3,000? 2 Artificial Intelligence (AI) Stocks to Buy and Hold for the Long Term",Yahoo,"Nvidia (NASDAQ: NVDA) is enabling the rapid adoption of AI.  Its graphics processing units (GPUs) are used in everything from playing video games to powering the largest data centers, where the AI magic happens.  CEO Jensen Huang will go down as one of the great business leaders of the 21st century."
2025-04-10,2 Tech Stocks Leading the Next Wave of Artificial Intelligence (AI) Disruption,Yahoo,"Artificial intelligence (AI) stocks are among those that have fallen out of favor in 2025, and thats not surprising.  The macroeconomic turmoil that President Donald Trumps new global trade war is likely to cause has spooked investors, leading them to take their profits in stocks that made strong gains in the past couple of years and head for the sidelines."
2025-04-14,"Snowflake Inc. (SNOW): “God Yes… I Pulled the Trigger,” Says Jim Cramer",Yahoo,"We recently published a list of 10 Stocks on Jim Cramer’s Radar. In this article, we are going to take a look at where Snowflake Inc. (NYSE:SNOW) stands against other stocks on Jim Cramer’s radar. On Thursday, Mad Money host Jim Cramer cautioned viewers about what may lie ahead once the 90-day pause on new […]"
2025-04-15,Snowflake Inc. (SNOW) Stock Sinks As Market Gains: What You Should Know,Yahoo,"In the most recent trading session, Snowflake Inc. (SNOW) closed at $144.55, indicating a -0.28% shift from the previous trading day."
2025-04-15,Snowflake Research Reveals that 92% of Early Adopters See ROI From AI Investments,Yahoo,"No-Headquarters/BOZEMAN, Mont., April 15, 2025--Snowflake (NYSE: SNOW), the AI Data Cloud company, in collaboration with Enterprise Strategy Group, today released the Radical ROI of Generative AI, a global research report surveying 1,900 business and IT leaders across nine different countries — all of whom are actively using AI for one or more use cases. Of all respondents, 92% reported that their AI investments are already paying for themselves, and 98% plan to invest more on AI in 2025. As A"
2025-04-16,Snowflake vs. MongoDB: Which Data Platform Stock is a Better Pick?,Yahoo,SNOW and MDB are well-known players in the database management system space. Which one is a better investment option?
2025-04-18,Snowflake Insider Ups Holding During Year,Yahoo,"Looking at Snowflake Inc.s ( NYSE:SNOW ) insider transactions over the last year, we can see that insiders were net..."
2025-04-24,"Okta, Snowflake, Appian, Allegro MicroSystems, and Lattice Semiconductor Stocks Trade Up, What You Need To Know",Yahoo,"A number of stocks jumped in the morning session after President Trump clarified that he had no intention of removing Federal Reserve Chair Jerome Powell, a statement that helped calm markets. Earlier remarks had sparked fears of political interference in decision-making at the central bank. With Trump walking back his earlier comments, investors likely felt more assured that monetary policy decisions would continue to be guided by data, not drama. That kept the Feds word credible, and more imp"
2025-04-26,Snowflake Inc. (SNOW): Among Billionaire Steve Cohen’s Large-Cap Stock Picks With Huge Upside Potential,Yahoo,"We recently published a list of Billionaire Steve Cohen’s 10 Large-Cap Stock Picks With Huge Upside Potential. In this article, we are going to take a look at where Snowflake Inc. (NYSE:SNOW) stands against other billionaire Steve Cohen’s large-cap stock picks with huge upside potential. What does the future hold for the US economy and […]"
2025-04-30,Snowflake Inc. (SNOW): Among Billionaire Michael Platt’s Stock Picks with Huge Upside Potential,Yahoo,"We recently published a list of Billionaire Michael Platt’s 10 Stock Picks with Huge Upside Potential. In this article, we are going to take a look at where Snowflake Inc. (NYSE:SNOW) stands against other billionaire Michael Platt’s stock picks with huge upside potential. Michael Platt is the co-founder and CEO of BlueCrest Capital Management, which was […]"
2025-05-01,"Snowflake to Announce Financial Results for the First Quarter of Fiscal 2026 on May 21, 2025",Yahoo,"No-Headquarters/BOZEMAN, Mont., May 01, 2025--Snowflake (NYSE: SNOW), the AI Data Cloud company, today announced it will release its financial results for the first quarter of fiscal year 2026, which ended April 30, 2025, following the close of the U.S. markets on Wednesday, May 21, 2025. Snowflake will host a conference call to discuss the financial results."
2025-05-06,2 Reasons to Like SNOW (and 1 Not So Much),Yahoo,"While the broader market has struggled with the S&P 500 down 4.7% since November 2024, Snowflake has surged ahead as its stock price has climbed by 37.8% to $167.30 per share. This was partly due to its solid quarterly results, and the run-up might have investors contemplating their next move."
2025-05-08,1 Growth Stock to Add to Your Roster and 2 to Be Wary Of,Yahoo,"Growth is a hallmark of all great companies, but the laws of gravity eventually take hold. Those who rode the COVID boom and ensuing tech selloff in 2022 will surely remember that the market’s punishment can be swift and severe when trajectories fall."
2025-05-09,Pinterest (PINS) Q1 Earnings Miss Estimates,Yahoo,"Pinterest (PINS) delivered earnings and revenue surprises of -8% and 1.09%, respectively, for the quarter ended March 2025. Do the numbers hold clues to what lies ahead for the stock?"
2025-05-14,Snowflake Inc. (SNOW) Rises Yet Lags Behind Market: Some Facts Worth Knowing,Yahoo,"In the most recent trading session, Snowflake Inc. (SNOW) closed at $181.02, indicating a +0.27% shift from the previous trading day."
2025-05-15,"1 Super Stock Down 55% to Buy Hand Over Fist, According to Wall Street",Yahoo,This stock is likely to experience significant gains in the coming years.
2025-05-21,NYSE Content Advisory: Pre-Market update + Retailers report earnings,Yahoo,The New York Stock Exchange (NYSE) provides a daily pre-market update directly from the NYSE Trading Floor. Access todays NYSE Pre-market update for market insights before trading begins.
2025-05-22,Snowflake’s (SNOW) Toppy Valuation Braces for Earnings Day of Reckoning,Yahoo,"Market expectations are sky-high for Snowflake (SNOW) going into its quarterly earnings announcement tomorrow. The stock has posted a robust 41% gain in the past six months, but now comes a time of reckoning for the stock that has promised so much and delivered. Market analysts expect SNOW to announce boosted earnings per share of $0.21, up ~50% year-over-year. The rather lofty earnings expectations are equally matched by revenues. Analysts are anticipating news of SNOW’s revenues rising 18% to"
2025-05-22,"Snowflake stock jumps on outlook, earnings beat",Yahoo,"Snowflake (SNOW) reported first quarter results that topped Wall Street estimates on both the top and bottom lines. Diluted earnings per share was $0.24 compared to the Bloomberg consensus estimate of $0.21. Revenue was $1.04 billion versus a $1.01 billion estimate. The company also raised its full-year product sales forecast. To watch more expert insights and analysis on the latest market action, check out more Market Domination Overtime here."
2025-05-22,Artisan Global Opportunities Fund Q1 2025 Commentary,SeekingAlpha,The Artisan Global Opportunities Fund portfolio generated negative absolute returns for Q1 of 2025. Click here to read the full commentary.
2025-05-23,"Stocks to Watch Recap: Hinge Health, TD Bank, Snowflake, Fannie Mae",Yahoo,"? After-Market Earnings: Deckers Outdoor (DECK) gave a lower-than-expected outlook for the current quarter, sending shares lower 13%. Ross Stores (ROSS) shares fell 11% afterhours following the discount department-store chain withdrawing its full-year outlook due to an expected drag from tariffs."
2025-05-23,Closing Bell Movers: Snowflake jumps 7% on earnings,Yahoo,"In the opening hour of the evening session, U.S. equity futures are down modestly, extending Wednesday’s broader declines. S&P 500 is down 0.1% at 5,855, Nasdaq 100 is off by 0.1% at 21,139, and Dow Industrials are slipping 0.2% below 41,900 level. In commodities, WTI Crude Oil is down 0.4% at $61.31 as rumors of escalation in the Middle East are replaced by worries over global growth, while Gold is up another 0.2% at $3,321 per ounce. Fiscal debt and deficit worries amid Congressional budget de"
2025-05-26,3 high-flying stocks with promising prospects,Yahoo,"Expensive stocks often command premium valuations because the market thinks their business models are exceptional. However, the downside is that high expectations are already baked into their prices, leaving little room for error if they stumble even slightly."
2025-05-28,Famous Investor Identifies Snowflake (SNOW) as One of the Market’s Top Stocks,Yahoo,"Josh Brown, an investor who frequently appears on CNBC, recently identified Snowflake Inc. (NYSE:SNOW) as one of his favorite names in the market when he was on the network. Snowflake Inc. (NYSE:SNOW) owns and operates “a cloud-based data platform.” Brown is the CEO of Ritholtz Wealth Management. Snowflake Inc. (NYSE:SNOW) Has Strong Momentum SNOW stock […]"
2025-05-30,Snowflake (SNOW) AI-Powered Hot Streak Leaves Its Valuation Melting,Yahoo,"Snowflake (SNOW) continues to impress with its AI-driven strategy, delivering a strong Q1 FY2026 that included a 26% year-over-year increase in product revenue and a robust $6.7 billion pipeline of contracted future business. The company’s transformation into a leading AI Data Cloud platform is gaining traction, fueled by high-profile partnerships with OpenAI and Anthropic—strategic moves that hint at even broader collaborations ahead. The vision is compelling, and the momentum is undeniable. Ho"
2025-06-01,Diversification Strategy Sparks Bullish Impetus in Nebius Group Stock (NBIS),Yahoo,"When I first invested in Nebius Group (NBIS) earlier this year, I approached it with cautious optimism—hyper-growth stocks carry inherent risk. Today, with the stock up over 50%, I remain confident and recently raised my 12-month price target to $60, implying further upside of over 50%. While its EV/Sales multiple above 50x may appear steep, it’s less relevant for a vertically integrated AI infrastructure leader positioned to capitalize on current momentum. In my view, Nebius remains one of the"
2025-06-03,Monte Carlo Announces Integration with Snowflake to Bring Data + AI Observability Solution to Snowflake Cortex Agents,Finnhub,"Monte Carlo announced at Snowflakes annual user conference, Snowflake Summit 2025, a strategic collaboration with Snowflake, the AI Data Cloud company, to support Snowflake Cortex Agents, Snowflakes..."
2025-06-04,"Incorta Connect Expands to Snowflake, Delivering ERP Data with Unmatched Speed, Accuracy, and Efficiency",Finnhub,"Incorta announced that Incorta Connect now natively supports Snowflake, enabling organizations to deliver live, detailed data from complex ERP systems like Oracle and SAP into the Snowflake Data Cloud..."
2025-06-04,"Gannett Co., Inc. Announces an Agreement with Snowflake",Finnhub,Gannett Co. Inc. announced an agreement with Snowflake to join Snowflake Marketplace. Snowflake Marketplace enables enterprises to enrich their AI apps and agents with proprietary unstructured data...
2025-06-04,"PayPals Venmo, Snowflake upgrade, Asana: Trending Tickers",Yahoo,"PayPal-owned (PYPL) mobile payment app Venmo is adding new features to its platform, including 15% cashback rewards at select retailers. UBS analysts upgrade Snowflake stock (SNOW) to a Buy rating and raise their price target to $265 per share. Asana (ASAN) shares sink Wednesday morning after topping first quarter earnings estimates while reporting a notable year-over-year decline in sales growth. To watch more expert insights and analysis on the latest market action, check out more Wealth here."
2025-06-10,Snowflake vs. Teradata: Which Data Analytics Stock is the Smarter Buy?,Yahoo,"TDC gains ground with strong cloud ARR growth and AI tie-ups, while SNOW faces valuation and spending headwinds."
2025-06-12,Transcript : Snowflake Inc. - Special Call,Finnhub,"Presenter SpeechHwee Bee Tan Hi, everyone, a warm welcome to SPN PULSE. Let me start over, right? I forgot to unmute myself today. Im Hwee Bee Tan, Im the Head of Partner Marketing for APJ at..."
2025-06-18,Palantir Vs. CoreWeave: Why Palantir Could Outperform At 80x Sales,SeekingAlpha,Both Palantir and CoreWeave have emerged as two of the markets hottest AI bets this year. Find out which one AI investment remains better positioned to withstand pressure.
2025-06-19,Will the AI-Infrastructure Boom Lift C3.ais Application Demand?,Yahoo,AIs 25% revenue growth and rising partner-driven deals show traction as enterprises seek turnkey AI solutions.
2025-06-20,"Trending tickers: SoftBank, Pop Mart, Snowflake, Salesforce and Nvidia",Yahoo,The latest investor updates on stocks that are trending on Friday.
2025-06-20,15 AI stocks to watch outside of the Magnificent 7,Yahoo,"Some investors may be wondering if they missed out on Nvidias (NVDA) artificial intelligence (AI) run. Futurum CEO Daniel Newman joins Morning Brief to highlight 15 alternative AI plays, including Broadcom (AVGO), Palantir (PLTR), and Oracle (ORCL), that could benefit from the next wave of custom chip demand. To watch more expert insights and analysis on the latest market action, check out more Morning Brief here."
2025-06-25,Snowflake Stock Climbs as Morgan Stanley Predicts Double-Digit Growth,Yahoo,Snowflake Gets Overweight Boost as Innovation Accelerates Under New CEO
2025-06-26,"Snowflake, WNS Partner to Accelerate Data Modernization, AI Adoption",Yahoo,"Snowflake Inc. (NYSE:SNOW) is one of the best US tech stocks to buy now. On June 10, WNS (Holdings) Limited (NYSE:WNS) announced a collaboration with Snowflake. The partnership aims to accelerate data modernization and use AI to improve business outcomes for organizations across various industries. WNS’s recent acquisition of Kipi.ai (occurring earlier this year on […]"
2025-06-26,Option traders moderately bearish in Snowflake with shares down 0.1%,Yahoo,"Option traders moderately bearish in Snowflake (SNOW), with shares down 23c near $222.91. Options volume relatively light with 12k contracts traded and calls leading puts for a put/call ratio of 0.25, compared to a typical level near 0.52. Implied volatility (IV30) is higher by 1.9 points near 31.94,in the lowest 10% of observations over the past year, suggesting an expected daily move of $4.48. Put-call skew steepened, indicating increased demand for downside protection. Published first on TheF"
2025-06-28,"Morgan Stanley Raised The PT on Snowflake Inc. (SNOW), Maintains a Buy Rating",Yahoo,"Snowflake Inc. (NYSE:SNOW) is one of the 11 Unstoppable Tech Stocks to Invest in. On June 24, analyst Sanjit Singh from Morgan Stanley raised the price target on Snowflake Inc. (NYSE:SNOW) from $220 to $262, while maintaining a Buy rating on the stock. The improved outlook is based on the company’s performance under CEO Sridhar Ramaswamy. Analyst […]"
2025-07-01,Goldman rolls out latest U.S. Conviction List update,Yahoo,"Investing.com -- Goldman Sachs has added three new names to its U.S. Conviction List, the investment bank revealed in a note Tuesday."
2025-07-03,Weekly Option Windfall: Snowflake Call Spread Boasts 31% Profit Potential,Yahoo,Option spreads can be profitable even if the underlying stock decreases or remains flat.
2025-07-03,"Transcript : Snowflake Inc. Presents at Jefferies Public Technology Conference, May-28-2025 11",Finnhub,"Presenter SpeechBrent Thill Good morning, everyone. My name is Brent Thill, and I will be one of your hosts this week. Thanks again for your support of the Jefferies conference. And were here for..."
2025-07-07,2 Cash-Producing Stocks to Consider Right Now and 1 to Avoid,Yahoo,"A company that generates cash isn’t automatically a winner. Some businesses stockpile cash but fail to reinvest wisely, limiting their ability to expand."
2025-07-07,Investing In The Intelligence Economy: Semantic Graph Engines,SeekingAlpha,Discover investment strategies for the emerging Intelligence Economy.
2025-07-07,CoreWeave and Circle Boomed After IPOs. These 3 Companies Could Be Next.,Yahoo,"The market is excited about initial public offerings again.  After the strong performances of recently floated stablecoin company  Circle  and cloud-rental company  CoreWeave  it’s worth casting an eye over the next candidates for an IPO, especially in the technology sector.  There are three major tech companies which could make waves when and if they go public, Figma, Cerebras Systems and Databricks."
2025-07-08,Snowflake Inc. (SNOW) Gains As Market Dips: What You Should Know,Yahoo,"In the latest trading session, Snowflake Inc. (SNOW) closed at $225.79, marking a +1.94% move from the previous day."
2025-07-09,Analyst: Snowflake (SNOW)’s AI Breakthroughs Could Power Long-Term Growth,Yahoo,"Snowflake Inc. (NYSE:SNOW) is one of the Top 10 AI Stocks in the Spotlight. On July 3, Monness analyst Brian White maintained a Buy rating on the stock and set a price target of $245.00. White’s rating reflects Snowflake’s impressive innovations and strategic advancements. At a recent summit, the company introduced several new features, including Snowflake Intelligence […]"
2025-07-15,UBS Reaffirms Buy on Snowflake (SNOW) Amid Strong Data Infrastructure Investment Trends,Yahoo,"Snowflake Inc. (NYSE:SNOW) ranks among the best cloud stocks to buy according to Wall Street analysts. On June 12, UBS reaffirmed its Buy rating on Snowflake Inc. (NYSE:SNOW) with a $265 price target. The rating affirmation comes after UBS analysts attended the Databricks conference in San Francisco, where they spoke with 15 clients and partners […]"
2025-07-16,Anthropic rolls out financial AI tools to target large clients,Yahoo,"Claude for financial services can “turbocharge” the work analysts or fund managers are already doing by serving as their research analyst assistant, said Jonathan Pelosi, global head of industry for financial services at Anthropic."
2025-07-23,Snowflake Inc. (SNOW) Stock Dips While Market Gains: Key Facts,Yahoo,"Snowflake Inc. (SNOW) closed at $212.25 in the latest trading session, marking a -1.58% move from the prior day."
2025-07-24,Snowflake (SNOW) Partners With Bloomreach To Enhance AI-Powered Marketing Solutions,Yahoo,"Bloomreachs partnership with Snowflake (SNOW) to enhance data infrastructure highlights the latters active role in expanding AI-driven solutions. Snowflakes stock price increased by 44% over the last quarter, partly buoyed by various partnerships, such as with MindBridge and Intapp, which underline its expanding client base and capabilities. The companys growth aligns with broader market trends, as the S&P 500 reached a new high on trade deal optimism, indicating overall positive investor..."
2025-07-25,Is It Worth Investing in Snowflake (SNOW) Based on Wall Streets Bullish Views?,Yahoo,"The average brokerage recommendation (ABR) for Snowflake (SNOW) is equivalent to a Buy. The overly optimistic recommendations of Wall Street analysts make the effectiveness of this highly sought-after metric questionable. So, is it worth buying the stock?"
2025-07-26,Where Will Palantir Technologies Be in 3 Years?,Yahoo,"The standout AI software company has achieved a 1,300% return in just the past 36 months."
2025-07-29,ClearBridge Growth Fund Q2 2025 Commentary,SeekingAlpha,U.S. equities rebounded strongly from tariff and geopolitical scares to deliver healthy gains in the second quarter. Read more here.
2025-08-05,Here’s Why Baron Global Advantage Fund’s Has Strong Conviction in NVIDIA (NVDA),Yahoo,"Baron Funds, an investment management company, released its “Baron Global Advantage Fund” investor letter for the second quarter of 2025. A copy of the letter can be downloaded here. In the second quarter, the fund returned 22.7% (Institutional Shares), compared to the MSCI ACWI Index’s (the Index) 11.5% gain and the MSCI ACWI Growth Index’s […]"
2025-08-06,Otelier upgrades flagship business intelligence platform IntelliSight,Yahoo,The enhanced platform leverages Snowflakes cloud data warehouse technology for improved cross-data analytics.
2025-08-08,The Trade Desk Reports Second Quarter 2025 Financial Results,Yahoo,"LOS ANGELES, August 07, 2025--The Trade Desk, Inc. (The Trade Desk, the Company or we) (NASDAQ: TTD), a provider of a global technology platform for buyers of advertising, today announced financial results for its second quarter ended June 30, 2025."
2025-08-13,"Snowflake, Datadog show strong July growth, MongoDB stabilizes",Yahoo,"Investing.com -- According to Bank of America’s Cloud Views note on Wednesday, Snowflake and Datadog posted standout results in July, while MongoDB showed signs of stabilization."
2025-08-14,Salesforce Pushes Data Cloud Adoption: Will It Anchor Growth?,Yahoo,"CRMs Data Cloud, storing 22T data points and growing ARR by 120% in Q1, is becoming central to its AI-driven growth push."
2025-08-20,Snowflake: The Platform For Economic AGI,SeekingAlpha,"Snowflake is positioning itself as the âfactory floorâ for enterprise AI, embedding LLMs, RAG, and skills into its AI Data Cloud where governance and data..."
2025-08-23,Snowflake Inc. (SNOW) Launches Public Preview of Snowpark Connect for Spark,Yahoo,"Snowflake Inc. (NYSE:SNOW) is one of the 14 Best IT Stocks to Buy for the Long Term. On August 8, 2025, Snowflake Inc. (NYSE:SNOW) launched the public preview of Snowpark Connect for Spark. This new architecture allows Apache Spark code to run directly in Snowflake warehouses. Snowflake Inc. (NYSE:SNOW) launched Snowpark Connect to address long-standing […]"
2025-08-25,Earnings live: Temu owner PDD Holdings stock gains as Nvidia earnings countdown begins,Yahoo,"The gush of second quarter earnings reports is beginning to slow to a trickle, and with most of the reports in, the results have been mostly positive."
2025-08-25,How Investors May Respond To Snowflake (SNOW) AI Optimism and Snowpark Connect Launch,Yahoo,"In recent days, analyst optimism surrounding Snowflake surged as major brokerages upgraded the company, citing robust demand for its AI-driven products and the public preview launch of Snowpark Connect for Spark, which enables direct execution of Apache Spark code within Snowflake warehouses. This momentum was further amplified by positive forecasts around Snowflake’s AI initiatives and expanding partnerships, signaling growing industry confidence in the companys evolving product..."
2025-08-27,Snowflake (SNOW) Is Considered a Good Investment by Brokers: Is That True?,Yahoo,"According to the average brokerage recommendation (ABR), one should invest in Snowflake (SNOW). It is debatable whether this highly sought-after metric is effective because Wall Street analysts recommendations tend to be overly optimistic. Would it be worth investing in the stock?"
2025-08-28,"Snowflake Stock Soars as AI Demand Boosts Results, Outlook",Yahoo,Snowflake exceeded fiscal 2026 second-quarter estimates for profit and sales as more customers used its AI software.
2025-08-28,Equity Markets Rise Intraday Ahead of Nvidia Earnings,Yahoo,US benchmark equity indexes were higher intraday as traders awaited technology bellwether Nvidias (
2025-08-29,"Up Nearly 60% in 2025, Is It Too Late to Buy Snowflake Stock?",Yahoo,"Snowflake reported another strong quarter, highlighting the strength of its business model."
2025-08-29,"Snowflake Pops After Strong Q2, Guidance Lift on AI Demand",Yahoo,Product revenue climbs 32% as customers lock in more deals
2025-08-30,"Earnings live: Alibaba stock soars, Marvell tanks, with Macys, Salesforce set to round out the reporting season",Yahoo,"The gush of second quarter earnings reports is beginning to slow to a trickle, and with most of the reports in, the results have been mostly positive."
2025-09-01,Snowflake (SNOW) Soars 21% on Highly Optimistic Outlook,Yahoo,We recently published 10 Stocks With Double-Digit to 100% Upside in Just a Week. Snowflake Inc. (NYSE:SNOW) is one of the worst performers on Friday. Snowflake Inc. saw its share prices climb by 21.26 percent week-on-week as investor sentiment was boosted by an impressive earnings performance in the second quarter and a highly optimistic growth […]
2025-09-02,Tredence Recognized as a Leader in Everest Group Data and AI Services Specialists - North America PEAK Matrix® Assessment 2025,Yahoo,"Tredence, a global leader in data science and AI solutions, has been recognized as a Leader and a Star Performer in Everest Groups Data and AI Services Specialists – North America PEAK Matrix® Assessment 2025."
2025-09-04,"GitLab Stock Drops as CFO Leaves for Snowflake, Offsetting Solid Results",Yahoo,"GitLabs CFO is leaving the company to take the same job at Snowflake, and shares of the software security platform dropped."
2025-09-09,AI analytics platforms are wind in our sails: Snowflake CEO,Yahoo,"All the way from the 2025 Goldman Sachs Communacopia and Technology Conference, Snowflake (SNOW) CEO Sridhar Ramaswamy sits down with Yahoo Finance executive editor Brian Sozzi to talk extensively about the companys development and deployment of AI service products, the companys business growth, and the narratives around the next generation of artificial intelligence technology, especially coming out of countries like China. To watch more expert insights and analysis on the latest market action, check out more Market Domination."
