date,headline,source,summary
2024-10-19,"Warren Buffett Recently Sold $800 Million Worth of This Artificial Intelligence (AI) Stock, While Buying Another $345 Million Worth of His Favorite Stock",Yahoo,Warren Buffetts Berkshire Hathaway investment company has been very active in the stock market lately.
2024-10-19,"Microsoft Stock Removed From Top Pick List. Plus, Airbnb, Snowflake, and More.",Yahoo,"Wall Street analysts weigh in on Microsoft, J.B. Hunt Transport Services, Airbnb, Snowflake, and Taiwan Semiconductor Manufacturing."
2024-10-20,3 Top Tech Stocks That Could Make You a Millionaire,Yahoo,"Snowflake, Datadog, and Zscaler are all potential multibaggers for patient investors."
2024-10-20,"Snowflake Inc. (SNOW) Navigates Investor Challenges Amid Strong AI Data Cloud Performance, Viewed as a Key Player in Next Wave of Generative AI Investments",Yahoo,"We recently compiled a list of the 20 Trending AI Stocks on Latest News and Ratings. In this article, we are going to take a look at where Snowflake Inc. (NYSE:SNOW) stands against the other trending AI stocks. S&P 500 to Reach 6,000 by Year-End Amid AI Boom and Earnings Growth Joining CNBC’s Squawk Box to […]"
2024-10-20,An Unconventional Case For Being Bullish On Snowflake,SeekingAlpha,"Financial writer evaluates Snowflakes high P/E ratio, sees potential despite concerns, drawing comparisons to Amazons success."
2024-10-20,These Top Tech Stocks Are Down 30% to 50% in 2024. Is It Time to Buy?,Yahoo,These companies share prices are discounted considering the long-term potential in semiconductors and cloud computing.
2024-10-24,Greek Mythology Reveals More About Oracle Than 10-Ks And Analyst Calls,SeekingAlpha,Oracle goes overboard in trying to show the world Snowflake is no match for it. Click here to read why Iâm on the fence with ORCL stock.
2024-10-24,Why Snowflake Inc. (SNOW) Dipped More Than Broader Market Today,Yahoo,"Snowflake Inc. (SNOW) closed the most recent trading day at $113.60, moving -1.65% from the previous trading session."
2024-10-27,Snowflake Inc. (SNOW): Among the Best Stocks to Buy for High Returns in 2024,Yahoo,"We recently compiled a list of the 8 Best Stocks to Buy for High Returns in 2024. In this article, we are going to take a look at where Snowflake Inc. (NYSE:SNOW) stands against the other stocks to buy for high returns. The broader market reached new record highs on October 11, driven by financial stocks […]"
2024-10-28,Palantir Q3 Preview: Path To $61 Is Possible,SeekingAlpha,Palantir is expected to grow its revenue between $697M and 701M for Q3 FY24. Click here to find out why Im upgrading PLTR stock to a buy.
2024-10-28,"Snowflake to Announce Financial Results for the Third Quarter of Fiscal 2025 on November 20, 2024",Yahoo,"No-Headquarters/BOZEMAN, Mont., October 28, 2024--Snowflake (NYSE: SNOW), the AI Data Cloud company, today announced it will release its financial results for the third quarter of fiscal year 2025, which ends October 31, 2024, following the close of the U.S. markets on Wednesday, November 20, 2024. Snowflake will host a conference call to discuss the financial results."
2024-10-30,Why Snowflakes Value Keeps Growing,SeekingAlpha,"Snowflakeâs projected revenue growth, high-value client acquisition, and expanding market presence drive long-term potential. Learn more on SNOW stock here."
2024-10-30,Jefferies: Snowflake Inc. (NYSE:SNOW) Is A Crowded Short Software Stock Among Institutional Investors,Yahoo,"We recently made a list of Jefferies’ Top Crowded Software Short Positions: Top 9 Stocks. In this piece, we will take a look at where Snowflake Inc. (NYSE:SNOW) ranks on the list of crowded software short positions. With the close of 2024 approaching fast, artificial intelligence continues to set the narrative on Wall Street. The […]"
2024-10-30,Baron Global Advantage Fund Q3 2024 Shareholder Letter,SeekingAlpha,"Baron Global Advantage Fund (I) gained 5.6% during the third quarter, compared to the 6.6% gain for benchmark index. Click here to read the full fund letter."
2024-10-30,"Clearwater Analytics, Snowflake enter data partnership",Yahoo,The collaboration will integrate Clearwater Analytics’ data with Snowflake’s AI Data Cloud.
2024-10-31,Is It Worth Investing in Snowflake (SNOW) Based on Wall Streets Bullish Views?,Yahoo,"Based on the average brokerage recommendation (ABR), Snowflake (SNOW) should be added to ones portfolio. Wall Street analysts overly optimistic recommendations cast doubt on the effectiveness of this highly sought-after metric. So, is the stock worth buying?"
2024-11-04,Is Snowflake Inc. (SNOW) Set to Explode in 2025?,Yahoo,"We recently compiled a list of the 10 Stocks Set to Explode in 2025. In this article, we are going to take a look at where Snowflake Inc. (NYSE:SNOW) stands against the other stocks set to explode in 2025. “Big Technology are The New Defensives” Strategist Says As the Magnificent Seven continues to release earnings for […]"
2024-11-06,Snowflake: Riding The Avalanche Of Innovation,SeekingAlpha,I initiate Snowflake (SNOW) coverage with a Strong Buy rating due to its strong revenue growth potential and compelling value proposition despite recent...
2024-11-10,Is Snowflake Inc. (NYSE:SNOW) Potentially Undervalued?,Yahoo,Snowflake Inc. ( NYSE:SNOW ) saw a double-digit share price rise of over 10% in the past couple of months on the NYSE...
2024-11-12,Snowflake Expands Capabilities for Enterprises to Deliver Trustworthy AI into Production,Yahoo,"No-Headquarters/BOZEMAN, Mont., November 12, 2024--Snowflake (NYSE: SNOW), the AI Data Cloud company, today announced at its annual developer conference, BUILD 2024, new advancements that accelerate the path for organizations to deliver easy, efficient, and trusted AI into production with their enterprise data. With Snowflake’s latest innovations, developers can effortlessly build conversational apps for structured and unstructured data with high accuracy, efficiently run batch large language mo"
2024-11-14,Google Parent Alphabet Sold 79% of Its Stake in Snowflake and Is Piling Into This Supercharged Artificial Intelligence (AI) Stock Instead,Yahoo,Shares of cloud-data warehousing stock Snowflake were significantly pared down in the third quarter in favor of an up-and-coming customer relationship management (CRM) company.
2024-11-15,"My Size, Inc. (MYSZ) Reports Q3 Loss, Misses Revenue Estimates",Yahoo,"My Size (MYSZ) delivered earnings and revenue surprises of 43.86% and 8.05%, respectively, for the quarter ended September 2024. Do the numbers hold clues to what lies ahead for the stock?"
2024-11-18,Wall Street Bulls Look Optimistic About Snowflake (SNOW): Should You Buy?,Yahoo,"The average brokerage recommendation (ABR) for Snowflake (SNOW) is equivalent to a Buy. The overly optimistic recommendations of Wall Street analysts make the effectiveness of this highly sought-after metric questionable. So, is it worth buying the stock?"
2024-11-19,Could Snowflake Inc. (SNOW) Grow 10x Over the Next 3 Years?,Yahoo,"We recently compiled a list of the 8 Stocks That Could 10X Over the Next 3 Years. In this article, we are going to take a look at where Snowflake Inc. (NYSE:SNOW) stands against the other stocks that could 10x over the next 3 years. The New Presidency and The Future of Big Tech The new […]"
2024-11-19,Snowflake (SNOW) Reports Earnings Tomorrow: What To Expect,Yahoo,Data warehouse-as-a-service Snowflake (NYSE:SNOW) will be announcing earnings results tomorrow after market close. Here’s what to expect.
2024-11-20,"Nvidia Q3 earnings, Fed commentary: What to Watch",Yahoo,"Asking for a Trend anchor Josh Lipton details the key events investors will be watching tomorrow, Wednesday, November 20. Nvidia (NVDA) takes the spotlight as it prepares to release its third quarter earnings results, with market participants eager to see if the company can maintain its growth trajectory. Other notable companies reporting include TJX Companies (TJX), Palo Alto Networks (PANW), Target (TGT), Snowflake (SNOW), Williams-Sonoma (WSM), and NIO (NIO). Meanwhile, the financial world will hear commentary from Federal Reserve governors Lisa Cook, Michelle Bowman, and Boston Fed President Susan Collins. Their speeches will provide insights into the central banks monetary policy and economic outlooks. To watch more expert insights and analysis on the latest market action, check out more Asking for a Trend here. This post was written by Angel Smith"
2024-11-20,Snowflake Earnings Are Coming. Can the Stock Stage a Comeback?,Yahoo,"Snowflake  stock has fallen by about $100 this year.  Analysts surveyed by FactSet expect the software company to post earnings of 15 cents a share on revenue of $899 million in the third quarter.  Earlier this month,  Palantir Technologies  and  Cisco Systems  both reported better-than-expected financials for their latest quarters and increased their respective outlooks for the year, citing strong AI technology demand."
2024-11-21,"Snowflake shares surge on rosy forecast, AI deal with Anthropic",Yahoo,"The company, whose shares have fallen 35% this year, is on track for its best day since going public in 2020.  The Bozeman, Montana-based companys results come months after Sridhar Ramaswamy took over as CEO, having previously spearheaded Snowflake’s AI strategy as SVP of AI, and analysts have been since watching how the firms AI efforts are progressing under the new leadership.  Snowflake announced a partnership with Anthropic on Wednesday, which will allow its customers to enhance their AI applications using Anthropics large language models on Snowflakes cloud-based data platforms."
2024-11-22,Snowflake Stock Has Best Day Ever After Earnings. It May Mark the End of  the Nvidia Powered Chip Trade.,Yahoo,"Snowflake stock was rising Thursday after a strong earnings report, while Nvidia stock was in the red."
2024-11-22,Why Is Datadog (DDOG) Stock Rocketing Higher Today,Yahoo,"Shares of cloud monitoring software company Datadog (NASDAQ:DDOG) jumped 7.3% in the afternoon session after data analytics software provider Snowflake (NYSE:SNOW) reported impressive third-quarter results, which surpassed analysts revenue, profit, and earnings expectations. The strong result is boosting sentiment in the software as a service (SaaS) space. Snowflake is particularly a read through for Datadog because both go to market with software consumption models, which means their revenue"
2024-11-26,Did Warren Buffett Dump This Artificial Intelligence (AI) Stock Too Soon? Its Up 26% Since Berkshire Hathaway Hit the Sell Button.,Yahoo,"Sometimes, even the best investors in the world struggle to time the market."
2024-11-26,From Data To Insights: Snowflakes AI Evolution And Investment Potential,SeekingAlpha,Snowflake aims to boost revenue with the new CEO and AI enhancements to compete with Databricks while partnering with Anthropic for advanced AI offerings.
2024-12-03,Analyst Boosts Snowflake (SNOW) Price Target Amid ‘Next Phase’ of AI Revolution,Yahoo,"We recently published a list of Top 10 AI Stocks on Investors’ Radar These Days. In this article, we are going to take a look at where Snowflake Inc. (NYSE:SNOW) stands against other top AI stocks on investors’ radar these days. The debate around AI systems hitting a “data wall” or plateau is heating up […]"
2024-12-04,Palantir: Long Way Down,SeekingAlpha,"We warn investors of Palantir Technologies high valuation and potential for significant losses, urging caution. Click here for PLTR stock update."
2024-12-06,"Snowflake Beat Expectations in Q3, but This Is Why Id Still Avoid the Stock",Yahoo,"Its been a tough year for the data storage company, whose CEO retired unexpectedly in February, leading to a stock sell-off.  As more businesses move their operations to the cloud, especially with AI, therell be a need for not just data storage, but also for analytics and processing.  The stock rallied recently on news that the company beat expectations for revenue ($942 million versus $897 million) and adjusted earnings per share ($0.20 versus $0.15) in the third quarter, which ended Oct. 31."
2024-12-06,Snowflake Inc. (SNOW) Partners with Cloudera and AWS to Enhance AI Data Cloud and Multi-Cloud Strategies,Yahoo,"We recently compiled a list of the 10 AI News Investors Should Not Miss. In this article, we are going to take a look at where Snowflake Inc. (NYSE:SNOW) stands against the other AI stocks investors should not miss. During an appearance on CNBC’s Squawk Box Europe, Matt Calkins, CEO of Appian, discussed the outlook for […]"
2024-12-07,"Snowflake EVP Sells $2.7 Million in Shares, Stoking Questions About Valuation",Yahoo,Snowflake Insider Sale Raises Eyebrows as Stock Surges
2024-12-08,He Investigates the Internet’s Most Vicious Hackers—From a Secret Location,Yahoo,"In the increasingly dangerous world of cybercrime, Brian Krebs faces threats, manipulation and the odd chess challenge."
2024-12-08,Snowflake Insiders Placed Bullish Bets Worth US$15.5m,Yahoo,Quite a few insiders have dramatically grown their holdings in Snowflake Inc. ( NYSE:SNOW ) over the past 12 months. An...
2024-12-10,Snowflake’s (SNOW) AI Push: Will It Overcome the Open-Table Format Challenge?,Yahoo,"We recently compiled a list of the 10 AI News That Broke The Internet. In this article, we are going to take a look at where Snowflake Inc. (NYSE:SNOW) stands against the other AI stocks. Should original content contributors be paid every time large language models use their work? OpenAI CEO Sam Altman believes they should, […]"
2024-12-10,Snowflake to phase out single-factor authentication by late 2025,Yahoo,The security policy change starts one year after a wave of attacks targeted more than 100 Snowflake customer environments without MFA.
2024-12-17,2025 Analyst Outlook: Julian Lin On Investing Amidst The Tech Bubble,SeekingAlpha,"AI hype is driving frothy valuations in tech, with key stocks showing clear signs of a bubble. Read more on what tech investors can expect in 2025."
2024-12-18,Databricks to Hit $62 Billion Valuation in New Funding Round,Yahoo,"(Bloomberg) -- Databricks Inc. is raising $10 billion in new funding, a massive cash injection that will bring the software maker’s valuation to $62 billion.Most Read from BloombergHow California Sees the World, and ItselfThe startup, which is among the world’s most highly valued closely held companies, “intends to invest this capital towards new AI products, acquisitions, and significant expansion of its international go-to-market operations,” according to a statement released Tuesday. The capi"
2024-12-18,Snowflake Sees 17% Upside as Jefferies Upgrades Price Target to $200,Yahoo,Cloud Giant Snowflake Gets Price Upgrade Amid Analyst Divides
2024-12-20,2 Technology Stocks That Could Help Make You a Fortune,Yahoo,"Technology stocks have delivered healthy gains to investors in 2024 despite bouts of volatility, which is evident from the 14% gains clocked by the Nasdaq-100 Technology Sector index so far this year, though it is worth noting that the index has underperformed the S&P 500 indexs 27% gains.  For instance, the Nasdaq-100 Technology Sector has gained an impressive 364% over the past decade as compared to the 199% jump clocked by the S&P 500 over the same period.  Data cloud platform provider Snowflake (NYSE: SNOW) has witnessed a solid surge in its stock price lately thanks to the companys improving growth prospects that point toward better financial performance in the future."
2024-12-20,"Snowflake Declines 18% in a Year: Buy, Sell or Hold the Stock?",Yahoo,SNOW is benefiting from expanding capabilities and strong AI partnerships amid intense competition and a stretched valuation.
2024-12-23,Snowflake Inc. : Snowflake,Finnhub,"Its impossible not to talk about Snowflake as the year wraps up. The company, which operates in the field of data and artificial intelligence, has not benefited from the investor enthusiasm for this..."
2024-12-30,Snowflake Inc. (SNOW) Gains Momentum with AI-Driven Innovations; Loop Capital Raises Price Target to $205 on Growth Potential,Yahoo,"We recently compiled a list of the 9 Important AI News and Ratings on Investors’ Radar. In this article, we are going to take a look at where Snowflake Inc. (NYSE:SNOW) stands against the other AI stocks. Artificial intelligence has become a dominant force in the stock market, driving the performance of top companies and capturing […]"
2025-01-03,"Oracle, Snowflake Lead AI Charge: Wedbush Sees Generative AI Driving 2025 Software Boom",Yahoo,"Wedbush highlights Oracle, Snowflake, and others as top AI software plays, citing generative AI adoption surge"
2025-01-03,"Software AI Stocks Start Off 2025: Palantir Falls, SoundHound Wavers, Snowflake Climbs",Yahoo,Palantir stock and other software AI stocks turned in mixed results on the first day of 2025 trading. SoundHound stock wavered.
