date,headline,source,summary
2025-09-09,September Doesn’t Need to Be Scary for Stocks. This Year Could Prove It.,Yahoo,"September has a fearsome reputation in the market, but it can be easy to dismiss concerns about monthly performance as superstitious or “astrological,” as Trivariate Research Founder Adam Parker puts it.  When it comes to  performance over the year, the index is a Capricorn, with January the winner historically."
2025-09-10,"Snowflake (SNOW): Buy, Sell, or Hold Post Q2 Earnings?",Yahoo,"The past six months have been a windfall for Snowflake’s shareholders. The company’s stock price has jumped 55.3%, hitting $229.20 per share. This was partly due to its solid quarterly results, and the run-up might have investors contemplating their next move."
2025-09-11,C3.ai Trades Near 52-Week Low: Right Time to Buy the Stock?,Yahoo,"The AI stock trades near its 52-week low as soft results, leadership changes and withdrawn guidance weigh on investor confidence."
2025-09-15,Here’s what sets apart the top companies most ready to thrive in the age of AI — and U.S. tech is leading the way,Yahoo,Also: All the news and watercooler chat from Fortune.
2025-09-17,What Catalysts Are Shifting the Narrative for Snowflake After Recent Analyst Upgrades,Yahoo,"Snowflakes consensus analyst price target has inched slightly higher, rising from $260.62 to $263.43 following the companys latest quarterly results. This modest increase reflects positive sentiment among analysts, as it is driven by robust revenue growth and expanding opportunities across Snowflakes platform. Stay with us to learn how you can stay on top of the evolving story behind this innovative data giant. What Wall Street Has Been Saying Following Snowflake’s latest quarterly report,..."
2025-09-18,Snowflake Named 2025 Strategic Partner of the Year by Morgan Stanley,Yahoo,"No-Headquarters/BOZEMAN, Mont., September 18, 2025--Snowflake (NYSE: SNOW), the AI Data Cloud company, today announced that it has been named Morgan Stanley’s 2025 Strategic Partner of the Year during the Firms 23rd Tech Week reception. The prestigious award recognizes Snowflakes transformative contributions in helping to power Morgan Stanleys data-driven initiatives and accelerating AI innovation across one of the worlds leading financial services firms."
2025-09-23,AI Market Could Soar 6 Times by 2030: 2 Brilliant AI Stocks to Buy Now (Hint: Not Nvidia),Yahoo,Long-term investors should pick stakes in companies building global AI infrastructure and enterprise data ecosystems.
2025-09-25,"Snowflake Announces Snowflake for Startups to Help Companies Build, Launch and Scale Enterprise-Grade AI Innovations",Yahoo,"MENLO PARK, Calif., September 24, 2025--Snowflake (NYSE: SNOW), the AI Data Cloud company, today unveiled Snowflake for Startups at the grand opening of its Silicon Valley AI (SVAI) Hub. An evolution of the Powered by Snowflake program, Snowflake for Startups serves as a launchpad to help founders build and scale enterprise-grade AI applications on Snowflake’s AI Data Cloud, delivering new product capabilities, strategic relationships with key venture capital firms and coworking opportunities."
2025-09-27,"Blend Achieves Snowflake Premier Partner Status, Unlocking Next Phase of Joint Innovation",Yahoo,"Blend today announced it has achieved Snowflake Premier Partner Status, a designation reserved for partners who demonstrate exceptional technical expertise and proven customer success on the Snowflake Data Cloud. This recognition enhances co-creating value for clients by combining Snowflakes innovation with Blends expertise to deliver faster outcomes, stronger solutions, and measurable business impact."
2025-09-29,"Snowflake Insiders Sell US$3.6m Of Stock, Possibly Signalling Caution",Yahoo,"Many Snowflake Inc. ( NYSE:SNOW ) insiders ditched their stock over the past year, which may be of interest to the..."
2025-09-30,UiPath Stock Rises Sharply. What OpenAI and Nvidia Have to Do With It.,Yahoo,UiPath  shares jumped Tuesday after the automation software company unveiled a slew of partnerships with several heavyweights in artificial intelligence.  The company said it was working with OpenAI to integrate the ChatGPT maker’s most advanced artificial-intelligence models with enterprise customer workflows.  UiPath  announced a separate collaboration with  Snowflake  to link UiPath’s Agentic Automation platform with  Snowflake’s  suite of Cortex-branded AI tools.
2025-10-01,Domo Recognized in Snowflakes Fourth Annual Modern Marketing Data Stack Report as One to Watch,Yahoo,"Domo (Nasdaq: DOMO) today announced that it has been recognized as a Business Intelligence (BI) One to Watch in Snowflakes annual report, The Modern Marketing Data Stack 2026: How Marketers Become Agents of Change in an AI-Driven World."
2025-10-01,Kipi.ai Delivers Marketing Mix Modeling and Analytics App on Snowflake AI Data Cloud,Yahoo,"NEW YORK & LONDON & MUMBAI, September 30, 2025--Kipi.ai Delivers Marketing Mix Modeling and Analytics App on Snowflake AI Data Cloud."
2025-10-02,Snowflake Unveils Cortex AI for Financial Services: Enterprise-Ready AI Built to Scale,Yahoo,"No-Headquarters/BOZEMAN, Mont., October 02, 2025--Snowflake (NYSE: SNOW), the AI Data Cloud company, today announced Snowflake Cortex AI for Financial Services, a comprehensive suite of AI capabilities and partnerships that empower financial services companies to unify their financial data ecosystem and securely deploy AI models, apps, and agents with that data — while offering rigorous security and compliance controls required in regulated industries."
2025-10-02,SAAS NORTH Returns To Ottawa This November 5-6 To Mark 10 Years of Tech Innovation and Growth,Yahoo,"VANCOUVER, British Columbia, October 02, 2025--SAAS NORTH, Canada’s longest-running and largest gathering of Software as a Service (SaaS), AI-native, and cloud software scaleup companies, celebrates a decade of growth and tech innovation this November 5-6, 2025, at its 10th annual conference. Taking place at Ottawa’s Rogers Centre, this year’s conference will welcome over 2,000 attendees and 800 leading SaaS companies spanning the two-day event, with participants coming from all across North Ame"
2025-10-03,"Dow Jones Futures Rise, Tesla Tries To Steady; Jobs Report Shut Down",Yahoo,Futures rise with Tesla trying to steady. Broadcom leads AI stocks flashing buy signals. The jobs report has been suspended due to the government shutdown.
2025-10-03,"UiPath (PATH) Is Up 5.4% After AI Partnerships with NVIDIA, OpenAI, Google and Microsoft Announced",Yahoo,"In late September 2025, UiPath announced a series of collaborations with leading technology firms, including NVIDIA, OpenAI, Google, Microsoft, and Snowflake, introducing advanced AI capabilities and major upgrades to its automation platform targeting high-trust enterprise workflows and industry-specific solutions. These developments highlight UiPath’s role in integrating frontier AI models and conversational agents into automation tools, making it easier for businesses to rapidly scale..."
2025-10-05,UiPath Stock Jumps on Collaboration With Nvidia and Others. Is It Time to Buy the Stock?,Yahoo,UiPath stock could have a strong upside if these partnerships can help reaccelerate revenue growth.
2025-10-07,Snowflake vs. Amazon: Which Cloud Data Stock Has an Edge Now?,Yahoo,SNOWs rapid platform expansion and AMZNs AWS momentum set the stage for a fierce race in the booming cloud analytics market.
2025-10-07,Are C3.ais High-Profile Partners Enough to Offset Missteps?,Yahoo,"Can AIs deep ties with Microsoft, AWS and Google Cloud offset execution hiccups and revive its fiscal 2026 momentum?"
2025-10-08,Palantir Foundry: Driving the Next Wave of Enterprise Intelligence,Yahoo,"Palantirs Foundry platform powers a 93% surge in U.S. commercial revenues, cementing its role as the engine behind PLTRs enterprise AI expansion."
2025-10-09,Snowflake Stock Rallies After Analyst Hikes Price Target,Yahoo,Snowflake stock rallied Wednesday following positive analyst commentary about the enterprise software company.
2025-10-09,SnapLogic Named a Leader in Snowflake’s 2026 Modern Marketing Data Stack Report,Yahoo,"SAN MATEO, Calif., October 09, 2025--SnapLogic, the Agentic Integration Company, today announced that it has been named a Leader in the Modern Marketing Data Stack 2026 report from Snowflake, the AI Data Cloud company. The annual report evaluates technology providers within the Snowflake AI Data Cloud ecosystem that are shaping the future of marketing data and AI-powered transformation."
2025-10-09,"Dow Jones Futures Rise; Nvidia Chipmaker Taiwan Semi Sales, Delta Air Earnings Strong",Yahoo,Taiwan Semiconductor sales were strong after Nvidia CEO Huang lifted the S&P 500 to highs. Delta Air rose on earnings.
2025-10-10,Why UiPath (PATH) Stock Is Up Today,Yahoo,Shares of automation software company UiPath (NYSE:PATH) jumped 12.3% in the afternoon session after the stock extended its positive momentum as the company announced a major push into advanced artificial intelligence through an expanded platform and several key partnerships.
2025-10-10,Datadog Stock Earns Relative Strength Rating Upgrade,Yahoo,"On Thursday, Datadog reached an important technical milestone, seeing its Relative Strength (RS) Rating jump into the 80-plus percentile with an improvement to 83, up from 80 the day before.  This proprietary rating measures market leadership by using a 1 (worst) to 99 (best) score that indicates how a stocks price action over the last 52 weeks matches up against other publicly traded companies.  Is Datadog Stock A Buy?"
