date,headline,source,summary
2024-10-18,"Is Tesla, Inc. (TSLA) the Best High Growth Lithium Stock to Invest In?",Yahoo,"We recently compiled a list of 10 High Growth Lithium Stocks to Invest In. In this article, we will look at where Tesla, Inc. (NASDAQ:TSLA) ranks among high growth lithium stocks to invest in. Lithium Prices Drop but Demand Signals Long-Term Gains Rio Tinto announced its acquisition of U.S.-based Arcadium for $6.7 billion, positioning itself […]"
2024-10-18,"iPhone 16 in China, Tesla probe, Intel-Altera: Stocks in Focus",Yahoo,"Apple (AAPL) iPhone 16 sales in China grew by 20% in its first three weeks on the market, according to Counterpoint Research data. The National Highway Traffic Safety Administration (NHTSA) is leading a probe into Teslas (TSLA) Full Self-Driving technology in its EVs following several crash reports. Tesla is currently expected to report its third quarter earnings results next week. Intel (INTC) aims to sell a minority stake in subsidiary chipmaker Altera Corporation. Seana Smith and Brad Smith report on these top trending stocks and stories. To watch more expert insights and analysis on the latest market action, check out more Morning Brief here. This post was written by Luke Carberry Mogan."
2024-10-18,Billionaire Says Global Conditions Are Treacherous And Getting Worse: Our Approach,SeekingAlpha,JPMorgan Chase CEO Jamie Dimon emphasized tremendous geopolitical risks facing the economy and market. Find out what strategies to consider for your portfolio.
2024-10-19,Teslas $60 Billion Setback: The Cybercab No-Show,SeekingAlpha,"The main attraction at Teslaâs We, Robot event was supposed to be the Cybercab, a two-seat, fully autonomous vehicle thatâs long been central to justifying Teslaâs gravity-defying valuation."
2024-10-19,"If I Could Only Buy 1 Magnificent Seven Stock in October, This Would Be It",Yahoo,"Theres one Magnificent Seven stock that appears to be falling out of favor with investors, but I think its still a good buy."
2024-10-19,Should You Buy Tesla Stock Before Oct. 23?,Yahoo,"Investing is never about one day, but one day can be exciting."
2024-10-19,"AI hearing aids, investing in womens sports: Asking for a Trend",Yahoo,"On todays episode of Asking for a Trend, Host Josh Lipton breaks down some of the top stories and themes of the trading week. Daymond John, FUBU and the Shark Group founder, and Brandon Sawalich, Starkey CEO, discuss how Starkey is using AI to revolutionize the hearing aid industry. John explains that he uses Starkey hearing aids, and explains, theyre way more than something that I just use to amplify hearing, which is probably the most important part. But now I can use them for so much more. Sawalich explains that Starkey is redefining hearing aids and eliminating the stigma of what hearing aids is. He continues, Its not about amplifying sound. You have a mini computer inside your ear where basically the ear is the new wrist, and helping people be the best selves they can be each and every day. The technology can be used for things like listening to music, sending messages, and translating languages. Sawalich even calls it your personal assistant. Womens sports have captured investors’ attention as WNBA viewership soars to a record high amid the WNBA Finals. Fortuna Investments CEO Justus Parmar breaks down why the venture capital firm is investing in women’s sports. Parmar outlines his view that sports is an emerging investment area with women’s sport representing an especially attractive investment opportunity. “Its a very unique asset class. So youve got the big four mens clubs. Those are kind of the blue-chip stocks of the portfolio. Youve got mens baseball, mens basketball, mens football, obviously, and NHL hockey… When it comes to womens sports, its much like a, I dont want to say a venture or a growth investment, but you know, some people think its underrepresented.” Finally, Josh Lipton breaks down what to watch next week, from Tesla (TSLA) earnings to fresh housing data. This post was written by Melanie Riehl"
2024-10-19,Tesla Stock Falls After Lackluster Robotaxi Event: Time to Buy the Dip?,Yahoo,The company has a lot of promises around AI and robotics. It is unclear whether they will be fulfilled.
2024-10-19,"Tesla earnings, Fedspeak, home sales: What to Watch Next Week",Yahoo,"Tesla (TSLA) kicks off the earnings season for Magnificent Seven tech names next week. Other notable companies publishing their quarterly results include Coca-Cola (KO), Amazon (AMZN), and General Motors (GM) Federal Reserve Bank of Dallas President Lorie Logan and Philadelphia Fed President Patrick Harker are set to deliver commentary next week as well. On the housing front, US existing home sales and new home sales are also due out. To watch more expert insights and analysis on the latest market action, check out more Asking for a Trend here. This post was written by Luke Carberry Mogan."
2024-10-19,"Stocks to watch next week: Tesla, Lloyds, LOréal, Coca-Cola and Unilever",Yahoo,Earnings preview of key companies reporting next week and what to look out for.
2024-10-23,Tesla Stock Edges Lower Ahead of Earnings. It Needs a Big Beat.,Yahoo,"Tesla stock was trading between gains and losses in early trading ahead of the company’s highly anticipated quarterly earnings report due in the afternoon.  Coming into Wednesday’s trading, Tesla stock has dropped for four consecutive days, leaving shares down about 12.3% this year.  Investors wanted to see some stability in profit margins and didn’t get it."
2024-10-23,Heres Why Tesla (TSLA) Is a Great Buy the Bottom Stock Now,Yahoo,"After losing some value lately, a hammer chart pattern has been formed for Tesla (TSLA), indicating that the stock has found support. This, combined with an upward trend in earnings estimate revisions, could lead to a trend reversal for the stock in the near term."
2024-10-24,Asia shares fall on US election anxiety; Tesla earnings provide some cheer,Finnhub,"Asian shares fell on Thursday, while the dollar held near three-month highs and U.S. yields rose as uncertainty over the U.S. election outcome kept markets on edge, though Teslas forecast-topping..."
2024-10-24,Tesla earnings: Are Full-Self Driving functions spurring demand?,Yahoo,"Tesla (TSLA) stock is climbing higher in extended-hours trading after reporting mixed third quarter earnings, missing revenue estimates ($25.18 billion vs. $25.43 billion expected) and posting adjusted earnings of $0.72 per share ($0.60 was expected). The EV maker stated it is on track for slight growth in EV deliveries for 2024, while projecting production on affordable EVs to begin in 2025. This just confirms what theyve been saying, which is were going to get affordable cars in the first half of next year, RBC Capital Markets Global Autos Analyst Tom Narayan tells Julie Hyman and Josh Lipton, adding: We all thought we were going to see something at the robotaxi event about this, but I think folks are just comforted to know that it is coming. Everything is on track on the more affordable cars. Narayan discusses Teslas earnings print and what it is forecasting about the electric automakers margins: They did do some discounting and theyre going to try to get that growth number for the full year. So Q4 youre going to see some price-cutting. But if they can still do a 17% margin, X credits, thats a pretty strong signal that... they can continue to hold on to margins. Tesla reported 462,890 EV deliveries, just below Wall Street consensus estimates 463,897. Narayan believes Teslas Full Self-Driving upgrades and pivots to autonomous driving could be boosting its demand. The services number was pretty high. So I do wonder if the services attach rate, especially FSD, might be making making an impact here. Folks could be thinking Im going to buy this car because of FSD, Narayan says. That may be catalyzing demand. And kind of even though the models are maybe a little long in the tooth... FSD is something, something special here that might be whats happening. To watch more expert insights and analysis on the latest market action, check out more Market Domination Overtime here. This post was written by Luke Carberry Mogan."
2024-10-24,Tesla Surprises Wall Street With Strong Third-Quarter Results,Yahoo,The robust performance comes after a tumultuous start to the year in which Tesla’s profit fell for two straight quarters.
2024-10-24,"Tesla: Sell The Rally, Autonomous Robots Do Not Justify Sky-High Valuation",SeekingAlpha,"The underwhelming demonstrations at the âWe, Robotâ event have culminated in a mismatch between real progress and Tesla, Inc. stockâs sky-high valuation. Learn more on TSLA stock here."
2024-10-24,Tesla shares pop 12% in Frankfurt on strong sales forecast,Finnhub,"Teslas Frankfurt-listed shares rose 12% to a two-week high on Thursday, as a strong sales forecast cheered investors. CEO Elon Musk on Wednesday forecast vehicle sales would grow by..."
2024-10-24,How Did Tesla Boost Its Profit Margins?,Yahoo,"Tesla blew past Wall Streets forecasts for profit margins.  “Our cost of goods sold per vehicle came down to its lowest level ever at about $35,100,” reads part of Tesla’s earnings release.  Tesla said its pickup produced positive gross profits for the first time in the third quarter."
2024-10-24,"Justice Dept warns Musks super PAC over million dollar giveaways, CNN reports",Finnhub,"The U.S. Justice Department has sent a letter to Elon Musks super PAC warning that the billionaire Tesla CEOs $1 million giveaways may violate federal law, CNN reported on Wednesday, citing people..."
2024-10-24,Tesla Q3: Elon Musk Teaches The Market A Lesson,SeekingAlpha,"Tesla, Inc.s strong Q3 earnings beat expectations, with impressive growth in free cash flow and margins. Read my updated look at TSLA stock prospects now."
2024-10-24,"Tesla posts surprise $2.17 billion third-quarter profit, up 17.3% from a year ago",Finnhub,"DETROIT — Tesla’s third-quarter net income rose 17.3% compared with a year ago as its electric vehicle sales rose. The Austin, Texas, company said Wednesday that it made $2.17 billion from..."
2024-10-24,"Tesla promises paid robotaxis next year, but significant hurdles remain",Yahoo,"Tesla CEO Elon Musk on Wednesday said the electric vehicle maker will roll out driverless ride-hailing services to the public in California and Texas next year, a bold claim likely to face significant regulatory and technical challenges.  We think that well be able to have driverless Teslas doing paid rides next year, Musk said on Teslas quarterly earnings call.  His statement doubled down and expanded on a pledge he made at Teslas robotaxi unveiling two weeks ago, where he said he expected to roll out unsupervised self-driving in certain Tesla vehicles in 2025."
2024-10-24,Why Lucid Stock Fell Today,Yahoo,Interest rates and the anticipation of big news from Tesla played roles in Lucid stocks moves Wednesday.
2024-10-25,"These Stocks Are Moving the Most Today: Tesla, Capri, Western Digital, Spirit Airlines, Deckers, Coursera, and More",Yahoo,"Tesla stock moves lower after shares of the electric-vehicle maker surged 22% on Thursday, a judge grants the FTC request to block Capri’s merger with Tapestry, Western Digital swings to a quarterly profit, and Spirit Airlines plans to cut staff and sell 23 airplanes."
2024-10-25,"Pomerantz Law Firm Investigates Claims On Behalf of Investors of Tesla, Inc. - TSLA",Finnhub,"NEW YORK, Oct. 25, 2024 /PRNewswire/ -- Pomerantz LLP is investigating claims on behalf of investors of  Tesla, Inc.  . Such investors are advised to contact Danielle Peyton at..."
2024-10-25,S&P 500 Gains and Losses Today: Tesla Stock Leads the Index Higher as Earnings Impress,Yahoo,"The S&P 500 added 0.2% on Thursday, Oct. 24, 2024, following strong quarterly results from Tesla and a slew of other corporate earnings releases."
2024-10-25,"Nasdaq, S&P 500 Rise Amid Tesla Rally; Dow Falls",Yahoo,"Nasdaq, S&P 500 Rise Amid Tesla Rally; Dow Falls"
2024-10-25,Heres a look at Musks contact with Putin and why it matters,Finnhub,"WASHINGTON — Elon Musk, the billionaire owner of major government contractor SpaceX and key ally of Republican presidential nominee Donald Trump, has been in regular contact with Russian President..."
2024-10-25,Tesla Faces Major Risks In The Future,SeekingAlpha,"Tesla faces growing risks due to Elon Musks political alignment, impacting its primary markets and consumer perception negatively. See why TSLA stock is a Sell."
2024-10-26,VWs Scout Motors debuts 2 new EVs and a surprise range extender hybrid option,Yahoo,"The revived Scout Motors finally showed off its two upcoming electric adventure vehicles, along with a bonus surprise."
2024-10-26,Tesla closes trading week convincingly in the green after impressive quarterly results,Finnhub,Copyright © BusinessAMBE 2023Key takeawaysTesla shares gained about 25 percent during the last two trading days of the week. Investors reacted very enthusiastically to the quarterly report....
2024-10-26,"Tesla Stock Rally Steamrolls Shorts, Erasing Year’s Gains in One Day",Yahoo,(Bloomberg) -- Tesla Inc.’s blowout earnings caught everyone off guard.Most Read from BloombergBooming Cambridge Exposes England’s Widening Wealth GapRobotaxis Are No Friend of Public TransportationArgentina Drug Trafficking Hotspot Sees Murders PlungeThe Tartarian CandidateOman Sees an Urban Future Distinct From Dubai and Abu DhabiBut it was the bears who paid the price this week. The electric-vehicle maker’s results delivered a gut-punch to short-sellers — investors who make money by betting t
2024-10-26,Chart of the Week: Taking a closer look at the Magnificent Seven,Yahoo,"This week, all members of the Magnificent Seven were back in the green after Teslas massive run Thursday. But looking closer into the year-to-date performance of the USs most valuable stocks highlights some things weve learned so far this year."
2024-10-26,"Musk, Putin and CEO Telephone Calls",Yahoo,"While some CEOs call other CEOs, Elon Musk’s call list reportedly extends to Vladimir Putin. Plus, Amazon’s grocery chief exits and The Information’s Stories of the Week."
2024-10-26,"S&P 500 Posts First Weekly Drop Since Early September as Materials, Health Care Weigh",Yahoo,"S&P 500 Posts First Weekly Drop Since Early September as Materials, Health Care Weigh"
2024-10-28,Best Growth Stocks To Buy And Research,DowJones,Best Growth Stocks To Buy And Research
2024-10-29,What happens as EU concludes investigation of Chinese-made EVs?,Finnhub,The European Union formally approved imposing tariffs on Chinese-made electric vehicles on Tuesday after an investigation that has divided the bloc and prompted retaliation from Beijing. ...
2024-10-29,"Elon Musk Admits Running Companies Hurts My Heart, But Sees No Other Option For Building The Future. I Never Wanted To Be CEO",Yahoo,"Elon Musk, known for his CEO roles at Tesla (NASDAQ:TSLA) and SpaceX and for his recent political engagements, has shared his thoughts on being a CEO many times. Despite his current status, Musk revealed that running companies is not something he ever aspired to. In a 2022 tweet, Musk wrote, Running companies hurts my heart but I dont see any other way to bring technology and design to fruition. I never wanted to be CEO – just wanted to work on product/technology. Bill Harris sounded like he"
2024-10-29,Tesla’s Growth to Come From ‘Multiple New Models’. The Stock Is Down.,Yahoo,Investors are still mulling over what Tesla CEO Elon Musk’s recent growth comments about 2025 mean for shares of the EV maker.
2024-10-29,Elon Musk predicts more robots than humans by 2040,Yahoo,"Tech billionaire CEO Elon Musk took the stage at the Saudia Arabia Future Investment Initiative conference, sharing his bold predictions for the future of autonomous vehicles. Musk stated that he expects unsupervised self-driving capabilities to be deployed in the US as soon as next year. Catalysts Anchor Seana Smith dives deeper into Musks remarks, addressing his outlook on Teslas (TSLA) cybertruck production, his plans for Starships to Mars, and his belief that there will be more robots than people worldwide by 2040. To watch more expert insights and analysis on the latest market action, check out more Catalysts here. This post was written by Angel Smith"
2024-10-29,Did Tesla Just Turn the Profit Corner?,Yahoo,"In retrospect, last years misery may have been worth it."
2024-10-29,"The Zacks Analyst Blog Meta, Tesla, Thermo Fisher Scientific and Food Comes From",Yahoo,"Meta, Tesla, Thermo Fisher Scientific and Food Comes From are included in this Analyst Blog."
2024-10-29,"Harris Or Trump? How The Next President Could Change The Game For Stocks, Taxes, And Inflation",SeekingAlpha,"If Trump wins, the market might experience a boost due to expectations of deregulation and business-friendly policies."
2024-10-30,Truth Social parent company Trump Media now worth more than Elon Musk’s X as Election Day nears,Yahoo,Truth Social stock market valuation is now greater than the estimated value of Elon Musk’s X as the the former presidents social media network soars ahead of Election Day.
2024-10-30,Has The Shyft Group (SHYF) Outpaced Other Auto-Tires-Trucks Stocks This Year?,Yahoo,Here is how The Shyft Group (SHYF) and Tesla (TSLA) have performed compared to their sector so far this year.
2024-10-30,"Dow Jones Futures Fall, Techs Rise; Google, Reddit Jump But Caterpillar, Eli Lilly, AMD Tumble",DowJones,"Dow Jones Futures Fall, Techs Rise; Google, Reddit Jump But Caterpillar, Eli Lilly, AMD Tumble"
2024-10-30,Elon Musk says Trumps economic plans will cause temporary hardship and tank the stock market,Yahoo,"Elon Musk is the richest person on the planet right now. That’s probably part of why he’s fine with former President Donald Trump’s economic plans causing, in his words, “temporary hardship” in the pursuit of a healthier economy years down the road."
2024-10-30,Dogecoin enjoys bump after Elon Musk boosts the crypto at Trump rally,Yahoo,Musks campaigning for Trump and references to an upcoming Department of Government Efficiency (D.O.G.E.) has pumped the cryptos price.
2024-10-30,How Kamala Harris is trying to use Elon Musk against Donald Trump,Yahoo,Donald Trumps closeness to the worlds richest man could be used against him. At least thats what the top super-PAC supporting Kamala Harris thinks.
2024-10-30,A lot rides on Big Tech earnings amid two busy weeks for markets,Yahoo,"With a slew of market-driving news set to greet investors over the next week, market strategists tell Yahoo Finance that what Big Tech earnings say about the fundamental story behind the stock market rally will matter most."
