date,headline,source,summary,category,directional_score
2025-07-25,4 Artificial Intelligence (AI) Stocks That Could Help Make You a Fortune,Yahoo,"The artificial intelligence (AI) build-out is far from over.  Data centers owned by Digital Realty are continuing to pop up, filled with components from Nvidia and Taiwan Semiconductor.  Amazon rents some of its data centers from Digital Realty.",Bullish,0.8
2025-07-29,Top 10 Income Funds From Eaton Vance,SeekingAlpha,"Discover Eaton Vances top closed-end funds offering reliable income, strong returns, and expert management.",Neutral,0.0
2025-07-29,Uber Or Unter? Where Could The Company Be In 20 Years?,SeekingAlpha,Explore Ubers future with 3 scenarios for 2045. Potential for gains or disruption makes it a buy for growth investors.,Neutral,0.0
2025-07-30,"UPS posts tepid results amid tariff, restructuring challenges",Yahoo,"UPS’s stock price slid Tuesday after it reported lower parcel volumes and difficulty cutting costs as it works to right-size its delivery network. The post UPS posts tepid results amid tariff, restructuring challenges appeared first on FreightWaves.",Neutral,0.0
2025-07-31,Big Tech to work with Trump administration to build digital health ecosystem,Yahoo,"The efforts will focus on two areas: creating a framework for patients and providers to easily share information, and creating more personal tools so patients can access resources needed to stay informed about their health.",Neutral,0.0
2025-07-31,"QMOM Is Struggling, Consider Other Options",SeekingAlpha,QMOM ETFs structure limits upside from top performers. See here to know why SPMO and MTUM ETFs outperform QMOM in momentum investing.,Neutral,0.0
2025-07-31,"Alphabets Recent Numbers Were Strong, but This Metric Could be a Red Flag",Yahoo,Alphabets growth may not be as solid as it looks.,Neutral,0.0
2025-07-31,"Big Tech earnings, Fed stays on hold, tariff deadline: 3 Things",Yahoo,"Here are three stories Wall Street is watching for Thursday, July 31. Meta (META) and Microsoft (MSFT) posted quarterly results that topped analysts expectations, sending futures higher. Apple (AAPL) and Amazon (AMZN) will post their reports after the market close. The Federal Reserve left rates unchanged at its July meeting. Chair Jerome Powells more hawkish tone has some investors questioning whether or not the Fed will cut in September. Traders are also looking for tariff headlines with President Trumps August 1 deadline quickly approaching. To watch more expert insights and analysis on the latest market action, check out more Morning Brief.",Neutral,0.0
2025-07-31,CMS partners with tech giants to enhance digital health framework in US,Yahoo,"The technology firms involved in the initiative include Amazon, Apple, Google, and OpenAI.",Bullish,0.85
2025-08-01,"Amazon posts strong Q2 growth, provides mixed guidance",Yahoo,"Amazon’s second quarter earnings beat Wall Street expectations, but the company provided mixed guidance for the third-quarter. The post Amazon posts strong Q2 growth, provides mixed guidance appeared first on FreightWaves.",Bullish,0.8
2025-08-01,Big Techs AI investments set to spike to $364 billion in 2025 as bubble fears ease,Yahoo,"Amazon, Alphabet, Microsoft, and Meta reported they were set to spend a cumulative $364 billion in their respective 2025 fiscal years, up from their prior estimates of around $325 billion.",Neutral,0.0
2025-08-01,Amazon Crushes Q2: Buy The Dip Or Regret It Later,SeekingAlpha,"Amazon Q2 25 results shine with double-digit growth in all segments. AWS, e-commerce, and ads thriveâdont miss this Strong Buy opportunity.",Bullish,0.85
2025-08-01,"These Stocks Are Moving the Most Today: Apple, Amazon, Figma, MicroStrategy, Coinbase, Reddit, Moderna, Fluor, and More",Yahoo,"Apple’s iPhone sales jump more than 13% in the tech giant’s fiscal third quarter, while Amazon stock falls on a weaker-than-expected forecast for third-quarter operating income.",Neutral,0.0
2025-08-02,What Moved Markets This Week,SeekingAlpha,"Wall Street faced its worst week since May amid weak jobs data, trade tensions, and a hawkish Federal Reserve.",Neutral,0.0
2025-08-02,Investing.com’s stocks of the week,Yahoo,"Investing.com -- Market sentiment soured in the latter part of the week, coming under significant pressure on Friday as investors digested the latest news, including signs of a weakening economy following the latest U.S. jobs numbers and President Trump’s updated tariffs.",Neutral,0.0
2025-08-02,"3 Growth Stocks to Invest $1,000 in Right Now",Yahoo,These 3 growth-oriented companies are all great choices for investors.,Neutral,0.0
2025-08-03,Microsoft: Dont Get Too Excited About Future Returns,SeekingAlpha,Discover why MSFTs upside might be limited despite strong earnings. Learn how peaked margins and valuation could impact future returns.,Neutral,0.0
2025-08-03,Amazon: Panic Selloff Could Be Short Lived (Rating Upgrade),SeekingAlpha,"Amazons latest earnings obliterated my previous concerns, mainly related to the impact of tariffs on its retail business.",Bullish,0.8
2025-08-04,Cash Windfall From Trump’s Tax Law Is Starting to Show Up at Big Companies,Yahoo,"The magnitude of the cash savings from this summer’s federal tax legislation is starting to take shape at America’s biggest companies.  AT&T  recently said it expected $1.5 billion to $2 billion in cash tax savings this year, due to provisions in the tax-and-spending law dubbed the One Big Beautiful Bill Act.  The high end of the range is equivalent to an 11% boost to analyst estimates of 2025 free cash flow before the law was enacted.",Neutral,0.0
2025-08-04,"DOVE LAUNCHES WOMENS WELLNESS RANGE, TURNING TMI INTO SUPERIOR CARE, AVAILABLE EXCLUSIVELY ON AMAZON",Yahoo,"Dove proudly unveils its first-ever Womens Wellness Range, an innovative lineup of life-stage tailored personal care products developed in close collaboration with gynecologists, menopause experts and dermatologists. Available exclusively in the Amazon U.S. store, the collection is just a search away for the millions of women already turning to Amazon for health and wellness essentials.",Bullish,0.75
2025-08-05,Weave Names Abhi Sharma as Chief Technology Officer,Yahoo,"LEHI, Utah, August 04, 2025--Weave (NYSE: WEAV), a leading all-in-one customer experience and payments software platform for small and medium-sized healthcare businesses, today announced the appointment of Abhi Sharma as the company’s Chief Technology Officer (CTO).",Neutral,0.0
2025-08-05,Oracle Stock Get Price Target Hike. Microsoft And Meta Driving Positive AI Infrastructure Sentiment,Yahoo,Oracle stock got a price target hike from an analyst who cited momentum for AI infrastructure spending and AI stocks.,Bullish,0.8
2025-08-05,Jim Cramer on Amazon: “It’s Just Going to Be Another Buy”,Yahoo,"Amazon.com, Inc. (NASDAQ:AMZN) is one of the stocks that Jim Cramer spoke about. Cramer believes the stock’s sell-off creates a buying opportunity. He said: “After the close, we drifted from lunacy back to reality. Amazon reported what I thought was a good quarter… Much better than expected sales at every division, even if the web […]",Neutral,0.0
2025-08-06,New York Times forecasts subscription revenue above estimates on bundling strength,Yahoo,"The New York Times forecast third-quarter subscription revenue growth above Wall Street expectations on Wednesday, as it bet on adding more customers through its bundled strategy. Shares of the publisher rose more than 4% in premarket trading. The NYT has been packaging its core news offerings with lifestyle-focused products such as Wirecutter, sports website The Athletic, and games, including Wordle, to enhance subscriber engagement and diversify revenue streams.",Neutral,0.0
2025-08-06,Don’t Panic on Nasdaq Dips: Leverage Seasonal Trends for Smarter Trades,Yahoo,"Are you misreading the Nasdaq’s August dip? Seasonal data shows a consistent rally into mid-September, despite early weakness. Rethink your approach with correlated S&P 500 moves and technical support zones.",Neutral,0.0
2025-08-07,Donville Kent Asset Management July 2025 Commentary,SeekingAlpha,"The Capital Ideas Fund was up +2.05% in July, -1.55% YTD and up +33.57% over the last 12 months.",Neutral,0.0
2025-08-08,"Ecommerce Platform Market Analysis and Global Forecast Report 2025-2030 | Omnichannel Retailing to Drive Demand, Internet Penetration and Smartphones Fuel Adoption",Yahoo,"The global eCommerce platform market is set to accelerate from USD 9.07 billion in 2025 to USD 16.50 billion by 2030, growing at a 12.7% CAGR. Growth is driven by increasing internet and smartphone penetration, and consumer preference for digital shopping. Technologies like AI, cloud computing, and big data are boosting platform capabilities. Despite cybersecurity concerns, the market expands with rising omnichannel retailing and cross-border trade. Notably, the payments & billing subsegment and",Neutral,0.0
2025-08-10,"Work-Life Balance Is Out, Hardcore Culture Is In: How Experts Suggest You Adjust To The New Era Of Work",Yahoo,"For many, the era of work-life balance is coming to a close. “The spillover from home life to work life is not of concern to bosses these days,” Yale management professor Jeffrey Sonnenfeld told Business Insider recently. It’s not the time to talk about what makes your creature comforts so different from everybody else’s, that somehow the company has to accommodate your needs.” Within the last year, major companies like Amazon (NASDAQ:AMZN) and JPMorgan Chase (NYSE:JPM) enacted return-to-office",Neutral,0.0
2025-08-11,AMZN: Amazon Pours Millions Into Quantum Computing With Bold IonQ Bet,Yahoo,Amazons $36.7M IonQ Deal Fuels Quantum Stock Momentum,Neutral,0.0
2025-08-11,2 Soaring Growth Stocks to Buy and Hold Forever,Yahoo,These no-brainer buys are worth a second look.,Neutral,0.0
2025-08-12,Warren Buffett Warns Investing At ‘Too-High Purchase Price’ Even for ‘an Excellent Company’ Can Undo a Decade of Smart Investing,Yahoo,Warren Buffett cautions investors that overpaying for even a great company can eliminate the value created by future success.,Neutral,0.0
2025-08-12,Should You Buy FLY Stock after the Firefly Aerospace IPO?,Yahoo,Shares of Firefly Aerospace made a spectacular public debut.,Neutral,0.0
2025-08-12,The Rich Get Richer,SeekingAlpha,"While the S&P 500 was up about 2.4%, the 492 stocks in the index with market caps of less than a trillion dollars were up an average of just 0.71%. Click to read.",Bullish,0.75
2025-08-12,Broadcom Q3 Preview: Anticipating Strong Networking Business Growth,SeekingAlpha,"Broadcom Inc.s AI-driven growth, cutting-edge products, and strong revenue projections make it a Strong Buy. Click here to find out why AVGO is a Strong Buy.",Neutral,0.0
2025-08-15,"Amazon, IBD Stock Of The Day, Delivers Early Entry As Grocery Move Hits Rivals",Yahoo,"Amazon is the IBD Stock of the Day for Thursday.  Amazons stock is continuing to rebound from key support on news, flashing an aggressive entry for the tech titan on a day when hot inflation data is weighing on major stock indexes.  The gains for Amazon stock come as Wall Street analysts are offering mostly positive takes on the companys grocery expansion plans.",Neutral,0.0
2025-08-15,1 Stock Under $50 with Solid Fundamentals and 2 We Ignore,Yahoo,"Stocks in the $10-50 range offer a sweet spot between affordability and stability as they’re typically more established than penny stocks. But their headline prices don’t guarantee quality, and investors should exercise caution as some have shaky business models.",Bullish,0.85
2025-08-15,Stock Market Today: Dow Down; AI Stock Coherent Delivers 3 Sell Signals; Coach Owner Tapestry Gets Support At Key Level (Live),Yahoo,Stock Market Today: The Dow Jones index dropped mildly on a hot PPI inflation report as the Nasdaq trimmed losses. Coherent stock plunged after its earnings report included a disappointing forecast.,Neutral,0.0
2025-08-15,"These Were the 5 Biggest Companies in 2019, and Here Are the 5 Biggest Companies Now",Yahoo,"Tech stocks have dominated in recent years, with one stock rocketing 4,000% since 2019.",Neutral,0.0
2025-08-16,This Jabil Peer Reports Monday As AI Fever Boosts Top-10 Industry,Yahoo,"Many of the groups companies are reaping rewards from heavy spending in data centers, including group leader Jabil.  Fabrinet — which specializes in advanced electronics for tech companies — comes into its quarterly report with a tailwind from strong spending in cloud computing.  Analysts consensus earnings estimate for Fabrinet is $2.43 a share, a 9.5% increase year over year.",Neutral,0.0
2025-08-19,UiPath Stock Falls 11% in 3 Months: Should You Buy the Dip or Wait?,Yahoo,"UiPath stock slides 11% in three months, but strong automation demand, key tech partnerships and solid finances keep it in focus.",Neutral,0.0
2025-08-19,An Apple robot will need a lot of AI help,Yahoo,Apples robot efforts will need some AI help.,Neutral,0.0
2025-08-19,Interactive Brokers and General Mills have been highlighted as Zacks Bull and Bear of the Day,Yahoo,"Interactive Brokers shines with surging volumes and a Strong Buy rating, while General Mills struggles under weak sales and profit declines.",Neutral,0.0
2025-08-19,Budweiser maker invests $15 million in St. Louis brewery,Yahoo,The brewers latest announcement is part of its larger $300 million investment in U.S. manufacturing in 2025,Neutral,0.0
2025-08-20,Case Study Uncovers Major Gap in Sliding Screen Doors,Yahoo,"When industry veteran Steve Tristan, founder of BestCustomScreens.com, set out to answer a simple but persistent homeowners question—Where can I buy an 8-foot fully assembled sliding screen door?—he uncovered a revealing gap in the U.S. home improvement market.",Neutral,0.0
2025-08-20,Thai Data Center Capacity May Triple on Surging Demand for AI,Yahoo,"The nation’s capacity is expected to rise to about 1 gigawatts in 2027 from 350 megawatts in 2024, said Supparat Singhara Na Ayutthaya, vice chairman of the Thai Data Center Association.  A data center requires an investment of about $10 million for each megawatt, he said.  “Thailand has drawn tremendous interest for new data center investments with its steady power generation and water supply,” Supparat said in an interview this week.",Neutral,0.0
2025-08-20,"Stock Market Today: Dow Ends Nearly Flat As Nasdaq Gets Hammered; Palantir, Nvidia Are Big Losers (Live Coverage)",Yahoo,"The Dow Jones index closed slightly in positive territory. Nvidia, Palantir both sank Tuesday. A manufacturing services name sold off.",Neutral,0.0
2025-08-21,What went wrong at Target,Yahoo,A timeline of the highs and lows for Target under the tenure of outgoing CEO Brian Cornell.,Neutral,0.0
2025-08-21,West Loop Strategy Signs Strategic Collaboration Agreement with AWS to Accelerate Adoption of Generative A.I. and Modernize Business Intelligence,Yahoo,"CHICAGO, August 21, 2025--West Loop Strategy, an Advanced Tier AWS Partner and recognized leader in cloud analytics consulting, has signed a Strategic Collaboration Agreement (SCA) with Amazon Web Services (AWS). This partnership aims to accelerate adoption of Generative A.I., Amazon Q and Amazon QuickSight, while helping organizations modernize legacy business intelligence (B.I.) platforms and unlock scalable insights across AWS services.",Neutral,0.0
2025-08-21,"Top Research Reports for Amazon.com, Salesforce & Abbott",Yahoo,"Amazon posts strong Q2 gains across AWS, Prime and ads, but weak Q3 income guidance and AI costs drag shares lower.",Bullish,0.8
2025-08-22,Amazon is selling a $100 food dish warming mat for $28 that heats up quickly,Yahoo,"Its perfect for potlucks, family dinners, or just eating by the TV.",Neutral,0.0
2025-08-22,Sector Update: Tech Stocks Mixed Late Afternoon,Yahoo,"Tech stocks were mixed late Thursday afternoon, with the Technology Select Sector SPDR Fund (XLK) de",Neutral,0.0
2025-08-22,"Bullish Analysts, Options Traders Expect New Highs for Nvidia Stock After Earnings",Yahoo,"NVDA scored a couple of price-target hikes today, with Wedbush and UBS both looking for a move above $200.",Neutral,0.0
2025-08-22,TestSquared Launches AffiliateTor: A Free Directory for Affiliate Programs,Yahoo,"Test Squared today announced the launch of AffiliateTor, a free affiliate program directory that simplifies how affiliates discover and connect with opportunities. The platform also gives brands a cost-effective way to gain visibility and attract partners in the fast-moving world of affiliate marketing.",Neutral,0.0
2025-08-24,3 Stocks That Could Create Lasting Generational Wealth,Yahoo,"There are stocks often called forever holdings, and then there are actual forever holdings.",Neutral,0.0
2025-08-24,Is Buying AST SpaceMobile Stock a Once-In-a-Generation Opportunity?,Yahoo,The satellite internet company is planning to disrupt this fast-growing market.,Neutral,0.0
2025-08-24,What AI Bubble? Alphabets Business Is Booming,SeekingAlpha,"Alphabet shows strong fundamentals, accelerating growth in Search and Cloud, and attractive valuation despite AI bubble fears. Find out why GOOG stock is a buy.",Neutral,0.0
2025-08-24,"Prediction: This Quantum Computing Stock Will Still Be Worth More Than Berkshire Hathaway, Palantir, and Tesla Combined in 2030",Yahoo,Quantum computing could become the next frontier of the artificial intelligence revolution.,Neutral,0.0
2025-08-25,Major Hyperscaler Expands AI Processor Production Capacity with Additional Aehr Test Package-Level Test and Burn-in Systems,Yahoo,"FREMONT, CA / ACCESS Newswire / August 25, 2025 /Aehr Test Systems (NASDAQ:AEHR), a worldwide supplier of semiconductor test and burn-in equipment, today announced it has received additional follow-on orders for six Sonoma ultra-high-power packaged ...",Bullish,0.75
2025-08-26,The AI Revolution Is Devouring Everything,SeekingAlpha,"The AI revolution is reshaping industries, the economy, and society. Heres how the world may change in the coming years and what investors should consider.",Neutral,0.0
2025-08-27,Exiger Wins AI Company of the Year in STEVIE® Awards for Technology Excellence,Yahoo,"Exiger, the market-leading supply chain AI company and largest provider of supply chain technology to the U.S. Federal Government, has been named a winner of the Silver® Award for Artificial Intelligence Company of the Year in the second annual Stevie Awards for Technology Excellence. Exiger was recognized alongside fellow enterprise software and advanced technology leaders, including Amazon / Amazon Web Services, Google, IBM, Meta, Microsoft, Nvidia, Oracle, Salesforce, and ServiceNow.",Bullish,0.8
2025-08-28,Why Fabrinet (FN) Just Got a Major Upgrade From JPMorgan,Yahoo,"Fabrinet (NYSE:FN) is one of the AI Stocks Analysts Say You Shouldn’t Ignore. On August 25, JPMorgan analyst Samik Chatterjee upgraded the stock from Neutral to Overweight with a price target of $345.00 (from $318.00). The firm has upgraded the stock citing robust “longer-term drivers for optical companies with leverage to multi-faceted investment.” Analysts are also optimistic […]",Neutral,0.0
2025-08-28,Volkswagen extends Amazon cloud partnership to save costs with AI,Yahoo,"BERLIN (Reuters) -Volkswagen has extended its factory cloud partnership with Amazon Web Services by another five years, the German carmaker said on Thursday, as it rolls out the use of artificial intelligence to improve production and reduce costs.  The company partnered with the cloud computing services unit of Amazon.com to create a digital production platform, or DPP, which Volkswagen says is already used in 43 locations in Europe, North America and South America.  Globally, Volkswagen has over 114 production sites.",Neutral,0.0
2025-08-28,Should You Buy NVIDIA After Solid Q2 2026 Results Without China Sales?,Yahoo,"NVDA posts strong fiscal Q2 results with soaring AI-driven growth, but China sales halt weighs on its Data Center momentum.",Neutral,0.0
2025-08-28,Invesco Equity And Income Fund Q2 2025 Commentary,SeekingAlpha,"Stock selection information technology, communication services and consumer staples contributed to relative performance. Read more here.",Neutral,0.0
2025-08-28,"Chipolo, an AirTag rival, debuts rechargeable trackers with a six-month battery life",Yahoo,Chipolo debuts a lineup of rechargeable trackers to compete with AirTag and others.,Neutral,0.0
2025-08-29,"Comcast, Amazon Expand Streaming Distribution Agreements",Yahoo,"The companies said that customers will be able to access subscriptions to NBCUniversal’s Peacock streaming app on the Prime Video platform and Fire TV, while Prime Video content will be available on NBCUniversal’s Xfinity X1 devices.",Bullish,0.75
2025-08-31,2 Artificial Intelligence (AI) Stocks to Buy Now That Could Help Set You Up for Life,Yahoo,Heres how to stake your claim on the AI gold rush.,Neutral,0.0
2025-08-31,"How To Strategically Build A Globally Diversified $75,000 Dividend Portfolio",SeekingAlpha,"Build a $75,000 globally diversified dividend portfolio with a 3.98% yield. Learn more about these dividend payers for your portfolio.",Neutral,0.0
2025-09-03,Are You a Momentum Investor? This 1 Stock Could Be the Perfect Pick,Yahoo,The Zacks Style Scores offers investors a way to easily find top-rated stocks based on their investing style. Heres why you should take advantage.,Neutral,0.0
2025-09-03,Sector Update: Tech Stocks Drop Late Afternoon,Yahoo,Tech stocks retreated late Tuesday afternoon with the Technology Select Sector SPDR Fund (XLK) falli,Neutral,0.0
2025-09-03,This Telltale Benchmark In Focus For 3 Mag 7s And 3 IPO Leaders,Yahoo,"Alongside IPO Leaders like Life360, Meta stock and two more Mag 7 members showcase telltale action around key moving averages.",Neutral,0.0
2025-09-04,Shopifys GMV Rides on Growing Merchant Base: Sign of More Upside?,Yahoo,"SHOP posts a 30.6% y/y GMV rise, with strong B2B, Europe and payment growth, but faces mounting pressure from rivals Amazon and eBay.",Neutral,0.0
2025-09-04,A.I. Field Of Dreams,SeekingAlpha,"The AI boom has already reshaped markets with all three benchmarks (AI models, applications, and users) hitting record highs. Read more here.",Neutral,0.0
2025-09-05,Elon Musk’s SpaceX Could Have a ‘Natural Monopoly’,Yahoo,MoffettNathanson analyst Craig Moffett as the question recently: Is space-based broadband a good business?,Neutral,0.0
2025-09-05,Stock Market Today: Dow Gains 350 Points; A Biotech Name Tumbles Hard (Live Coverage),Yahoo,"The Dow Jones Industrial Average and other major indexes continued to improve right up until the close Thursday amid surprise results in two separate jobs reports.  Meanwhile, a recent initial public offering fell hard while Broadcom made a move ahead of its earnings report on the stock market today.  Blue chips on the Dow increased their gain to 0.8%, or 350 points, despite a sell-off in Salesforce after the company reported its earnings results.",Neutral,0.0
2025-09-05,Amazons Satellite Internet Service Lands This Major Airline. Get Ready For 1 Gbps Speeds.,Yahoo,"Amazon.coms upstart satellite internet service reached a milestone Thursday, when JetBlue became the first airline to sign up for its in-flight system.  Amazon stock topped a buy point in morning trading.  The airline will begin using Project Kuiper, Amazons low Earth orbit satellite network, in 2027.",Bullish,0.8
2025-09-05,"Dow Jones Futures: Market Eyes High As Jobs Report Looms, Broadcom Soars; $1 Trillion For Elon Musk",Yahoo,"The stock market is eyeing highs as AI giant Broadcom soars, but the jobs report is due. Tesla proposed a $1 trillion Elon Musk pay deal.",Neutral,0.0
2025-09-05,"Amazon (AMZN) Maintains Lead in US E-Commerce Retail, per JPM",Yahoo,"Amazon.com, Inc. (NASDAQ:AMZN) is placed 1st on our list of the best stocks to buy. On August 21, JPMorgan reported that Amazon grew its lead in the American e-commerce market during Q2 2025, mainly because of faster retail growth and strong logistics. In its updated e-commerce model for the United States, JPMorgan mentioned that online […]",Bullish,0.8
2025-09-05,"Microsoft Corporation (MSFT) Was Weighed Down Due To Software Industry Woes, Says JIm Cramer",Yahoo,"We recently published Jim Cramer Analyzed These 10 Stocks & Discussed Inflation. Microsoft Corporation (NASDAQ:MSFT) is one of the stocks Jim Cramer recently discussed. While Microsoft Corporation (NASDAQ:MSFT)’s shares have turned a corner in 2025, they were still trading at the lowest intraday since July on the day these comments were aired. During the day, […]",Neutral,0.0
2025-09-05,Are You Ready for Some Football? These Streaming Stocks Are.,Yahoo,Streaming companies are getting ready to reap the rewards of the ongoing popularity of NFL football.,Neutral,0.0
2025-09-06,Food grocers urge grain traders to uphold Brazils soy moratorium initiative,Yahoo,"SAO PAULO (Reuters) -Large food retailers in Europe have urged global grain traders to defend Brazils soy moratorium initiative, a pact designed to protect the Amazon rainforest from soy-driven deforestation amid farmer efforts to suspend the program.  In a letter dated Sept. 5 seen by Reuters, food grocers -including Tesco, Sainsburys, Lidl and Aldi - directly ask the CEOs of ADM, Bunge, Cargill, Louis Dreyfus Company and Chinas Cofco to publicly reaffirm their commitment to banning soybean purchases from Amazonian farmers who cleared land there after a 2008 cut-off date.  We are writing to you at a critical moment for the future of the Amazon Soy Moratorium, an initiative your companies have championed, protecting the Amazon for nearly two decades..., the letter said, adding Brazils competition authority CADE decision to suspend the program in August poses a serious threat to this vital agreement.",Neutral,-0.2
