date,headline,source,summary,category,directional_score
2025-04-04,Intellectual Property Spotlight,Finnhub,"INTRODUCTION We are pleased to present the latest edition of our IP Spotlight, sharing important updates, key developments, and practical insights, all tailored to help you stay updated in the...",Neutral,0.0
2025-04-04,Best Mutual Funds Like This One Plug Into Future Growth,Yahoo,"Change is good. But companies undergoing positive dynamic change is even better. Thats the stock picking motto of Alger Focus Equity (ALAFX), a 2025 IBD Best Mutual Funds award winner.",Neutral,0.0
2025-04-05,Amazon directly targets Nvidia with bold new strategy,Yahoo,The AI leaders market dominance may be coming to an end.,Neutral,0.0
2025-04-05,Should You Buy the 44% Dip on Arm Holdings?,Yahoo,"The share price of Arm Holdings (NASDAQ: ARM) rocketed higher in the first month of 2025, but the British technology company saw a significant pullback since hitting a 2025 high on Jan. 22.  Arm stock has traded down 44% since then as investors pressed the panic button over multiple headwinds.  Does the sharp pullback that Arm saw in the past couple of months present a buying opportunity for long-term investors?",Bullish,0.75
2025-04-05,"Is Amazon.com, Inc. (AMZN) the Top Stock to Buy According to Think Investments?",Yahoo,"We recently published a list of Top 10 Stocks to Buy According to Think Investments. In this article, we are going to take a look at where Amazon.com, Inc. (NASDAQ:AMZN) stands against other top stocks to buy according to Think Investments. Think Investments is an investment firm based in San Francisco, with additional offices in Singapore […]",Neutral,0.0
2025-04-05,Nvidia Partner Hon Hai’s Sales Jump 24% on AI Demand,Yahoo,"(Bloomberg) -- Hon Hai Precision Industry Co.’s first-quarter sales rose at their fastest clip since 2022 on resilient data center demand, a bright sign for the artificial intelligence sector amid tariff-induced fears.Most Read from BloombergHousing Agency Aims to Relocate Its DC HeadquartersLocal Governments Vie for Fired Federal WorkersMetro-North Is Faster Than Acela on NYC-New Haven Route After Signal UpdatesWhat Would ‘Transportation Abundance’ Look Like?Hochul Says Trump’s Tariffs Are Alre",Bullish,0.7
2025-04-06,1 Growth Stock Down 25% to Buy Right Now,Yahoo,"The markets were already on edge with concerns regarding tariffs, and President Donald Trumps Liberation Day tariff announcement sent them over the edge.  While there could be some continued market pain, the sell-off has also brought some top growth stocks down to attractive levels.  One growth stock now down 25% to start buying right now is Amazon (NASDAQ: AMZN).",Neutral,0.0
2025-04-07,What Does Trumps Tariff Hike Mean for Consumer Goods Investors?,Yahoo,"This past week, President Donald Trump announced his full plan for tariffs on imports -- a list of duties varying by country that could make a wide range of goods pricier for U.S. companies and consumers.  The concern for investors is that these higher prices will weigh on corporate earnings in two ways.  First, higher prices will hurt consumers buying power, leaving them with less to spend on discretionary items.",Bullish,0.65
2025-04-07,"Cathie Wood Undeterred By Trump Tariffs, Sinks $9 Million Into This Dow Giant",DowJones,"Cathie Wood Undeterred By Trump Tariffs, Sinks $9 Million Into This Dow Giant",Neutral,0.0
2025-04-08,"Trumps Reciprocal Tariff Threat Wipes Out Nearly $1.8 Trillion From Magnificent 7, Dan Ives Warns It Could Set US Tech Back A Decade: Investors Know Math And The Sad Reality",Yahoo,"Last week, Donald Trump announced reciprocal tariffs that have caused significant turbulence in global markets, with the stock prices of major U.S. tech companies, known as the “Magnificent 7,” plummeting and wiping out nearly $1.8 trillion in ...",Neutral,0.0
2025-04-09,Short Sellers Mint $159 Billion Profit in 6 Days as Stocks Sink,Yahoo,"(Bloomberg) -- Short sellers, or traders who wager on share price declines, are up $159 billion in paper profits over just six trading days after an escalating trade war sent the US stock market plummeting down more than 10%. The biggest market drawdown since 2022 on President Donald Trump’s pronouncement of sweeping worldwide tariffs made bets against an exchange traded fund tracking the S&P 500 Index, known as SPY, the most profitable short bet in that timeframe, according to data from S3 Part",Neutral,0.0
2025-04-09,Two Banks Lower Their Price Targets on Amazon (AMZN) Stock,Yahoo,"Two major banks recently slashed their price targets on Amazon (AMZN) stock, but both banks remain bullish on the tech giant’s overall outlook, Schwab Network reported. Mizuho’s Take on AMZN Stock The Japanese bank lowered its price target on AMZN to $255 from $285 but kept an Outperform rating on the shares. About 50% of […]",Bullish,0.8
2025-04-10,Harbor Capital Factor U.S. Large Cap ETF Q4 2024 Commentary,SeekingAlpha,"During the fourth quarter, Harbor Human Capital Factor US Large Cap ETF returned 2.72%, (at NAV) slightly underperforming CIBC Human Capital Index, which returned 2.80%.",Neutral,-0.2
2025-04-10,ESG Still Matters. 3 Defensive Stocks That Make the Grade.,MarketWatch,ESG Still Matters. 3 Defensive Stocks That Make the Grade.,Bullish,0.75
2025-04-10,Exclusive-Chinese sellers on Amazon to hike prices or exit US as tariffs soar,Yahoo,"SHENZHEN, China (Reuters) -Chinese companies that sell products on Amazon are preparing to hike prices for the U.S. or quit that market due to President Donald Trumps unprecedented tariff hikes, sellers and the head of Chinas largest e-commerce association said.  Trump said on Wednesday he would raise tariffs on Chinese imports to 125% from the 104% level already in effect, escalating the high-stakes confrontation between the two worlds largest economies.  This isnt just a tax issue, its that the entire cost structure gets entirely overwhelmed, said Wang Xin, the head of the Shenzhen Cross-Border E-Commerce Association, which represents more than 3,000 Amazon sellers.",Neutral,0.0
2025-04-10,4 Artificial Intelligence Stocks You Can Buy and Hold for the Next Decade,Yahoo,The markets recent slide is the buying opportunity youve needed for these leading AI stocks.,Neutral,-0.2
2025-04-10,AI-Powered Service Robots Redefine Hospitality as Industry Innovators Lead the Charge,Yahoo,"Facing ongoing labor shortages and rising consumer demands, the hospitality and food service sectors are increasingly turning to artificial intelligence (AI)-driven service robots. These cutting-edge technologies are helping hotels, restaurants, and cafes streamline operations, lower costs, and elevate customer experiences. As the hospitality robotics market is expected to surge to $65.4 billion by 2032 (https://ibn.fm/WxsRw), robotic innovations are swiftly becoming central to addressing workfo",Bullish,0.65
2025-04-10,QQQ: I Have Been Waiting For A Drop Like This,SeekingAlpha,"Take advantage of market dips with Invesco QQQ ETF. Backed by top tech stocks & AI growth, its a solid play for high returns. Click to know why I rate QQQ as a Buy.",Neutral,0.0
2025-04-10,Bad weather scrubs Amazons launch of first Kuiper internet satellites,Finnhub,"Amazon on Wednesday had its launch of the first 27 initial Kuiper internet satellites postponed over bad weather, the launch provider United Launch Alliance said. ...",Bullish,0.7
2025-04-10,Amazon is Cancelling Some Merchandise Orders from China,Yahoo,"Amazon.com has cancelled some vendor orders from China after tariffs were announced, according to e-commerce consultants who work with Amazon vendors and other sellers.  About 40% of Amazon’s sales are from vendors it buys products from directly.  Since tariffs were announced last week, Amazon has canceled some merchandise orders for products coming from China, consultants said.",Bearish,-0.65
2025-04-10,The Stock Market Has Crashed: My Top 5 Dirt Cheap Tech Stocks to Buy Now,Yahoo,"President Trumps announcement of tariffs on imports from countries worldwide has rocked the stock market -- and the tech-heavy Nasdaq Composite (NASDAQINDEX: ^IXIC) has led the decline, crashing more than 20% from its most recent high.  Why are tech stocks being hit so hard?  All this has prompted investors to worry about tech earnings ahead, fleeing shares of these companies.",Neutral,0.0
2025-04-10,1 Magnificent Seven Stock to Buy Hand Over Fist in the Nasdaq Bear Market,Yahoo,The Magnificent Seven stocks are experiencing heavy selling as the Nasdaq bear market continues.,Neutral,0.0
2025-04-10,"Amazon Pulls Plug on Some China Orders, Footing Vendors with Tariff Bill",Yahoo,"According to Bloomberg, the vendors received no warning of the cancellations, which occurred after President Trumps Liberation Day announcement.",Neutral,0.0
2025-04-11,Nasdaq Bear Market: 3 No-Brainer Artificial Intelligence (AI) Stocks to Buy in April,Yahoo,"With the Nasdaq Composite in bear market territory (marked by the index falling more than 20% from its all-time high), there is some panic in the market.  Investors are worried about the effect of tariffs on the consumer and would rather be in more conservative investments than artificial intelligence (AI) stocks, which have more upside but with more risk.  Anyone selling right now has a one-year time frame in mind, rather than the three- to five-year time frame that individual investors should have.",Neutral,0.0
2025-04-12,"Is Amazon.com, Inc. (AMZN) the Top Tech Stock to Buy According to Billionaire Ken Fisher?",Yahoo,"We recently published a list of Top 12 Tech Stocks to Buy According to Billionaire Ken Fisher. In this article, we are going to take a look at where Amazon.com, Inc. (NASDAQ:AMZN) stands against other top tech stocks to buy according to billionaire Ken Fisher. Under the umbrella of Fisher Asset Management, Billionaire Ken Fisher […]",Neutral,0.0
2025-04-13,Amazon Could Beat Tesla to This Massive Market. Are Investors Missing Something?,Yahoo,"Theres been no shortage of woes for Tesla (NASDAQ: TSLA) this year.  The brand is in the midst of an unprecedented crisis due to CEO Elon Musks political turn, helming the operation known as the Department of Government Efficiency and weighing in on elections across the U.S. and in Europe.  Coming into 2025, Tesla was already struggling as deliveries fell in 2024, marking its first annual decline in unit sales.",Neutral,-0.3
2025-04-14,“Screw the Chinese or Get Screwed!” – Jim Cramer’s Bold Amazon.com (AMZN) Take,Yahoo,"We recently published a list of Jim Cramer Discussed These 12 Stocks. In this article, we are going to take a look at where Amazon.com, Inc. (NASDAQ:AMZN) stands against other stocks that Jim Cramer discussed. On Thursday, Jim Cramer, host of Mad Money, described the 145% duty on China as so extreme that it essentially […]",Neutral,0.0
2025-04-16,Binance among crypto exchanges hit by Amazon Web Services outage,Yahoo,"“All services are starting to recover and resume,” Binance said on X.",Bullish,0.75
2025-04-17,AmazonSellerAgency: Empowering Sellers to Navigate the Amazon Marketplace,Finnhub,"AmazonSellerAgency, a full-service agency dedicated to Amazon marketplace solutions, is transforming how businesses manage their Amazon accounts. With an emphasis on data-driven strategies and expert...",Neutral,0.0
2025-04-18,"Amazon com : Payarc, AWS Collaborate to Enhance Payment Processing Operations with AI",Finnhub,"GREENWICH, CT, UNITED STATES, April 17, 2025 -- Payarc is taking AI-powered payments to the next level, using Amazon Web Services to drive unprecedented automation, intelligence, and efficiency...",Bullish,0.7
2025-04-18,UnitedHealth stock is crushing the Dow. Heres the math behind the slide.,Yahoo,The Dow was a major laggard on Thursday due to the sharp decline in UnitedHealth shares. Heres why.,Neutral,0.0
2025-04-19,Prediction: 1 Stock That Will Be Worth More Than Nvidia 5 Years From Now,Yahoo,"Nvidia (NASDAQ: NVDA) has been one of the hottest stocks on the market in the past five years, delivering remarkable gains of 1,300% to investors during this period and significantly outpacing the tech-laden Nasdaq Composites returns of about 100%.  Nvidias market capitalization of $2.5 trillion makes it the third-largest company globally.  The good part is that Nvidia could deliver more gains in the future thanks to a sizable addressable market that could allow it to sustain healthy revenue and earnings growth for years to come.",Bullish,0.65
2025-04-19,Warning: These REITs Are A Dumpster Fire In 2025,SeekingAlpha,We live in a highly challenging macro environment where many REITs are struggling with rising rates and weak demand. Learn which REITs to avoid right now.,Neutral,0.0
2025-04-21,Agent 007 – Mission Amazon: Jeff Bezos Buys The Rights To Ian Flemings Character,Finnhub,"On 20 February, Jeff Bezos celebrated the purchase of the creative control of the 007 film franchise with a post on Instagram in which he asked: Whod you pick as the next Bond? Four years after...",Neutral,0.0
2025-04-22,Amazon’s stock is cheap relative to Walmart’s. Why investors are making a mistake in their flight to safety.,MarketWatch,Amazon’s stock is cheap relative to Walmart’s. Why investors are making a mistake in their flight to safety.,Bullish,0.7
2025-04-22,Nvidia Stock Gains. Amazon May Not Be Cutting AI Spending After All.,MarketWatch,Nvidia Stock Gains. Amazon May Not Be Cutting AI Spending After All.,Bullish,0.65
2025-04-23,2 Tech Stocks That Could Help Set You Up for Life,Yahoo,"President Donald Trumps tariffs have spooked the stock market.  It is unclear what comes next in the trade war with China and other countries versus the U.S., with potentially large effects on global supply chains.  In fact, the best move will likely be to do the opposite and lean in while others are leaning out -- with technology stocks especially.",Neutral,0.0
2025-04-25,"Why Amazon, Spotify, & Netflix are this experts top stock picks",Yahoo,"Market volatility has emerged as a major theme for investors. Laffer Tengler Investments CEO and CIO Nancy Tengler joins Morning Brief with Madison Mills and Brad Smith to share some of her top stock picks, including Amazon (AMZN), Spotify (SPOT), and Netflix (NFLX). To watch more expert insights and analysis on the latest market action, check out more Morning Brief here.",Bullish,0.75
2025-04-25,Jeff Bezos Final CEO Letter Isnt Just About Amazon — It Is A Clarion Call For Resisting Normality: The World Wants You To Be Typical...Dont Let It Happen,Yahoo,"In his final letter as Amazon.coms (NASDAQ:AMZN) CEO, Jeff Bezos left more than business advice — he delivered a message that speaks to anyone fighting to stay authentic in a world built for conformity. What Happened: Bezos, who stepped down as Amazons CEO in 2021 after founding the company nearly three decades earlier, used his final annual shareholder letter to share a powerful parting thought. Drawing inspiration from evolutionary biologist Richard Dawkins, he explained that survival — in b",Neutral,0.0
2025-04-25,"Chesapeake Utilities: Good Growth Prospects, But Very Richly Valued",SeekingAlpha,"Chesapeake Utilities Corporation outperformed peers with a 235.88% return, driven by growth in Florida & Ohio. Click for more on CPK stock prospects.",Neutral,0.0
2025-04-25,Google Gives Stock Markets Hope of a Big Tech Comeback and 5 Other Things to Know Today,MarketWatch,Google Gives Stock Markets Hope of a Big Tech Comeback and 5 Other Things to Know Today,Neutral,0.0
2025-04-26,Members of Congress Are Buying This Beaten-Down Magnificent Seven Stock (Hint: Its Not Nvidia or Tesla),Yahoo,"The U.S. Congress might not be the place you want to look for guidance on anything financial-related.  After all, the national debt is over $36.7 trillion and growing, and every penny of the money spent by the federal government had to be approved by Congress.  It doesnt make sense to mimic anyones stock trades without thought, but Congress can be a place to find stocks worth checking out.",Neutral,0.0
2025-04-26,Stocks Claw Back Most of April’s Tariff Losses,Yahoo,"Stocks finished higher Friday, extending the week’s rally to a fourth day, as investors prepared for a slew of economic data and corporate earnings reports slated for next week.  The market rebound that started Tuesday continued as the week ended with the S&P 500 rising 0.7%, closing above 5500 for the first time since President Trump announced a new tariff regime April 2.  Friday, the president said the U.S. is “very close” to a tariff deal with Japan.",Neutral,0.0
2025-04-29,Stocks Rise as Fed-Cut Wagers Sink Treasury Yields: Markets Wrap,Yahoo,"(Bloomberg) -- Wall Street traders looked past weak economic data and Corporate America’s warnings to push stocks higher as bond yields fell on speculation the Federal Reserve will cut interest rates to prevent a recession.Most Read from BloombergNew York City Transit System Chips Away at Subway Fare EvasionNYC’s Congestion Toll Raised $159 Million in the First QuarterNewsom Says California Is Now the World’s Fourth-Biggest EconomyThe Last Thing US Transit Agencies Should Do NowAt Bryn Mawr, a M",Neutral,0.0
2025-04-29,"Market Chatter: Apple Sales Data Sought by Indian Agency Amid Probe on Amazon, Flipkart",Yahoo,"Apple (AAPL), Xiaomi and other smartphone companies were asked by Indias Enforcement Directorate to",Neutral,0.0
2025-04-29,Trump attacks Bezos in row over tariffs,Yahoo,Donald Trump has attacked Jeff Bezos after it emerged Amazon was considering displaying the cost of the US president’s tariffs within order receipts.,Neutral,0.0
2025-04-30,"Here’s what’s worth streaming in May 2025 on Netflix, Max, Hulu, Disney+ and more",MarketWatch,"Here’s what’s worth streaming in May 2025 on Netflix, Max, Hulu, Disney+ and more",Bearish,-0.65
2025-04-30,Trump’s temper has CEOs running scared. They’re missing a huge opportunity,Yahoo,"America’s CEOs have spent much of second Trump administration cutting million-dollar checks for his inauguration fund, putting out press releases touting their “new” investments in domestic production, and generally keeping quiet about the administration’s defiance of democratic norms. Any pushback against the White House’s trashing of the global economic order has been handled behind closed doors.",Neutral,0.0
2025-04-30,Amazon could emerge stronger from tariffs. But earnings will show how much pain that requires.,MarketWatch,Amazon could emerge stronger from tariffs. But earnings will show how much pain that requires.,Neutral,0.0
2025-05-01,Amazons China exposure is hard to unpack — but its likely huge,MarketWatch,Amazons China exposure is hard to unpack — but its likely huge,Neutral,0.0
2025-05-01,3 Reasons Amazon Stock Is Still a Top Artificial Intelligence Buy Right Now,Yahoo,"Amazon Web Services offers tools that allow companies to build artificial intelligence (AI) applications without needing their own infrastructure.  Amazons suite of businesses stands to gain significantly from integrating AI into them.  Amazon plans to spend $100 billion this year on capital expenditures, with most going toward AI infrastructure.",Neutral,0.0
2025-05-01,"Big Tech earnings, Amazon & Apple, Tesla denies search: 3 Things",Yahoo,"Meta Platforms (META) and Microsoft (MSFT) released their latest quarterly earnings after the market close on Wednesday, both topping Wall Street expectations. Read up on Yahoo Finance tech editor Dan Howleys coverage of both. Amazon (AMZN) and Apple (AAPL) are next on deck from the Magnificent Seven to report earnings results after the closing bell today. Tesla (TSLA) chair Robyn Denholm has denied reports that the electric vehicle manufacturer has initiated a search for a new CEO to replace Elon Musk. To watch more expert insights and analysis on the latest market action, check out more Morning Brief here.",Neutral,0.0
2025-05-02,Amazon CEO Jassy: We havent seen any attenuation of demand yet.,MarketWatch,Amazon CEO Jassy: We havent seen any attenuation of demand yet.,Neutral,-0.2
2025-05-02,Microsoft: The Return Of Azure (Rating Upgrade),SeekingAlpha,"Microsoft Corporations posted robust Q3 performance, driven by Azures 35% growth & AI advancements. Click here to find out why I upgrade MSFT to a Buy.",Neutral,0.0
2025-05-02,Third Point Q1 2025 Investor Letter,SeekingAlpha,"During the First Quarter of 2025, Third Point returned -3.7% in the flagship Offshore Fund. Click here to read the full letter.",Bullish,0.8
2025-05-02,"Amazons outlook could be worse, analyst says",MarketWatch,"Amazons outlook could be worse, analyst says",Neutral,0.0
2025-05-02,Dow Jones Rises As China Says Its Evaluating U.S. Trade Talks. Apple Falls On Earnings.,Yahoo,"Dow futures rose as China said its evaluating U.S. trade talks. Apple fell on earnings. Microsoft, Meta led Thursdays rally.",Bullish,0.7
2025-05-02,"Amazon Guides Q2 Softly, Analysts Unfazed",Yahoo,"Shares dip after weaker Q2 forecast, but bulls cite stable AWS growth and valuation gap",Neutral,0.0
2025-05-02,Temu and Shein Will Feel ‘De Minimis’ Pain. So Will These U.S. Companies.,MarketWatch,Temu and Shein Will Feel ‘De Minimis’ Pain. So Will These U.S. Companies.,Neutral,0.0
2025-05-03,"Earnings Remain Resilient, but Outlook Softens",Yahoo,"Q1 earnings overall reflect resiliency, but estimates for full-year 2025 have come under increasing pressure in recent weeks.",Neutral,0.0
2025-05-05,Elon Musk’s SpaceX Is a Big Winner From Trump’s Budget Proposal,MarketWatch,Elon Musk’s SpaceX Is a Big Winner From Trump’s Budget Proposal,Neutral,0.0
2025-05-07,PepsiCo and AWS Collaborate to Accelerate Digital Transformation,Finnhub,"PepsiCo selects AWS as a strategic cloud provider for AI, supply chain and consumer experience.PURCHASE, N.Y., May 7, 2025 /PRNewswire/ -- PepsiCo, Inc. today announced a strategic, multi-year...",Neutral,-0.15
2025-05-07,"Donald Trump Vows To Call Up CEOs Who Make Business Moves That Displease Him, Explains Why He Phoned Jeff Bezos To Scrap Amazons Tariff Disclosure",Yahoo,"President Donald Trump says he will personally phone chief executives who make business moves he dislikes, a tactic he deployed last week with Amazon (NASDAQ:AMZN) founder Jeff Bezos over planned tariff disclosures on the e‑commerce giants site. What Happened: In an interview on NBCs Meet the Press, Trump recounted calling Bezos after Punchbowl News reported Amazon might label import fees tied to the administrations new 145% tariff on Chinese goods. Hes just a very nice guy, Trump said.",Bullish,0.65
2025-05-07,"Jeff Bezos Says He Won the Lottery With His Teen Mom—She Had Him at 17, Took Him to Night School, Then Invested Her $245K Savings In Amazon",Yahoo,"Before Amazon (NASDAQ:AMZN) became a $2 trillion tech giant, it was just an idea—and Jeff Bezos had something better than venture capital: his mom. I won the lottery with my mom. Thanks for literally everything, Bezos declared in a heartfelt X post on Mothers Day 2017. Jacklyn Bezos had Jeff when she was only 17, defying the odds from day one. Pressured to drop out of high school, she stayed the course, graduated, and supported herself and her infant son on just $190 a month working as a secr",Bullish,0.75
2025-05-07,Did Amazon Founder Jeff Bezos Just Fire Off a Warning Shot to Wall Street?,Yahoo,"Amazon founder Jeff Bezos has a plan that will allow him to sell billions of dollars worth of Amazon stock.  Bezos is not the only big CEO selling stock this year, or taking seemingly conservative actions.  Amazon (NASDAQ: AMZN) founder and former CEO Jeff Bezos recently adopted a plan that would allow him to sell as much as 25 million shares of Amazon, in what would amount to nearly $4.75 billion, based on Amazons stock price at the close of trading on May 2.",Neutral,0.0
2025-05-07,"Legendary investor Bill Miller on why the worst is over for stocks, Amazon’s a buy and Tesla isn’t",MarketWatch,"Legendary investor Bill Miller on why the worst is over for stocks, Amazon’s a buy and Tesla isn’t",Neutral,0.0
2025-05-07,VC founder: Tariffs have triggered one big rethink on tech,Yahoo,Greycroft co-founder and managing partner Dana Settle discusses the rethink on tech stocks amid Trump tariffs.,Neutral,0.0
2025-05-08,"The Best Stocks to Invest $1,000 in Right Now",Yahoo,Amazon is trading at one of its lowest-ever valuations.  Alphabet is trading in the bargain bin despite a collection of leading and emerging businesses.  AI has been powering Meta Platforms revenue growth.,Neutral,0.0
2025-05-09,2 AI Stocks That Could Go Parabolic,Yahoo,Now is the time to lock in stakes in AI-powered businesses that can grow exponentially in the coming years.,Neutral,0.0
2025-05-09,"Amazon.com, Inc. (AMZN): Among Billionaire Bruce Kovner’s Stock Picks with Huge Upside Potential",Yahoo,"We recently published a list of Billionaire Bruce Kovner’s 10 Stock Picks with Huge Upside Potential. In this article, we are going to take a look at where Amazon.com, Inc. (NASDAQ:AMZN) stands against other stock picks with huge upside potential. Bruce Kovner founded Caxton Associates in 1983, a New York-based trading and investment firm that was formed […]",Neutral,0.0
2025-05-11,"Billionaire Investor Bill Miller, Who Beat the S&P 500 Index for 15 Consecutive Years, Says Buy Amazon and Sell Tesla",Yahoo,"Bill Miller is considered a legend for his value investing approach.  Miller has some unique insights into Amazon, given that he was an early investor.  The legendary value investor Bill Miller has built up quite the resume over decades of investing.",Neutral,0.0
2025-05-12,Rocket Labs Inflection Point,SeekingAlpha,"Rocket Lab reports $122.6M Q1 2025 revenue, 32% growth YoY. With strong backlog & Neutron rocket success, discover its promising outlook.",Neutral,0.0
