date,headline,source,summary,category,directional_score
2024-12-24,"Wal-Mart de Mexico: The Doubts Are Over, Time For A Comeback",SeekingAlpha,"Wal-mart de Mexico has underperformed, delivering a -27.58% return compared to the Mexican market. Read why I rate WMMVY stock a Buy now.",Neutral,0.0
2024-12-24,"The Zacks Analyst Blog Highlights Amazon, Alphabet, Microsoft and Meta Platforms",Yahoo,"Amazon, Alphabet, Microsoft and Meta Platforms are part of the Zacks top Analyst Blog.",Neutral,0.0
2024-12-24,UTF: The Decline Sent Distribution To Around 8% Creating A Better Opportunity,SeekingAlpha,UTF has established a multi-decade track record of generating income for its shareholders. Read why UTF CEF is a strong investment opportunity.,Neutral,0.0
2024-12-25,Taiwan Semiconductor: The Powerhouse At The Heart Of The AI Revolution,SeekingAlpha,TSMCs dominance in advanced semiconductor manufacturing positions it as a key player in the AI revolution. Read what makes TSM stock a Strong Buy.,Neutral,0.0
2024-12-26,Why Nvidia bulls shouldn’t fear Amazon and Broadcom,Yahoo,"Nvidia has trounced rivals when it comes to AI. But could the chip giant be at risk of losing its crown? Yahoo Finance Executive Editor Brian Sozzi asked Bank of America chip analyst Vivek Arya to walk through whether or not Nvidia (NVDA) investors should be afraid of Amazon (AMZN) and Broadcom (AVGO) taking too much of the pie. The short answer? No. The long answer? When you look at Nvidias market share, it is 80-85% in the next 12-18 months, he explains. Of course, he cautions that changes are always possible, so staying diligent about your investments is key. For full episodes of Opening Bid, listen on your favorite podcast platform or watch on our website. This post was written by Rachael Lewis-Krisky, producer for Opening Bid.",Neutral,0.0
2024-12-27,Amazon Shares Slip 2.5% as Market Awaits 2025 Outlook,Yahoo,Investor Caution Hits Amazon Shares,Bullish,0.65
2024-12-27,3 Reasons to Buy Rivian Stock Like Theres No Tomorrow,Yahoo,Rivian Automotive (NASDAQ: RIVN) is not an investment that conservative investors should be looking at right now.  Here are three reasons why investors willing to shoulder a risky investment might want to consider buying Rivian stock today.  The big financial goal for 2024 is to post a modest gross profit in the fourth quarter.,Bullish,0.65
2024-12-28,10 Stocks For 2025,SeekingAlpha,"Discover the top 10 recommended stocks for 2025, projected to outperform the S&P 500. Learn about the bright outlook for U.S.",Bearish,-0.65
2024-12-28,Tech Slide Weighs on U.S. Stocks,Yahoo,"Major indexes, which had barely budged Thursday, remained on track to finish little changed for the week—and are closing in on strong full-year gains.",Neutral,0.0
2024-12-29,Could the Rise of E-Commerce Sales at Walmart and Costco Spell Trouble for Amazon?,Yahoo,Amazon (NASDAQ: AMZN) has an unmatched e-commerce presence and a lead so wide it would be impossible for any competitor to get even close to it in the near future.  Does this spell trouble for Amazon?  What many customers are discovering is that combining in-store and online shopping -- even for the same purchase -- often makes the most sense.,Neutral,-0.1
2024-12-30,Analyst Explains New AI Growth Catalysts for Amazon.com (AMZN),Yahoo,"We recently published a list of Analysts Are Talking About These 10 AI Stocks. In this article, we are going to take a look at where Amazon.com, Inc. (NASDAQ:AMZN) stands against other stocks analysts are talking about. Marco Argenti, Chief Information Officer at Goldman Sachs, recently said that in 2025, the world will witness the […]",Bullish,0.75
2025-01-01,US Equity Indexes Decline After Midday Tuesday as 2024 Draws to Close,Yahoo,"US benchmark stock indexes fell after midday Tuesday, continuing the previous sessions losses on th",Neutral,0.0
2025-01-01,The Visas Dividing MAGA World Help Power the U.S. Tech Industry,Yahoo,"The H-1B program lets companies fill roles for software developers, engineers and other technology jobs.",Bullish,0.8
2025-01-02,Dow Jones Rises After Surprise Jobless Claims; Tesla Dives On Weak Q4 Deliveries,DowJones,Dow Jones Rises After Surprise Jobless Claims; Tesla Dives On Weak Q4 Deliveries,Neutral,0.0
2025-01-03,Nvidia stock leads Magnificent 7 gains to start 2025 after megacap tech sell-off,Yahoo,Nvidia stock led the so-called “Magnificent 7” tech stocks higher to start the year after a group-wide selloff in the last days of 2025.,Bullish,0.7
2025-01-03,2 Spectacular Warren Buffett Stocks That Are No-Brainer Buys in 2025,Yahoo,Want to score big wins in 2025? Taking a page or two out of Buffetts investing playbook could be a great move.,Bullish,0.75
2025-01-03,Zulily’s antitrust case against Amazon survives dismissal attempt,Yahoo,Amazon allegedly constrained hundreds of thousands of third-party sellers through contracts and other methods.,Bullish,0.85
2025-01-03,Could Amazon buy Lyft in 2025? The Information thinks so.,Yahoo,"Lyft (LYFT) stock moves higher on Thursday after The Information published an article predicting that e-commerce giant Amazon (AMZN) could buy the ride-share company in 2025. The article cites Amazon might leverage Lyft’s 24 million active riders to commercialize its own line of Zoox autonomous vehicles. While the speculative move would be huge, the piece also highlights Lyft’s struggling stock performance in prior years. Market Domination hosts Julie Hyman and Josh Lipton explore the prospects of any hypothetical dealmaking between the two companies. To watch more expert insights and analysis on the latest market action, check out more Market Domination here. This post was written by Josh Lynch",Neutral,0.0
2025-01-04,Amazon price target gets lift by Wolfe Research. Heres why.,Yahoo,"Amazon (AMZN) received a price target boost to $270 per share from $250 by Wolfe Research. The analyst team maintained its Outperform rating on the e-commerce giants stock. Josh Lipton and Josh Schafer dissect Wolfe Researchs analyst note, which points to revenue upside in its AWS (Amazon Web Services) segment and retail margins. To watch more expert insights and analysis on the latest market action, check out more Market Domination here. This post was written by Luke Carberry Mogan.",Bullish,0.9
2025-01-04,3 Unstoppable Stocks to Build a Portfolio Around for 2025 and Beyond,Yahoo,"The stock market has a long history of delivering wealth-building returns for investors, but the future is inherently uncertain, which is why you never want to put all your eggs in one basket.  Heres why Amazon (NASDAQ: AMZN), Alphabet (NASDAQ: GOOG) (NASDAQ: GOOGL), and Warren Buffetts Berkshire Hathaway (NYSE: BRK.A) (NYSE: BRK.B) are excellent starter stocks for 2025.  Amazon stock climbed 1,300% over the last decade and tacked on 45% in just the last year.",Neutral,0.0
2025-01-05,SoFi Technologies: Wall Street Vs Retail Investors,SeekingAlpha,"Financial writer delves into the contrasting views on SoFi, a battleground stock disliked by analysts but beloved by retail investors.",Neutral,0.0
2025-01-06,Amazon AWS and HERE sign 10-year $1 billion deal for AI mapping and location services,Yahoo,"Amazon and HERE have entered into a 10-year, $1 billion agreement that will see the mapping company use Amazons cloud infrastructure for new software capabilities.",Neutral,0.0
2025-01-06,"NVIDIA Corp., Microsoft share gains lead Dows 269-point jump",MarketWatch,"NVIDIA Corp., Microsoft share gains lead Dows 269-point jump",Neutral,0.0
2025-01-06,Big Tech ETF rallies as Nvidia posts big gain,MarketWatch,Big Tech ETF rallies as Nvidia posts big gain,Bullish,0.7
2025-01-07,"Anthropic to raise $2 billion in deal valuing AI startup at $60 billion, WSJ reports",Finnhub,"AI startup Anthropic is in advanced talks to raise $2 billion in a deal valuing the OpenAI rival at $60 billion, the Wall Street Journal reported on Tuesday, citing people familiar with the matter. ...",Neutral,0.0
2025-01-07,"Meta Ends Fact-Checking on Facebook, Instagram in Free-Speech Pitch",Yahoo,"CEO Mark Zuckerberg, who has been building ties with the incoming Trump administration, said the move was an attempt to restore free expression on its platforms.",Neutral,0.0
2025-01-07,My Recommended Portfolio Picks For 2025,SeekingAlpha,"Investors can strategize their portfolio with Multiplo Picks, a selection of 10 stocks based on the overvalued American indexes.",Neutral,0.0
2025-01-07,Stock Market Today: Dow Jones Firm As Jensen Huang CES Speech Looms; Palantir Mauled On This (Live Coverage),Yahoo,The Dow Jones fell on the stock market today amid Trump tariff news. Nvidia rallied ahead of a CES appearance by CEO Jensen Huang.,Neutral,0.0
2025-01-07,"Load Growth Focuses Power Sector On Residential Rates, Interconnection Clarity",SeekingAlpha,"As datacenter-driven load growth increasingly takes shape, US utilities and power providers in 2025 will aim to take advantage of those opportunities. Read more here.",Neutral,0.0
2025-01-08,"Magnificent Seven Stocks: Nvidia, Tesla Slide; Meta Sells Off",DowJones,"Magnificent Seven Stocks: Nvidia, Tesla Slide; Meta Sells Off",Bullish,0.75
2025-01-08,Amazon Autos launches online sales,Yahoo,"The platform allows shoppers to browse, order and finance any new Hyundai vehicle in 54 U.S. markets.",Bullish,0.8
2025-01-08,AWS says itll invest at least $11B to expand data center infrastructure in Georgia,Yahoo,"On Tuesday, Amazon Web Services (AWS), Amazons cloud computing division, said that it plans to invest at least $11 billion in Georgia to expand its infrastructure to support various cloud computing and AI technologies. AWS estimates that its investment will create roughly 550 jobs in the state. AWS is proud to expand our operations in Georgia to help drive the next generation of cutting-edge technologies such as AI, the company wrote in a press release. Were grateful for the state and loc",Bullish,0.8
2025-01-08,"If I Could Buy Only 1 Magnificent Seven Stock in 2025, This Would Be It",Yahoo,2024 was another all-around terrific year for the Magnificent Seven.,Bullish,0.7
2025-01-08,Yahoo co-founder Jerry Yang: Masayoshi Son is recasting himself into an AI player with his $100 billion bet,Yahoo,SoftBank billionaire Masayoshi Son has pledged to invest $100 billion in the US over the next four years. Masas longtime friend and Yahoo co-founder Jerry Yang weighs in on the pledge.,Neutral,0.0
2025-01-08,HORAN Capital Advisors Winter 2024 Quarterly Investor Letter,SeekingAlpha,"With Q4 2024 behind investors, some of the uncertainty that served as a potential headwind for the market is now in the rearview mirror. Click here to read more.",Neutral,0.0
2025-01-08,Will Amazon (AMZN) Beat Estimates Again in Its Next Earnings Report?,Yahoo,Amazon (AMZN) has an impressive earnings surprise history and currently possesses the right combination of the two key ingredients for a likely beat in its next quarterly report.,Bullish,0.75
2025-01-08,Amazon com : Bedrock Powers WPS AI to Enhance Office Software Productivity,Finnhub,"January 8, 2025-Amazon Web Services, Inc. , an Amazon.com, Inc. company , today announced that WPS, the worlds leading office software and service provider, has selected Amazon Bedrock, a service for...",Bullish,0.65
2025-01-09,Top 3 tech trends that dominated CES 2025,Yahoo,"The 2025 Consumer Electronics Show (CES) is drawing to a close, running from January 7 to January 11, 2025. Yahoo Finance Tech Editor Dan Howley breaks down the top three takeaways from this years conference including widespread artificial intelligence initiatives, new semiconductor products from industry leaders like Nvidia (NVDA) and AMD (AMD), and the latest automotive technologies such as self-driving capabilities. For more expert insight and the latest market action, click here. This post was written by Angel Smith",Neutral,0.0
2025-01-09,Amazon and Meta: Wolfe Chooses the Best Internet Stocks to Buy,Yahoo,"With a new Presidential administration set to take office in less than two weeks, there’s a feeling of change in the air. Some of the changes are already clear – President-elect Trump has made clear his intent to implement new tax policies, and his previous term in office has already shown that he favors pro-business, growth-oriented economic policies, along with economic deregulation. The combination promises to keep the good times rolling in the stock markets. Watching the situation from Wolfe",Bullish,0.7
2025-01-09,"Rigetti, IonQ stocks plunge after Nvidia CEO says useful quantum computing is decades away",Yahoo,"Rigetti Computing, IonQ, and other quantum stocks fell more than 40% after Nvidia CEO Jensen Huang told Wall Street analysts that “very useful quantum computers” are likely 20 years away.",Neutral,-0.2
2025-01-09,Amazons Next Moonshot Is A Challenge To SpaceX Starlink,SeekingAlpha,"Amazonâs satellite broadband initiative, Project Kuiper, shows huge potential. Find out why AMZN stock could thrive with a projected $57B NPV by 2025.",Bullish,0.85
2025-01-09,Amazon Warehouse Workers Plan February Vote on Union Representation,Yahoo,"Amazon.com (AMZN) workers at a warehouse near Raleigh, North Carolina, have been cleared by the Nati",Neutral,-0.35
2025-01-10,Dow Jones Dives 600 Points On Strong Jobs Report; Nvidia Tumbles On New AI Chip Limits,DowJones,Dow Jones Dives 600 Points On Strong Jobs Report; Nvidia Tumbles On New AI Chip Limits,Neutral,0.0
2025-01-10,Amazon offers ad tech to retailers in retail media land grab,Yahoo,The cloud-based Amazon Retail Ad Service allows retailers to manage contextually relevant campaigns on their own e-commerce sites.,Bullish,0.7
2025-01-10,Cloud Provider Parent Companies Reorganize As AI Adoption Ramps,SeekingAlpha,"The cloud units ofÂ Amazon, Alphabet, andÂ Microsoft are maintaining their operating margins as they forge ahead with record capital investments to finance AI infrastructure buildouts.",Bullish,0.65
2025-01-10,ClearBridge Appreciation Strategy Q4 2024 Commentary,SeekingAlpha,"The Strategy outperformed its benchmark during a volatile quarter, as strong contributions from our financials and energy holdings overcame detractors in consumer staples.",Neutral,0.0
2025-01-10,Is Amazon.com Inc. (AMZN) the Best Technology Stock to Invest In for the Long Term,Yahoo,"We recently compiled a list of the 12 Best Technology Stocks to Invest In for the Long Term. In this article, we are going to take a look at where Amazon.com Inc. (NASDAQ:AMZN) stands against the other technology stocks. On January 1, King Lip, BakerAvenue Wealth Management’s chief strategist and partner, joined CNBC’s ‘Closing Bell’ to […]",Neutral,0.0
2025-01-10,The CEOs Who Are Tearing Up the Policies Trump Hates,Yahoo,Companies seeking to benefit from campaign promises to cut regulations and taxes are ditching diversity and climate initiatives; ‘EVERYBODY WANTS TO BE MY FRIEND!!!’,Bullish,0.75
2025-01-13,"Marvell: All-In On AI, Where To Be A Buyer On The Chart",SeekingAlpha,"Marvell Technology is seeing strong AI growth, despite potential challenges. Find out why MRVL stock offers potential upside and a good buy on dips.",Neutral,0.0
2025-01-16,USA: Why I Just Doubled My Position,SeekingAlpha,USA offers a unique blend of high dividend yield and substantial tech exposure. Read why USA CEF is a compelling investment for passive income investors.,Neutral,0.0
2025-01-16,Quantum-computing stocks could be rich takeover targets. Here’s what to know.,MarketWatch,Quantum-computing stocks could be rich takeover targets. Here’s what to know.,Neutral,0.0
2025-01-16,The Gold Standard: What Sets Amazon Wealth Automation Apart in E-commerce,Finnhub,"In the ever-expanding world of e-commerce, standing out requires more than just an innovative product or a well-executed marketing campaign. It demands expertise, vision, and a commitment to creating...",Neutral,0.0
2025-01-17,"As Biden warns of an oligarchy, Trump will be flanked by tech billionaires at his inauguration",Finnhub,"President Joe Bidens pointed warning about the U.S. becoming an “ oligarchy ” of tech billionaires will be illustrated at Donald Trumps inauguration, when the worlds three richest men will sit...",Neutral,0.0
2025-01-20,Covered Call Income Funds For Dummies,SeekingAlpha,"Discover high-yield income opportunities with Covered Call Funds and ETFs, tailored for income-focused investors seeking regular payouts. Click for more.",Neutral,0.0
2025-01-22,Dodge & Cox Stock Fund Q4 2024 Shareholder Letter,SeekingAlpha,Stocks surged in November after President Donald Trump won the U.S. election and Republicans won majorities in both the Senate and House of Representatives.,Neutral,0.0
2025-01-23,"German e-commerce sales rise for first time since 2021, says lobby group",Finnhub,"German online retailers last year eked out slight revenue gains for the first time since 2021, an industry body said on Thursday, citing higher savings that are giving Germans more confidence to...",Neutral,0.0
2025-01-23,How the Rusty Remains of a Failed Nuclear Project Could Signal a Renaissance,MarketWatch,How the Rusty Remains of a Failed Nuclear Project Could Signal a Renaissance,Neutral,0.0
2025-01-24,"Beyond Oracle and Nvidia, these stocks and sectors can benefit from the Stargate AI venture",MarketWatch,"Beyond Oracle and Nvidia, these stocks and sectors can benefit from the Stargate AI venture",Bullish,0.65
2025-01-24,Amazon com : Will Share Its Q4 2024 Earnings On February 6,Finnhub,"Amazon will hold a conference call to discuss its Q4 2024 financial results on February 6 at 2 p.m. PT/5 p.m. ET. The event will be webcast live, and the audio and associated slides will be available...",Neutral,0.0
2025-01-24,Interesting Earnings Action Coming,SeekingAlpha,"NetflixsÂ post earnings pop, and why next week looms large in earnings. Contextualizing recent AI news.",Neutral,0.0
2025-01-25,5 Best CEFs This Month For Nearly 10% Yield (January 2025),SeekingAlpha,Discover high-yield closed-end funds for income investors with reasonable total returns. Click for our process of winnowing out the best CEFS this month.,Neutral,0.0
2025-01-28,Is AT&T Or Verizon The Better Dividend Stock After Outperforming Q4 2024 Earnings?,SeekingAlpha,Both Verizon and AT&T have delivered outperforming Q4 results and positive outlooks. Click here to read more about T and VZ stocks.,Neutral,0.0
2025-01-28,TSMCs Selloff Creates A Buy Opportunity,SeekingAlpha,Analysis of Taiwan Semiconductor Manufacturing Company Limiteds stock drop due to DeepSeeks development. Click for how to approach TSM stock after the decline.,Neutral,0.0
2025-01-28,Talen goes to court over FERCs Amazon co-located data center rejection,Finnhub,Talen Energy is asking a U.S. appeals court to weigh in on a decision by federal regulators last year to reject a power agreement for an Amazon data center connected directly to Talens Pennsylvania...,Neutral,-0.3
2025-01-28,SCAP For Monthly Income And Growth,SeekingAlpha,Retiree seeks income and growth with SCAP small cap value stock investment for higher returns than S&P 500. Read more on SCAP ETF here.,Neutral,0.0
2025-01-29,RGA Investment Advisors Q4 2024 Investment Commentary,SeekingAlpha,"On the surface, 2024 appeared to be another banner year for equity markets, but beneath the hood, the story was categorically different. Click here to read more.",Bullish,0.65
2025-01-30,DeepSeek Upended Wall Streets Rosy View Of AI Stocks Like Nvidia. What That Means For U.S. Hopes To Outrun China.,DowJones,DeepSeek Upended Wall Streets Rosy View Of AI Stocks Like Nvidia. What That Means For U.S. Hopes To Outrun China.,Neutral,0.0
2025-01-31,"UPS Yields Nearly 6%; Dividend Is Safe, CEO Says",MarketWatch,"UPS Yields Nearly 6%; Dividend Is Safe, CEO Says",Bullish,0.7
2025-01-31,Amazon Cloud Offers DeepSeek AI Models As Meta Open Source Rivalry Grows,DowJones,Amazon Cloud Offers DeepSeek AI Models As Meta Open Source Rivalry Grows,Bearish,-0.65
2025-01-31,UPS Earnings Top Views But Shipping Giant Dives On Amazon News,DowJones,UPS Earnings Top Views But Shipping Giant Dives On Amazon News,Neutral,0.0
2025-01-31,How Cheap AI Could Boost Retail Stocks Like CVS and Best Buy,MarketWatch,How Cheap AI Could Boost Retail Stocks Like CVS and Best Buy,Neutral,0.0
2025-02-01,DeepSeek Took a Bite Out of the Mag 7. Here’s What Happens Next.,MarketWatch,DeepSeek Took a Bite Out of the Mag 7. Here’s What Happens Next.,Neutral,0.0
2025-02-01,UPS’s Boss Is Under Pressure From Unhappy Investors—Its Own Retirees,DowJones,UPS’s Boss Is Under Pressure From Unhappy Investors—Its Own Retirees,Neutral,0.0
2025-02-01,ESG: An ESG ETF Including Oil Companies,SeekingAlpha,"FlexShares STOXX US ESG Select Index Fund (ESG) holds ethical stocks with above-median ESG scores, outperforming Russell 1000 with similar risk. See more here.",Neutral,0.0
2025-02-01,"EU to make Temu, Shein and Amazon liable for unsafe goods, FT reports",Finnhub,"The European Union is planning to make e-commerce platforms such as Temu, Shein and Amazon Marketplace liable for dangerous or illegal products sold online, the Financial Times reported on Saturday. ...",Neutral,0.0
2025-02-02,"What’s worth streaming on Netflix, Max, Hulu and more in February 2025 — and which subscriptions to stop",MarketWatch,"What’s worth streaming on Netflix, Max, Hulu and more in February 2025 — and which subscriptions to stop",Neutral,0.0
2025-02-03,Atlassian Q2: This Is Just The Beginning,SeekingAlpha,Atlassians enterprise and AI growth boost investor confidence. Read why TEAM stock remains attractive as revenue and margins expand beyond expectations.,Bullish,0.7
2025-02-03,Trump’s tariffs could hurt Temu and Shein. Here’s which stocks stand to gain.,MarketWatch,Trump’s tariffs could hurt Temu and Shein. Here’s which stocks stand to gain.,Neutral,0.0
2025-02-04,"Trump Tariffs Target Loophole Utilized By Temu, Shein. Why That Matters For Meta.",DowJones,"Trump Tariffs Target Loophole Utilized By Temu, Shein. Why That Matters For Meta.",Neutral,0.0
2025-02-04,3 Possible Paths For Value In 2025,SeekingAlpha,Prepare for the future by investing in undervalued companies with strong fundamentals - be resilient in the face of potential market scenarios in 2025.,Neutral,0.0
2025-02-04,"Magnificent Seven Stocks: Apple, Nvidia Rebound; Alphabet Hits New High Ahead Of Q4 Earnings",DowJones,"Magnificent Seven Stocks: Apple, Nvidia Rebound; Alphabet Hits New High Ahead Of Q4 Earnings",Neutral,0.0
2025-02-04,AI Infrastructure: Laying The Groundwork,SeekingAlpha,Generative AI could add $16 trillion to global gross domestic product by 2030. Click to read.,Neutral,0.0
2025-02-04,Stocks That May Benefit From An AI Evolution This Year,SeekingAlpha,"Tech stocks are in focus as many of the bellwethers report results, but also because of the potential impact of DeepSeek on the AI sector. Morningstar Researchs David Sekera discusses.",Neutral,0.0
2025-02-05,"Reddit Q4 Preview: Up 200%, And Still Room To Run",SeekingAlpha,"Reddits stock has surged 22% since December, outperforming the S&P 500 by 17x, as I was bullish on its strong Advertising and Data Licensing growth and expanding margins.",Neutral,0.0
2025-02-05,Over 1 billion Chinese packages affected by US restrictions,Finnhub,"Shanghai, China, Feb 5 .- More than 1 billion packages of low-cost products from China will be affected after US President Donald Trump announced the end of customs exemption for shipments from that...",Neutral,-0.1
2025-02-05,Alphabet is showing the downside of being an AI stock,MarketWatch,Alphabet is showing the downside of being an AI stock,Neutral,-0.05
2025-02-05,Exclusive-Amazon set to release long-delayed Alexa generative AI revamp,Finnhub,"Amazon is set to release its long-awaited - and delayed - Alexa generative artificial intelligence voice service, said three people familiar with the matter, and has scheduled a press event for later...",Bullish,0.8
2025-02-05,Amazon Q4 Preview: Trump Tariffs Are A Good Thing,SeekingAlpha,"Amazon.com, Inc.s automation and cost optimizations, including nuclear energy, position it to excel despite tariffs. Click for my AMZN Q4 earnings preview.",Bullish,0.7
2025-02-06,John Schulman leaves AI startup Anthropic,Finnhub,"John Schulman, an OpenAI co-founder who joined Anthropic last year, has left his role at the artificial intelligence startup, the company said late on Wednesday. We are sad to see John...",Neutral,0.0
2025-02-06,Stock Market Today: Dow Jones Flat But Nvidia Rises On DeepSeek News; Cathie Wood Stock Crashes (Live Coverage),DowJones,Stock Market Today: Dow Jones Flat But Nvidia Rises On DeepSeek News; Cathie Wood Stock Crashes (Live Coverage),Neutral,0.0
2025-02-06,Teladoc Health Stock Soars. Why It’s An ‘Under-the-Radar AI Play.’,MarketWatch,Teladoc Health Stock Soars. Why It’s An ‘Under-the-Radar AI Play.’,Neutral,0.0
2025-02-07,"Stock Market Today: Nasdaq Slumps 1.1% After Hawkish Jobs Report, But Palantir Hits New High (Live Coverage)",DowJones,"Stock Market Today: Nasdaq Slumps 1.1% After Hawkish Jobs Report, But Palantir Hits New High (Live Coverage)",Neutral,0.0
2025-02-07,"Amazon Q4: Solid Results, But Weak Guidance Makes Shares Sink",SeekingAlpha,"AMZN shares seem pricey compared to other Magnificent 7 stocks, following a 40% stock price increase over the past year. Click here to read why AMZN is a Hold.",Bearish,-0.7
2025-02-07,"Stocks to Watch: Amazon.com, Take-Two Interactive Software, Pinterest, e.l.f. Beauty",MarketWatch,"Stocks to Watch: Amazon.com, Take-Two Interactive Software, Pinterest, e.l.f. Beauty",Neutral,0.0
2025-02-07,"The Good—and Bad—in Apple, Amazon, and Other Big Tech Earnings",MarketWatch,"The Good—and Bad—in Apple, Amazon, and Other Big Tech Earnings",Neutral,0.0
